"glossary_term","glossary_translation","source","target","file","location"
"Tavern","hospoda","Meat is used in the taverns, inns and big inns to prepare rations, snacks and meals for the miners. It is also consumed at the training sites (training camp and battle arena).","Maso se používá v hospodách, hostincích a velkých hostincích k přípravě přídělů, svačin a jídel pro horníky. Konzumují ho i na cvičištích (výcvikový tábor a bitevní aréna).","tribes_encyclopedia","../../data/tribes/wares/meat/helptexts.lua:10"
"Tavern","hospoda","Meat can also be obtained as pork from piggeries. It is used in the inns and taverns to prepare lunch for the miners and is consumed at the training sites (arena, colosseum, training camp).","Maso se dá také získat z vepřů ve vepřínech. Používá se v hostincích a hospodách k přípravě obědů pro horníky a cvičiště (aréna, koloseum a výcvikový tábor).","tribes_encyclopedia","../../data/tribes/wares/meat/helptexts.lua:12"
"Tavern","hospoda","Rations are produced in a tavern, an inn or a big inn out of fish or meat or pitta bread.","Příděly se vyrábějí v hospodě, hostinci nebo velkém hostinci z ryb, masa nebo chleba.","tribes_encyclopedia","../../data/tribes/wares/ration/helptexts.lua:6"
"Tavern","hospoda","Rations are produced in a tavern out of fish or meat or bread.","Příděly se vyrábějí v hospodě z ryb, masa nebo chleba.","tribes_encyclopedia","../../data/tribes/wares/ration/helptexts.lua:8"
"taverns","hospody","At first, we should find out how many taverns we currently have. Widelands offers you a window where you can easily check this.","Jako první bychom měli zjistit, kolik hospod máme. Widelands má okno, kde to lze jednoduše zjistit.","scenario_tutorial04_economy.wmf","../../data/campaigns/tutorial04_economy.wmf/scripting/texts.lua:55"
"taverns","hospody","Look up how many taverns you have.","Podívej kolik hospod máš.","scenario_tutorial04_economy.wmf","../../data/campaigns/tutorial04_economy.wmf/scripting/texts.lua:89"
"taverns","hospody","You have closed the building statistics window. I didn’t notice that you switched to the medium buildings to look up the number of taverns. Would you please be so nice and show it to me?","Zavřel jsi okno statistiky budov. Nevšiml jsem si, že by si se přepnul na střední budovy a podíval se na počet hospod. Byl by jsi tak laskavý a ukázal mi to?","scenario_tutorial04_economy.wmf","../../data/campaigns/tutorial04_economy.wmf/scripting/texts.lua:98"
"taverns","hospody","The Barbarian bakers are best in making this flat and tasty pitta bread. It is made out of wheat and water following a secret recipe. Pitta bread is used in the taverns, inns and big inns to prepare rations, snacks and meals. It is also consumed at training sites (training camp and battle arena).","Barbarští pekaři jsou nejlepší v pečení těchto placatých a chutných chlebových placek. Vyrábí se z pšenice a vody podle tajného receptu. Chlebové placky se používají v hospodách, hostincích a velkých hostincích k přípravě přídělů, svačin a jídel. Také jsou potřeba pro cvičiště (výcvikový tábor a bitevní aréna).","tribes_encyclopedia","../../data/tribes/wares/bread_barbarians/helptexts.lua:4"
"taverns","hospody","The bakers of the Empire make really tasty bread out of flour and water. It is used in taverns and inns to prepare rations and meals. Bread is also consumed at the training sites (arena, colosseum, training camp).","Císařští pekaři pečou z mouky a vody skutečně chutný chleba, který se v hospodách a hostincích používá pro přípravu přídělů a jídel. Chléb je potřeba i při výcviku vojáků (aréna, koloseum, výcvikový tábor).","tribes_encyclopedia","../../data/tribes/wares/bread_empire/helptexts.lua:4"
"taverns","hospody","Besides pitta bread and meat, fish is also a foodstuff for the Barbarians. It is used in the taverns, inns and big inns and at the training sites (training camp and battle arena).","Krom chlebových placek a masa jsou i ryby potravou barbarů. Používají se v hospodách, hostincích, velkých hostincích a cvičištích (výcvikový tábor a bitevní aréna).","tribes_encyclopedia","../../data/tribes/wares/fish/helptexts.lua:6"
"taverns","hospody","Besides bread and meat, fish is also a foodstuff for the Empire. Fish are used in taverns, inns and training sites (arena, colosseum, training camp).","Kromě chleba a masa se v Císařství konzumují také ryby. Používají se v hospodách, hostincích a při výcviku vojáků (aréna, koloseum, výcvikový tábor).","tribes_encyclopedia","../../data/tribes/wares/fish/helptexts.lua:8"
"taverns","hospody","Meat is used in the taverns, inns and big inns to prepare rations, snacks and meals for the miners. It is also consumed at the training sites (training camp and battle arena).","Maso se používá v hospodách, hostincích a velkých hostincích k přípravě přídělů, svačin a jídel pro horníky. Konzumují ho i na cvičištích (výcvikový tábor a bitevní aréna).","tribes_encyclopedia","../../data/tribes/wares/meat/helptexts.lua:10"
"taverns","hospody","Meat can also be obtained as pork from piggeries. It is used in the inns and taverns to prepare lunch for the miners and is consumed at the training sites (arena, colosseum, training camp).","Maso se dá také získat z vepřů ve vepřínech. Používá se v hostincích a hospodách k přípravě obědů pro horníky a cvičiště (aréna, koloseum a výcvikový tábor).","tribes_encyclopedia","../../data/tribes/wares/meat/helptexts.lua:12"
"Economy","hospodářství","After returning home, Lutius and his crew are faced with an economy in shambles. Resolving the bottlenecks in the economy will be of utmost importance to reinstate the glory of the empire.","Po tom, co se Lutius a jeho muži vrátili domů, musí čelit faktu, že je ekonomika v troskách. Náprava zdevastované ekonomiky má tu nejvyšší prioritu, abychom navrátili Císařství jeho zašlou slávu.","maps","../../data/campaigns/emp04.wmf/elemental:10"
"Economy","hospodářství","The point is that the first island only provides rocks and trees, the second only meadows and resources. The economies you leave behind will continue to work for you, but you will only reap the benefits at the moment you reach a new island.","Příprav se na to, že na prvním ostrově najdeš pouze kamení a dřevo, na druhém pouze louky a suroviny. Ekonomika, kterou vybuduješ ti bude vydělávat pořád ale k těžbě se dostaneš až postoupíš na další ostrov.","mp_scenario_island_hopping.wmf","../../data/maps/MP_Scenarios/Island_Hopping.wmf/scripting/texts.lua:24"
"Economy","hospodářství","We have established ourselves on this island. The next step is now to make it a home. I reckon we need to establish a sustainable economy and to explore our surroundings. I called for specialists and will follow their advice.","Na tento ostrov jsme dorazili v pořádku. Dalším krokem bude tento ostrov zabydlet. Počítám, že musíme vybudovat soběstačnou ekonomiku a prozkoumat naše okolí. Povolala jsem specialisty a budu se řídit jejich radami.","scenario_atl01.wmf","../../data/campaigns/atl01.wmf/scripting/texts.lua:190"
"Economy","hospodářství","Khantrukh has just informed me that our basic food economy was built up successfully. Finally, none of us has to fear starvation anymore.","Khantrukh mě právě informoval, že se nám podařilo zabezpečit zásobování základními potravinami. Konečně se nikdo z nás nemusí obávat hladovění.","scenario_bar02.wmf","../../data/campaigns/bar02.wmf/scripting/texts.lua:257"
"Economy","hospodářství","I just got informed that our mining economy has started its work. This news brought a smile to my face – even if the hardest part is still waiting to be done, now that our smiths will give their best to further ease our lives.","Právě mě informovali, že naši horníci začali těžit. Tahle novinka mě velice těší - přestože to nejtěžší nás teprve čeká, kováři nám do budoucna mohou velmi ulehčit život.","scenario_bar02.wmf","../../data/campaigns/bar02.wmf/scripting/texts.lua:295"
"Economy","hospodářství","Our geologists found a lot more deposits of iron ore, coal and even gold. We should enhance our current mines as soon as our miners are more experienced. We should build up some more mines, a bigger food infrastructure to always supply our men with sufficient food and a further processing economy. But that’s still not everything – most of our soldiers are quite young and neither have a good weapon nor are they well trained. We should build up training sites to prepare them for their future tasks.","Naši geologové objevili mnohem více nalezišť železné rudy, uhlí a dokonce zlata. Jakmile naši horníci získají potřebné zkušenosti, měli bychom vylepšit stávající doly. Taky bychom měli postavit nové doly a posílit naši přípravu jídla, aby zvládla všechny zásobovat jídlem, a rozvinout další zpracování surovin. A to pořád není všechno - většina našich vojáků je stále velmi mladá a nemají dobrou zbraň ani dostatečný výcvik. Měli bychom postavit cvičiště, kde by se připravili na své budoucí úkoly.","scenario_bar02.wmf","../../data/campaigns/bar02.wmf/scripting/texts.lua:323"
"Economy","hospodářství","Good news! Today our wood economy was completed. Now we can be sure that we will have enough wood for our future building projects.","Dobré zprávy! Dnes byly dokončeny budovy pro zpracování dřeva. Nyní už určitě budeme mít dost dřeva pro naše budoucí stavební projekty.","scenario_emp02.wmf","../../data/campaigns/emp02.wmf/scripting/texts.lua:149"
"Economy","hospodářství","I noticed that our stonemason has started his work, finally. He will cut the number of marble columns that we request in our basic economy settings.","Všiml jsem si, že náš kameník začal pracovat, konečně. Nařeže nespočet mramorových sloupů, které jsou třeba pro základní hospodářský model.","scenario_emp03.wmf","../../data/campaigns/emp03.wmf/scripting/texts.lua:308"
"Economy","hospodářství","This is offering us more options to get the shambles in our economy solved.","Toto nám dává více možností, jak napravit neduhy naší ekonomiky.","scenario_emp04.wmf","../../data/campaigns/emp04.wmf/scripting/texts.lua:377"
"inns","hostince","Beer is produced in micro breweries and used in inns and big inns to produce snacks.","Pivo se vaří v malém pivovaru a používá se v hosticích a velkých hostincích k přípravě svačin.","tribes_encyclopedia","../../data/tribes/wares/beer/helptexts.lua:4"
"inns","hostince","The Barbarian bakers are best in making this flat and tasty pitta bread. It is made out of wheat and water following a secret recipe. Pitta bread is used in the taverns, inns and big inns to prepare rations, snacks and meals. It is also consumed at training sites (training camp and battle arena).","Barbarští pekaři jsou nejlepší v pečení těchto placatých a chutných chlebových placek. Vyrábí se z pšenice a vody podle tajného receptu. Chlebové placky se používají v hospodách, hostincích a velkých hostincích k přípravě přídělů, svačin a jídel. Také jsou potřeba pro cvičiště (výcvikový tábor a bitevní aréna).","tribes_encyclopedia","../../data/tribes/wares/bread_barbarians/helptexts.lua:4"
"inns","hostince","The bakers of the Empire make really tasty bread out of flour and water. It is used in taverns and inns to prepare rations and meals. Bread is also consumed at the training sites (arena, colosseum, training camp).","Císařští pekaři pečou z mouky a vody skutečně chutný chleba, který se v hospodách a hostincích používá pro přípravu přídělů a jídel. Chléb je potřeba i při výcviku vojáků (aréna, koloseum, výcvikový tábor).","tribes_encyclopedia","../../data/tribes/wares/bread_empire/helptexts.lua:4"
"inns","hostince","Besides pitta bread and meat, fish is also a foodstuff for the Barbarians. It is used in the taverns, inns and big inns and at the training sites (training camp and battle arena).","Krom chlebových placek a masa jsou i ryby potravou barbarů. Používají se v hospodách, hostincích, velkých hostincích a cvičištích (výcvikový tábor a bitevní aréna).","tribes_encyclopedia","../../data/tribes/wares/fish/helptexts.lua:6"
"inns","hostince","Besides bread and meat, fish is also a foodstuff for the Empire. Fish are used in taverns, inns and training sites (arena, colosseum, training camp).","Kromě chleba a masa se v Císařství konzumují také ryby. Používají se v hospodách, hostincích a při výcviku vojáků (aréna, koloseum, výcvikový tábor).","tribes_encyclopedia","../../data/tribes/wares/fish/helptexts.lua:8"
"inns","hostince","A real meal is made in inns out of bread and fish/meat. It satisfies the needs of miners in deep mines.","Skutečné jídlo se připravuje v hostincích z chleba a ryb/masa. Takové jídlo zasytí i horníky v hlubinných dolech.","tribes_encyclopedia","../../data/tribes/wares/meal/helptexts.lua:6"
"inns","hostince","Meat is used in the taverns, inns and big inns to prepare rations, snacks and meals for the miners. It is also consumed at the training sites (training camp and battle arena).","Maso se používá v hospodách, hostincích a velkých hostincích k přípravě přídělů, svačin a jídel pro horníky. Konzumují ho i na cvičištích (výcvikový tábor a bitevní aréna).","tribes_encyclopedia","../../data/tribes/wares/meat/helptexts.lua:10"
"inns","hostince","Meat can also be obtained as pork from piggeries. It is used in the inns and taverns to prepare lunch for the miners and is consumed at the training sites (arena, colosseum, training camp).","Maso se dá také získat z vepřů ve vepřínech. Používá se v hostincích a hospodách k přípravě obědů pro horníky a cvičiště (aréna, koloseum a výcvikový tábor).","tribes_encyclopedia","../../data/tribes/wares/meat/helptexts.lua:12"
"Inn","hostinec","The other day Boldreth asked me to accompany him to the new inn. It would cheer me up, he said.","Jednoho dne mě Boldreth přemluvil, abych jej doprovodil do nového hostince. Řekl, že mne to povzbudí.","scenario_bar01.wmf","../../data/campaigns/bar01.wmf/scripting/texts.lua:504"
"Inn","hostinec","When I looked around, I saw faithful faces, trusting that I could guide them through these dark days. Yet before I could speak any words of gratitude or encouragement, one of my warriors ran into the inn. He had been far out in the forest for the past days and I could see how weary he was.","Když jsem se rozhlédl, uviděl jsem tváře svých věrných druhů, kteří věří, že je dokážu provést těmito temnými dny. Avšak předtím než jsem mohl vyslovit slova vděčnosti a povzbuzení, vběhl do hostince jeden z mých bojovníků. Byl v těchto dnech daleko v lesích a bylo poznat, jak zmožený se cítil.","scenario_bar01.wmf","../../data/campaigns/bar01.wmf/scripting/texts.lua:507"
"Inn","hostinec","OK. In the list, you’ve seen that you have no more taverns or inns. That means that you’re not producing any rations. But let’s see what we still have in stock.","Dobře. V seznamu je vidět, že už nemáš ani hospody ani hostince. To znamená, že nepřipravuješ žádné příděly. Tak se podíváme, co máme ještě v zásobě.","scenario_tutorial04_economy.wmf","../../data/campaigns/tutorial04_economy.wmf/scripting/texts.lua:121"
"Inn","hostinec","Produces beer of the lower grade. This beer is a vital component of the snacks that inns and big inns prepare for miners in deep mines.","Vaří pivo nižší úrovně. Pivo je životně důležitá součást svačin, které hostince a velké hostince připravují pro horníky v hlubinných dolech.","tribes_encyclopedia","../../data/tribes/buildings/productionsites/barbarians/micro_brewery/helptexts.lua:13"
"Inn","hostinec","Beer is produced in micro breweries and used in inns and big inns to produce snacks.","Pivo se vaří v malém pivovaru a používá se v hosticích a velkých hostincích k přípravě svačin.","tribes_encyclopedia","../../data/tribes/wares/beer/helptexts.lua:4"
"Inn","hostinec","The Barbarian bakers are best in making this flat and tasty pitta bread. It is made out of wheat and water following a secret recipe. Pitta bread is used in the taverns, inns and big inns to prepare rations, snacks and meals. It is also consumed at training sites (training camp and battle arena).","Barbarští pekaři jsou nejlepší v pečení těchto placatých a chutných chlebových placek. Vyrábí se z pšenice a vody podle tajného receptu. Chlebové placky se používají v hospodách, hostincích a velkých hostincích k přípravě přídělů, svačin a jídel. Také jsou potřeba pro cvičiště (výcvikový tábor a bitevní aréna).","tribes_encyclopedia","../../data/tribes/wares/bread_barbarians/helptexts.lua:4"
"Inn","hostinec","The bakers of the Empire make really tasty bread out of flour and water. It is used in taverns and inns to prepare rations and meals. Bread is also consumed at the training sites (arena, colosseum, training camp).","Císařští pekaři pečou z mouky a vody skutečně chutný chleba, který se v hospodách a hostincích používá pro přípravu přídělů a jídel. Chléb je potřeba i při výcviku vojáků (aréna, koloseum, výcvikový tábor).","tribes_encyclopedia","../../data/tribes/wares/bread_empire/helptexts.lua:4"
"Inn","hostinec","Besides pitta bread and meat, fish is also a foodstuff for the Barbarians. It is used in the taverns, inns and big inns and at the training sites (training camp and battle arena).","Krom chlebových placek a masa jsou i ryby potravou barbarů. Používají se v hospodách, hostincích, velkých hostincích a cvičištích (výcvikový tábor a bitevní aréna).","tribes_encyclopedia","../../data/tribes/wares/fish/helptexts.lua:6"
"Inn","hostinec","Besides bread and meat, fish is also a foodstuff for the Empire. Fish are used in taverns, inns and training sites (arena, colosseum, training camp).","Kromě chleba a masa se v Císařství konzumují také ryby. Používají se v hospodách, hostincích a při výcviku vojáků (aréna, koloseum, výcvikový tábor).","tribes_encyclopedia","../../data/tribes/wares/fish/helptexts.lua:8"
"Inn","hostinec","A real meal is made in inns out of bread and fish/meat. It satisfies the needs of miners in deep mines.","Skutečné jídlo se připravuje v hostincích z chleba a ryb/masa. Takové jídlo zasytí i horníky v hlubinných dolech.","tribes_encyclopedia","../../data/tribes/wares/meal/helptexts.lua:6"
"Inn","hostinec","Meat is used in the taverns, inns and big inns to prepare rations, snacks and meals for the miners. It is also consumed at the training sites (training camp and battle arena).","Maso se používá v hospodách, hostincích a velkých hostincích k přípravě přídělů, svačin a jídel pro horníky. Konzumují ho i na cvičištích (výcvikový tábor a bitevní aréna).","tribes_encyclopedia","../../data/tribes/wares/meat/helptexts.lua:10"
"Inn","hostinec","Meat can also be obtained as pork from piggeries. It is used in the inns and taverns to prepare lunch for the miners and is consumed at the training sites (arena, colosseum, training camp).","Maso se dá také získat z vepřů ve vepřínech. Používá se v hostincích a hospodách k přípravě obědů pro horníky a cvičiště (aréna, koloseum a výcvikový tábor).","tribes_encyclopedia","../../data/tribes/wares/meat/helptexts.lua:12"
"Inn","hostinec","Rations are produced in a tavern, an inn or a big inn out of fish or meat or pitta bread.","Příděly se vyrábějí v hospodě, hostinci nebo velkém hostinci z ryb, masa nebo chleba.","tribes_encyclopedia","../../data/tribes/wares/ration/helptexts.lua:6"
"Inn","hostinec","A bigger morsel than the ration to provide miners in deep mines. It is produced in an inn or a big inn out of fish/meat, pitta bread and beer.","Větší porce než je příděl, určená pro horníky v hlubinných dolech. Připravuje se v hostinci nebo velkém hostinci z ryb/masa, chlebových placek a piva.","tribes_encyclopedia","../../data/tribes/wares/snack/helptexts.lua:4"
"Innkeeper","hostinský","Oh no, look at this: our tavern is burning! In all the hurry, our innkeeper accidentally dropped a torch. She is fine, but we could not extinguish the fire in time.","Ale ne, podívej se na to: naše hospoda hoří! Ve všem tom shonu hostinská nechtěně upustil pochodeň. Je v pořádku ale bohužel jsme nestačili uhasit oheň včas.","scenario_tutorial04_economy.wmf","../../data/campaigns/tutorial04_economy.wmf/scripting/texts.lua:44"
"Host","hostitel","Available host commands are:","Příkazy k dispozici jsou:","widelands","../../src/network/gamehost.cc:257"
"Host","hostitel","Failed to host the server!","Nezdařilo se vytvořit server!","widelands","../../src/network/gamehost.cc:494"
"game","hra","Some say that impenetrable lands to the far north scared away even the most courageous settlers and the bravest of the brave warriors. Big and old forests, full of big and predatory game, cut across by wetlands and hills were shrouded in mystery. The ones who had managed to come back mentioned tremendous buildings, decorated with carvings and gold from majestic mountain ranges somewhere amongst the wilderness. Dozens of years after only some crumbly ruins remain of these good old times, covered with moss and trees. Their shapes give only an idea about the craftsmanship of ancient constructors. Nobody knows why they (have) disappeared. Nobody knows why. People say that now nothing is blocking the road to wealth. But many will die pulled apart by wolves, engulfed by swamp… encircled by hostile tribes.","Říká se, že neproniknutelné severní země odstrašily i ty nejodvážnější osadníky a nejudatnější z udatných válečníků. Velké a staré lesy, plné zvěře a predátorů, se rozprostírají napříč mokřinami a pahorkatinou, věčně zahalené v tajemstvím. Ti, kteří se tam vydali a přežili, mluvili o ohromných budovách pokrytých tajemnými rytinami a o zlatu, které lze dobývat z majestátných hor v divočině. Po mnoha letech zůstaly pouze ruiny pokryté mechem a zarostlé stromy. Jejich tvary dávají tušit velikost a umění dávných stavitelů. Nikdo neví, kam (uprchli) zmizeli. Nikdo neví, proč se tak stalo. Proto někteří tvrdí, že cesta k bohatství, ukrývajícímu se na severu je volná. Přesto mnozí zahynou roztrháni vlky, pohlceni bažinami... a obklíčeni nepřátelskými kmeny.","maps","../../data/maps/The_Far_North.wmf/elemental:10"
"game","hra","%s is now King of the Hill and will win the game in 20 minutes, if nobody takes over the hill before then.","%s je nyní Králem Hory a pokud nikdo horu do 20 minut neobsadí, stane se vítězem.","mp_scenario_island_hopping.wmf","../../data/maps/MP_Scenarios/Island_Hopping.wmf/scripting/texts.lua:51"
"game","hra","%s has won the game. Congratulations!","%s vyhrál hru. Gratulace!","mp_scenario_island_hopping.wmf","../../data/maps/MP_Scenarios/Island_Hopping.wmf/scripting/texts.lua:55"
"game","hra","I am sorry, but will I have to tear this down again. We might need the space here later on. If I am too slow for you, you might want to play a real game and just find everything out for yourself. Otherwise, please bear with me, I am not the youngest and quickest anymore.","Omlouvám se ale budu to muset opět strhnout. Později budeme toto místo potřebovat. Pokud jsem pro tebe příliš pomalý, možná by bylo lepší, spustit normální hru a zjistit si vše sám. V opačném případě se mnou prosím zůstaň, už nejsem nejmladší ani nejrychlejší.","scenario_tutorial01_basic_control.wmf","../../data/campaigns/tutorial01_basic_control.wmf/scripting/texts.lua:17"
"game","hra","If you want things to go faster, simply use the Page Up key on your keyboard to increase the game speed. You can use Page Down to make the game slower again.","Pokud bys rád aby se věci děly rychleji, jednoduše stiskni na klávesnici Page Up na zvýšení rychlosti hry. Na zpomalení hry slouží klávesa Page Down.","scenario_tutorial01_basic_control.wmf","../../data/campaigns/tutorial01_basic_control.wmf/scripting/texts.lua:136 ../../data/campaigns/tutorial01_basic_control.wmf/scripting/texts.lua:149"
"game","hra","The message window is central to fully controlling your tribe’s fortune. However, you will get a lot of messages in a real game. To keep your head straight, you should try to keep the inbox empty.","Okno se zprávami je základem pro plnou kontrolu osudu tvého kmene. V průběhu ostré hry ale budeš dostávat záplavu zpráv. Aby ses v nich neztratil, dbej na to, aby tvoje schránka byla vždy prázdná.","scenario_tutorial01_basic_control.wmf","../../data/campaigns/tutorial01_basic_control.wmf/scripting/texts.lua:388"
"game","hra","Well done! Let’s see how messages work in a real game, shall we? For this, I’ll take all rocks away from the poor stonemasons in the quarries. They will then send a message each that they can’t find any in their work areas the next time they try to do some work.","Výborně! Nyní se podíváme na to, jak zprávy fungují ve skutečné hře, můžeme? Za tímto účelem, vezmu všechno kamení chudákům kameníkům v lomech. Ti, jakmile se pokusí pracovat, pošlou zprávu, že ve svém okolí nemohou najít kamení.","scenario_tutorial01_basic_control.wmf","../../data/campaigns/tutorial01_basic_control.wmf/scripting/texts.lua:419"
