"glossary_term","glossary_translation","source","target","file","location"
"Al’thunran","Al’thunran","We can see the raging flames that swallow Al’thunran from here, miles away.","Míle odsud, míle daleko, stále vidíme zběsilé plameny, které polykají Al'thunran.","scenario_bar01.wmf","../../data/campaigns/bar01.wmf/scripting/texts.lua:171"
"Al’thunran","Al’thunran","When I gazed at the horizon, I still saw crimson lights flicker in the distance. It is incredible with how much passion my brethren fight this war. I fear the moment I will see Al’thunran again – will there be anything but ashes and wasted ruins left of our once beautiful capital when we get there?","Když jsem se zahleděl k horizontu, stále jsem v dálce viděl purpurové záblesky. Je až neuvěřitelné, s jakým zápalem mí bratři bojují a prodlužují tuto válku. Děsím se chvíle, kdy opět spatřím Al'thunran - bude tam ještě něco kromě popela a zbořených zdí? Na místě, kde kdysi bývalo naše nádherné město?","scenario_bar01.wmf","../../data/campaigns/bar01.wmf/scripting/texts.lua:522"
"Atlantis","Atlantida","After landing on a mysterious island close to Atlantis, the remaining Atlanteans struggle to make a new home for themselves.","Po přistání na tajemném ostrově blízko Atlantidy se zbývající Atlanťané snaží vybudovat pro sebe nový domov.","maps","../../data/campaigns/atl01.wmf/elemental:11"
"Atlantis","Atlantida","This story is taking place during the reign of King Askandor, the 43rd successor of King Ajanthul. He had been a good king, ruling Atlantis with wisdom and foresight. But with age, he became afraid of dying and so he began looking for a cure for death even though most clerics warned him against it. Some said that endless life was only for the gods and that to seek for it was forbidden.","Tento příběh začal během vlády krále Askandora, 43-tého potomka krále Ajanthula. Byl dobrým králem a vládl Atlantidě s moudrostí a prozíravostí. S přibývajícím věkem však přišel strach ze smrti a král, přestože jej mnozí kněží varovali, začal hledat lék proti smrti. Někteří říkali, že věčný život je vyhrazen samotným bohům a usilovat o něj je zapovězeno.","scenario_atl01.wmf","../../data/campaigns/atl01.wmf/scripting/texts.lua:150"
"Atlantis","Atlantida","But not even this changed the mind of the god. The water kept on rising. Nearly driven insane by guilt, pain and anger, Jundlina became a heretic: Secretly, she gathered people of the common folk who were not in line with the decision of the clerics to accept the god’s will. Together with them, she set the temple on fire and stole a ship to flee from the god’s influence over Atlantis. This small group started praying to Satul, the fire god and the worst enemy of Lutas.","Ale ani tento děsivý skutek nezměnil vůli boha a voda dál stoupala. Pološílená z pocitu viny, bolesti a hněvu, se Jundlina rozhodla pro kacířství: potají shromáždila obyčejné lidi, kteří vzdorovali rozhodnutí kněžského řádu pokorně přijmout vůli svého boha. Společně se svými lidmi zapálila chrám a ukradli loď, aby unikli na ní z Atlantidy před hněvem svého bývalého boha. Tato malá skupinka začala uctívat Satula, boha ohně, největšího nepřítele boha Lutase.","scenario_atl01.wmf","../../data/campaigns/atl01.wmf/scripting/texts.lua:172"
"Atlantis","Atlantida","Leaving the dying Atlantis and their past behind, they started on a quest to find a place sheltered by the fire and protected from the sea.","A tak zanechali umírající Atlantidu za sebou a vydali se na výpravu hledání nového útočiště, chráněného ohněm a bezpečného před vodou.","scenario_atl01.wmf","../../data/campaigns/atl01.wmf/scripting/texts.lua:174"
"Atlantis","Atlantida","We left Atlantis and sailed east. We entered the forbidden sea on the sixth day without noticing any pursuers from Atlantis and without Lutas having smashed our ship. Now, we are out of his reach. One day later, we sighted an island which seems to have one of these fire spitting mountains on it. I deemed this a sign from the fire god and we landed on its shore.","Opustili jsme Atlantidu a odpluli na východ. Šestého dne jsme vpluli do zakázaného moře, aniž bychom zaznamenali známky pronásledování a ani Lutas nám neroztříštil loď. Nyní jsme již mimo jeho dosah. O den později jsme na obzoru uviděli ostrov, který na kterém je jedna z těch hor chrlících oheň. Pokládám to za šťastné znamení od ohnivého boha, proto jsme se na ostrově vylodili.","scenario_atl01.wmf","../../data/campaigns/atl01.wmf/scripting/texts.lua:184"
"Atlantis","Atlantida","We spent the last week building two watchtowers on the mountains close to our landing area; and, of course, a hall for us all. We have very talented constructors in our group – still, the buildings do not match the art we had on Atlantis. I hope they will withstand the next rain. At least, the towers will warn us if a ship from Atlantis follows us and if the island is inhabited, we will see attackers a long time before they arrive.","Minulé dva týdny jsme strávili budováním dvou věží na hoře blízko místa kde jsme se vylodili a samozřejmě i sídla pro nás všechny. V naší skupině jsou velmi talentovaní stavitelé - přesto budovy zcela neodpovídají zpracování, na které jsme zvyklí z Atlantidy. Doufám, že přečkají příští déšť. Věže nás alespoň mohou varovat kdyby se blížila loď z Atlantidy, nebo je-li ostrov obydlený, uvidíme útočníky dlouho před tím, než k nám dorazí.","scenario_atl01.wmf","../../data/campaigns/atl01.wmf/scripting/texts.lua:187"
"Atlantis","Atlantida","May Satul warm you, Jundlina! I agree with what Loftomor proposes. We need a good supply of building materials for we have to expand our territory swiftly. I will not feel safe on this island as long as we have not seen all its shores. I brought plenty of good men from Atlantis. The military might is available. We only need some housing to live in.","Nechť vás Satul hřeje, Jundlino! Plně souhlasím s Loftomorovým návrhem. Potřebujeme zásobu stavebního materiálu, protože musíme rychle rozšiřovat svá území. Dokud neprozkoumáme celé pobřeží ostrova, nebudu se zde na ostrově cítit v bezpečí. Přivedl jsem z Atlantidy spoustu dobrých mužů. Vojenskou sílu máme k dispozici, jediné co potřebujeme, jsou budovy ve kterých budeme přebývat.","scenario_atl01.wmf","../../data/campaigns/atl01.wmf/scripting/texts.lua:209"
"Atlantis","Atlantida","May Satul warm you, Jundlina. My name is Opol, and I am the highest weaver of the guild abandoning Atlantis and Lutas with you. I come with sad news indeed: we have no more spidercloth. Not a single piece is to be found in our warehouses. Could you not help the weavers’ guild by arranging the building of a weaving mill and a spider farm? The spiders deliver the finest silk and we will produce the finest spidercloth from it.","Ať ti Satul požehná, Jundlino. Jmenuji se Opol a jsem vrchní tkadlec cechu, co opustil Atlantidu a Luta s tebou. Přicházím ale se smutnou zprávou: došla nám pavoučí látka. Ve skladišti už nemáme ani kousek. Možná by si mohla pomoci trochu tkalcovskému cechu a nechat postavit tkalcovnu a pavoučí farmu? Pavoucí předou to nejjemnější hedvábí a z něj umíme upříst tu nejjemnější látku.","scenario_atl01.wmf","../../data/campaigns/atl01.wmf/scripting/texts.lua:268"
"Atlanteans","Atlanťané","When their God lost faith in the Atlanteans and drowned their island, one woman’s struggle for justice and a second chance for her people would become the stuff of legends. Leading the remaining Atlanteans into a new future in a new part of the World, Jundlina became the most powerful human of her time, but at a high cost: her humanity and soul.","Když bůh Atlanťanů ztratil víru v jejich napravení, potopil jejich ostrov, boj jediné ženy o stravedlnost a druhou šanci pro svůj lid se stal základem legend. Jundlina vyvedla zbývající Atlanťany do nové začátku v jiné části světa. Stala se tak nejmocnější osobou své doby, ale zaplatila za to vysokou cenu: ztratila své lidství a svou duši.","maps","../../data/campaigns/campaigns.conf:48"
"Atlanteans","Atlanťané","Like all other tribes, the Atlanteans are also able to train soldiers: the dungeon trains attack – the major attribute of the Atlanteans – and the labyrinth trains evasion, health and defense. The items produced by the industry are used to train better soldiers in the two training sites.","Podobně jako u ostatních kmenů, i u Atlanťanů lze vycvičit vojáky: v kobkách se cvičí útok - hlavní vlastnost Atlanťanů - a v labyrintu odrážení, zdraví a obrana. K výcviku lepších vojáků ve cvičištích se používají věci, které vytváří tvé hospodářství.","scenario_atl01.wmf","../../data/campaigns/atl01.wmf/scripting/texts.lua:111"
"Atlanteans","Atlanťané","The clerics retreated into meditation and the reason for the rising water was soon to be found: the god Lutas had lost faith in the Atlanteans because of the boldness of their king. He decided to withdraw the rights that were granted to King Ajanthul and his children. And so, he called them back below the sea again.","Kněží se ponořili do hlubokých meditací a důvod stoupající vody byl zanedlouho nalezen a oznámen: bůh Lutas ztratil víru ve své Atlanťany kvůli pýše a zpupnosti jejich krále. Rozhodl se odebrat jim výsady, které byly uděleny králi Ajanthulovi a jeho potomkům. A proto je opět volá zpět pod vodní hladinu.","scenario_atl01.wmf","../../data/campaigns/atl01.wmf/scripting/texts.lua:160"
"Atlanteans","Atlanťané","Ahh, but I think this is impossible to change. The preparing and eating of food is something deeply ingrained in us Atlanteans – it is a ceremony that we just need for our well-being. So I guess we cannot take this away from the individuals completely.","Ach, ale to nebude možné jen tak změnit. Konzumace doma připraveného jídla je něco, co je zakořeněno hluboko v nás Atlanťanech - je to něco jako obřad, který má pevné místo v našem životě. Takže myslím, že to lidem nemůžeme jen  tak z ničeho nic odepřít.","scenario_atl01.wmf","../../data/campaigns/atl01.wmf/scripting/texts.lua:237"
"Atlanteans","Atlanťané","Fish is one of the biggest food resources of the Atlanteans. It has to be smoked in a smokery before being delivered to mines, training sites and scouts.","Ryby jsou největším zdrojem potravy Atlanťanů. Musí být vyuzeny v udírně a poté dopraveny do dolů, cvičišť a průzkumníků.","tribes_encyclopedia","../../data/tribes/wares/fish/helptexts.lua:4"
"Atlanteans","Atlanťané","These advanced shields are used by the best soldiers of the Atlanteans. They are produced in the armor smithy and used in the labyrinth – together with food – to train soldiers from defense level 1 to level 2.","Tyto vylepšené štíty používají nejlepší atlantští vojáci. Vyrábějí se v platnéřství a používají se v labyrintu - spolu s jídlem - k výcviku obrany vojáků z úrovně 1 na úroveň 2.","tribes_encyclopedia","../../data/tribes/wares/shield_advanced/helptexts.lua:4"
"Barbarians","Barbaři","After losing an important battle against the barbarians which lead to the loss of a big part of the Empire’s territory, Lutius leaves Fremil to start a new life. But his destiny takes his ship into a heavy storm, which nearly destroys it. Only with a lot of luck he manages to beach his damaged ship on an unknown desert strand and save his people. For now.","Po prohrané bitvě s barbary, která vedla ke ztrátě velké části území císařství, Lutius opustil Fremil a začal nový život. Ale osud zavedl jeho loď do velké bouře, která ji skoro zničila. Pouze díky velkému štěstí dokázal dovést svou loď na písečnou část neznámého pobřeží a zachránit své lidi. Pro zatím.","maps","../../data/campaigns/emp01.wmf/elemental:9"
"Barbarians","Barbaři","Three weeks later, I returned to Fremil to speak with our king. He was furious at the Barbarians, yet forbade any attack on these tribes. He believed that our army was too weak to survive in a war against the Barbarians.","O tři týdny později jsem dorazil do Fremilu, abych si promluvil s Císařem. Byl z barbarů vzteky bez sebe, ale stejně zakázal na jejich kmeny zaútočit. Věřil, že naše armáda je příliš slabá, aby vyhrála válku s barbary.","scenario_emp01.wmf","../../data/campaigns/emp01.wmf/scripting/texts.lua:90"
"Barbarians","Barbaři","Still, I saw no way that I could erase my shame without fighting against these Barbarians. So, I left Fremil by boat to find a new world and a new life for myself, somewhere in the south. Now I am sailing on the Gulf of Perl with my family, some of my friends and a few of my best warriors.","I tak jsem neviděl jiné cesty, jak odčinit svou vinu, než bojem s barbary. Proto jsem Fremil opustil na lodi. Rozhodl jsem se hledat na jihu nové země, kde bych mohl začít nový život. Teď tedy pluji na jih perlovou zátokou s mou rodinou, několika mými přáteli a hrstkou svých nejlepších bojovníků.","scenario_emp01.wmf","../../data/campaigns/emp01.wmf/scripting/texts.lua:93"
"Barbarians","Barbaři","You have established a working economy, trained new soldiers and driven the Barbarians from the island.","Vystavěl si fungující hospodářství, vycvičil nové vojáky a vyhnal Barbary z ostrova.","scenario_emp02.wmf","../../data/campaigns/emp02.wmf/scripting/texts.lua:269"
"Barbarians","Barbaři","The message was addressed to me, begging me to come back to Fremil. It says that the Empire is at war with the Barbarians. They were attacked from the north by the tribe that I was forbidden to attack. It is clear to me what I must do…","Zpráva byla určena mně, prosila mě o návrat do Fremilu. Císařství je prý ve válce s Barbary. Byli napadeni ze severu kmenem, na který jsem nesměl zaútočit. Vím, co musím udělat…","scenario_emp02.wmf","../../data/campaigns/emp02.wmf/scripting/texts.lua:287"
"Barbarians","Barbaři","Let’s finish the Barbarians off and provide a nice colony to the caesar of our empire.","Skoncujeme s barbary a dáme caesarovi naší říše pěknou kolonii.","scenario_emp03.wmf","../../data/campaigns/emp03.wmf/scripting/texts.lua:462"
"Barbarians","Barbaři","Sire, finally we have defeated the Barbarians in this region. And furthermore, we have built a nice colony for our empire.","Pane, konečně jsme porazili barbary v této oblasti. A co víc, postavili jsme zde pěknou kolonii našeho císařství.","scenario_emp03.wmf","../../data/campaigns/emp03.wmf/scripting/texts.lua:551"
"Barbarians","Barbaři","The initial setting depends on the type of the building. For the Barbarians, the sentry is the only building that prefers rookies by default. You should change this setting to fit your current needs.","Úvodní nastavení záleží na typu stavby. U Barbarů je strážnice jediná stavba, která preferuje zelenáče před hrdiny. Nastavení můžeš změnit dle své vůle.","scenario_tutorial02_warfare.wmf","../../data/campaigns/tutorial02_warfare.wmf/scripting/texts.lua:135"
"Barbarians","Barbaři","The ax is the basic weapon of the Barbarians. All young soldiers are equipped with it.","Sekera je základní zbraň barbarů. Všichní tví mladí vojáci jsou jí vybaveni.","tribes_encyclopedia","../../data/tribes/wares/ax/helptexts.lua:4"
"Barbarians","Barbaři","Only this beer is acceptable for the soldiers in a battle arena. Some say that the whole power of the Barbarians lies in this ale. It helps to train the soldiers’ evade level from 0 to 1 to 2. Strong beer is also used in big inns to prepare meals.","Jedině tohle pivo je přijatelné pro vojáky v bitevní aréně. Někteří říkají, že síla barbarů spočívá v tomto pivu. Pomáhá trénovat odrážení vojáků z úrovně 0 na 1 až 2. Silné pivo se také používá ve velkých hostincích na přípravu jídel.","tribes_encyclopedia","../../data/tribes/wares/beer_strong/helptexts.lua:4"
"Barbarians","Barbaři","The fires of the Barbarians are usually fed with coal. Consumers are several buildings: lime kiln, smelting works, ax workshop, war mill, and helm smithy.","Barbarské ohně jsou většinou udržovány uhlím. Uhlí spotřebovává několik budov: vápenná pec, slévárna, dílna na sekery, válečná akademie a kovárna přileb.","tribes_encyclopedia","../../data/tribes/wares/coal/helptexts.lua:8"
"Barbarians","Barbaři","Besides pitta bread and meat, fish is also a foodstuff for the Barbarians. It is used in the taverns, inns and big inns and at the training sites (training camp and battle arena).","Krom chlebových placek a masa jsou i ryby potravou barbarů. Používají se v hospodách, hostincích, velkých hostincích a cvičištích (výcvikový tábor a bitevní aréna).","tribes_encyclopedia","../../data/tribes/wares/fish/helptexts.lua:6"
"Lumberjack’s Hut","Chata dřevorubce","I see you have already built a quarry and two lumberjack’s huts. That is a good beginning if we want to stay here longer.","Vidím, že jsi již postavil lom a dvě chaty pro dřevorubce. To je dobrý začátek, pokud tu chceme chvíli vydržet.","scenario_bar01.wmf","../../data/campaigns/bar01.wmf/scripting/texts.lua:252"
"Lumberjack’s Hut","Chata dřevorubce","We need to find a nice place for the lumberjack’s hut. To make this easier, we can activate ‘Show building spaces’. There are two ways you can do this:","Pro dřevorubcovu chatu musíme najít hezké místo. To si můžeme usnadnit tak, že aktivujeme "Ukaž místa ke stavění". Lze to provést dvěma způsoby:","scenario_tutorial01_basic_control.wmf","../../data/campaigns/tutorial01_basic_control.wmf/scripting/texts.lua:42"
"Lumberjack’s Hut","Chata dřevorubce","There you go. I will explain about all those symbols in a minute. First, let me show you how to make a lumberjack’s hut and how to connect it with a road. There is a sweet spot for a lumberjack right next to those trees. I’ll describe the steps I will take and then ask you to click on the ‘OK’ button for me to demonstrate.","A je to. Všechny ty symboly ti vysvětlím za chvilku. Nejprve ti ukážu, jak postavit chatu dřevorubce a jak ji napojit na cestu. Hned vedle těch stromů je krásné místečko pro dřevorubce. V následujícím panelu ti vysvětlím všechny kroky a jakmile klikneš na tlačítko "OK", tak ti je i předvedu.","scenario_tutorial01_basic_control.wmf","../../data/campaigns/tutorial01_basic_control.wmf/scripting/texts.lua:65"
"Lumberjack’s Hut","Chata dřevorubce","That won’t do yet. I still need to connect the lumberjack’s hut to the rest of my road network. After ordering the construction site, I was automatically put into road building mode, so all I have to do is click on the blue flag in front of my headquarters.","To ještě nestačí. Ještě musím připojit dřevorubcovu chatu k ostatním cestám. Když jsem založil staveniště, dostal jsem se automaticky do režimu stavby cest, takže jediné, co musím udělat, je kliknout na modrou vlajku před hlavní budovou.","scenario_tutorial01_basic_control.wmf","../../data/campaigns/tutorial01_basic_control.wmf/scripting/texts.lua:85"
"Lumberjack’s Hut","Chata dřevorubce","That won’t do yet. I still need to connect the lumberjack’s hut to the rest of my road network. You have disabled the option ‘Start building road after placing a flag’ (to change that, choose ‘Options’ in the Widelands main menu). Therefore, I have entered the road building mode manually. I will tell you later how to do that. To build the road, all I have to do now is click on the blue flag in front of my headquarters.","To ještě nebude stačit. Stále potřebuji propojit chatu dřevorubce s okolními cestami. Vypnuli jste volbu "Postavit cestu při umístění vlajky" (pro změnu vyberte Volby v hlavní nabídce Widelands). Proto jsem se přepnul do módu stavba cest a teď stačí jen kliknout na modrou vlajku před mou hlavní budovou.","scenario_tutorial01_basic_control.wmf","../../data/campaigns/tutorial01_basic_control.wmf/scripting/texts.lua:96"
"Lumberjack’s Hut","Chata dřevorubce","The quarry is a small building like the lumberjack’s hut. You can therefore build it on any field that shows a red, yellow or green house when the building spaces symbols are enabled (Press Space for that).","Lom je malá budova stejně jako dřevorubecká chata. Proto ji lze postavit na jakémkoliv políčku, které má ikonu červeného, žlutého nebo zeleného domku, pokud je zapnuto zobrazení míst ke stavění (pro zapnutí stiskni mezerník).","scenario_tutorial01_basic_control.wmf","../../data/campaigns/tutorial01_basic_control.wmf/scripting/texts.lua:254"
"Lumberjack’s Hut","Chata dřevorubce","The lumberjack working at this lumberjack’s hut can’t find any trees in his work area. You should consider dismantling or destroying the building or building a ranger’s hut.","Dřevorubec pracující v této chatě dřevorubce nemůže ve svém okolí najít žádné stromy. Měl by si zvážit rozebrání, zničení nebo postavení chaty lesníka.","tribes","../../data/tribes/buildings/productionsites/barbarians/lumberjacks_hut/init.lua:61"
"Gamekeeper’s Hut","Chata hajného","Build a hunter’s hut, a gamekeeper’s hut and a tavern","Postav loveckou chatu, chatu hajného a hospodu","scenario_bar01.wmf","../../data/campaigns/bar01.wmf/scripting/texts.lua:66"
"Gamekeeper’s Hut","Chata hajného","Always build a ranger’s and a gamekeeper’s hut, so you will not run out of logs or game.","Vždy postav chaty pro lesníka a hajného, aby ti nedošly kmeny nebo zvěřina.","texts","../../data/txts/tips/barbarians.lua:8"
"Gamekeeper’s Hut","Chata hajného","The hunter working out of this hunter’s hut can’t find any game in his work area. Remember that you can build a gamekeeper’s hut to release more game into the wild.","Lovec pracující v této lovecké chatě nemůže najít žádnou zvěř ve svém okolí. Pamatuj, že je potřeba postavit chatu hajného aby se někdo staral o množení divoké zvěře.","tribes","../../data/tribes/buildings/productionsites/barbarians/hunters_hut/init.lua:68"
"Ranger’s Hut","Chata lesníka","Build a ranger’s hut next to each lumberjack’s hut.","Postav chatu lesníka vedle každé chaty dřevorubce.","scenario_bar01.wmf","../../data/campaigns/bar01.wmf/scripting/texts.lua:26"
"Ranger’s Hut","Chata lesníka","So, in order to replace the trees we chop down, we should build some ranger’s huts, preferably close to the lumberjack’s huts.","Abychom nahradili stormy, které jsme pokáceli, je třeba postavit chaty pro lesníky. Nejlépe poblíž chat dřevorubců.","scenario_bar01.wmf","../../data/campaigns/bar01.wmf/scripting/texts.lua:258"
"Objective","Cíl","But the following objective is even more important:","Ale tento úkol je ještě důležitější:","scenario_emp03.wmf","../../data/campaigns/emp03.wmf/scripting/texts.lua:423"
"Objective","Cíl","This objective has no description.","Tento úkol nemá popis.","widelands","../../src/logic/objective.h:38"
"Objective","Cíl","The filename that the game was saved under followed by the map’s name, or the map’s name followed by the last objective achieved.","Název souboru následovaný názvem mapy nebo název mapy následovaný názvem posledního splněného úkolu.","widelands","../../src/wui/load_or_save_game.cc:123"
"Empire","Císařství","Two empires race for the treasures of a legendary peninsula…","Dvě říše se předhánějí v hledání pokladu legendárního poloostrovu...","maps","../../data/maps/Golden_Peninsula.wmf/elemental:10"
"Empire","Císařství","The river has always provided food and communication. This time, eight empires will fight for control over this land.","Řeka vždy poskytovala potravu i dopravu. Tentokrát bude o vládu nad touto zemí válčit osm říší.","maps","../../data/maps/The_Nile_v2.wmf/elemental:10"
"Empire","Císařství","In this game, you start out on a small piece of land with just a few resources. Using these, you’ll create an empire with many thousands of inhabitants. On your way towards this goal, you will have to establish an economic infrastructure, explore the land around you and face rivaling tribes.","V této hře začneš na malém kousku světa jen s trochou surovin. Pomocí nich postupně vybuduješ impérium čítající tisíce obyvatel. Na tvé cestě k tomuto cíli vybuduješ hospodářskou infrastrukturu, objevíš nové země kolem sebe a postavíš se konkurenčním kmenům.","texts","../../data/txts/help/common_helptexts.lua:19"
"Empire","Císařství","The bakers of the Empire make really tasty bread out of flour and water. It is used in taverns and inns to prepare rations and meals. Bread is also consumed at the training sites (arena, colosseum, training camp).","Císařští pekaři pečou z mouky a vody skutečně chutný chleba, který se v hospodách a hostincích používá pro přípravu přídělů a jídel. Chléb je potřeba i při výcviku vojáků (aréna, koloseum, výcvikový tábor).","tribes_encyclopedia","../../data/tribes/wares/bread_empire/helptexts.lua:4"
"Empire","Císařství","The fires of the Empire smelting works, armor smithies and weapon smithies are usually fed with coal.","Císařské ohně ve slévárně, platnéřství a zbrojířství jsou obvykle udržovány uhlím.","tribes_encyclopedia","../../data/tribes/wares/coal/helptexts.lua:10"
