"glossary_term","glossary_translation","source","target","file","location"
"Fish","ryba","Rations are produced in a tavern, an inn or a big inn out of fish or meat or pitta bread.","Příděly se vyrábějí v hospodě, hostinci nebo velkém hostinci z ryb, masa nebo chleba.","tribes_encyclopedia","../../data/tribes/wares/ration/helptexts.lua:6"
"Fish","ryba","Rations are produced in a tavern out of fish or meat or bread.","Příděly se vyrábějí v hospodě z ryb, masa nebo chleba.","tribes_encyclopedia","../../data/tribes/wares/ration/helptexts.lua:8"
"Fish","ryba","As no Atlantean likes raw fish, smoking it in a smokery is the most common way to make it edible.","Protože Atlanťané nejedí ryby syrové, nejběžnější zpracování je jejich vyuzení v udírně.","tribes_encyclopedia","../../data/tribes/wares/smoked_fish/helptexts.lua:4"
"Fish","ryba","The fisher fishes delicious fish.","Rybáři loví chutné ryby.","tribes_encyclopedia","../../data/tribes/workers/atlanteans/fisher/helptexts.lua:3"
"Fish","ryba","Catches fish in the sea.","Chytá ryby v moři.","tribes_encyclopedia","../../data/tribes/workers/barbarians/fisher/helptexts.lua:3"
"Fish","ryba","Catches fish in the sea.","Chytá ryby v moři.","tribes_encyclopedia","../../data/tribes/workers/empire/fisher/helptexts.lua:3"
"Reed Yard","rákosové pole","The gardener working at this reed yard has no cleared soil to plant his seeds.","Zahradník nemůže pěstovat rákos, protože nemá kam sázet.","tribes","../../data/tribes/buildings/productionsites/barbarians/reed_yard/init.lua:72"
"Reed Yard","rákosové pole","Thatch reed is produced in a reed yard and used to make the roofs of buildings waterproof.","Rákos se pěstuje na rákosovém poli a používá se na stavbu střech.","tribes_encyclopedia","../../data/tribes/wares/thatch_reed/helptexts.lua:4"
"Farmer","sedlák","Boldreth is right! We don’t have enough food to survive a long, cold winter. We should start building a well, a fisher’s and a hunter’s hut. And if we find enough space, we should as well build up a farm and a bakery! One of our farmers seems to be very clever – he already got some crops to grow in this cold soil.","Boldreth má pravdu! Nemáme dost jídla abychom přežili dlouhou a mrazivou zimu. Měli bychom začít stavět studny, chaty pro rybáře a lovce. Pokud najdeme dostatek místa, měli bychom postavit i obilné pole a pekárnu! Naši sedláci se zdají být velmi chytří - už se jim podařilo vypěstovat malou úrodu v této promrzlé půdě.","scenario_bar02.wmf","../../data/campaigns/bar02.wmf/scripting/texts.lua:248"
"Ax","sekera","So you want to prepare us for a longer stay in these forests, Thron? Well, I see the wisdom in doing so, yet my heart is yearning for a glorious return to Al’thunran. Too long have we waited while our brethren have fought on the battlefield, and our axes and swords have turned rusty over time.","Tak ty nás chceš připravit na delší pobyt v těchto lesech, Thronene? Ačkoliv je toto moudré rozhodnutí, stejně mé srdce touží po slavném návratu do Al’thunran. Příliš dlouho jsme čekali zatímco naši bratři bojovali na bitevním poli a naše sekery a meče mezitím zrezavěli.","scenario_bar01.wmf","../../data/campaigns/bar01.wmf/scripting/texts.lua:317"
"Ax","sekera","To train in the training camp, our soldiers need food like in the battle arena, but no strong beer. Instead, they need different axes for attack training and helmets for health training.","Pro trénink ve výcvikovém táboře, potřebují vojáci jídlo, stejně jako v bitevní aréně, ale není potřeba silné pivo. Místo toho potřebují různé sekery pro výcvik útoku a přilby pro výcvik zdraví.","scenario_tutorial02_warfare.wmf","../../data/campaigns/tutorial02_warfare.wmf/scripting/texts.lua:122"
"Ax","sekera","Produces axes, sharp axes and broad axes.","Vyrábí sekery, ostré sekery a široké sekery.","tribes_encyclopedia","../../data/tribes/buildings/productionsites/barbarians/ax_workshop/helptexts.lua:13"
"Ax","sekera","If all needed wares are delivered in time, this building can produce each type of ax in about %s on average.","Pokud jsou všechny potřebné suroviny doručeny včas, může tato budova vyrobit jakýkoukoliv sekeru za v průměru %s.","tribes_encyclopedia","../../data/tribes/buildings/productionsites/barbarians/ax_workshop/helptexts.lua:23 ../../data/tribes/buildings/productionsites/barbarians/warmill/helptexts.lua:27"
"Ax","sekera","Produces all the axes that the Barbarians use for warfare.","Vyrábí všechny sekery, které barbaři potřebují ve válce.","tribes_encyclopedia","../../data/tribes/buildings/productionsites/barbarians/warmill/helptexts.lua:16"
"Ax","sekera","Only very important things are embellished with gold. It is used as a precious building material and to produce different axes (in the war mill) and different parts of armor (in the helm smithy).","Pouze ty nejdůležitější věci jsou zdobeny zlatem. Používá se coby vzácný stavební materiál a na výrobu různých seker (ve válečné akademii) a na výrobu různých částí zbroje (v kovárně na přilby).","tribes_encyclopedia","../../data/tribes/wares/gold/helptexts.lua:8"
"Warehouse","skladiště","May Satul warm you, Jundlina. My name is Opol, and I am the highest weaver of the guild abandoning Atlantis and Lutas with you. I come with sad news indeed: we have no more spidercloth. Not a single piece is to be found in our warehouses. Could you not help the weavers’ guild by arranging the building of a weaving mill and a spider farm? The spiders deliver the finest silk and we will produce the finest spidercloth from it.","Ať ti Satul požehná, Jundlino. Jmenuji se Opol a jsem vrchní tkadlec cechu, co opustil Atlantidu a Luta s tebou. Přicházím ale se smutnou zprávou: došla nám pavoučí látka. Ve skladišti už nemáme ani kousek. Možná by si mohla pomoci trochu tkalcovskému cechu a nechat postavit tkalcovnu a pavoučí farmu? Pavoucí předou to nejjemnější hedvábí a z něj umíme upříst tu nejjemnější látku.","scenario_atl01.wmf","../../data/campaigns/atl01.wmf/scripting/texts.lua:268"
"Warehouse","skladiště","The third tab shows you the wares that are stored in your headquarters, your warehouses and ports. They are not needed anywhere and are therefore your reserve.","Třetí záložka zobrazuje suroviny, které jsou uloženy ve tvé hlavní budově, tvých skladištích a přístavech. Nejsou nikde potřeba a proto tvoří tvoje zásoby.","scenario_tutorial04_economy.wmf","../../data/campaigns/tutorial04_economy.wmf/scripting/texts.lua:158"
"Warehouse","skladiště","I’ve shown you our stock menu window, where you could see which wares are at the warehouses. You remember?","Ukázal jsem ti naše okno zásob, kde se můžeš podívat, jaké suroviny jsou ve skladištích. Pamatuješ?","scenario_tutorial04_economy.wmf","../../data/campaigns/tutorial04_economy.wmf/scripting/texts.lua:398"
"Warehouse","skladiště","Most buildings will only produce something when the stock level in your warehouses falls below the target quantity, so you should indicate the reserve you want to stockpile.","Většina budov vyrábí pouze dokud zásoby ve skladišti nespadnou pod určitou hodnotu. Můžeš si tedy nastavit kolik se má uchovat surovin pro případ nouze.","scenario_tutorial04_economy.wmf","../../data/campaigns/tutorial04_economy.wmf/scripting/texts.lua:418"
"Warehouse","skladiště","To achieve this, you will have to do two things. First, set a preference for marble columns in the desired warehouse. All marble columns produced in the future will be brought there if possible.","Aby jsi toho dosáhl, jsou zapotřebí dvě věci. První, nastavit preferenci pro mramorové sloupy v požadovaném skladišti. Všechny vyrobené mramorové sloupy budou přeneseny tam, pokud to bude možné.","scenario_tutorial04_economy.wmf","../../data/campaigns/tutorial04_economy.wmf/scripting/texts.lua:453 ../../data/campaigns/tutorial04_economy.wmf/scripting/texts.lua:461"
"Warehouse","skladiště","You get points for precious wares in your warehouses. The player with the highest number of wares at the end of 4 hours wins the game.","Za každé vzácné suroviny ve svém skladišti dostaneš body. Vyhrává hráč s největším počtem surovin na konci 4 hodinové hry.","win_conditions","../../data/scripting/win_conditions/collectors.lua:20"
"slope","sklon","There is a small slope to climb to reach this field. This means that your workers will be faster walking downhill than they will be walking uphill.","Je tu malé stoupání, které je třeba zdolat  cestou na toto pole. To znamená, že tví dělníci budou rychleji zcházet do údolí než stoupat nahoru.","scenario_tutorial01_basic_control.wmf","../../data/campaigns/tutorial01_basic_control.wmf/scripting/texts.lua:302"
"rocks","sklály","The point is that the first island only provides rocks and trees, the second only meadows and resources. The economies you leave behind will continue to work for you, but you will only reap the benefits at the moment you reach a new island.","Příprav se na to, že na prvním ostrově najdeš pouze kamení a dřevo, na druhém pouze louky a suroviny. Ekonomika, kterou vybuduješ ti bude vydělávat pořád ale k těžbě se dostaneš až postoupíš na další ostrov.","mp_scenario_island_hopping.wmf","../../data/maps/MP_Scenarios/Island_Hopping.wmf/scripting/texts.lua:24"
"rocks","sklály","Get to the rocks north-east from you and build a quarry there.","Dostaň se ke skalám na severovýchodě a postav tam lom.","scenario_bar01.wmf","../../data/campaigns/bar01.wmf/scripting/texts.lua:37"
"rocks","sklály","I beg your forgiveness, chieftain, but I have a grave concern to discuss with you. The rocks close to our camp are shrinking fast under our workers’ tools, and it is a matter of little time only before they are all gone.","Prosím o prominutí, náčelníku, ale chci s tebou mluvit o vážné věci. Skal u našeho tábora je stále méně a rychle mizí pod nářadím našich dělníků. Je pouze otázkou času, než zmizí docela.","scenario_bar01.wmf","../../data/campaigns/bar01.wmf/scripting/texts.lua:325"
"rocks","sklály","While it is certainly no worthy task for a warrior, at least it is something to do! Thron, what would you say about my taking a few of our most restless warriors and venturing somewhat closer to the great mountain of Kal’mavrath – maybe we will find some more big rocks to please the old man?","Ačkoliv to není úkol hodný válečníka, alespoň je co dělat! Throne, co by si říkal na to, kdybych si vzal hrstku našich nejneposednějších válečníků a vydal se s nimi k velké hoře Kal’mavrath - možná najdeme více skal, které potěší starce?","scenario_bar01.wmf","../../data/campaigns/bar01.wmf/scripting/texts.lua:333"
"rocks","sklály","At last! These rocks should last for a while.","No konečně! Tyhle skály by měly na chvíli stačit.","scenario_bar01.wmf","../../data/campaigns/bar01.wmf/scripting/texts.lua:349"
"rocks","sklály","Sire, I just thought about the rocks standing on the south shore of this land. Perhaps we could cut out some useful granite and beautiful marble.","Pane, právě jsem přemýšlel o skalách, které jsou na jižním břehu. Možná bychom z nich mohli získat nějakou tu žulu a krásný mramor.","scenario_emp01.wmf","../../data/campaigns/emp01.wmf/scripting/texts.lua:204"
"rocks","sklály","Later, I walked down to the rocks in the south and looked for a place where we could build a quarry to get some granite for our larger buildings.","Později jsem se byl projít ke skalám na jihu a poohlédnout se po místě, kde bychom mohli vybudovat lom a získat tak žulu na větší budovy.","scenario_emp02.wmf","../../data/campaigns/emp02.wmf/scripting/texts.lua:137"
"rocks","sklály","Again, I felt like I was in paradise when I noticed that some marble-like stones were among the rocks. It seems that we will soon be able to build strong, luxurious buildings, like those we were accustomed to in Fremil.","Opět jsem se cítil jako v ráji, když jsem si ve skalách všiml kamenů, které se strukturou až nápadně podobaly mramoru. Vypadá to, že brzy budeme schopni vybudovat silné, luxusní budovy. Takové na jaké jsme byli zvyklí ve Fremilu.","scenario_emp02.wmf","../../data/campaigns/emp02.wmf/scripting/texts.lua:140"
"rocks","sklály","Build a quarry close to the abundant rocks to free some building plots and get some valuable resources.","Postav lom poblíž opuštěných kamenů, abys uvolnil prostor pro budovy a získal cenné suroviny.","scenario_emp03.wmf","../../data/campaigns/emp03.wmf/scripting/texts.lua:59"
"rocks","sklály","Again, we stranded on an unknown coast and slept in the shade under some palm trees until the sun was risen high up in the sky. I’m afraid that when we awoke at noon, nobody was really surprised that all we could see was sand… although the amount of rocks near our camp was astonishing.","Stále jsme ztraceni na neznámém pobřeží a spíme ve stínu palem, dokud slunce nevystoupí vysoko nad horizont. Obávám se, že až se v poledne probudíme, nebude nikdo příliš překvapen, že je písek, kam až oko dohlédne... ačkoliv bylo to množství skal poblíž našeho tábořiště dech beroucí.","scenario_emp03.wmf","../../data/campaigns/emp03.wmf/scripting/texts.lua:214"
"rocks","sklály","To make matters even worse, all the land we can see is blocked by rocks and trees. I fear we won’t find the resources we need to build a new ship.","Aby toho nebylo málo, všechna zem, kam až oko dohlédne je blokována skálami a stromy. Bojím se, že nenalezneme suroviny potřebné na stavbu nové lodi.","scenario_emp03.wmf","../../data/campaigns/emp03.wmf/scripting/texts.lua:220"
"rocks","sklály","But although this is a good step forward, I can’t see much space for buildings. The whole island is littered with rocks. How can we ever build a new ship or even have some basic infrastructure to make our lives more comfortable?","I když je to krok správným směrem, není tu moc místa na budovy. Celý ostrov je posetý skálami. Jak vůbec budeme schopni postavit novou loď nebo alespoň základní infrastrukturu, abychom si žili lépe?","scenario_emp03.wmf","../../data/campaigns/emp03.wmf/scripting/texts.lua:265"
"rocks","sklály","I think we should try to reveal some building space by cutting up all the rocks in a quarry.","Myslím, že bychom měli uvolnit stavební místa odstraněním všech kamenů v lomu.","scenario_emp03.wmf","../../data/campaigns/emp03.wmf/scripting/texts.lua:277"
"rocks","sklály","Some Rocks Were Found","Byly nalezeny skály","scenario_tutorial01_basic_control.wmf","../../data/campaigns/tutorial01_basic_control.wmf/scripting/texts.lua:177"
"rocks","sklály","Granite can be mined in granite mines, but the easier way is to build a quarry next to some rocks lying around. As it happens, there is a pile of them just to the west (left) of your headquarters. I will teach you now how to move your view over there.","Žula se dá těžit v dole na žulu ale jednodušší je postavit si lom vedle kamení ležícího kolem. Jak už se tak stává, je ho plno západně (nalevo) od tvé hlavní budovy. Naučím tě, jak tam přesunout kameru.","scenario_tutorial01_basic_control.wmf","../../data/campaigns/tutorial01_basic_control.wmf/scripting/texts.lua:180"
"rocks","sklály","Build a quarry next to those rocks here. Remember how I did it earlier?","Postav lom vedle tady těch skal. Pamatuješ, jak se to dělá?","scenario_tutorial01_basic_control.wmf","../../data/campaigns/tutorial01_basic_control.wmf/scripting/texts.lua:239"
"rocks","sklály","Just click on any house symbol next to the rocks, select the small buildings tab in the window that opens up, then click on the quarry symbol.","Stačí kliknout na kterýkoli symbol domu vedle skal, vybrat záložku s malými budovami v okně, které se otevře, a pak vybrat symbol lomu.","scenario_tutorial01_basic_control.wmf","../../data/campaigns/tutorial01_basic_control.wmf/scripting/texts.lua:255"
"rocks","sklály","When there are many rocks, you can consider building another quarry. This will make the granite production faster.","Když už tu je tolik kamení, zvaž stavbu dalšího lomu. To urychlí těžbu žuly.","scenario_tutorial01_basic_control.wmf","../../data/campaigns/tutorial01_basic_control.wmf/scripting/texts.lua:341"
"rocks","sklály","Build a second quarry near the rocks and connect it to your road network.","Postav druhý lom nedaleko skal a připoj ho k ostatním cestám.","scenario_tutorial01_basic_control.wmf","../../data/campaigns/tutorial01_basic_control.wmf/scripting/texts.lua:342"
"rocks","sklály","Build a second quarry next to the rocks. Do not forget to connect it to another flag.","Postav druhý lom vedle skal. Nezapomeň další vlajku.","scenario_tutorial01_basic_control.wmf","../../data/campaigns/tutorial01_basic_control.wmf/scripting/texts.lua:348"
"rocks","sklály","Well done! Let’s see how messages work in a real game, shall we? For this, I’ll take all rocks away from the poor stonemasons in the quarries. They will then send a message each that they can’t find any in their work areas the next time they try to do some work.","Výborně! Nyní se podíváme na to, jak zprávy fungují ve skutečné hře, můžeme? Za tímto účelem, vezmu všechno kamení chudákům kameníkům v lomech. Ti, jakmile se pokusí pracovat, pošlou zprávu, že ve svém okolí nemohou najít kamení.","scenario_tutorial01_basic_control.wmf","../../data/campaigns/tutorial01_basic_control.wmf/scripting/texts.lua:419"
"rocks","sklály","The stonecutter working at this quarry can’t find any rocks in his work area.","Kameník pracující v tomto lomu nemůže v okolí najít žádné skály.","tribes","../../data/tribes/buildings/productionsites/atlanteans/quarry/init.lua:65"
"rocks","sklály","The stonemason working at this quarry can’t find any rocks in his work area.","Kameník pracující v tomto lomu nemůže v okolí najít žádné skály.","tribes","../../data/tribes/buildings/productionsites/barbarians/quarry/init.lua:72"
"rocks","sklály","The stonemason working at this quarry can’t find any rocks in his work area.","Kameník pracující v tomto lomu nemůže v okolí najít žádné skály.","tribes","../../data/tribes/buildings/productionsites/empire/quarry/init.lua:80"
"rocks","sklály","Cuts blocks of granite out of rocks in the vicinity.","Vyřezává žulové bloky ze skal v okolí.","tribes_encyclopedia","../../data/tribes/buildings/productionsites/atlanteans/quarry/helptexts.lua:16"
"rocks","sklály","The quarry needs rocks to cut within the work area.","Lom potřebuje ve svém okolí skály aby bylo, co lámat.","tribes_encyclopedia","../../data/tribes/buildings/productionsites/atlanteans/quarry/helptexts.lua:21"
"rocks","sklály","Cuts raw pieces of granite out of rocks in the vicinity.","Řeže surové bloky žuly ze skal v okolí.","tribes_encyclopedia","../../data/tribes/buildings/productionsites/barbarians/quarry/helptexts.lua:16"
"rocks","sklály","The quarry needs rocks to cut within the work area.","Lom potřebuje ve svém okolí skály aby bylo, co lámat.","tribes_encyclopedia","../../data/tribes/buildings/productionsites/barbarians/quarry/helptexts.lua:21"
"rocks","sklály","Cuts blocks of granite and marble out of rocks in the vicinity.","Vyřezává bloky žuly a mramoru ze skal v okolí.","tribes_encyclopedia","../../data/tribes/buildings/productionsites/empire/quarry/helptexts.lua:16"
"rocks","sklály","The quarry needs rocks to cut within the work area.","Lom potřebuje ve svém okolí skály aby bylo, co lámat.","tribes_encyclopedia","../../data/tribes/buildings/productionsites/empire/quarry/helptexts.lua:21"
"rocks","sklály","Cuts blocks of granite out of rocks in the vicinity.","Vyřezává žulové bloky ze skal v okolí.","tribes_encyclopedia","../../data/tribes/workers/atlanteans/stonecutter/helptexts.lua:3"
"rocks","sklály","Cuts raw pieces of granite out of rocks in the vicinity.","Řeže surové bloky žuly ze skal v okolí.","tribes_encyclopedia","../../data/tribes/workers/barbarians/stonemason/helptexts.lua:3"
"rocks","sklály","Cuts blocks of granite and marble out of rocks in the vicinity.","Vyřezává bloky žuly a mramoru ze skal v okolí.","tribes_encyclopedia","../../data/tribes/workers/empire/stonemason/helptexts.lua:3"
"Smelter","slévač","May Satul warm you, Jundlina. Have you considered mining for resources in the mountains around us? We are running short of quartz and diamonds for our buildings. Also, we could use more iron, gold and especially coal. If we find an ample supply of those commodities, we could start producing weapons and tools; this would help enormously. Of course, we would need smelters, a weapon smithy, an armor smithy and a toolsmithy. And maybe even more.","Nechť vás hřeje Satul, Jundlino. Zvážila jste možnost těžby nerostných surovin v okolních horách? Začíná nám docházet křemen i diamanty na stavbu našich budov. Také bychom potřebovali více železa, zlata a hlavně uhlí. Pokud bychom objevili dostatečnou zásobu těchto surovin, mohli bychom začít vyrábět zbraně a nástroje, což by nám neuvěřitelně pomohlo. Samozřejmě potřebujeme i slévárnu, zbrojířství, platnéřství a dílnu. A možná dokonce i další výrobny.","scenario_atl01.wmf","../../data/campaigns/atl01.wmf/scripting/texts.lua:303"
"Smelting Works","slévárna","The ores have to be smelted at a smelting works before they can be used. The refined materials are then used in the weapon smithy, the armor smithy and the toolsmithy.","Rudu je nutné nejprve roztavit ve slévárně než ji lze použít. Takto zpracovaný materiál se poté používá ve zbrojířství, platnéřství a v dílně.","scenario_atl01.wmf","../../data/campaigns/atl01.wmf/scripting/texts.lua:88"
"Smelting Works","slévárna","Expand your territory to the mountains, send geologists to search for ore and coal and build a mining economy with mines, taverns, smelting works and metal workshop.","Rozšiř své území k horám, pošli geology hledat rudy, uhlí a postav těžební hospodářství tj. doly, hospody, slévárny a dílny na železo.","scenario_bar02.wmf","../../data/campaigns/bar02.wmf/scripting/texts.lua:80"
"Smelting Works","slévárna","By the Gods, this is an unbelievable stroke of fortune! There are two more mountains, and it seems that one has a large quantity of coal and the other of iron ore. I advise you to immediately build iron and coal mines (or at least charcoal kilns), smelting works, toolsmithies, armor and weapon smithies.","U všech bohů, to je neuvěřitelná náhoda! Jsou zde další dvě hory a zdá se, že jedna ukrývá bohaté zásoby uhlí a druhá železné rudy. Radím ti okamžitě postavit důl na uhlí a železnou rudu (nebo alespoň milíř na dřevěné uhlí), slévárny, dílny, platnéřsví a zbrojařství.","scenario_emp02.wmf","../../data/campaigns/emp02.wmf/scripting/texts.lua:198"
"Smelting Works","slévárna","Here in the northern part, you only have a goldmine and a warehouse. While the miners are supplied well with food, there is no way to transport the gold ore to our smelting works in the southern part.","Zde v severní části, máš pouze důl na zlato a skladiště. Ačkoliv jsou tví horníci dobře zásobeni jídlem, nemáš žádný způsob, jak přepravit zlatou rudu do slévárny na jihu.","scenario_tutorial03_seafaring.wmf","../../data/campaigns/tutorial03_seafaring.wmf/scripting/texts.lua:34"
"Smelting Works","slévárna","The Atlantean fires in smelting works, armor smithies and weapon smithies are fed with coal.","Atlantské ohně ve slévárně, platnéřství a zbrojířství jsou udržovány uhlím.","tribes_encyclopedia","../../data/tribes/wares/coal/helptexts.lua:6"
"Smelting Works","slévárna","The fires of the Empire smelting works, armor smithies and weapon smithies are usually fed with coal.","Císařské ohně ve slévárně, platnéřství a zbrojířství jsou obvykle udržovány uhlím.","tribes_encyclopedia","../../data/tribes/wares/coal/helptexts.lua:10"
"Smelting Works","slévárna","Iron ore is mined in iron mines. It is smelted in a smelting works to retrieve the iron.","Železná ruda se těží v dolech na železo a musí být zpracována ve slévárně, kde se z ní získává železo.","tribes_encyclopedia","../../data/tribes/wares/iron_ore/helptexts.lua:4"
"delete","smazat; delete","Manage your messages more efficiently: press ‘N’ for News to access the messages window, then use ‘G’ for Go To, and the Delete key to archive messages.","Spravování tvých zpráv může být efektivnější: stisknuti "N" pro přístup ke zprávám a poté stisknuti "G" k přemístění k objektu a klávesa "Delete" archivuje zprávy.","texts","../../data/txts/tips/general_game.lua:39"
"delete","smazat; delete","Do you really want to delete this replay?","Opravdu chceš smazat tento záznam?","widelands","../../src/wui/load_or_save_game.cc:240"
"delete","smazat; delete","Do you really want to delete this %d replay?","Opravdu chceš smazat tento %d záznam?","widelands","../../src/wui/load_or_save_game.cc:243"
"delete","smazat; delete","Do you really want to delete these %d replays?","Opravdu chceš smazat tyto %d záznamy?","widelands","../../src/wui/load_or_save_game.cc:243"
"delete","smazat; delete","Do you really want to delete this game?","Opravdu chceš smazat tuto hru?","widelands","../../src/wui/load_or_save_game.cc:250"
