"glossary_term","glossary_translation","source","target","file","location"
"port space","港の候補地","Show expeditions that have found a port space or are founding a colony","港を発見したか植民地を建設中の探検船を表示","tribes_encyclopedia","../../data/tribes/scripting/help/controls.lua:144"
"Fisher","漁師","The fisher working at this aqua farm can’t find any fish ponds in his work area. Please make sure there is a working clay pit nearby and the aqua farm is supplied with all needed wares, or consider dismantling or destroying this building.","作業エリア内にこれ以上養殖池がありません。近くに穴掘りを配置し、養殖場には物資をきちんと供給しましょう。それができないのであれば、建物を解体、破壊することを考えましょう。","tribes","../../data/tribes/buildings/productionsites/frisians/aqua_farm/init.lua:99"
"Fisher’s Hut","漁師の庵","The fisher working out of this fisher’s hut can’t find any fish in his work area.","ここの漁師は作業エリア内に魚を見つけられません","tribes","../../data/tribes/buildings/productionsites/barbarians/fishers_hut/init.lua:63"
"Fisher’s House","漁師小屋","The fisher working out of this fisher’s house can’t find any fish in his work area. Remember that you can increase the number of existing fish by building a fish breeder’s house.","この漁師は作業エリア内に魚を見つけられません。養魚番小屋を建てれば残っている魚を増やすことができるかもしれません。","tribes","../../data/tribes/buildings/productionsites/atlanteans/fishers_house/init.lua:54"
"Fisher’s House","漁師小屋","The fisher working out of this fisher’s house can’t find any fish in his work area.","漁師は作業エリア内に魚を見つけられません","tribes","../../data/tribes/buildings/productionsites/empire/fishers_house/init.lua:54"
"Fisher’s House","漁師小屋","The fisher working out of this fisher’s house can’t find any fish in his work area.","漁師は作業エリア内に魚を見つけられません","tribes","../../data/tribes/buildings/productionsites/frisians/fishers_house/init.lua:64"
"Fishing Net","漁網","The fishing net is used by the fisher and produced by the toolsmith.","魚網は漁師が使用する道具で、道具工房で製造されます。","tribes_encyclopedia","../../data/tribes/initialization/atlanteans/units.lua:712"
"Smokery","燻製工房","This hook pole is used by the smoker to suspend all the meat and fish from the top of the smokery. It is created by the toolsmith.","ひっかけ棒は、燻製職人が工房で肉や魚を吊り下げる時に使用します。ひっかけ棒は道具職人が製造します。","tribes_encyclopedia","../../data/tribes/initialization/atlanteans/units.lua:739"
"Smoked Fish","燻製魚","Hungry customers in times of a shortage of smoked fish and meat","燻製製品不足時のハラペコ客","tribes_encyclopedia","../../data/tribes/initialization/frisians/units.lua:1920"
"Ox","牛","They are amazing animals: The ox is as swift as a human being while being much stronger and very frugal: all we need is wheat and water to breed them and they will do their work on the roads loyally and reliably.","彼らは素晴らしい動物です。人間と同等の早さで動きつつも、ずっと力持ちでずっと質素な生活に耐えます。小麦と水を与えて育ててあげさえすれば、忠実かつ確実に道で物資の輸送をしてくれます。","scenario_bar01.wmf","../../data/campaigns/bar01.wmf/scripting/texts.lua:481"
"ware","物資","The shipwright will take the ware he needs to a free spot at the shoreline and build a ship there. When the first ship is finished, it will launch onto the sea, and the shipwright will construct another one.","船大工は必要な品を持って海岸線のフリーな場所に向かい、船の建造を始めるでしょう。船が完成すると、その船は海に漕ぎ出し、船大工はまた別の船を造るでしょう。","scenario_tutorial03_seafaring.wmf","../../data/campaigns/tutorial03_seafaring.wmf/scripting/texts.lua:97"
"ware","物資","In this tab, you can see the difference between production and consumption, called ‘economy health’. You can see at one glance which one of those two is higher for the selected ware, that means whether the amount increases or decreases.","このタブでは、生産量と消費量の差分を見ることができます。これを経済の「健全性」と呼びます。これを見れば、生産と消費のどちらが勝っているのかを一目で理解することができます。値が増えているのか減っているのかを見るだけのことですから。","scenario_tutorial04_economy.wmf","../../data/campaigns/tutorial04_economy.wmf/scripting/texts.lua:383"
"Hunter’s Hut","狩人の庵","The hunter working out of this hunter’s hut can’t find any game in his work area. Remember that you can build a gamekeeper’s hut to release more game into the wild.","この狩人は作業エリア内に獲物を見つけられません。狩猟番の庵を建てれば獲物を増やすことができることをお忘れなく。","tribes","../../data/tribes/buildings/productionsites/barbarians/hunters_hut/init.lua:70"
"Hunter’s House","狩人小屋","The hunter working out of this hunter’s house can’t find any game in his work area.","ここの狩人は作業エリア内に獲物を見つけられません","tribes","../../data/tribes/buildings/productionsites/atlanteans/hunters_house/init.lua:52"
"Hunter’s House","狩人小屋","The hunter working out of this hunter’s house can’t find any game in his work area.","ここの狩人は作業エリア内に獲物を見つけられません","tribes","../../data/tribes/buildings/productionsites/empire/hunters_house/init.lua:55"
"Hunter’s House","狩人小屋","The hunter working out of this hunter’s house can’t find any game in his work area.","ここの狩人は作業エリア内に獲物を見つけられません","tribes","../../data/tribes/buildings/productionsites/frisians/hunters_house/init.lua:74"
"Productivity","生産率","May Satul warm you too, Colionder. Yes, I wondered if there is a way that we could centralize our food production. We lose a lot of productivity because our people are accustomed to making their own food. I feel if we could split responsibilities, it would be better for us all. I want your thoughts on this.","あなたにもサテュールの暖かなご加護を、コリオンデル。ええ、食料生産を一極集中させるための何か良い方策がないかと思って。人々は自分達の食べ物を全部自前で作っているけど、それが経済の生産性を落としているように思うの。役割をうまく分担することができたら、皆のためになると思うの。あなたはどう思いますか？","scenario_atl01.wmf","../../data/campaigns/atl01.wmf/scripting/texts.lua:229"
"Productivity","生産率","Oh no! Amalea is right. In fact, I can’t see any productivity at all. And the road network seems to be completely in shambles as well. Who might be responsible for this chaos?","なんということだ！アマリアが正しかった。ここには何の生産性も見られない。さらに、道路網もめちゃくちゃだ。一体誰がこんなことをしたのだ？","scenario_emp04.wmf","../../data/campaigns/emp04.wmf/scripting/texts.lua:248"
"Productivity","生産率","Have a look at the economy. There is hardly any productivity at all. Whoever managed our country while we were absent created utter chaos. I’m not quite sure how we can fix this, if at all possible.","ざっと街を見渡してみたわ。でもほとんど生産性が見られないの。私たちが留守にしている内に街を統治していた誰かが深い混沌を作ってしまったみたい。どうやったらこれを直せるのかしら？そもそも可能なのかしら？","scenario_emp04.wmf","../../data/campaigns/emp04.wmf/scripting/texts.lua:306"
"Productivity","生産率","This situation was caused by the sad fact that our people lost the instructions on how to construct and operate farms. Therefore they have zero productivity and the constructors don’t know how to dismantle them either.","何でこんなことになっているかと言うと、市民達は農場をどのように作るのか、そしてどのように運営するのか、その方法を失ってしまったらしいの。だから、何も生産できないし、建築者もどう解体すればいいのかわからないの。","scenario_emp04.wmf","../../data/campaigns/emp04.wmf/scripting/texts.lua:336"
"Productivity","生産率","Look Lutius, I have just analyzed our economy somewhat further. I think there might be a problem with our farms. They don’t show any productivity although there is enough space to plant wheat.","ルティウス、見て、ちょっと詳細に経済を分析してみたの。そしたら、どうも農場に問題があるみたい。小麦を植える十分なスペースがあるはずなのに、全然生産性がないのよね。","scenario_emp04.wmf","../../data/campaigns/emp04.wmf/scripting/texts.lua:550"
"Productivity","生産率","Below every building, there are two lines. The first one shows the number of buildings you own and how many are under construction. The second line shows the average productivity if it is a production site or training site, or the stationed and desired soldiers in military buildings.","全ての建物の下には情報が二行で示されています。一行目にはすでに完成済みの数と現在建設中のものの数が示されています。二行目には、生産系建物か訓練系建物ならば平均の生産性が、軍事系建物ならば、その種類の建物について駐留している兵士の総数、そして要求されている兵士数の合計が表示されます。","scenario_tutorial04_economy.wmf","../../data/campaigns/tutorial04_economy.wmf/scripting/texts.lua:74"
"Productivity","生産率","‘0%’: This indicates the average productivity of all buildings of that type. You have just started this game, therefore none of your buildings has done any work yet, but they are going to start working soon.","「0%」: これは全てのタイプの建物の平均生産性を示します。今はまだゲーム開始直後で、建物はまだまともに働いていないのでこの数字になっています。少し待てばすぐに数字が上昇していくでしょう。","scenario_tutorial04_economy.wmf","../../data/campaigns/tutorial04_economy.wmf/scripting/texts.lua:86"
"Productivity","生産率","‘2/4’ below your sentry: For military buildings, the stationed soldiers are shown instead of a productivity. You want to have four soldiers in your sentries, but only two soldiers are stationed in this kind of building. This leaves two vacant positions – we really need more soldiers.","詰所の下の「2/4」: 軍事建物では、生産性の代わりに駐留する兵士数が表示されます。詰所全体で合計で４名置いておきたいところですが、現在は合計で２名しかいないという意味になります。つまりは2人分の空きがあるということで ── 我々にはもっと兵士が必要だということです。","scenario_tutorial04_economy.wmf","../../data/campaigns/tutorial04_economy.wmf/scripting/texts.lua:87"
"Tower","監視塔","It is amazing how far one can see from the highest tower of the castle. We can watch the whole island. So now I wonder why Lanissa did not see us and thus did not prepare. Be that as it may, some things will never come to the light of day. The only important issue at the moment are the opposing troops still left. We have discovered enemy positions held by Erwyn to the north and east of the castle. He is known to be a strong warlord and surely commands the strongest warriors. In the south, we caught sight of some food infrastructures guarded by Jomo – a younger warlord – and we should take care of those infrastructures so we can cut off our enemies’ food supply.","この城の最も高い塔から見える景色は見事なものだった。島の端から端まで見渡すことができる。しかし、そうするとなぜ Lanissa は我々の存在に気付かず、無防備であったのだろう？まあ、どんなに調べても、考えても、答えが得られないことはままあるものだ。今大事なことは、まだ敵対する勢力が存在するということだ。この城から見て北東に Erwyn の保持する戦力が確認できた。彼は強大な将軍と言うから、率いる戦士も屈強だろう。南には食料生産のインフラが確認できる。Jomo という若い将軍が守っているようだ。あのインフラをどうにかしてしまえば、敵の食料供給を断つことができるかもしれない。","map_the_green_plateau.wmf","../../data/maps/SP_Scenarios/The_Green_Plateau.wmf/scripting/texts.lua:79"
"Lime Kiln","石灰窯","The fires of the Barbarians are usually fed with coal. Consumers are several buildings: lime kiln, smelting works, ax workshop, war mill, and helm smithy.","石炭は野蛮人の扱う火の燃料として良く使われます。灰色窯、精錬所、斧工房、戦鍛冶、そして兜工房のように様々な建物で消費されます。","tribes_encyclopedia","../../data/tribes/initialization/barbarians/units.lua:269"
"Coal","石炭","Build coal and iron mines","炭鉱と鉄鉱を建てましょう","scenario_bar01.wmf","../../data/campaigns/bar01.wmf/scripting/texts.lua:41"
"Coal","石炭","Build a lime kiln and coal economy","石灰窯の建設と炭の供給確保","scenario_bar01.wmf","../../data/campaigns/bar01.wmf/scripting/texts.lua:106"
"Coal","石炭","Barbarian lumberjacks fell the trees; rangers take care of the supply of trees. Logs are also used in the metal workshop to build basic tools, and in the charcoal kiln for the production of coal. The wood hardener refines logs into blackwood by hardening them with fire.","野蛮人の木こりは木を切ります。植樹番は木の安定供給を助けます。丸太は建築資材でもありますが、金物工房での日用工具の作成や炭焼き小屋での炭の製造にも使われます。また、黒材工房は炎で丸太を固くして黒材を製造します。","tribes_encyclopedia","../../data/tribes/initialization/barbarians/units.lua:113"
"Coal","石炭","This beer is produced in a brewery out of wheat and water. It is consumed by miners in coal and iron mines.","ビールは醸造所で小麦と水から醸造され、炭鉱や鉄鉱の鉱夫に消費されます。","tribes_encyclopedia","../../data/tribes/initialization/empire/units.lua:235"
"Coal","石炭","Woodcutters fell the trees; foresters take care of the supply of trees. Logs are also used in the blacksmithy to build basic tools, and in the charcoal kiln for the production of coal. Smokeries use logs as fuel for smoking meat and fish.","木こりは木を切ります。植樹番は木を供給します。丸太は建築資材としても使われますが、鍛冶場で日用道具の作成、炭焼き小屋での炭の製造にも使われます。また、燻製工房でも魚や肉を燻製にする際の燃料として丸太を使います。","tribes_encyclopedia","../../data/tribes/initialization/frisians/units.lua:100"
"destroy","破壊","Murilius has made it quite clear that he won’t leave us alone. I fear we must defeat him and destroy his colony if we ever want to have peace here.","ムリリウスはどうあっても我々を見逃さないだろう。この地で平和を確保するには、彼とその植民地を打倒しなければならないのか。","scenario_fri02.wmf","../../data/campaigns/fri02.wmf/scripting/texts.lua:373"
"destroy","破壊","Since our quarries are useless now, you can destroy them and reuse the space later on.","採石場はもはや無意味です。破棄して土地を有効活用できるようにしましょう。","scenario_tutorial01_basic_control.wmf","../../data/campaigns/tutorial01_basic_control.wmf/scripting/texts.lua:542"
"Clay Pit","穴掘り小屋","The fisher working at this aqua farm can’t find any fish ponds in his work area. Please make sure there is a working clay pit nearby and the aqua farm is supplied with all needed wares, or consider dismantling or destroying this building.","作業エリア内にこれ以上養殖池がありません。近くに穴掘りを配置し、養殖場には物資をきちんと供給しましょう。それができないのであれば、建物を解体、破壊することを考えましょう。","tribes","../../data/tribes/buildings/productionsites/frisians/aqua_farm/init.lua:99"
"Economy","経済","Mining Economy Completed","鉱山開発体制完成","scenario_bar02.wmf","../../data/campaigns/bar02.wmf/scripting/texts.lua:287"
"Economy","経済","I just got informed that our mining economy has started its work. This news brought a smile to my face – even if the hardest part is still waiting to be done, now that our smiths will give their best to further ease our lives.","鉱山開発体制が整ったという連絡が入ってきた。思わず笑みがこぼれてしまう、嬉しい報告だった ── 一番困難な部分には手つかずとは言え。ともあれ、これで鍛冶師達が我らの暮らしをさらに快適にしてくれることだろう。","scenario_bar02.wmf","../../data/campaigns/bar02.wmf/scripting/texts.lua:290"
"Economy","経済","Our mining economy seems to work fine, that is already good news! Anyway, there are still a lot of men and women waiting in our hall to get a task, so they can help our soldiers to prepare for the war to come.","鉱山の開発は順調に進んでいる、これは良い知らせだ！しかし、仕事を与えられるのを待っている者がまだまだ多くいる。来たるべき戦争に備え、兵士を補助する役割を彼らに与えてはどうか？","scenario_bar02.wmf","../../data/campaigns/bar02.wmf/scripting/texts.lua:315"
"Economy","経済","Our geologists found a lot more deposits of iron ore, coal and even gold. We should enhance our current mines as soon as our miners are more experienced. We should build up some more mines, a bigger food infrastructure to always supply our men with sufficient food and a further processing economy. But that’s still not everything – most of our soldiers are quite young and neither have a good weapon nor are they well trained. We should build up training sites to prepare them for their future tasks.","地質学者は大量の鉄鉱石、石炭、さらには金鉱石の存在を確認している。鉱夫の経験が十分になり次第、鉱山を拡張するべきだろう。さらには、鉱山の数そのものを増やしたり、食料の生産体制をさらに拡張していくべきだろう。しかし、これで全てでは無い ── 兵士の大部分はまだ若く、大した訓練を受けていないし、良い武器を持っているわけでもない。だから、訓練施設を建設し、彼らにも来たるべき時に備えさせるべきだ。","scenario_bar02.wmf","../../data/campaigns/bar02.wmf/scripting/texts.lua:318"
"Economy","経済","Good news! Today our wood economy was completed. Now we can be sure that we will have enough wood for our future building projects.","良い知らせだ！本日、木材供給体制が整った。以後の建築計画のために十分な木材も確保できるだろう。","scenario_emp02.wmf","../../data/campaigns/emp02.wmf/scripting/texts.lua:149"
"Economy","経済","So, we need more cloth to finally be able to build ships. But there is no space on the island for building a whole economy to produce cloth. Therefore, we need to build the necessary wares step by step.","というわけで、船を作るにはまず布を用意しなくちゃ。でも、この狭い島じゃ布生産に関する体制を同時に全部動かすことはできないわ。だから、段階的に物資を生産するしかないの。","scenario_emp03.wmf","../../data/campaigns/emp03.wmf/scripting/texts.lua:369"
"Economy","経済","Don’t forget to check the target quantity of wool and cloth in the economy settings. We need to turn all the wheat into wool and then the all the wool into cloth.","羊毛と布の目標数の設定を忘れないようにお願いね。私たちは全ての小麦を羊毛に、そして全ての羊毛を布にしなくちゃいけないんだから。","scenario_emp03.wmf","../../data/campaigns/emp03.wmf/scripting/texts.lua:401"
"Economy","経済","Have a look at the economy. There is hardly any productivity at all. Whoever managed our country while we were absent created utter chaos. I’m not quite sure how we can fix this, if at all possible.","ざっと街を見渡してみたわ。でもほとんど生産性が見られないの。私たちが留守にしている内に街を統治していた誰かが深い混沌を作ってしまったみたい。どうやったらこれを直せるのかしら？そもそも可能なのかしら？","scenario_emp04.wmf","../../data/campaigns/emp04.wmf/scripting/texts.lua:306"
"Economy","経済","Build a wood economy and a reed farm","木材供給体制とカヤ農場","scenario_fri01.wmf","../../data/campaigns/fri01.wmf/scripting/texts.lua:25"
"Economy","経済","Well done. We have built an aqua farm, and our mining economy is stable for now. However, the miners tell me that the resources are already low, and the mines may run completely empty soon.","うまくいきましたな。養殖場を建設したことで、鉱山採掘体制が安定しましたぞ。しかし、鉱夫達によると、すでに資源は枯渇しつつあるようで、もう時間の問題で枯渇するという予測のようです。","scenario_fri02.wmf","../../data/campaigns/fri02.wmf/scripting/texts.lua:236"
"Economy","経済","The third tab shows you the economy health of the ware. When the value is positive, this means your stock is growing.","三番目のタブは物資の生産消費バランスの健全性を示します。値が正の場合、その物資のストックは増え続けていることを意味します。","scenario_tutorial04_economy.wmf","../../data/campaigns/tutorial04_economy.wmf/scripting/texts.lua:373"
"Ship","船","Praise the gods. We finally have a ship industry.","神よ感謝します。やっとまた海に出られるようになりました。","scenario_emp03.wmf","../../data/campaigns/emp03.wmf/scripting/texts.lua:389"
"Ship","船","Although this ship ran aground, it still serves as accommodation for your people. It also stores your wares and tools.","座礁していますが、人々が寝泊まりすることはできます。また、物資や道具の保管も可能です。","tribes_encyclopedia","../../data/tribes/initialization/empire/units.lua:1181"
"Ship","船","This expedition can’t be canceled, because the ship has no port to return to.","帰るべき港が無いのでこの探検はキャンセルできません。","widelands","../../src/wui/shipwindow.cc:218"
"Smelting Works","製錬所","Expand your territory to the mountains, send geologists to search for ore and coal and build a mining economy with mines, taverns, smelting works and metal workshop.","山に向かって領土を広げ、地質学者を送って鉱石や石炭を探しましょう。そして、各種鉱山、酒場、精錬所、そして金物工房を建設して基本的な鉱山経済を構築しましょう。","scenario_bar02.wmf","../../data/campaigns/bar02.wmf/scripting/texts.lua:74"
"Smelting Works","製錬所","By the Gods, this is an unbelievable stroke of fortune! There are two more mountains, and it seems that one has a large quantity of coal and the other of iron ore. I advise you to immediately build iron and coal mines (or at least charcoal kilns), smelting works, toolsmithies, armor and weapon smithies.","おお神よ！これは何という奇跡なのか！さらに二つの山がありました。一方には石炭、そしてもう一方には鉄鉱石が大量に眠っているようです。すぐに鉄鉱、炭鉱 (炭焼き小屋で代用できないこともないです)、精錬所、道具工房、防具工房、武器工房を建設しましょう。","scenario_emp02.wmf","../../data/campaigns/emp02.wmf/scripting/texts.lua:198"
"Smelting Works","製錬所","I strongly recommend building a production chain for mining and melting some gold. I think we need a vineyard, a winery, a tavern, a fisher’s house or a hunter’s house and a smelting works. And the mines themselves of course.","鉱石の採掘から精錬までを行えるように建物を整備した方が良いと思うわ。ブドウ園、酒場、漁師小屋、狩人小屋、精錬所がそれぞれ１つずつ必要かしらね。もちろん、それに加えて鉱山そのものも必要ね。","scenario_emp03.wmf","../../data/campaigns/emp03.wmf/scripting/texts.lua:447"
