"glossary_term","glossary_translation","source","target","file","location"
"produce","saothraich","Logs are an important basic building material. They are produced by felling trees.","’S e stuth togail bunasach a tha san fhiodh. Leagaidh tu craobhan gus fhaighinn.","tribes_encyclopedia","../../data/tribes/wares/log/helptexts.lua:4"
"produce","saothraich","The weapon smithy and the shipyard also use planks to produce the different tridents and mighty ships.","Cleachdaidh a’ cheàrdach arm is an doca maidean cuideachd gus muirgheadhan is longan cumhachdach a thogail.","tribes_encyclopedia","../../data/tribes/wares/planks/helptexts.lua:8"
"Charcoal Kiln","sloc guail-fhiodha","The charcoal kiln needs %s on average to produce one coal.","Bheir an t-àth-ghuail %s sa chuibheas gus gual a dhèanamh.","tribes_encyclopedia","../../data/tribes/buildings/productionsites/frisians/charcoal_kiln/helptexts.lua:23"
"Charcoal Kiln","sloc guail-fhiodha","Digs up mud from the ground and uses water to turn it into clay. Clay is used to make bricks, reinforce the charcoal kiln and to build ships.","Gearraidh e an talamh airson criadh a dhèanamh dheth le uisge. Thèid criadh a chleachdadh airson breigichean a dhèanamh, na h-àthan-ghuail a dhèanamh nas seasmhaiche agus longan a thogail.","tribes_encyclopedia","../../data/tribes/buildings/productionsites/frisians/clay_pit/helptexts.lua:16"
"resource","stòras","The point is that the first island only provides rocks and trees, the second only meadows and resources. The economies you leave behind will continue to work for you, but you will only reap the benefits at the moment you reach a new island.","’S e cnag na cùise nach doir a’ chiad eilean dhut ach carraigean is craobhan ’s nach fhaigh thu ach machair ’s clach-mèinneir is gual air an dàrna eilean. Obraichidh an t-eaconamaidh air na h-eileanan roimhe fhathast ach chan fhaigh thu buannachd às ach aig an àm a ruigeas tu eilean ùr.","mp_scenario_island_hopping.wmf","../../data/maps/MP_Scenarios/Island_Hopping.wmf/scripting/texts.lua:24"
"resource","stòras","The citadel can house 12 soldiers, and it is the biggest military building the Barbarians can build. It also costs a lot of resources and takes a long time to build. It is most suited to guard strategically important points like constricted points or mountains.","’S urrainn do 12 shaighdear còmhnaidh ann an cathair is ’s ise togalach an airm as motha as urrainn dha na Tùsanaich a thogail. Tha i glè chosgail cuideachd is bheir e ùine mhòr gus tè a thogail. Tha i nas fhearr gus ionadan cudromach a dhìon a leithid àiteachan caola no beanntan.","scenario_tutorial02_warfare.wmf","../../data/campaigns/tutorial02_warfare.wmf/scripting/texts.lua:190"
"resource","stòras","Keep an eye on your fishers. After fish resources are exhausted in their work area, they will stop fishing.","Cum sùil air na h-iasgairean agad. Sguiridh iad dhen iasgach nuair nach eil iasg san raon-obrach aca tuilleadh.","texts","../../data/txts/tips/barbarians.lua:4 ../../data/txts/tips/empire.lua:4"
"resource","stòras","The fish breeder working out of this fish breeder’s house can’t find any fish in his work area. Remember that you can only regenerate your fish resources if there are some fish left to breed.","Cha do lorg an gille-iasg a tha ag obair aig an ionad-àraich èisg seo iasg sam bith taobh a-staigh an raoin-obrach tuilleadh. Thoir an aire nach urrainn dhut cur ris na tha ann de dh’èisg mur eil gin dhuibh air fhàgail tuilleadh.","tribes","../../data/tribes/buildings/productionsites/atlanteans/fishbreeders_house/init.lua:54"
"resources","stòrasan","The point is that the first island only provides rocks and trees, the second only meadows and resources. The economies you leave behind will continue to work for you, but you will only reap the benefits at the moment you reach a new island.","’S e cnag na cùise nach doir a’ chiad eilean dhut ach carraigean is craobhan ’s nach fhaigh thu ach machair ’s clach-mèinneir is gual air an dàrna eilean. Obraichidh an t-eaconamaidh air na h-eileanan roimhe fhathast ach chan fhaigh thu buannachd às ach aig an àm a ruigeas tu eilean ùr.","mp_scenario_island_hopping.wmf","../../data/maps/MP_Scenarios/Island_Hopping.wmf/scripting/texts.lua:24"
"resources","stòrasan","The citadel can house 12 soldiers, and it is the biggest military building the Barbarians can build. It also costs a lot of resources and takes a long time to build. It is most suited to guard strategically important points like constricted points or mountains.","’S urrainn do 12 shaighdear còmhnaidh ann an cathair is ’s ise togalach an airm as motha as urrainn dha na Tùsanaich a thogail. Tha i glè chosgail cuideachd is bheir e ùine mhòr gus tè a thogail. Tha i nas fhearr gus ionadan cudromach a dhìon a leithid àiteachan caola no beanntan.","scenario_tutorial02_warfare.wmf","../../data/campaigns/tutorial02_warfare.wmf/scripting/texts.lua:190"
"resources","stòrasan","Keep an eye on your fishers. After fish resources are exhausted in their work area, they will stop fishing.","Cum sùil air na h-iasgairean agad. Sguiridh iad dhen iasgach nuair nach eil iasg san raon-obrach aca tuilleadh.","texts","../../data/txts/tips/barbarians.lua:4 ../../data/txts/tips/empire.lua:4"
"resources","stòrasan","The fish breeder working out of this fish breeder’s house can’t find any fish in his work area. Remember that you can only regenerate your fish resources if there are some fish left to breed.","Cha do lorg an gille-iasg a tha ag obair aig an ionad-àraich èisg seo iasg sam bith taobh a-staigh an raoin-obrach tuilleadh. Thoir an aire nach urrainn dhut cur ris na tha ann de dh’èisg mur eil gin dhuibh air fhàgail tuilleadh.","tribes","../../data/tribes/buildings/productionsites/atlanteans/fishbreeders_house/init.lua:54"
"Saw","sàbh","The traitor left his armies dying where they lay when he saw that he would not keep my forces back. Kalitath disappeared in the confusion of the war, but I don’t care now. Shall he flee and be forgotten for all times as a tribal leader that would not bow before the wooden throne, that is mine to take now.","Dh’fhàg an cealgair na daoine aige gus am faigheadh iad bàs far an robh iad ’nan laighe nuair a mhothaich e nach b’ urrainn dha mo chumail air ais. Theich Kalitath ann an ùpraid a’ chogaidh ach tha mi coma a-nis. Gun teicheadh e ’s gun rachadh e a-mach à cuimhne gu bràth mar an ceannard nach gèilleadh fon chathair fhiodha a ghabhas mi fhìn a-nis.","scenario_bar02.wmf","../../data/campaigns/bar02.wmf/scripting/texts.lua:226"
"Saw","sàbh","Still, I saw no way that I could erase my shame without fighting against these Barbarians. So, I left Fremil by boat to find a new world and a new life for myself, somewhere in the south. Now I am sailing on the Gulf of Perl with my family, some of my friends and a few of my best warriors.","Co-dhiù no co-dheth, bhiodh an nàire orm gu bràth mura dèanainn sabaid an aghaidh nan Tùsanach. Air an adhbhar sin, dh’fhàg mi Fremil air long gus saoghal ’s beatha ùr a lorg dhomh àiteigin gu deas. Tha mi a’ seòladh Camas Pherl le mo theaghlach ’s mo cuideachd a-nis.","scenario_emp01.wmf","../../data/campaigns/emp01.wmf/scripting/texts.lua:92"
"Saw","sàbh","We landed on an unknown coast and found peaceful rest under the palm trees growing at the shore. But that is about as good as it gets. The truth is: when I woke up this morning, I saw nothing but sand around us.","Bhuail sinn tràigh nach aithne dhuinn agus fhuair sinn fois shìtheil fo na craobhan-pailm a tha a’ fàs air an oirthir. Ach ’s ann nach eil deagh naidheachd eile ann. A dh’innse na fìrinn, nuair a dhùisg mi an-diugh, chan fhaca mi ach gainneamh timcheall oirnn.","scenario_emp01.wmf","../../data/campaigns/emp01.wmf/scripting/texts.lua:116"
"Saw","sàbh","At first, I was naive and hoped that they were peaceful, but as soon as one of them saw me, they charged towards me and started attacking me with their throwing spears. Thanks be to the Gods that I was able to flee and hide myself, before retreating back to our colony under cover of darkness.","Nach mise a bha gorm aig an toiseach ’s làn dòchais gum biodh iad sìtheil ach cho luath ’s a mhothaich iad dhomh, ghabh iad orm leis na sleaghan tilgeil aca. Taing do na diathan gun deach leam teicheadh agus m’ fhalach mus do chùlaich mi don tuineachadh againn air an oidhche.","scenario_emp02.wmf","../../data/campaigns/emp02.wmf/scripting/texts.lua:245"
"Carpenter","sàbhadair","Krumta, carpenter of Chat’Karuth","Krumta, saor Chat’Karuith","tribes_encyclopedia","../../data/tribes/buildings/productionsites/barbarians/lumberjacks_hut/helptexts.lua:8"
"save","sàbhail gu","Lower the demand for marble columns in the economy settings to four. This will help to save some marble for buildings.","Ìslich an t-iarrtas air colbhan marmoir gu ceithir ann an roghainnean na h-eaconamaidh. Cuidichidh seo ach an caomhain sinn beagan marmoir airson togalaichean.","scenario_emp03.wmf","../../data/campaigns/emp03.wmf/scripting/texts.lua:77"
"save","sàbhail gu","By changing the target quantity, you can therefore decide which wares/tools your resources (in this case: iron) should be turned into or whether you would like to save your iron and wait until you know what you will need it for.","Nuair a shuidhicheas tu an t-uiread-amais, cuiridh tu romhad dè am bathar/na h-acainnean a thèid a dhèanamh dhen stòras a th’ agad (iarainn sa bhall-eisimpleir seo) no am b’ fhearr leat an t-iarann a ghlèidheadh gus am bi fios agad air dè nì thu leis.","scenario_tutorial04_economy.wmf","../../data/campaigns/tutorial04_economy.wmf/scripting/texts.lua:428"
"Advanced Spear","sàr-shleagh","This is an advanced spear with a steel tip. It is produced in a weapon smithy and used in a training camp – together with food – to train soldiers from attack level 1 to level 2.","Seo sleagh leasaichte le barr stàilinn. Saothraichidh tu ann an ceàrdach arm i is thèid a cleachdadh sa champa oideachaidh – le biadh – gus ionnsaigh nan saighdearan oideachadh o leibheil 1 gu leibheil 2.","tribes_encyclopedia","../../data/tribes/wares/spear_advanced/helptexts.lua:4"
"Lumberjack’s House","taigh coillteir","But until that day, many years may pass! For now, we must concentrate on the present, and build a few lumberjack’s houses and a sawmill to produce some basic building materials.","Ach nach digeadh an latha ud a dh’aithghearr! Feumaidh sinn ar n-aire a thoirt air an latha an-diugh agus taighean do na coilltearan agus muileann sàbhaidh a thogail gus am faigh sinn stuthan togail bunasach.","scenario_emp02.wmf","../../data/campaigns/emp02.wmf/scripting/texts.lua:127"
"Fruit Collector’s House","taigh-cruinniche","The fruit collector working at this fruit collector’s house can’t find any berry bushes in his work area. You should consider building another berry farm, or dismantling or destroying this building.","Cha do lorg an cruinniche a tha ag obair aig an taigh-chruinniche seo preas dearcan taobh a-staigh an raoin-obrach. Bu chòir dhut croit-dhearc eile a thogail faisg air no an togalach a thoirt às a chèile no a mhilleadh.","tribes","../../data/tribes/buildings/productionsites/frisians/collectors_house/init.lua:63"
"Barracks","taigh-feachd","Boldreth seems more and more torn as the days go by. The spirits of my fellows sink as the cold season approaches, and we are still living in no more than huts and barracks. I never intended to stay out here in the wilderness for so long – but I never thought my brothers would engage in this senseless battle for so long either.","Tha Boldrad fo bharrachd uallach gach latha. Tha an leann-dubh a’ tighinn air mo chuideachd on a tha an geamhradh gu bhith tighinn oirnn agus chan eil sinn a’ fuireach ach ann am bothanan. Cha robh mi an dùil fuireach san fhàsach seo cho fada sin – ach cha shaoilinn a-riamh gum maireadh an còmhstri gun chiall seo eadar mo dhà bhràthair cho fada sin.","scenario_bar01.wmf","../../data/campaigns/bar01.wmf/scripting/texts.lua:232"
"Hunter’s House","taigh-sealgair","To provide these foodstuffs, you can build a fisher’s house, a hunter’s house, a farm, a mill and a bakery.","’S urrainn dhut taigh-iasgair, tuathanas, muileann ’s taigh-fuine a thogail gus am biadh seo ullachadh.","scenario_emp02.wmf","../../data/campaigns/emp02.wmf/scripting/texts.lua:77"
"Tavern","taigh-tàirn","The tavern can produce one ration in %s on average if the supply is steady; otherwise, it will take 50%% longer.","Saothraichidh an taigh-tàrn greimeag gach %s sa chuibheas ma thèid stuthan a lìbhrigeadh dha gu cunbhalach; mura dèid, bheir e 50%% nas fhaide.","tribes_encyclopedia","../../data/tribes/buildings/productionsites/frisians/tavern/helptexts.lua:23"
"Well","tobar","Your well established smuggling routes suddenly got busy: two other tribes have appeared and now a rivalry among smugglers has started. Which team will be the first to smuggle a certain number of wares?","Dh’fhàs na slighean cùiltearachd stèidhichte agad trang gu h-obann: nochd dà threubh eile ’s tha còmhstri am measg an luchd-cùiltearachd air a tòiseachadh. Cò an sgioba a mhalairteas uiread de bhathar ro chàch?","maps","../../data/maps/MP_Scenarios/Smugglers.wmf/elemental:11"
"Well","tobar","But all seemed well. Only the horses seemed to feel something was wrong. During the nights, they went crazy and were full of fear. It was not long before the horse breeder Xydra figured out what was wrong with them: the sea level in front of their stable was rising with ever increasing speed.","Co-dhiù, cha robh dragh air duine. Cha do dh’fhairich ach na h-eich gun robh càil cearr. Bhiodh iad gòrach leis an t-eagal rè na h-oidhche. Cha b’ fhada gus an do thuig an gille-each Xydra na bha cearr orra: bha àirde na mara air beulaibh an stàbaill ag èirigh na bu luaithe ’s na bu luaithe.","scenario_atl01.wmf","../../data/campaigns/atl01.wmf/scripting/texts.lua:158"
"Well","tobar","This is good news indeed, Opol. Our economy is developing very well. Go back to your work now, Opol, and may Satul warm you and all your guild members!","Seo deagh naidheachd dha-rìribh, Opol. Tha an eaconamaidh againn a’ fàs glè mhath. Till don obair agad a-nis, Opol agus gum blàthaicheadh Satul thu agus gach bhall de chomann nam breabadair!","scenario_atl01.wmf","../../data/campaigns/atl01.wmf/scripting/texts.lua:293"
"Well","tobar","Today I saw the first recruits gathering in front of the new barracks. If everything goes well, they should receive their training soon.","Chunnaic mi na ciad glas-laoich cruinn còmhla air beulaibh an taighe-fheachd ùir an-diugh. Chan fhada gus am faigh iad oideachadh ma thèid leinn mar bu chòir.","scenario_atl01.wmf","../../data/campaigns/atl01.wmf/scripting/texts.lua:329"
"Well","tobar","I received an invitation from Sidolus. The first day of training in the newly finished labyrinth will be tomorrow. The dungeon is done as well and will start its work soon. I am looking forward to tomorrow; I am very interested in how our soldiers are trained, and I wonder if the additional workload will keep them from bullying the civilian population.","Fhuair mi cuireadh o Shidolus. Tòisichidh an t-oideachadh sa chuartan ùr an làrna-mhàireach. Tha an toll-dubh air a thogail cuideachd agus tòisichidh e air obair a dh’aithghearr. Tha fiughar agam ri a-màireach; tha mi glè dheònach fiosrachadh mar a thèid na saighdearan againn oideachadh agus chan eil mi cinnteach am foghainn a bharrachd obrach a th’ aca o mhaoidheadh nan sìobhaltach.","scenario_atl01.wmf","../../data/campaigns/atl01.wmf/scripting/texts.lua:360"
"Well","tobar","So you want to prepare us for a longer stay in these forests, Thron? Well, I see the wisdom in doing so, yet my heart is yearning for a glorious return to Al’thunran. Too long have we waited while our brethren have fought on the battlefield, and our axes and swords have turned rusty over time.","An ann gu bheil thu airson ar n-ullachadh ach am fuirich sinn sna coilltean seo nas fhaide, a Throin? Uill, tuigidh mi an gliocas a th’ ann, ach tha fadachd ’nam chridhe gus an till sinn gu Al’tùnran gu soirbheachail. Tha sinn air fuireach ro fhada ann a sheo mar-thà fad ’s a tha ar cuideachd a’ sabaid an aghaidh càch a chèile air a’ bhlàr agus tha na tuaghan is claidheamhan againn air am fàs meirgeach.","scenario_bar01.wmf","../../data/campaigns/bar01.wmf/scripting/texts.lua:320"
"Well","tobar","Wonderful! Our roofs are not dripping anymore, and we have all the material we need for, well, whichever monumental building we see fit!","Sgoinneil! Chan dig an t-uisge tro ar mullaichean tuilleadh agus tha stuth-togail againn airson… tha… canamaid togalach spaideil mòr sam bith a thogras sinn!","scenario_bar01.wmf","../../data/campaigns/bar01.wmf/scripting/texts.lua:489"
"Well","tobar","He told me about the blockhouse. Well, I don’t think we need more blockhouses – instead, we might concentrate on other things now.","Dh’innis e dhomh mun taigh-bhloca. Uill, ar leam chan eil sinn feumach air barrachd taighean-bloca a-nis – bu chòir dhuinn ar n-aire a thoirt air cùisean eile.","scenario_emp01.wmf","../../data/campaigns/emp01.wmf/scripting/texts.lua:158"
"Well","tobar","Lutius, this may seem very tricky, but we can do it. First of all, we need patience as well as speed and a plan to succeed in this part of the world.","A Lutius, tha coltas toinnte air ach nì sinn a’ chùis. Feumaidh sinn a bhith foighidinneach is luath is glic gu h-àraidh ach am bitheamaid soirbheachail sa cheàrn seo dhen t-saoghal.","scenario_emp03.wmf","../../data/campaigns/emp03.wmf/scripting/texts.lua:274"
"Well","tobar","Unfortunately, we lost our holy shrine of Neptune in the great storm, so we can’t worship him well. I think we should search the whole region to see if we can recover all six pieces of the shrine.","Gu mì-fhortanach, chaill sinn ar n-altair naomh Neaptuin sa ghailleann agus chan urrainn dhuinn ùrnaigh cheart a dhèanamh dha. Saoilidh mi gum bu chòir dhuinn an sgìre slàn a rùrachadh feuch an gabhamaid na sia leacan aice uile air ais.","scenario_emp03.wmf","../../data/campaigns/emp03.wmf/scripting/texts.lua:566"
"Well","tobar","I wanted to teach you how to build new flags, but it seems you have already found out on your own. Well done!","Bha mi airson ionnsachadh dhut mar a thogas tu bratach ùr, ach tha e agad mar-thà a-rèir coltais. Sin thu fhèin!","scenario_tutorial01_basic_control.wmf","../../data/campaigns/tutorial01_basic_control.wmf/scripting/texts.lua:146"
"Well","tobar","Here in the northern part, you only have a goldmine and a warehouse. While the miners are supplied well with food, there is no way to transport the gold ore to our smelting works in the southern part.","Aig a’ cheann a tuath an-seo, chan eil ach mèinn òir agus taigh-stòrais agad. Fad ’s a tha biadh a dh’fhòghnas aig na mèinnearan, chan eil dòigh ann gus a’ chlach-òir a chur dhan cheàrdach leaghadair ceann a deas.","scenario_tutorial03_seafaring.wmf","../../data/campaigns/tutorial03_seafaring.wmf/scripting/texts.lua:34"
"Well","tobar","Connected to a computer player (the face in the picture as well as the mouse hover texts indicate the strength of the currently selected computer player).","Ceangailte ri cluicheadair coimpiutair (innsidh an dà chuid an t-aodann san dealbh is an teacsa nuair a chumas tu an luchag os a chionn dè cho làidir ’s a tha an cluicheadair coimpiutair a thagh thu an-dràsta).","texts","../../data/txts/help/multiplayer_help.lua:18"
"breed","tog","‘He loves the animals and to breed them<br>
         as we love to cook and eat them.’","“Is esan a bhrideas<br>is sinne a dh’itheas.”","tribes_encyclopedia","../../data/tribes/buildings/productionsites/barbarians/gamekeepers_hut/helptexts.lua:3"
"breed","tog","should breed resource type %s, which does not exist in world; tribe is not compatible with world","bu chòir dha stòras %s a thàrmachadh nach eil air an t-saoghal seo; mar sin chan eil an treubh co-chòrdail ris an t-saoghal seo","widelands","../../src/logic/map_objects/tribes/worker.cc:219"
"building","togalach","The fisher working out of this fisher’s house can’t find any fish in his work area. Remember that you can increase the number of existing fish by building a fish breeder’s house.","Cha do lorg an t-iasgair a tha ag obair aig an taigh-iasgair seo iasg sam bith taobh a-staigh an raoin-obrach tuilleadh. Thoir an aire gur urrainn dhut cur ris na tha ann de dh’èisg ma thogas tu ionad-àraich èisg.","tribes","../../data/tribes/buildings/productionsites/atlanteans/fishers_house/init.lua:59"
"Small buildings","togalaichean beaga","Red building symbols can only hold small buildings and flags.","Chan urrainn dhut ach togalach beag no bratach a thogail air samhla taighe dearg.","scenario_tutorial01_basic_control.wmf","../../data/campaigns/tutorial01_basic_control.wmf/scripting/texts.lua:244"
"Medium Buildings","togalaichean meadhanach","First, I’ll left-click on the symbol where I want the lumberjack’s hut to be built. A window will appear where I can choose between buildings. Because I’ll click a yellow house symbol – which means that its field can house medium and small buildings – I am presented with all the medium buildings that I can build. The lumberjack’s hut is a small building, so I will go on to select the small buildings tab. Then I’ll choose the lumberjack’s hut.","An toiseach, nì mi briogadh clì air an t-samhla far a bheil mi airson am bothan coillteir a thogail. Nochdaidh uinneag far an urrainn dhomh togalach a thaghadh. On a nì mi briogadh air samhla buidhe – is ciall dha seo gu bheil rum san raon airson togalaich mheadhanaich no bhig – chì mi na h-uile togalach meadhanach a b’ urrainn dhomh togail. ’S e togalach beag a th’ anns a’ bhothan choillteir is mar sin taghaidh mi taba nan togalaichean beaga. Taghaidh mi am bothan coillteir an uairsin.","scenario_tutorial01_basic_control.wmf","../../data/campaigns/tutorial01_basic_control.wmf/scripting/texts.lua:75"
"tribe","treubh","When Chat’Karuth died, he was an old man, father to three strong and ambitious sons, and warlord to an army that could match any enemy willing to rise against the ancient forests. Though at the end of his glorious reign, Chat’Karuth chose his eldest son, Thron, to succeed him as the tribe’s warlord – a decision that left his two brothers unsatisfied. The old warlord knew that. As his father instructed him, Thron left the capital of Al’thunran, the home of the Throne Among the Trees, and withdrew his forces to the high hills where he buried the corpse of his father. There he swore to the gods and his father’s spirit that he’d return to re-established order. While his brothers have raged blind war against Thron and the few forces he left to secure the borders of Al’thunran, the young warlord seeks to reunite his ambitious brothers and force the tribes to march once again under a common banner.","’S e an ceannard-cogaidh a bh’ ann an Cat’Charud agus stiùirich e feachd a cheannsaicheadh gach nàmhaid a bhiodh deònach èirigh an aghaidh nan seann choilltean. Bha e ’na bhodach nuair a chaochail e ’s triùir mhac glòir-mhiannach treun aige. Ged a thagh Cat’Charud a mhac as sine Tron mar an ceannard-cogaidh ùr aig deireadh a rìoghachd glòrmhor, dh’fhàg an co-dhùnadh aige an dithis bhràithrean eile mì-shàsaichte. Mhothaich an seann tighearna dha. Mar a mhol athair ris, dh’fhàg Tron cathair-bhaile Al’tùnrain, dachaigh cathair nan craobh ’s chùlaich e fheachd dhan mhonadh far an do thìodhlaic e corp athar. Ghabh e bòid dha na diathan ’s dha dh’anam athar gun tilleadh e na cùisean gu mar a b’ àbhaist. Fhad ’s a tha a bhràithrean ri strì gu fiadhaich an aghaidh Throin ’s an fheachd bhig a dh’fhàg e gus crìochan Al’tùnrain a dhìon, tha an tighearna-cogaidh òg ag amas a bhràithrean glòir-mhiannach a rèiteachadh ach am biodh na cinnidhean air an ath-chruinneachadh fon aon bratach a-rithist.","maps","../../data/campaigns/campaigns.conf:32"
"tribe","treubh","It seems as if this magical valley has been inhabited by wisents since the beginning of days. When your tribe came to this place, you were sure that it offered enough space for a peaceful life. But can your tribe live in peace with your neighbors?","Bhiodh tairbh-allaidh beò sa ghleann dhraoidheach seo o shean. Nuair a thàinig do chuideachd dhan àite seo, bha sibh cinnteach gun robh rum gu leòr ann airson beatha sìtheil. Ach am bi sìth eadaraibh fhèin ’s ur nàbaidhean?","maps","../../data/maps/Wisent_Valley.wmf/elemental:10"
"Warrior’s Ax","tuagh-ghaisgich","‘A new warrior’s ax brings forth the best in its wielder – or the worst in its maker.’","“Nì tuagh as fhearr an gaisgeach a bhuaileas.”","tribes_encyclopedia","../../data/tribes/buildings/productionsites/barbarians/ax_workshop/helptexts.lua:3 ../../data/tribes/buildings/productionsites/barbarians/warmill/helptexts.lua:6"
"Reed Farmer","tuathanach-cuilce","No worse fortune can befall a reed farmer than to see his roof leaking.","Nach olc ma bhios an fhuaraich air mullach tuathanaich-chuilce.","tribes_encyclopedia","../../data/tribes/buildings/productionsites/frisians/reed_farm/helptexts.lua:6"
"window","uinneag","On Windows, you can find the file called COPYING.txt in the installation folder, and the Widelands Start menu entry provides a link to this file.","Air Windows, lorgaidh tu am faidhle air a bheil COPYING.txt sa phasgan stàlaidh is bheir an t-innteart aig Widelands sa chlàr-taice tòiseachaidh ceangal dhan fhaidhle seo dhut.","texts","../../data/txts/LICENSE.lua:19"
