"glossary_term","glossary_translation","source","target","file","location"
"Help","cobhair","But they fear that the war around Al’thunran will set an end to this life. Therefore, they have decided to join us, hoping that we can help each other.","Ach tha eagal orra gun cuir an cogadh mu Al’tùnran crìoch air an dòigh-bheatha seo. Mar sin, chuir iad romhpa aonachadh rinn, an dòchas gun doireadh sinn taic dha chàch a chèile.","scenario_bar01.wmf","../../data/campaigns/bar01.wmf/scripting/texts.lua:551"
"Help","cobhair","As your roads grow longer and your economy bigger, you should make good use of your oxen to help transport wares more quickly.","Fhad ’s a tha na rathaidean agad a’ fàs nas fhaide ’s an eaconamaidh agad nas motha, cuir na daimh agad gu feum gus am bathar a ghluasad gu luath.","scenario_bar02.wmf","../../data/campaigns/bar02.wmf/scripting/texts.lua:53"
"Help","cobhair","Our mining economy seems to work fine, that is already good news! Anyway, there are still a lot of men and women waiting in our hall to get a task, so they can help our soldiers to prepare for the war to come.","Tha coltas gu bheil eaconamaidh nam mèinnean againn ag obair mar bu chòir, seo deagh naidheachd mar-thà! Co-dhiù no co-dheth, tha mòran fhireannach is bhoireannach a’ feitheamh san talla againn gus dleastanas a ghabhail os làimh ach an cuidicheadh iad na saighdearan leis an ullachadh airson a’ chogaidh a tha romhainn.","scenario_bar02.wmf","../../data/campaigns/bar02.wmf/scripting/texts.lua:320"
"Help","cobhair","This was the last tutorial I had prepared for you. I’ve now taught you everything I know. There are still secrets hidden in this world even I don’t know about. I will now search for a quiet place to spend my sunset years. If you have still questions, the Widelands community will surely help you. You can find it at:","Seo an t-oideachadh mu dheireadh a dh’ullaich mi air do shon. Tha mi air a h-uile rud air a bheil mi eòlach a shealltainn dhut. Tha rùn-dìomhair no dhà eile falaichte san t-saoghal seo nach eil fiù ’s mi fhìn eòlach air. Lorgaidh mi àite far a chuireas mi seachad m’ aois. Ma tha ceist no dhà agad fhathast, bheir coimhearsnachd Widelands taic dhut gun teagamh. Lorgaidh tu i air:","scenario_tutorial04_economy.wmf","../../data/campaigns/tutorial04_economy.wmf/scripting/texts.lua:473"
"Help","cobhair","If the bug concerns something not being displayed correctly or if it helps demonstrate the issue, please include one or more screenshots.","Cuir glacadh-sgrìn no dhà ris ma tha am buga mu dhèidhinn rudeigin nach dèid a shealltainn mar bu chòir no ma chuireas iad ri mìneachadh an duilgheadais.","texts","../../data/txts/README.lua:33"
"Help","cobhair","If you wish to help us translate, please visit %s","Nam bu toigh leat taic a thoirt dhuinn leis an eadar-theangachadh, tadhail air %s","widelands","../../src/ui_fsmenu/options.cc:542"
"Help","cobhair","Please report this problem to help us improve Widelands. You will find related messages in the standard output (stdout.txt on Windows). You are using build %1$s (%2$s).","Nach innis thu dhuinn mun duilgheadas seo ach an doir sinn piseach air Widelands? Chì thu teachdaireachdan co-cheangailte ris san às-chur stannardach (stdout.txt air Windows). Tha thu a’ chleachdadh an togail %1$s (%2$s).","widelands","../../src/wlapplication.cc:1114"
"Berry Farm","croit-dhearc","The berry farm needs free space within the work area to plant the bushes.","Bidh a’ chroit-dhearc feumach air rum shaor am broinn an raoin-obrach aice gus na preasan a chur ann.","tribes_encyclopedia","../../data/tribes/buildings/productionsites/frisians/berry_farm/helptexts.lua:18"
"quarry","cuaraidh","Great! Today the building of the quarry was completed. Now we will get enough granite and marble to construct larger buildings.","Nach math sin! Chaidh togail a’ chuaraidh a choileanadh an-diugh. Gheibh sinn gaireal agus marmor gu leòr a-nis gus togalaichean mòra a thogail.","scenario_emp02.wmf","../../data/campaigns/emp02.wmf/scripting/texts.lua:159"
"quarry","cuaraidh","It would be a good source for bolstering our supply of quality marble, beyond the meager quantities available from the quarry. Perhaps you were right when you said that this island was like paradise.","’S e stòras math a bhiodh ann gus cur ris an deagh-mharmor againn o nach fhaigh sinn ach gu gann e on chuaraidh. Feumaidh gun robh sibh ceart nuair a thuirt sibh gun robh an t-eilean seo coltach ri pàrras.","scenario_emp02.wmf","../../data/campaigns/emp02.wmf/scripting/texts.lua:187"
"quarry","cuaraidh","Good news from the people, Lutius. I got the message that our first quarry has started its work today.","Fhuair sinn deagh naidheachd on t-sluagh, a Lutius. Chaidh innse dhomh gun do thòisich a’ ciad chuaraidh againn ag obair an-diugh.","scenario_emp03.wmf","../../data/campaigns/emp03.wmf/scripting/texts.lua:291"
"quarry","cuaraidh","Now go ahead, try it. The quarry is a small building, so if you click on a medium or big building symbol, you will have to select the small buildings tab first to find it. Go on, check it out!","Siuthad is feuch e a-nis. ’S e togalach beag a th’ anns a’ chuaraidh, mar sin ma bhriogas tu air samhla togail meadhanach no mòr, feumaidh tu taba nan togalaichean beaga a thaghadh an toiseach gus a lorg. Siuthad, thoir sùil air!","scenario_tutorial01_basic_control.wmf","../../data/campaigns/tutorial01_basic_control.wmf/scripting/texts.lua:247"
"quarry","cuaraidh","The quarry is a small building like the lumberjack’s hut. You can therefore build it on any field that shows a red, yellow or green house when the building spaces symbols are enabled (Press Space for that).","’S e togalach beag a tha sa chuaraidh mar a tha am bothan coillteir. Mar sin, ’s urrainn dhut fear a thogail air raon sam bith a sheallas taigh dearg, buidhe no uaine nuair a bhios na h-ionadan togail ’gan nochdadh (brùth air Space gus an nochdadh).","scenario_tutorial01_basic_control.wmf","../../data/campaigns/tutorial01_basic_control.wmf/scripting/texts.lua:254"
"quarry","cuaraidh","Just click on any house symbol next to the rocks, select the small buildings tab in the window that opens up, then click on the quarry symbol.","Briog air samhla taighe sam bith ri taobh nan carraigean, tagh taba nan togalaichean beaga san uinneag a nochdas is an uairsin briog air samhla a’ chuaraidh.","scenario_tutorial01_basic_control.wmf","../../data/campaigns/tutorial01_basic_control.wmf/scripting/texts.lua:255"
"quarry","cuaraidh","Connect your quarry construction site to your headquarters with a road. You would have been put directly into road building mode after ordering a new site. But now, you aren’t.","Ceangal làrach togail a’ chuaraidh ris a’ phrìomh-àras agad le rathad. Bhiodh thu ann am modh togail rathaidean sa bhad nan robh thu dìreach air làrach ùr òrdachadh. Ach chan eil thu an-dràsta.","scenario_tutorial01_basic_control.wmf","../../data/campaigns/tutorial01_basic_control.wmf/scripting/texts.lua:313"
"quarry","cuaraidh","It seems like you destroyed a construction site for a quarry we wanted to build. Since we need the granite, I suggest you reload the game from a previous savegame. Luckily, these are created from time to time. To do so, you have to go back to the main menu and choose ‘Single Player’ → ‘Load Game’. And please be a bit more careful next time.","Na mhill thu làrach togail a’ chuaraidh a bha sinn airson togail? On a tha sinn feumach air a’ ghaireal, mholainn gun luchdaich thu an geama às ùr o gheama air a shàbhaladh. Gu fortanach, cruthaichidh sinn fear dhut o àm gu àm. Gus geama a luchdadh, till dhan phrìomh chlàr-taice agus tagh “Aon chluicheadair” → “Luchdaich geama”. Agus nach bi thu nas fhaiceallaiche an ath thuras?","scenario_tutorial01_basic_control.wmf","../../data/campaigns/tutorial01_basic_control.wmf/scripting/texts.lua:331"
"quarry","cuaraidh","Now we know what’s going on. Let’s wait for the quarries to finish.","Tha fios againn a-nis dè tha a’ tachairt. Fuirich ort a-nis gus am bi an dà chuaraidh deiseil.","scenario_tutorial01_basic_control.wmf","../../data/campaigns/tutorial01_basic_control.wmf/scripting/texts.lua:366"
"quarry","cuaraidh","‘2/1’ below the quarry: This means that you have two quarries, plus another one which is under construction.","“2/1” fon chuaraidh: Is ciall dha seo gu bheil dà chuaraidh agad is fear eile a tha ’ga thogail.","scenario_tutorial04_economy.wmf","../../data/campaigns/tutorial04_economy.wmf/scripting/texts.lua:76"
"quarry","cuaraidh","The stonecutter working at this quarry can’t find any rocks in his work area.","Chan urrainn dhan tochailtear a tha ag obair aig a’ chuaraidh seo carraig a lorg taobh a-staigh an raoin-obrach tuilleadh.","tribes","../../data/tribes/buildings/productionsites/atlanteans/quarry/init.lua:65"
"quarry","cuaraidh","The stonemason working at this quarry can’t find any rocks in his work area.","Chan urrainn dhan chlachair a tha ag obair aig a’ chuaraidh seo carraig a lorg taobh a-staigh an raoin-obrach tuilleadh.","tribes","../../data/tribes/buildings/productionsites/barbarians/quarry/init.lua:72"
"quarry","cuaraidh","The stonemason working at this quarry can’t find any rocks in his work area.","Chan urrainn dhan chlachair a tha ag obair aig a’ chuaraidh seo carraig a lorg taobh a-staigh an raoin-obrach tuilleadh.","tribes","../../data/tribes/buildings/productionsites/empire/quarry/init.lua:80"
"quarry","cuaraidh","The stonemason working at this quarry can’t find any rocks in his work area.","Chan urrainn dhan chlachair a tha ag obair aig a’ chuaraidh seo carraig a lorg taobh a-staigh an raoin-obrach tuilleadh.","tribes","../../data/tribes/buildings/productionsites/frisians/quarry/init.lua:72"
"Reed","cuilceach","Cultivates reed that serves two different purposes for the Barbarian tribe.","Togaidh e feur a choileanas dà fheumalachd do threubh nan Tùsanach.","tribes_encyclopedia","../../data/tribes/buildings/productionsites/barbarians/reed_yard/helptexts.lua:13"
"Reed","cuilceach","Cultivates reed that serves three different purposes for the Frisians.","Togaidh e feur a choileanas trì feumalachdan do na Frìoslannaich.","tribes_encyclopedia","../../data/tribes/buildings/productionsites/frisians/reed_farm/helptexts.lua:16"
"Fur Garment","còta-bèin","Sews fur garments out of reindeer fur.","Nì e còtaichean-bèin à bian rèin-fhèidh.","tribes_encyclopedia","../../data/tribes/buildings/productionsites/frisians/sewing_room/helptexts.lua:13"
"oxen","daimh","Chieftain, remember the poor carriers: Our roads get longer and longer and the burden on their shoulders never gets lighter. We should breed more oxen to make their work lighter and our transportation more efficient.","A cheannaird, cuimhnichibh air na giùlanairean bochda: Tha na rathaidean againn a’ fàs nas fhaide is nas fhaide ach chan fhàs an eallach a tha orra nas aotruime. Bu chòir dhuinn barrachd dhaimh a thogail ach am biodh an obair aca na b’ fhasa is an còmhdhail againn na b’ èifeachdaiche.","scenario_bar02.wmf","../../data/campaigns/bar02.wmf/scripting/texts.lua:359"
"Fruit","dearcan","Meat doesn’t grow on bushes. Fruit does.","Chan fhàs feòil air preasan. Fàsaidh measan.","tribes_encyclopedia","../../data/tribes/buildings/productionsites/frisians/collectors_house/helptexts.lua:3"
"Builder","fear-togail","We found one more building of this strange making. We have yet to see any of its builders. But obviously there has been a community on this island before and obviously it was militarized. I have to check on our military status with my generals. I will not allow that a potential enemy will find us unprepared.","Lorg sinn fear eile de na togalaichean neònach ud. Chan eil sgeul air na daoine a thog iad fhathast. Ach bha coimhearsnachd san eilean seo roimhe gun teagamh agus tha e follaiseach gun robh feachd aca. Feumaidh mi bruidhinn ris na cinn-armailt agam a thaobh cor an fheachd againn. Cha cheadaich mi gun dig nàmhaid oirnn ma dh’fhaoidte is sinn gun uallachadh.","scenario_atl01.wmf","../../data/campaigns/atl01.wmf/scripting/texts.lua:404"
"Builder","fear-togail","Praise Satul! Ostur, the young ship builder did it. We have three ships – never have I seen sturdier ones – with enough room to carry all of us and some wares too. And this rescue came just in time: Lutas is about to swallow the rest of this island, the water rises faster by the hour. But we can make our escape now and start over in some country farther away…","Moladh do Shatul! Chaidh an latha le Ostur, an saor-luinge òg. Tha trì longan againn – chan fhaca mi gin na bu treasa roimhe riamh – le rum gu leòr annta gus ar muinntir gu lèir agus beagan stòrasan a chur annta. Agus fhuair sinn teasairginn ri deagh-àm: tha Lutas gu bhith slugadh an corr dhen eilean ’s an cuan ag èiridh nas luaithe gach uair. Ach teichidh sinn a-nis agus gheibh sinn beatha ùr air tìr nas fhaide air falbh…","scenario_atl01.wmf","../../data/campaigns/atl01.wmf/scripting/texts.lua:474"
"Smoked Meat","feòil-rèiste","All I need to be happy is a slice of honey bread with some smoked meat and a beer.","Thoir sliseag arain-mheala le feòil no iasg-rèiste dhomh is bith mi cho sona ri bròg.","tribes_encyclopedia","../../data/tribes/buildings/productionsites/frisians/drinking_hall/helptexts.lua:6"
"Log","fiodh","You tried to log back in, but the server has no knowledge of your previous state anymore.","Dh’fheuch thu ri clàradh a-steach a-rithist, ach chan aithnich am frithealaiche an staid a bh’ agad roimhe tuilleadh.","widelands","../../src/network/internet_gaming_messages.cc:63"
"Blackwood","fiodh cruaidh","Hardens logs by fire into blackwood, which is used to construct robust buildings.","Cleachdaidh e teine gus fiodh a chruthachadh ach an gabh a chleachdadh gus togalaichean seasmhach a thogail.","tribes_encyclopedia","../../data/tribes/buildings/productionsites/barbarians/wood_hardener/helptexts.lua:16"
"Flour","flùr","Blackroots are a special kind of root produced at blackroot farms and processed in mills. The Atlanteans like their strong taste and use their flour for making bread.","Saothraichidh tu freumhagan ann an tuathanasan fhreumhagan is bheir thu dhan mhuileann iad an uairsin. Is toigh leis na h-Atlantaich am blas làidir is cleachdaidh iad am min gus aran a dhèanamh.","tribes_encyclopedia","../../data/tribes/wares/blackroot/helptexts.lua:4"
"game","geama","Some say that impenetrable lands to the far north scared away even the most courageous settlers and the bravest of the brave warriors. Big and old forests, full of big and predatory game, cut across by wetlands and hills were shrouded in mystery. The ones who had managed to come back mentioned tremendous buildings, decorated with carvings and gold from majestic mountain ranges somewhere amongst the wilderness. Dozens of years after only some crumbly ruins remain of these good old times, covered with moss and trees. Their shapes give only an idea about the craftsmanship of ancient constructors. Nobody knows why they (have) disappeared. Nobody knows why. People say that now nothing is blocking the road to wealth. But many will die pulled apart by wolves, engulfed by swamp… encircled by hostile tribes.","Tha cuid ag ràdh gun do chum an tìr dho-inntrig fada tuath fiù ’s an luchd-tuineachaidh ’s na gaisgich as dàna air falbh. ’S e seann choilltean mòra dìomhair a bh’ ann làn bheathaichean sealgair mòra eadar talamh fliuch ’s cnuic. Dh’innseadh an fheadhainn a thill beò às mu thogalaichean mòra le sgeadachadh snaidhte ’s òir orra agus gun dàinig an t-òr à monaidhean àite air choireigin san fhàsach. Bliadhnaichean mòra às dèidh seo, chan eil ach fuighill còmhdaichte le còinneach ’s craobhan air fhàgail dhen bheatha mhath a b’ àbhaist a bhith ann. Cha doir an cruthan ach beachd farsaing dhut mu cheàird an luchd-togail àrsaidh. Chan eil fios aig duine carson a dh’fhalbh iad. Chan eil fios aig duine carson. Thathar ag ràdh nach eil dad a’ bacadh an rathad dhan bheairteas a-nis. Ach gheibh mòran dhiubh bàs air an reubadh le madaidhean-allaidh, air an dol fodha ann am boglach… le treubhan nàimhdeil timcheall orra.","maps","../../data/maps/The_Far_North.wmf/elemental:10"
"game","geama","Widelands is nearly feature complete and is much fun to play alone and even more in multiplayer with others. Still, there is always more work to be done in all areas. If you are interested in contributing – be it by making graphics, fixing bugs or adding new features, translating the game into your language or creating new maps – get in touch on our homepage.","Tha sinn air cha mhòr a h-uile gleus a tha fainear dhuinn airson Widelands a chruthachadh is tha e tlachdmhor ri chluiche ’nad aonar no le daoine eile sa mhodh ioma-chluicheadair. Tha barrachd obrach ri dèanamh an-còmhnaidh co-dhiù sna h-uile roinn. Nam bu toigh leat taic a thoirt dhuinn – ge b’ e an dèan thu grafaigeachd, an càraich thu bugaichean, an cuir thu gleusan ùra ris, an eadar-theangaich thu dhan chànan agad fhèin e no an cruthaich thu mapaichean ùra – dèan conaltradh rinn air an làrach-lìn againn.","texts","../../data/txts/README.lua:14"
"game","geama","Exit Game Confirmation","Dearbh an fhàgail","widelands","../../src/wui/game_options_menu.cc:45"
"Outpost","gearastan","An Outpost for Exile","Tuineachadh nam fògarrach","maps","../../data/campaigns/campaigns.conf:96 ../../data/campaigns/emp02.wmf/elemental:9"
"outpost","gearastan","An Outpost for Exile","Tuineachadh nam fògarrach","maps","../../data/campaigns/campaigns.conf:96 ../../data/campaigns/emp02.wmf/elemental:9"
"Outpost","gearastan","On this island, we will start our new life. We will build up an outpost for our exile, which perhaps will become a new, beautiful home for every one of us.","’S ann san eilean seo a thòisicheas sinn air ar beatha ùr. Togaidh sinn tuineachadh nam fògarrach a thèid ’na dhachaigh àlainn ùr airson gach fear dhuinn, ma dh’fhaoidte.","scenario_emp02.wmf","../../data/campaigns/emp02.wmf/scripting/texts.lua:116"
"outpost","gearastan","On this island, we will start our new life. We will build up an outpost for our exile, which perhaps will become a new, beautiful home for every one of us.","’S ann san eilean seo a thòisicheas sinn air ar beatha ùr. Togaidh sinn tuineachadh nam fògarrach a thèid ’na dhachaigh àlainn ùr airson gach fear dhuinn, ma dh’fhaoidte.","scenario_emp02.wmf","../../data/campaigns/emp02.wmf/scripting/texts.lua:116"
"Blacksmith","gobha","You have thirty seconds to learn the basics of swordfighting and how to stay alive in battle. A third of that time has gone by for the introduction alone! You’d better pay close attention to me in order to make the most of it. Now here is your new short sword, forged just for you by our best blacksmiths. Time’s up everyone, now go occupy your sentinels!","Bidh leth-mhionaid agad airson sabaid bhunasach leis a’ chlaidheamh is mar a sheasas tu air a’ bhlàr ionnsachadh. Chaidh an treas pàirt dhen ùine sin a chaitheamh leis an ro-ràdh mar-thà! Thoir an dùr-aire orm ach am faigh thu na ghabhas às. Nise, seo an claidheamh-beag ùr agad a chaidh a dhèanamh dhut leis na goibhnean as fhearr againn. Dh’fhalbh an ùine mar-thà, gabhaidh caitheamh sna freiceadanan agaibh gun dàil a-nis!","tribes_encyclopedia","../../data/tribes/buildings/productionsites/frisians/barracks/helptexts.lua:3"
"Ration","greimeag","While this is true, we should consider it later, for now other obstacles are at hand. The miners will definitely demand greater rations for working high up on the mountain in this bitter cold, and providing these supplies may not be easy.","Ged a tha sin fìor, bu chòir dhuinn smaoineachadh air uaireigin eile on a tha cnapan-starra eile romhainn an-dràsta. Bidh na mèinnearan ag iarraidh greimeannan bidhe as motha on a tha iad ag obair àrd air a’ bheinn san fhuachd uabhasach a tha ann agus is dòcha nach bi e furasta na dh’fheumas iad a thoirt dhaibh.","scenario_bar01.wmf","../../data/campaigns/bar01.wmf/scripting/texts.lua:380"
"Ration","greimeag","Of course, it is dark and cold in such depths and only a few venture voluntarily into these places. We should reward this bravery with greater rations for them. And a pint of beer or two will keep their spirits high.","Gu nàdarra, tha doimhne dhen leithid dorcha is fuar agus cha dèid mòran ann gu saor-thoileach. Bu chòir dhuinn duais de barrachd bìdh a thoirt dha na daoine dàna ud. Agus bidh iad ann an deagh shunnd ma gheibh iad pinnt no dhà.","scenario_bar01.wmf","../../data/campaigns/bar01.wmf/scripting/texts.lua:448"
"campaign","iomairt","Invalid path to file in campaigns.conf: %s","Slighe mhì-dhligheach dhan fhaidhle ann an campaigns.conf: %s","widelands","../../src/ui_fsmenu/campaign_select.cc:397"
"Beer","leann","Of course, it is dark and cold in such depths and only a few venture voluntarily into these places. We should reward this bravery with greater rations for them. And a pint of beer or two will keep their spirits high.","Gu nàdarra, tha doimhne dhen leithid dorcha is fuar agus cha dèid mòran ann gu saor-thoileach. Bu chòir dhuinn duais de barrachd bìdh a thoirt dha na daoine dàna ud. Agus bidh iad ann an deagh shunnd ma gheibh iad pinnt no dhà.","scenario_bar01.wmf","../../data/campaigns/bar01.wmf/scripting/texts.lua:448"
"Ship","long","Man your ship and sail to the horizon.","Cruinnich sgioba is seòl dhan aineolach.","maps","../../data/maps/Crossing_the_Horizon_v2.wmf/elemental:10"
"Headquarters Shipwreck","long bhriste ’na phrìomh-àras","The headquarters shipwreck is your main building.","’S e am prìomh thogalach agad a th’ anns an long bhriste seo.","tribes_encyclopedia","../../data/tribes/buildings/warehouses/empire/headquarters_shipwreck/helptexts.lua:22"
"Fishing Net","lìon-èisg","Reed is the traditional material for roofing. It is also needed for producing buckets and fishing nets, and it is woven – together with reindeer fur – into the cloth used for ships’ sails.","Tha feur ’ga chleachdadh airson mullaich a thogail gu dualchasach. Bidh feum air airson peilichean is lìn-èisg a dhèanamh cuideachd agus thèid a bheart-fhighe – le bian rèin-fhèidh – airson clò a dhèanamh do shiùil nan long.","tribes_encyclopedia","../../data/tribes/buildings/productionsites/frisians/reed_farm/helptexts.lua:21"
"trade","malairt","Serves as a base for overseas colonization and trade. Also stores your soldiers, wares and tools.","Seo an t-ionad agad airson tuineachadh is malart thar chuain. Cumaidh tu na saighdearan, am bathar ’s na h-acainnean agad ann cuideachd.","tribes_encyclopedia","../../data/tribes/buildings/warehouses/atlanteans/port/helptexts.lua:16"
"trade","malairt","Serves as a base for overseas colonization and trade. Also stores your soldiers, wares and tools.","Seo an t-ionad agad airson tuineachadh is malart thar chuain. Cumaidh tu na saighdearan, am bathar ’s na h-acainnean agad ann cuideachd.","tribes_encyclopedia","../../data/tribes/buildings/warehouses/barbarians/port/helptexts.lua:16"
"trade","malairt","Serves as a base for overseas colonization and trade. Also stores your soldiers, wares and tools.","Seo an t-ionad agad airson tuineachadh is malart thar chuain. Cumaidh tu na saighdearan, am bathar ’s na h-acainnean agad ann cuideachd.","tribes_encyclopedia","../../data/tribes/buildings/warehouses/empire/port/helptexts.lua:16"
"Market","margaid","This market has received a new trade offer.","Fhuair a’ mhargaid seo tairgse airson malairt ùr.","widelands","../../src/logic/game.cc:797"
"medium","meadhanach","The chain armor is a medium armor for Empire soldiers. It is produced in an armor smithy and used in a training camp – together with food – to train soldiers from health level 2 to level 3.","’S e armachd mheadhanach aig saighdearan na h-Impireachd a th’ anns a mhàilleach. Saothraichidh tu ann an ceàrdach armachd i is thèid a cleachdadh sa champa oideachaidh – le biadh – gus slàinte nan saighdearan oideachadh o leibheil 2 gu leibheil 3.","tribes_encyclopedia","../../data/tribes/wares/armor_chain/helptexts.lua:4"
"medium","meadhanach","This is the medium trident. It is produced in the weapon smithy and used by advanced soldiers in the dungeon – together with food – to train from attack level 1 to level 2.","Seo a’ mhuirgheadh mheadhanach. Saothraichidh tu sa cheàrdach arm i is thèid a cleachdadh le saighdearan adhartach san toll-dubh – le biadh – gus an ionnsaigh oideachadh o leibheil 1 gu leibheil 2.","tribes_encyclopedia","../../data/tribes/wares/trident_steel/helptexts.lua:4"
"Meal","mias","I promise you, before the sun sets today you will have a magnificent meal fit for the chieftain of all clans!","Bidh biadh math agad a bhios iomchaidh do cheannard nan cinnidhean uile ro dhubhradh na grèine le cinnt!","scenario_bar01.wmf","../../data/campaigns/bar01.wmf/scripting/texts.lua:413"
