"glossary_term","glossary_translation","source","target","file","location"
"Hunter","Jäger","The hunter brings fresh, raw meat to the colonists.","De Jager jaggt friskes, ruges Fleesk för de Lüü.","tribes_encyclopedia","../../data/tribes/initialization/barbarians/units.lua:646"
"Hunter","Jäger","The hunter brings fresh, raw meat to the colonists.","De Jager jaggt friskes, ruges Fleesk för de Lüü.","tribes_encyclopedia","../../data/tribes/initialization/empire/units.lua:700"
"Hunter","Jäger","The hunter brings fresh, raw meat to the colonists.","De Jager jaggt friskes, ruges Fleesk för de Lüü.","tribes_encyclopedia","../../data/tribes/initialization/frisians/units.lua:745"
"map","Kaart","Center the map on the selected ship","To deese Schipp springen","tribes_encyclopedia","../../data/tribes/scripting/help/controls.lua:146"
"map","Kaart","Show original map names","Wies echte Namen vun de Karten","widelands","../../src/ui_fsmenu/mapselect.cc:83"
"map","Kaart","Center the map on the selected ship","To deese Schipp springen","widelands","../../src/wui/seafaring_statistics_menu.cc:158"
"Barracks","Kasern","Boldreth seems more and more torn as the days go by. The spirits of my fellows sink as the cold season approaches, and we are still living in no more than huts and barracks. I never intended to stay out here in the wilderness for so long – but I never thought my brothers would engage in this senseless battle for so long either.","As de Dagen vörbigahn, kummt mi Boldreth mehr un mehr rumrieten vör. Miene Kameraden verlesen hör Mood as de kolle Tied nahder kummt, un wi leven immer noch in nix as Kaaten un Brattsen. Ick harr nooit vörhatt, so lang in de Wildernis to blieven – aver ick hett ok nooit docht, dat se sik so lang mit deesem unnützen Krieg befaten.","scenario_bar01.wmf","../../data/campaigns/bar01.wmf/scripting/texts.lua:214"
"Fortification","Kasteel","We must improve our military capabilities. If there are foes on the island, we have to be prepared when we meet them. We should also enforce the fortification of our borders.","Wi mutten uns’ Soldateree verbetern. Wenn dat up de Insel Feinde gifft, mutten wi stark wesen, wenn wi se treffen. Wi sallen ok de Befestigungen an uns’ Grenzen utbauen.","scenario_atl01.wmf","../../data/campaigns/atl01.wmf/scripting/texts.lua:406"
"Fortification","Kasteel","The news that a patrol brought is not good to hear. Our spies tell us that the war tribes still rage in battle, but some of the elder soldiers and tribe leaders seem to grow tired of this senseless war. Kalitath, son of Kun is the first war leader to leave Al’thunran, thus leaving his side weak and vulnerable. As my scouts report, he has set foot on the lower grounds around the capital, securing the outer fortification rings.","De Bespejers hebben slimme Narichten brocht. Se seggen uns, dat de Völkers immer noch im Stired stahn, aver eenige vun de ollern Soldaten un Anföhrers wullen deesen unnützen Krieg nich wiederföhren. Kalitat, de Söhn vun Kuun, is de eerste Kriegs-Anföhrer, well Alltunraan verlaten hett; nu is siene Sied blot swack tegen Angriffen schütt. Miene Bespejers mellen, dat he sik bi de Flacklannen um de Höövdstadt daallaten hett un de butern Schanzen sekert.","scenario_bar02.wmf","../../data/campaigns/bar02.wmf/scripting/texts.lua:170"
"Fortification","Kasteel","The frontier line of my forces has expanded to the edge of the forests. We have a long and cold winter and so many miles behind us. The fortification that we erected around Ondun will guarantee us a fast supply of men and goods, and once Al’thunran is in my hands, the two cities will be linked by a good and defensible infrastructure. Still, I hope I will not walk alone on this mission, I hope Kalitath son of Kun will follow my call.","Miene Grenz-Lienje is bit tu de Waldrann vörrückt. Wi hebben eenen langen, kollen Winter un unbannig völe Mielen achter uns. De Schanz, wat wi bi Onduun baut hebben, gewährt uns Naschuuv an Lüü un Waren, un wenn ick eerst Alltunraan hebb, worden de twee Steden vun eener goden Weertskupp verbunnen, wat sik ok good verteidigen lett. Aver ick hoop, dat ick dat nich alleen daan kregen mutt; ick hoop, dat Kalitat, Söhn vun Kuun, mienen Roop folgt.","scenario_bar02.wmf","../../data/campaigns/bar02.wmf/scripting/texts.lua:194"
"Fortification","Kasteel","The first fortification Thron ordered has just been completed. At the moment, he seeks to bring trust and belief to those who live inside the walls of our new habitat that we named ‘Ondun’, which means ‘those who wait’ in the old tongue. But Thron is not yet satisfied – and I fully understand his fears: the forests are deep, and the frontier to Al’thunran is near. I am sure that there are a thousand greater dangers out there than the unknown tracks.","De eersten Schanzen, wat Troon hett bauen laten, sünd nu beschickt. Jüüst nu will he Vertrauen un Free to de Lüü brengen, well in de Müren vun uns’ neje Stadt wohnen, wat wi »Onduun« benöhmt hebben. wat in de ollen Spraak »Se well wachten« hett. Aver Troon is noch nich tofree – un ick verstah siene Angst: De Walden sünd deep, un de Grenz vun Alltunraan is dicht bi. Ick bün mi seker, dat dat daar buten dusend slimmere Gefahren as de komsiken Sporen gifft.","scenario_bar02.wmf","../../data/campaigns/bar02.wmf/scripting/texts.lua:269"
"team","Klottje","To establish a smuggling route, you need to build a warehouse on a sending/receiving spot while your team mate has to build one on the corresponding receiving/sending spot. A ware is then transported every 10 seconds.","Um een Smuggel-Padd intorichten, mutt du up eenem Enn vun eenem Tunnel een Kraamhuus bauen, un dien Partner an de glieke Stee in sienem Gewest ok eens bauen. Dann word all 10 Sekünnen eene Waar smuggelt.","mp_scenario_smugglers.wmf","../../data/maps/MP_Scenarios/Smugglers.wmf/scripting/texts.lua:10"
"team","Klottje","Remember that the map has rotational symmetry. For example, when you have found a spot to the top-left of your headquarters, the corresponding spot will be to the bottom-right of the headquarters of your team mate.","Vergeet nich, dat de Kaart evenmatig mit eenem Dreihzentrum is. Dat heet, wenn du links boven vun dienem Raadhuus eene Stee finnst, hett dien Partner de glieke Stee rechts unner sienem Raadhuus.","mp_scenario_smugglers.wmf","../../data/maps/MP_Scenarios/Smugglers.wmf/scripting/texts.lua:16"
"ore","Kluut","Use the river wisely. Your opponents will do the same. You will find the main ore resources deep in the desert.","Bruuk de Stroom klook. Diene Feinde doon dat ok. Du finnst de wichtigsten Kluten-Lagers deep in de Wüüst.","maps","../../data/maps/The_Nile.wmf/elemental:11"
"ore","Kluut","Expand your territory to the mountains, send geologists to search for ore and coal and build a mining economy with mines, taverns, smelting works and metal workshop.","Vergroter dien Gewest bit to de Bargen, schick Schattsökers, um na Kluten un Köhl to söken, un bau eene Bargwarks-Weertskupp mit Bargwarken, Kneipen, Smeltwarken un eener Metalldreihbank.","scenario_bar02.wmf","../../data/campaigns/bar02.wmf/scripting/texts.lua:74"
"ore","Kluut","As long as we don’t produce rations, our miners won’t dig for ore. And without iron, we cannot forge a single helm.","Bit wi weer Happen produzeren, graven uns’ Bargwarkskeerls nich mehr na Kluten. Un sünner Iesen könen wi keene Helms smeden.","scenario_tutorial04_economy.wmf","../../data/campaigns/tutorial04_economy.wmf/scripting/texts.lua:227"
"ore","Kluut","We learned the smelting from our forefathers, a basic craftsmanship taming the fire and the ore into pure metals.","Wi hebben dat Smelten vun uns’ Vörvaders lehrt, eene slichte Handwarkskunst, dat Füür un de Kluten in pure Metallen to tähmen.","tribes_encyclopedia","../../data/tribes/initialization/atlanteans/units.lua:1665"
"ore","Kluut","‘Way down here in these golden grounds<br>with stones above us the thousand pounds<br>I dig in the dust until I see the spark;<br>The golden ore I find in the dark.’","»In deesen depen golden Grünnen<br>unner Fels to dusend Tünnen<br>graav ick im Klei dör de stoffig Spold<br>bit ick finn im Düüster dat lechte Gold.«","tribes_encyclopedia","../../data/tribes/initialization/atlanteans/units.lua:1832"
"ore","Kluut","‘He who has enough bread will never be too tired to dig the ore and wield the ax.’","»Well genoog Brood hett, word nie to sluff, na Kluten to graven un de Ext to swingen.«","tribes_encyclopedia","../../data/tribes/initialization/barbarians/units.lua:1291"
"button","Knoop","The second one is the more common and faster one: press-and-hold the right mouse button anywhere on the map, then move your mouse around and you’ll see the view scroll.","Över de anner Kant kannst du de rechte Muustaste enerwegens up de Kaart drücken un hollen un dann diene Muus bewegen, un de Sicht verschuuvt sik. Dat is handig un gang un geve.","scenario_tutorial01_basic_control.wmf","../../data/campaigns/tutorial01_basic_control.wmf/scripting/texts.lua:245"
"Warehouse","Kraamhuus","Every warehouse has four buttons to set the preference. If you move your mouse pointer over them, you will see tooltips that explain what the buttons do.","Elkeen Waarhuus hett veer Knopen, um Vörrang fasttoleggen. Wenn du de Muus daaröver beweegst, süchst du Texten, de di seggen, wat de Knopen doon.","scenario_tutorial04_economy.wmf","../../data/campaigns/tutorial04_economy.wmf/scripting/texts.lua:538"
"warlord","Kummandant","From the north we are endangered by a belligerent tribe, led by warlord Törver, that is rapidly building up its armies. They may soon have become too strong to be defeated.","Im Noorden droht uns een striedlevend Volk, wat Generaal Törver anföhrt, un wat siene Soldateree fix utbaut. Se worden bold to machtig worden, um se noch manntjen to könen.","map_along_the_river.wmf","../../data/maps/SP_Scenarios/Along_The_River.wmf/scripting/texts.lua:14"
"Coal Mine","Köhle-Bargwark","If the food supply is steady, the coal mine can produce two pieces of coal in %s on average.","Wenn de Spiesen to rechter Tied ankomen, produzeert deeses Bargwark dör de Bank all %s twee Köhlen.","tribes_encyclopedia","../../data/tribes/initialization/frisians/units.lua:2014"
"Cook","Kööksch","Our building infrastructure is finished and I spent some days making sure that everybody is working well together. Now, there are other pressing matters. I called Colionder, my personal cook, before me to get his help with sorting some things out.","Uns’ Bau-Weertskupp is kumpleet un ick hebb een paar Dagen daarmit verbrocht, uptopassen, dat all Lüü good tosamen warken. Nu gifft dat anner wichtige Dingen. Ick hebb Kojonder, mienen persönelken Kock, to mi ropen laten, um mit siener Hülp een paar Dinge klaar to maken.","scenario_atl01.wmf","../../data/campaigns/atl01.wmf/scripting/texts.lua:217"
"Cook","Kööksch","‘He loves the animals and to breed them<br>as we love to cook and eat them.’","»He leevt to Tüchten all de Deerten<br>so geern as wi se geern verweerten.«","tribes_encyclopedia","../../data/tribes/initialization/barbarians/units.lua:1209"
"Terrain","Landskupp","Red player is close to the ores, but has little fertile terrain. Yellow player has plenty of good land, but must move far from his starting position to find ores. Blue player takes the middle ground – he has some fertile land and is not too far away from the resources.","De rode Speler is dicht an de Kluten, hett aver haast keene Eer, waar wat wasst. De gele Speler hett vööl godes Land, mutt aver wied weg söken, um Kluten to kriegen. De blaue Speler is daartüsken – he hett een bietje früchtbares Land un is nich so wied weg vun de Mineraalen.","maps","../../data/maps/Comet_Island.wmf/elemental:11"
"Terrain","Landskupp","Click on the map to increase, Shift + Click on the map to decrease terrain height","Klicke de Kaart tum Verhogen an; drücke daar de Umschalt-Tast bi tum lütter maken.","widelands","../../src/editor/ui_menus/tool_change_height_options_menu.cc:60"
"Terrain","Landskupp","Ctrl + Click on the map to set terrain height","Klicke de Kaart an un drücke daar de Strg-Tast bi tum Fastsetten vun de Höcht.","widelands","../../src/editor/ui_menus/tool_change_height_options_menu.cc:63 ../../src/editor/ui_menus/tool_noise_height_options_menu.cc:79"
"Terrain","Landskupp","Click on the map to set terrain height to a random value within the specified range","Klick de Kaart an tum Fastmaken vun de Höcht to eene tofällige Tahl in de utköört Intervall.","widelands","../../src/editor/ui_menus/tool_noise_height_options_menu.cc:73 ../../src/editor/ui_menus/tool_noise_height_options_menu.cc:76"
"Long Sword","Langes Sweert","They learn to attack with three different swords: The long sword, broadsword and double-edged sword. The latter two contain gold, and all of them iron. The advanced soldiers are taught to use two swords at once: They keep their first double-edged sword, and are given various other swords to wield in their other hand. This makes six steps of attack training.","Se lehren de Angriff mit dree verschedenen Sweerten: Dat Lange, Brede un Tweesneidige Sweert. De lesten twee enthollen Gold, un alle Iesen. De beteren Soldaten bruken twee Sweerten up eenmaal: Se behollen hör eerstes Tweesneidigs Sweert, un kriegen verschedene anner Sweerten, de se mit hör anner Hand föhren könen. Dat sünd all tosamen sess Stappen vun Angriffs-Öven.","scenario_fri01.wmf","../../data/campaigns/fri01.wmf/scripting/texts.lua:324"
"Long Sword","Langes Sweert","The long sword is the weapon used by level 1 soldiers. Level 4 soldiers are equipped with a long and a double-edged sword.","Dat Lange Sweert is de Wapen, de Soldaten vum Stand 1 bruken. Soldaten vum Stand 4 hebben een Langes un een Tweesneidigs Sweert.","tribes_encyclopedia","../../data/tribes/initialization/frisians/units.lua:546"
"Lanissa","Laniss'","Defeat Lanissa and capture the ancient castle.","Manntje Laniss’ un nehm dat steenolle Slött in.","map_the_green_plateau.wmf","../../data/maps/SP_Scenarios/The_Green_Plateau.wmf/scripting/texts.lua:26"
"Lanissa","Laniss'","Let’s hope that Lanissa – the warlord holding sway over that castle – has not discovered our movements yet. Perhaps we have a chance of conquering that mighty building without a bigger fight! However, it is essential that we capture it. It will be the key to our reign over this island!","Hopentlik hett uns Laniss’ – de Kummandantin, de dat Slött kuntrolleert – noch nich funnen. Villicht könen wi deesen gewaltigen Boo sünner grote Slachten innehmen! Wi mutten ’t driest innehmen. ’t is de Slötel tum Seggen över deese Insel!","map_the_green_plateau.wmf","../../data/maps/SP_Scenarios/The_Green_Plateau.wmf/scripting/texts.lua:68"
"Lanissa","Laniss'","Wonderful! Our troops have finally defeated Lanissa and her soldiers. The ancient castle is ours!","Hunnert! Uns’ Soldateree hett Laniss’ un hör Soldaten ennelk manntjet. Dat steenolle Slött hört to uns!","map_the_green_plateau.wmf","../../data/maps/SP_Scenarios/The_Green_Plateau.wmf/scripting/texts.lua:78"
"Lanissa","Laniss'","It is amazing how far one can see from the highest tower of the castle. We can watch the whole island. So now I wonder why Lanissa did not see us and thus did not prepare. Be that as it may, some things will never come to the light of day. The only important issue at the moment are the opposing troops still left. We have discovered enemy positions held by Erwyn to the north and east of the castle. He is known to be a strong warlord and surely commands the strongest warriors. In the south, we caught sight of some food infrastructures guarded by Jomo – a younger warlord – and we should take care of those infrastructures so we can cut off our enemies’ food supply.","’t is nich to glöven, wo wied man vun de hoogsten Toorn im Slött sehn kann. Wi könen de ganze Insel sehn. Wunnerlik, dat Laniss’ uns nich sehn un sik för uns rüst hett. Aver egaal, mennig Dingen blieven man unbegriepelk. Wichtig is blot, dat de övrigen Soldatereen noch daar sünd. Wi hebben im Noorden un Oosten vum Slött Stellungen vun Feinden unner Erwin funnen. He is een gewaltiger Kummandant un hett wiss de starksten Soldaten. Im Süden hebben wi de Spiesen-Weertskupp vun Jomo – een junger Kummandant – funnen, um de wi uns kümmern mutten, um de Spiesen-Versörgung vun uns’ Feinden to unnerbreken.","map_the_green_plateau.wmf","../../data/maps/SP_Scenarios/The_Green_Plateau.wmf/scripting/texts.lua:79"
"Carrier","Lastendrager","The carrier working at this well can’t find any water in his well.","De Arbeider, de bi deese Well warkt, hett keen Water in de Quell mehr.","scenario_emp04.wmf","../../data/campaigns/emp04.wmf/scripting/tribes/well1/init.lua:54"
"Carrier","Lastendrager","The carrier working at this well can’t find any water in his well.","De Arbeider, de bi deese Well warkt, hett keen Water in de Quell mehr.","tribes","../../data/tribes/buildings/productionsites/atlanteans/well/init.lua:57"
"Carrier","Lastendrager","The carrier working at this well can’t find any water in his well.","De Arbeider, de bi deese Well warkt, hett keen Water in de Quell mehr.","tribes","../../data/tribes/buildings/productionsites/barbarians/well/init.lua:66"
"Carrier","Lastendrager","The carrier working at this well can’t find any water in his well.","De Arbeider, de bi deese Well warkt, hett keen Water in de Quell mehr.","tribes","../../data/tribes/buildings/productionsites/empire/well/init.lua:61"
"Carrier","Lastendrager","The carrier working at this well can’t find any water in his well.","De Arbeider, de bi deese Well warkt, hett keen Water in de Quell mehr.","tribes","../../data/tribes/buildings/productionsites/frisians/well/init.lua:66"
"Empire","Latienskes Riek","Six months ago, Lutius – a young general of the Empire – was sent with 150 soldiers to the frontier beyond the northern forests where Barbarian tribes were crossing onto land held by the Empire. His task was to defend the Empire’s land. At first, everything was calm. He even talked to a few Barbarian children and thought about a peaceful life – side by side with this archaic folk. He began to feel safer and his army began to drop their attention off the potential enemy. That was their undoing. One night in March his unprepared army was attacked by 100 Barbarian footmen and was completely scattered. Only with his bare life he and a handful of his soldiers survived.","Vör sess Maanten wurr Lutjus – een junger Offizeer vum Latiensken Riek – mit 150 Soldaten an de Grenz achtern de noordelken Walden schickt, waar de Willen Lüü ins Land vum Riek indrungen. Siene Upgaav weer, dat Land vum Riek to verdedigen. Eerst weer all friedelk. He snackde mit Willen Kinners un wullt in Freden leven – Sied an Sied mit de steenolle Volk. He meende, seker to wesen, un siene Soldaten achtden nich mehr up de mögelk Feinden. Dat weer een Fehler. In eener Määrtnacht wurren siene unrüsten Soldaten vun 100 Willen Stahfasten angrepen un heel un dall verjaggt. He un een paar vun sienen Soldaten överleevden mit nix as de blote Leven.","maps","../../data/campaigns/campaigns.lua:75"
"Empire","Latienskes Riek","On their way home to defend the Empire, the crew of Lutius was surprised by the will of the gods.","As se na Huus gahn, um dat Latienske Riek to verdedigen, worden Lutjus un siene Lüü vun de Will vun de Gotten överrumpelt.","maps","../../data/campaigns/emp03.wmf/elemental:10"
"Empire","Latienskes Riek","We need to finish the Empire off to have a chance to build a new home.","Wi mutten dat Riek manntjen, um eene Kans to hebben, hier eene neje Heimaad to bauen.","scenario_atl02.wmf","../../data/campaigns/atl02.wmf/scripting/texts.lua:144"
"Empire","Latienskes Riek","May Satul warm you, Kalitath! We have defeated the troops of the Empire in the north. Now we expect our princess to return home.","Satuul sall Jo warmen, Kalitat! Wi hebben de Soldateree vun de noordelk Riek manntjet. Nu verwachten wi, dat uns’ Königstochter na Huus torügg kummt.","scenario_atl02.wmf","../../data/campaigns/atl02.wmf/scripting/texts.lua:463 ../../data/campaigns/atl02.wmf/scripting/texts.lua:472"
"Empire","Latienskes Riek","Sidolus, during my stay with the Barbarians I learned a lot about their hospitality and bravery. They really impressed me and their warriors and gods seemed to be very strong in the battle against the Empire. Especially their leader Kalitath made a very good host and I started to think about uniting our tribes to make for a peaceful future on this island. So I want you to prepare our people for a marriage and peaceful coexistence with the Barbarians. This includes learning about their gods and preparing to worship them.","Sidoolus, as ick mit de Willen Lüü leevt hebb, hebb ick vööl över hör Gastlikheid un Mood lehrt. Se hebben mi unbannig imponeert, un hör Kriegers un Gotten weren im Stried tegen dat Riek baldadig machtig. Vör allem hör Anföhrer Kalitat weer een bannig goder Weert, un ick hebb anfangen, daaröver natodenken, uns’ Völkers för eene freedsame Tokunft up deeser Insel to vereenen. Also sallst Jo nu uns’ Lüü up eene Hochtied vörbereiden un up freedsamen Tosamenleven mit de Willen Lüü. Dat heet ok, dat se över hör Gotten lehren mutten un wo man se anbeedt.","scenario_atl02.wmf","../../data/campaigns/atl02.wmf/scripting/texts.lua:502"
"Empire","Latienskes Riek","They name themselves an Empire, and their leader is called Maletus. I want you to train your soldiers and help us defeat his lousy Empire.","Se nömen sik sülven een Riek, un hör Anföhrer heet Maletus. Ick will, dat Jo jo Soldaten utbildt un uns hülpt, sien lusig Riek to manntjen.","scenario_atl02.wmf","../../data/campaigns/atl02.wmf/scripting/texts.lua:682"
"Empire","Latienskes Riek","So I want you to defeat this Empire, but ensure that we will become and remain strong enough to enforce the respect we deserve.","Ick will also, dat Jo deeses Riek manntjet, aver pass up, dat wi machtig genoog worden un blieven, dat wi de Respekt, wat wi verdeent hebben, infördern könen.","scenario_atl02.wmf","../../data/campaigns/atl02.wmf/scripting/texts.lua:692"
"Empire","Latienskes Riek","The message was addressed to me, begging me to come back to Fremil. It says that the Empire is at war with the Barbarians. They were attacked from the north by the tribe that I was forbidden to attack. It is clear to me what I must do…","’t was eene Naricht för mi, de mi daarum anging, dat ick na Freemilt torügg koom. Dat Latienske Riek is im Krieg mit de Willen Lüü. Se sünd vun Noorden angrepen worden, vun de Volk, wat ick nich angriepen dürde. Ick weet, wat ick doon mutt …","scenario_emp02.wmf","../../data/campaigns/emp02.wmf/scripting/texts.lua:288"
"Empire","Latienskes Riek","I really don’t know if and how we will get back home. And the war is going on without us. I hope my fellow soldiers are defending our empire well.","Ick weet würrelk nich, of un wo wo torügg na Huus komen sallen. Un de Krieg gaht sünner uns wieder. Ick hoop, miene Soldaten-Fründe verteidigen uns’ Riek good.","scenario_emp03.wmf","../../data/campaigns/emp03.wmf/scripting/texts.lua:221"
"Empire","Latienskes Riek","Yes my fellow soldiers, we have done it! We have met all the challenges that were put in front of us. But my heart is still with our home. We shall set sail as soon as possible to help defend the Empire from the Barbarian tribe.","Jau, miene Soldaten-Fründe, wi hebben ’t klaar brocht! Wi hebben all de Rutföderungen överwunnen, de vör uns laggen. Aver mien Hart is noch to Huus. Wi sallen tur See fahren, sobold wi nu könen, um dat Riek tegen dat Wille Volk mit to verteidigen.","scenario_emp03.wmf","../../data/campaigns/emp03.wmf/scripting/texts.lua:624"
"Empire","Latienskes Riek","Furthermore, we will have to live with the guilt of destroying a temple of an Empire goddess on our souls.","Un wi mutten nu alltied mit de Schuld leven, dat wi eenen Tempel vun eener Rieks-Gottin verneelt hebben.","scenario_emp04.wmf","../../data/campaigns/emp04.wmf/scripting/texts.lua:478"
"Empire","Latienskes Riek","Defeat the Barbarians and the Empire Colony","Manntje de Willen Lüü un dat Rieks-Dörp","scenario_fri02.wmf","../../data/campaigns/fri02.wmf/scripting/texts.lua:118"
"Empire","Latienskes Riek","The Barbarians and the Empire are too dangerous to allow them to live near us. We must defeat them both.","De Willen Lüü un dat Riek sünd to gefahrelk, as dat wi se in uns’ Naberskupp leven laten könen. Wi mutten se beide manntjen.","scenario_fri02.wmf","../../data/campaigns/fri02.wmf/scripting/texts.lua:119"
"Empire","Latienskes Riek","Strangers! I, Murilius, Proconsul of the Northern Lands, a province of the Empire, demand to know who you are and what business you have in these lands!","Frömde! Ick, Murilius, Prokonsul vun de Noordlannen, eene Provinz vum Latiensken Riek, will weten, well ji west un wat ji in deesen Landen doot!","scenario_fri02.wmf","../../data/campaigns/fri02.wmf/scripting/texts.lua:271"
"Empire","Latienskes Riek","If you seek to live peacefully here, you are not faced with a choice whether to allow them to live here – you are required to assist the Empire in driving them out.","Wenn ji hier in Free leven wullt, gifft ’t för ji keene Kör, of ji se hier leven laat – ji mutt vun Nöden de Riek daarbi stönen, se daarvun to drieven.","scenario_fri02.wmf","../../data/campaigns/fri02.wmf/scripting/texts.lua:286"
