"glossary_term","glossary_translation","source","target","file","location"
"building","bauen","Below every building, there are two lines. The first one shows the number of buildings you own and how many are under construction. The second line shows the average productivity if it is a production site or training site, or the stationed and desired soldiers in military buildings.","Unner elkeen Huus sünd twee Riegen. De eerste wiest de Tahl vun Husen, wat du hest un wat baut word. De twede wiest de Wöörde vun all deese Husen dör de Bank, wenn ’t een normaales Huus of een Övens-Boo is, of de Tahl vun Soldaten, de daar sünd un de sien sallen, wenn ’t een Soldateree-Boo is.","scenario_tutorial04_economy.wmf","../../data/campaigns/tutorial04_economy.wmf/scripting/texts.lua:74"
"building","bauen","This is the building statistics window. It shows you all buildings you can own, sorted by their size.","Dat us dat Fenster för Tahlen över Husen. ’t wiest du all de Husen, de du hest, na Grött sorteert.","scenario_tutorial04_economy.wmf","../../data/campaigns/tutorial04_economy.wmf/scripting/texts.lua:83"
"building","bauen","‘2/4’ below your sentry: For military buildings, the stationed soldiers are shown instead of a productivity. You want to have four soldiers in your sentries, but only two soldiers are stationed in this kind of building. This leaves two vacant positions – we really need more soldiers.","»2/4« unner diener Wachters-Kamer: För Soldateree-Boen wiest dat Fenster de Tahl vun Soldaten un nich de Wöörde. Du willst veer Soldaten in dienen Wachters-Kamerken hebben, hest aver blot twee Soldaten in deesen Husen. ’t gifft also twee lege Steden – wi bruken absolut mehr Soldaten.","scenario_tutorial04_economy.wmf","../../data/campaigns/tutorial04_economy.wmf/scripting/texts.lua:87"
"building","bauen","If you click on a building, you can scroll through the buildings of the selected type.","Klick up een Huus un du kannst tüsken all Husen vun de utköörte Aard jumpen.","scenario_tutorial04_economy.wmf","../../data/campaigns/tutorial04_economy.wmf/scripting/texts.lua:89"
"building","bauen","If you don’t have any building of a particular building type, it will be shown greyed out.","Husen, wo du keene vun hest, worden grau wiest.","scenario_tutorial04_economy.wmf","../../data/campaigns/tutorial04_economy.wmf/scripting/texts.lua:90"
"building","bauen","When you move the slider to the blue area on the left side (low priority), the corresponding ware gets delivered less frequently. Red (right side) means that as many wares as possible should be delivered to this building, maybe because it produces something important.","Wenn du de Schiever to de blaue Kuntrei links (leegste Wichtigkeit) schuffst, word de Waar seltener levert. De rode Kuntrei (rechter Hand) maakt, dat so völe Waren as mögelk to deese Huus transporteert worden sallen, to ’n Bispööl wiel ’t wat wichtigs produzeert.","scenario_tutorial04_economy.wmf","../../data/campaigns/tutorial04_economy.wmf/scripting/texts.lua:321"
"building","bauen","Wares stored in the building are shown in full color.","Waren, wat im Huus sünd, worden in echter Klöör wiest.","scenario_tutorial04_economy.wmf","../../data/campaigns/tutorial04_economy.wmf/scripting/texts.lua:323"
"building","bauen","Wares not present in the building yet but already being transported there are shown in a darker grey.","Waren, wat nich nich im Huus sünd, aver al daarhen brocht worden, worden in dunker Grau wiest.","scenario_tutorial04_economy.wmf","../../data/campaigns/tutorial04_economy.wmf/scripting/texts.lua:325"
"building","bauen","Most enhanced buildings need experienced workers. Do not enhance a building unless you have the necessary workers available.","De meesten utbauten Husen bruken Arbeiders mit Erfahrung. Bau de Husen eerst dann ut, wenn du de nödigen Arbeiders hest.","texts","../../data/txts/tips/barbarians.lua:12 ../../data/txts/tips/empire.lua:12 ../../data/txts/tips/frisians.lua:12"
"building","bauen","You can place a medium building on any node where there is a slope no greater than 1 in the south-east direction and its height difference to all nodes in a radius of 2 is no greater than 2.","Du kannst een middelmatigs Huus up elkeen Knütt setten, waar de Schüünte nich mehr as 1 na Süüdoost un de Höchten-Unnerscheed to all Knütten bit 2 Felden Ofstand nich mehr as 2 is.","texts","../../data/txts/tips/editor.lua:44"
"building","bauen","The building process will only start after a road is built to the construction site.","Dat Beschicken begünnt eerst, wenn eene Straat tur Baustee föhrt.","texts","../../data/txts/tips/general_game.lua:7"
"building","bauen","Be sure to send a geologist to survey sites before building a well or a mine.","Schick immer eenen Schattsöker, um de Stee to unnersöken, bevör du eene Well of een Bargwark baust.","texts","../../data/txts/tips/general_game.lua:11"
"building","bauen","Your territory can be expanded by building various military buildings – Sentry, Fortress, Blockhouse, etc.","Du kannst dien Gewest groter maken, indeem du Soldateree-Boen baust – to ’n Bispööl Wachters-Kamern, Schanzen of Toorns.","texts","../../data/txts/tips/general_game.lua:15"
"building","bauen","Use the priority sliders in building windows to adjust delivery of a specific ware. Holding down Shift while clicking will adjust all wares at once.","Bruuk de Wichtigkeids-Schuvers in eenem Huus-Fenster, um de Versörgung mit eener wissen Waar fasttoleggen. Holl daarbi de Umschalt-Tast drückt, um ’t för all Waren up eenmaal fasttosetten.","texts","../../data/txts/tips/general_game.lua:32"
"building","bauen","Some buildings, such as the farm, have a very small work area. If the building is surrounded with trees or roads, production will stop.","Eenige Husen, to ’n Bispööl de Buurderee, hebben een bannig lüttes Arbeidsgewest. Wenn dat Huus mit Bomen of Straten dichtmüürt is, kann ’t nich mehr arbeiden.","texts","../../data/txts/tips/general_game.lua:69"
"building","bauen","When a building is destroyed, its workers will start looking for a nearby flag from which they can move by road to a connected warehouse. If there are no such flags in the vicinity, they will keep wandering around and eventually die.","Wenn een Huus ofrieten word, söken de Arbeiders na eener Fahn, vun waar se över Straten to een Kraamhuus komen könen. Wenn keene sülke Fahn in de Naberskupp is, wannern se sünner Stüür rum bit se starven.","texts","../../data/txts/tips/general_game.lua:98"
"building","bauen","The liana cutter working at this site can’t find any tree in her work area. You should consider dismantling or destroying the building or building a jungle preserver’s hut.","De Boomreep-Slagerske dat warkt bi deese Stee hett keene Bomen tum Warken. Överlegg di, of du dat Huus plattrieten of ofbrannen willst, of bau eene Waldwahrderske-Kaat.","tribes","../../data/tribes/buildings/productionsites/amazons/liana_cutters_hut/init.lua:51"
"building","bauen","The woodcutter working at this woodcutter’s hut can’t find any trees in her work area. You should consider dismantling or destroying the building or building a jungle preserver’s hut.","De Boomslagerske, de bi deese Boomslagerske-Kaat warkt, hett keene Bomen in de Arbeidsgewest. Riet dat Huus platt of brann ’t of, of boo eene Waldwahrderske-Kaat.","tribes","../../data/tribes/buildings/productionsites/amazons/woodcutters_hut/init.lua:59"
"building","bauen","The fisher working out of this fisher’s house can’t find any fish in his work area. Remember that you can increase the number of existing fish by building a fish breeder’s house.","De Fisker dat warkt bi deese Fiskeree hett keene Fiske tum Fangen. Du kannst de Fiske vermehren, wenn du een Fisstüchteree baust.","tribes","../../data/tribes/buildings/productionsites/atlanteans/fishers_house/init.lua:54"
"building","bauen","The woodcutter working at this woodcutter’s house can’t find any trees in his work area. You should consider dismantling or destroying the building or building a forester’s house.","De Boomslager dat warkt bi deese Boomslageree hett keene Bomen tum Ofslaan. Överlegg di, of du dat Huus plattrieten of ofbrannen willst, of bau een Försterhuus.","tribes","../../data/tribes/buildings/productionsites/atlanteans/woodcutters_house/init.lua:48"
"building","bauen","The lumberjack working at this lumberjack’s hut can’t find any trees in his work area. You should consider dismantling or destroying the building or building a ranger’s hut.","De Boomhauer dat warkt bi deese Boomhaueree hett keene Bomen tum Ofslaan. Överlegg di, of du dat Huus plattrieten of ofbrannen willst, of bau een Boomplanteree.","tribes","../../data/tribes/buildings/productionsites/barbarians/lumberjacks_hut/init.lua:60"
"building","bauen","The lumberjack working at this lumberjack’s house can’t find any trees in his work area. You should consider dismantling or destroying the building or building a forester’s house.","De Boomhauer dat warkt bi deese Boomhaueree hett keene Bomen tum Ofslaan. Överlegg di, of du dat Huus plattrieten of ofbrannen willst, of bau een Försterhuus.","tribes","../../data/tribes/buildings/productionsites/empire/lumberjacks_house/init.lua:51"
"building","bauen","The beekeeper working at this beekeeper’s house can’t find any flowering fields or bushes in his work area. You should consider building another farm or berry farm nearby, or dismantling or destroying this building.","De Imker dat warkt bi deese Imkeree hett keene Ackers of Busken mit Blössems in de Naberskupp. Bau een Buurderee of Buskenplanteree of överlegg di, of du dat Huus plattrieten of ofbrannen willst.","tribes","../../data/tribes/buildings/productionsites/frisians/beekeepers_house/init.lua:65"
"building","bauen","The fruit collector working at this fruit collector’s house can’t find any berry bushes in his work area. You should consider building another berry farm, or dismantling or destroying this building.","De Früchtenpottjer dat warkt bi deese Früchtenpottjeree hett keene Busken mit Früchten in de Naberskupp. Bau een Buskenplanteree of överlegg di, of du dat Huus plattrieten of ofbrannen willst.","tribes","../../data/tribes/buildings/productionsites/frisians/collectors_house/init.lua:65"
"building","bauen","The woodcutter working at this woodcutter’s house can’t find any trees in his work area. You should consider dismantling or destroying the building or building a forester’s house.","De Boomslager dat warkt bi deese Boomslageree hett keene Bomen tum Ofslaan. Överlegg di, of du dat Huus plattrieten of ofbrannen willst, of bau een Försterhuus.","tribes","../../data/tribes/buildings/productionsites/frisians/woodcutters_house/init.lua:61"
"building","bauen","You can only build this building on top of a tree.","Deeses Huus kann blot in de Kroon vun eenem Boom baut worden.","tribes_encyclopedia","../../data/tribes/initialization/amazons/units.lua:1542"
"building","bauen","A new building is being built at this construction site.","An deeser Baustee word een nejes Huus baut.","tribes_encyclopedia","../../data/tribes/initialization/amazons/units.lua:1618 ../../data/tribes/initialization/atlanteans/units.lua:2004 ../../data/tribes/initialization/barbarians/units.lua:1793 ../../data/tribes/initialization/empire/units.lua:2264 ../../data/tribes/initialization/frisians/units.lua:2191"
"building","bauen","Atlanteans use logs also as the base for planks, which are used in nearly every building. Besides the sawmill, the charcoal kiln, the toolsmithy and the smokery also need logs for their work.","De Atlantinger maken ut Boomstammen Planken, wat för haast elkeen Huus bruukt word. Nich blot de Saagmöhlen, ok de Holtköhl-Branneree, de Warktüügsmee un de Rökelkamer bruken Boomstammen tum Arbeiden.","tribes_encyclopedia","../../data/tribes/initialization/atlanteans/units.lua:431"
"building","bauen","This is the building where expeditions will be equipped to boldly go and find new shores.","Dat is dat Huus, waar Söken utrüst worden, um driest uttogahn un neje Küsten to finnen.","tribes_encyclopedia","../../data/tribes/initialization/atlanteans/units.lua:1450"
"building","bauen","Only the pure, white stones Diamond and Quartz will enlighten our people. Thus, every major building will need them so the inhabitants may worship Satul to warm them.","Nix as de reinen, witten Stenen Edelsteen un Blinkerflint worden uns’ Lüü lechtmaken. Um dat mutt elkeen groters Huus se bruken, dat de Inwohners Satuul hoogachten könen, dat he se waarmt.","tribes_encyclopedia","../../data/tribes/initialization/atlanteans/units.lua:1792"
"building","bauen","With three soldiers we can achieve an optimal balance between military power and building cost.","Mit dree Soldaten kriegen wi de beste Utgliek tüsken Soldateree-Macht un Baukösten.","tribes_encyclopedia","../../data/tribes/initialization/atlanteans/units.lua:1911"
"building","bauen","Notes on the building instructions","Wenk up de Bau-Instruksjes","tribes_encyclopedia","../../data/tribes/initialization/atlanteans/units.lua:1913"
"building","bauen","Picks are used by stonemasons and miners. They are produced in the metal workshop (but cease to be produced by the building if it is enhanced to an ax workshop and war mill).","Flintslagers un Bargwarkskeerls bruken Pickhacken. Se worden in de Metalldreihbank produzeert (aver nich mehr, wenn dat Huus to eener Extensmede of Oorlogs-Smee utbaut word).","tribes_encyclopedia","../../data/tribes/initialization/barbarians/units.lua:334"
"building","bauen","Felling axes are used by lumberjacks and produced in the metal workshop (but cease to be produced by the building if it is enhanced to an ax workshop and war mill).","Boomslager-Exten worden vun Boomhauer bruukt un in de Metalldreihbank produzeert (aver nich mehr, wenn dat Huus to eener Extensmede of Oorlogs-Smee utbaut word).","tribes_encyclopedia","../../data/tribes/initialization/barbarians/units.lua:346"
"building","bauen","Therefore the gardener and the ranger use them. Produced at the metal workshop (but cease to be produced by the building if it is enhanced to an ax workshop and war mill).","De Gaardner un de Boomplanter bruken se also.  Se worden in de Metalldreihbank produzeert (aver nich mehr, wenn dat Huus to eener Extensmede of Oorlogs-Smee utbaut word). ","tribes_encyclopedia","../../data/tribes/initialization/barbarians/units.lua:359"
"building","bauen","Geologists, builders, blacksmiths and helmsmiths all need a hammer. Make sure you’ve always got some in reserve! They are one of the basic tools produced at the metal workshop (but cease to be produced by the building if it is enhanced to an ax workshop and war mill).","Schattsökers, Baukeerls, Wapensmidds un Panzersmidds bruken all eenen Klöpper. Pass up, dat du alltied welke över hest! Se worden as elkeen Warktüüg in de Metalldreihbank produzeert (aver nich mehr, wenn dat Huus to eener Extensmede of Oorlogs-Smee utbaut word). ","tribes_encyclopedia","../../data/tribes/initialization/barbarians/units.lua:372"
"building","bauen","They are one of the basic tools produced in a metal workshop (but cease to be produced by the building if it is enhanced to an ax workshop and war mill).","Se worden as elkeen Warktüüg in de Metalldreihbank produzeert (aver nich mehr, wenn dat Huus to eener Extensmede of Oorlogs-Smee utbaut word).","tribes_encyclopedia","../../data/tribes/initialization/barbarians/units.lua:385"
"building","bauen","Hunting spears are produced in the metal workshop (but cease to be produced by the building if it is enhanced to an ax workshop and war mill).","Jaggtsperen worden in de Metalldreihbank produzeert (aver nich mehr, wenn dat Huus to eener Extensmede of Oorlogs-Smee utbaut word).","tribes_encyclopedia","../../data/tribes/initialization/barbarians/units.lua:398"
"building","bauen","Scythes are produced by the metal workshop (but cease to be produced by the building if it is enhanced to an ax workshop and war mill).","Sichten worden in de Metalldreihbank produzeert (aver nich mehr, wenn dat Huus to eener Extensmede of Oorlogs-Smee utbaut word).","tribes_encyclopedia","../../data/tribes/initialization/barbarians/units.lua:411"
"building","bauen","Bread paddles are produced in the metal workshop like all other tools (but cease to be produced by the building if it is enhanced to an ax workshop and war mill).","Broodschüppen worden as elkeen Warktüüg in de Metalldreihbank produzeert (aver nich mehr, wenn dat Huus to eener Extensmede of Oorlogs-Smee utbaut word).","tribes_encyclopedia","../../data/tribes/initialization/barbarians/units.lua:424"
"building","bauen","Kitchen tools are needed for preparing rations, snacks and meals. Be sure to have a metal workshop to produce this basic tool (but it ceases to be produced by the building if it is enhanced to an ax workshop and war mill).","Besteck is nödig, um Happen, Spiesen un Mahltieden torechttomaken. ’t word in de Metalldreihbank produzeert (aver nich mehr, wenn dat Huus to eener Extensmede of Oorlogs-Smee utbaut word).","tribes_encyclopedia","../../data/tribes/initialization/barbarians/units.lua:434"
"building","bauen","They are used in the smelting works and produced by the metal workshop (but they cease to be produced by the building if it is enhanced to an ax workshop and war mill).","Se worden in Smeltwarken bruukt un vun de Metalldreihbank produzeert (aver nich mehr, wenn dat Huus to eener Extensmede of Oorlogs-Smee utbaut word).","tribes_encyclopedia","../../data/tribes/initialization/barbarians/units.lua:446"
"building","bauen","If all needed wares are delivered in time, this building can produce grout in about %s on average.","Wenn alle nödigen Waren to rechter Tied ankomen, produzeert deeses Huus dör de Bank all %s Mörtel.","tribes_encyclopedia","../../data/tribes/initialization/barbarians/units.lua:1284"
"building","bauen","If all needed wares are delivered in time, this building can produce a pitta bread in %s on average.","Wenn alle nödigen Waren to rechter Tied ankomen, produzeert deeses Huus dör de Bank all %s een Pitta-Brood.","tribes_encyclopedia","../../data/tribes/initialization/barbarians/units.lua:1297"
"building","bauen","If all needed wares are delivered in time, this building can produce beer in about %s on average.","Wenn alle nödigen Waren to rechter Tied ankomen, produzeert deeses Huus dör de Bank all %s Beer.","tribes_encyclopedia","../../data/tribes/initialization/barbarians/units.lua:1310"
"building","bauen","If all needed wares are delivered in time, this building can produce each tool in about %s on average.","Wenn alle nödigen Waren to rechter Tied ankomen, produzeert deeses Huus dör de Bank all %s elkeen Warktüüg.","tribes_encyclopedia","../../data/tribes/initialization/barbarians/units.lua:1402"
"building","bauen","If all needed wares are delivered in time, this building can produce each type of ax in about %s on average.","Wenn alle nödigen Waren to rechter Tied ankomen, produzeert deeses Huus dör de Bank all %s elkeen Ext.","tribes_encyclopedia","../../data/tribes/initialization/barbarians/units.lua:1418 ../../data/tribes/initialization/barbarians/units.lua:1437"
"building","bauen","If all needed wares are delivered in time, this building can produce an ox in %s on average.","Wenn alle nödigen Waren to rechter Tied ankomen, produzeert deeses Huus dör de Bank all %s eenen Oss.","tribes_encyclopedia","../../data/tribes/initialization/barbarians/units.lua:1466"
"building","bauen","Marble columns represent the high culture of the Empire, so they are needed for nearly every larger building. They are produced out of marble at a stonemason’s house.","Marmelpielers wiesen de hoge Kultuur un Wüürd vum Latiensken Riek un worden daarum för haast elkeen grotes Huus bruukt. Se worden in eenem Steenbickerhuus ut Marmel maakt.","tribes_encyclopedia","../../data/tribes/initialization/empire/units.lua:294"
"building","bauen","You can manually remove the dike when the land is sufficiently secured to prevent wasting resources. To do so, build a flag, road, or building in its place.","Du kannst de Diek von Hand wegmaken, wenn dat Land genoog sekert is, daarmit keene Mineraale verklüngelt worden. Daarto baust du eene Fahn of Straat of een Huus in sien Stee.","tribes_encyclopedia","../../data/tribes/initialization/frisians/units.lua:1242"
"building","bauen","The diker will terraform the land around each breakwater he builds several times. You can manually remove breakwaters when the land is sufficiently secured to prevent wasting resources; to do so, build a flag, road, or building in the dike’s place.","De Diekbauer wannelt dat Land um elkeen Lahnung, wat he baut, mennigmaal um. Du kannst de Lahnung vun Hand wegmaken, wenn dat Land seker genoog is, daarmit keene Mineraale verklüngelt worden; bau daarto eene Fahn of Straat of een Huus in hör Stee.","tribes_encyclopedia","../../data/tribes/initialization/frisians/units.lua:1985"
"building","bauen","This building can either be built directly or obtained by enhancing another building.","Deeses Huus kann stuuv baut of vun eenem annern Huus utbaut worden.","tribes_encyclopedia","../../data/tribes/scripting/help/building_help.lua:654"
"building","bauen","Toggle building visibility","Sicht up Husen wiesen of verbargen","tribes_encyclopedia","../../data/tribes/scripting/help/controls.lua:62"
"building","bauen","the building has the following wares: %s","dat Huus hett deese Waren: %s","widelands","../../src/logic/map_objects/tribes/production_program.cc:543"
"building","bauen","the building doesn’t have the following wares: %s","dat Huus hett deese Waren nich: %s","widelands","../../src/logic/map_objects/tribes/production_program.cc:566"
"building","bauen","Any wares left in the building will be dropped out by the builder, increasing the dismantling time","Elkeen Waar, wat noch im Huus is, word vun de Baukeerl rutsmieten. Dat Plattrieten düürt dann langer.","widelands","../../src/wui/actionconfirm.cc:253"
"building","bauen","Destroy the target building instead of conquering it","Dat angriepen Huus nich innehmen, sünnern ofbrannen","widelands","../../src/wui/attack_window.cc:323"
"building","bauen","(no building selected)","(keen Huus utköört)","widelands","../../src/wui/building_statistics_menu.cc:65"
"building","bauen","You need to connect this flag to a scouting building before you can send a scout here.","Du muttst deese Fahn mit eenem Bespejer-Huus verbinnen, ehr du hier eenen Bespejer henstüren kannst.","widelands","../../src/wui/fieldaction.cc:448"
"interface","bedeenen","The ‘General’ tab contains information about all the basic interface controls for Widelands. Furthermore, you can find tips that are relevant for your tribe there.","De Listenwessler »Allgemeen« hett Informationen över ’t Stüren vun Widelands. Daar gifft ’t ok Tipps för dien Volk.","scenario_tutorial04_economy.wmf","../../data/campaigns/tutorial04_economy.wmf/scripting/texts.lua:283"
"interface","bedeenen","The interactive add-ons packager allows you to create, edit, and delete add-ons. You can bundle maps designed with the Widelands Map Editor as an add-on using the graphical interface and share them with other players, without having to write a single line of code.","De interaktiv Verwiederns-Packer verlöövt di, Verwiederns to maken, to bewarken un wegtodoon. Du kannst Kaarten, wat du mit de Widelands Kaart-Bewarker maakt hest, mit de graphisk Schnittstee as een Verwiedern packen un se mit anner Spelers delen, sünner eene enkelt Rieg Quelltexten schrieven to mutten.","widelands","../../src/ui_fsmenu/addons/manager.cc:338"
"needs %1% on average","bruukt ut un dör %1%","The farmer needs %1% on average to sow and harvest a sheaf of corn.","De Buur bruukt dör de Bank %1% um een Bünsel Mais to saien un to arnten.","tribes_encyclopedia","../../data/tribes/initialization/atlanteans/units.lua:1741"
"needs %1% on average","bruukt ut un dör %1%","The blackroot farmer needs %1% on average to sow and harvest a bundle of blackroot.","De Swartwuddel-Buur bruukt dör de Bank %1% um een Bünsel Swartwuddels to saien un to arnten.","tribes_encyclopedia","../../data/tribes/initialization/atlanteans/units.lua:1755"
"needs %1% on average","bruukt ut un dör %1%","The farmer needs %1% on average to sow and harvest a sheaf of wheat.","De Buur bruukt dör de Bank %1% um een Bünsel Weit to saien un to arnten.","tribes_encyclopedia","../../data/tribes/initialization/barbarians/units.lua:1480"
"needs %1% on average","bruukt ut un dör %1%","The miller needs %1% on average to grind wheat into a sack of flour.","De Müller bruukt dör de Bank %1% um Weit för eenen Sack Mehl to mahlen.","tribes_encyclopedia","../../data/tribes/initialization/empire/units.lua:1433"
"needs %1% on average","bruukt ut un dör %1%","The baker needs %1% on average to bake a loaf of bread.","De Backer bruukt dör de Bank %1% um een Brood to backen.","tribes_encyclopedia","../../data/tribes/initialization/empire/units.lua:1454"
"needs %1% on average","bruukt ut un dör %1%","The brewer needs %1% on average to brew a vat of beer.","De Broer bruukt dör de Bank %1% um een Fatt Beer to broen.","tribes_encyclopedia","../../data/tribes/initialization/empire/units.lua:1476"
"needs %1% on average","bruukt ut un dör %1%","The innkeeper needs %1% on average to prepare a ration.","De Weert bruukt dör de Bank %1% um een Happ torechttomaken.","tribes_encyclopedia","../../data/tribes/initialization/empire/units.lua:1537"
