"glossary_term","glossary_translation","source","target","file","location"
"plot","parcela","Large plots are rare on those small islands. Prioritize construction of large buildings on them. Sometimes you will need big military buildings to expand all the way to the next island. The AI will perform poorly.","Veľké parcely sa na týchto ostrovčekoch vyskytujú zriedkavo. Stavajte na nich preto prioritne veľké budovy. Niekedy je na ovládnutie ďalších ostrovov nutné postaviť veľké vojenské budovy. Umelá inteligencia vykazuje slabý výkon.","maps","../../data/maps/Archipelago_Sea.wmf/elemental:11"
"plot","parcela","The sentry is the only military site that fits on a small building plot. If your lumberjack has cleared enough space, you can also build another military building.","Strážnica je jediná vojenská budova, ktorá sa zmestí na parcelu pre malé budovy. Ak váš drevorubač vyprázdnil dostatok miesta, môžete postaviť aj ďalšie vojenské budovy.","scenario_tutorial01_basic_control.wmf","../../data/campaigns/tutorial01_basic_control.wmf/scripting/texts.lua:451"
"plot","parcela","Remember that big buildings (green icon) cannot be built on small (red) or medium (yellow) building plots, but buildings can be built on a building plot that provides more space than they need. You should always keep that in mind when you search for a suitable place.","Pamätajte si, že veľké budovy (označené zelenou ikonou) nemožno postaviť  na malých (označené červenou) alebo stredných (označené žltou) stavebných parcelách. Každú budovu však možno postaviť na parcele, ktorá poskytuje viac miesta, ako budova potrebuje. Nezabudnite na to, keď budete hľadať vhodné miesto.","scenario_tutorial01_basic_control.wmf","../../data/campaigns/tutorial01_basic_control.wmf/scripting/texts.lua:459"
"Spider Farm","pavúčia farma","Build a spider farm and a weaving mill","Postavte pavúčiu farmu a tkáčovňu","scenario_atl01.wmf","../../data/campaigns/atl01.wmf/scripting/texts.lua:72"
"Spider Farm","pavúčia farma","The weavers produce spidercloth and tabards in the weaving mill. Spidercloth is needed for the construction of some buildings and clothing, while tabards are the uniforms of soldiers. The weaving mill needs gold thread and spider silk as raw material. Spider silk is produced by the spider farm, while gold thread is produced by the gold spinning mill out of gold.","Tkáči vyrábajú v tkáčovni pavúčiu látku a kabátce. Pavúčia látka je potrebná na zhotovenie niektorých budov a oblečení a kabátce slúžia ako uniformy vojakov. Tkáčovňa potrebuje ako suroviny zlatú niť a pavúčí hodváb. Pavúčí hodváb sa produkuje na pavúčej farme, kým zlatá niť sa vyrába zo zlata v pradiarni zlata.","scenario_atl01.wmf","../../data/campaigns/atl01.wmf/scripting/texts.lua:75"
"Spider Farm","pavúčia farma","May Satul warm you too, Opol. I wanted to delay production of spidercloth, but I understand your urgency. Your suggestion sounds fair to me, I will build your weaving mill and spider farm. I will also build a gold spinning mill so that the golden tabards you make will not be golden by name alone.","Nech vás hreje Satul tiež, Opol. Pôvodne som chcela produkciu pavúčej látky odložiť, ale chápem, že je to pre vás naliehavé. Váš návrh znie férovo, postavím vám tkáčovňu a pavúčiu farmu. Taktiež nechám postaviť pradiareň zlata, aby zlaté kabátce, ktoré vyrábate, neboli zlaté len v názve.","scenario_atl01.wmf","../../data/campaigns/atl01.wmf/scripting/texts.lua:277"
"Spider Farm","pavúčia farma","This corn is processed in the mill into fine cornmeal that every Atlantean baker needs for a good bread. Also horse and spider farms need to be provided with corn.","Táto kukurica sa spracúva v mlyne na drobnú kukuričnú múku, ktorú potrebuje každý atlantídsky pekár na pečenie chleba. Kukuricu treba zadovážiť aj stajniam a pavúčim farmám.","tribes_encyclopedia","../../data/tribes/wares/corn/helptexts.lua:4"
"Spider Farm","pavúčia farma","Spider silk is produced by spiders, which are bred by spider farms. It is processed into spidercloth in a weaving mill.","Pavúčí hodváb produkujú pavúky, ktoré sa chovajú na pavúčich farmách. V tkáčovni sa spracúva na pavúčiu látku.","tribes_encyclopedia","../../data/tribes/wares/spider_silk/helptexts.lua:4"
"Spidercloth","pavúčia látka","May Satul warm you too, Opol. I wanted to delay production of spidercloth, but I understand your urgency. Your suggestion sounds fair to me, I will build your weaving mill and spider farm. I will also build a gold spinning mill so that the golden tabards you make will not be golden by name alone.","Nech vás hreje Satul tiež, Opol. Pôvodne som chcela produkciu pavúčej látky odložiť, ale chápem, že je to pre vás naliehavé. Váš návrh znie férovo, postavím vám tkáčovňu a pavúčiu farmu. Taktiež nechám postaviť pradiareň zlata, aby zlaté kabátce, ktoré vyrábate, neboli zlaté len v názve.","scenario_atl01.wmf","../../data/campaigns/atl01.wmf/scripting/texts.lua:277"
"Spidercloth","pavúčia látka","Swift now, we need a house for Ostur next to the lake, and we need planks, logs and spidercloth for the construction there. Forget about everything else, we need those wares on top of the mountain before our warehouses are all swallowed by the sea.","Rýchlo, musíme Osturovi postaviť budovu pri jazere. Na stavbu budeme potrebovať dosky, kmene a pavúčiu látku. Zabudnite na všetko ostatné; tento tovar je nutné preniesť na vrchol hory, skôr ako všetky naše sklady zhltne more.","scenario_atl01.wmf","../../data/campaigns/atl01.wmf/scripting/texts.lua:464"
"Spidercloth","pavúčia látka","Very good. Your shipyard is finished and your shipwright immediately started working. For the construction of ships, he needs logs, planks and spidercloth, which will be transported to the shipyard.","Výborne. Lodenica je hotová a lodiar začal ihneď pracovať. Na stavbu lodí potrebuje kmene, dosky a pavúčiu látku, ktoré sa donesú do lodenice.","scenario_tutorial03_seafaring.wmf","../../data/campaigns/tutorial03_seafaring.wmf/scripting/texts.lua:106"
"Spidercloth","pavúčia látka","You need to stop your shipyard when you have enough ships. Otherwise, your shipwright will consume all your logs and spidercloth, producing dozens of ships.","Keď budete mať dosť lodí, zastavte produkciu v lodenici. Lodiar by inak spotreboval všetky vaše kmene a pavúčiu látku na výrobu tuctov lodí.","scenario_tutorial03_seafaring.wmf","../../data/campaigns/tutorial03_seafaring.wmf/scripting/texts.lua:110"
"Spidercloth","pavúčia látka","Weaves spidercloth for buildings and ships’ sails, and tabards to equip and train the soldiers.","Tká pavúčiu látku, materiál na stavbu budov a zhotovenie lodných plachiet, a kabátce, ktoré tvoria výbavu vojakov a používajú sa na ich výcvik.","tribes_encyclopedia","../../data/tribes/buildings/productionsites/atlanteans/weaving_mill/helptexts.lua:16"
"Spidercloth","pavúčia látka","Spider silk is produced by spiders, which are bred by spider farms. It is processed into spidercloth in a weaving mill.","Pavúčí hodváb produkujú pavúky, ktoré sa chovajú na pavúčich farmách. V tkáčovni sa spracúva na pavúčiu látku.","tribes_encyclopedia","../../data/tribes/wares/spider_silk/helptexts.lua:4"
"Spider Silk","pavúčí hodváb","Spidercloth is made out of spider silk in a weaving mill. It is used in the toolsmithy and the shipyard. Also some higher developed buildings need spidercloth for their construction.","Pavúčia látka sa vyrába z pavúčieho hodvábu v tkáčovni. Používa sa vo vyhni na nástroje a v lodenici. Okrem toho je potrebná pri stavbe niektorých dokonalejších budov.","tribes_encyclopedia","../../data/tribes/wares/spidercloth/helptexts.lua:4"
"Bakery","pekáreň","Other ways to produce food – different kinds of food – are fishers and farms. The wheat of the farms has to be processed with water in a bakery before it becomes edible. You can obtain water by building a well on a spot where your geologists have found a water source.","Ďalšie spôsoby výroby jedla – iných druhov jedla – sú rybolov a pestovanie pšenice. Pšenica z fariem sa najprv musí spracovať s vodou v pekárni, až potom sa bude dať jesť. Vodu možno získať zo studne postavenej na mieste, kde geológovia našli zdroj vody.","scenario_bar01.wmf","../../data/campaigns/bar01.wmf/scripting/texts.lua:77"
"Bakery","pekáreň","In our situation, you might want to work the bakeries as fast as possible because they supply our taverns, so you could set water to the highest priority for them. The other buildings (for example the donkey farm) would then get less water, but the bakery could work faster.","Vzhľadom na našu situáciu môže byť žiaduce, aby pekárne pracovali čo najrýchlejšie, pretože zásobujú naše krčmy. Zásobovaniu pekární vodou by ste preto mohli predeliť najvyššiu prioritu. Ostatné budovy (napríklad oslia farma) by dostávali menej vody, zato pekárne by pracovali rýchlejšie.","scenario_tutorial04_economy.wmf","../../data/campaigns/tutorial04_economy.wmf/scripting/texts.lua:279"
"Bakery","pekáreň","Blackroot Flour is produced in mills out of blackroots. It is used in bakeries to make a tasty bread.","Z čiernych koreňov sa v mlynoch vyrába múka. Používa sa v pekárňach na prípravu chutného chleba.","tribes_encyclopedia","../../data/tribes/wares/blackroot_flour/helptexts.lua:4"
"Bakery","pekáreň","This tasty bread is made in bakeries out of cornmeal, blackroot flour and water. It is appreciated as basic food by miners, scouts and soldiers in training sites (labyrinth and dungeon).","Tento chutný chlieb sa vyrába v pekárňach z kukuričnej múky, čiernokoreňovej múky a vody. Je uznávaný ako základná potravina pre baníkov, prieskumníkov a vojakov vo výcvikových stavbách (labyrint a kobka).","tribes_encyclopedia","../../data/tribes/wares/bread_atlanteans/helptexts.lua:4"
"Bakery","pekáreň","Flour is produced by the mill out of wheat and is needed in the bakery to produce the tasty Empire bread.","Z čiernych koreňov sa v mlynoch vyrába múka. Používa sa v pekárňach na prípravu chutného chleba.","tribes_encyclopedia","../../data/tribes/wares/flour/helptexts.lua:4"
"Bakery","pekáreň","Water is used in the bakery and the horse and spider farms.","Voda sa používa v pekárni, stajni a pavúčej farme.","tribes_encyclopedia","../../data/tribes/wares/water/helptexts.lua:6"
"Bakery","pekáreň","Water is used in the bakery, the micro brewery and the brewery. The lime kiln and the cattle farm also need to be supplied with water.","Voda sa spotrebúva v pekárni, mikropivovare a pivovare. Vodou zásobované musia byť aj vápenky a kravíny.","tribes_encyclopedia","../../data/tribes/wares/water/helptexts.lua:10"
"Bakery","pekáreň","Water is used in the bakery and the brewery. The donkey farm, the sheep farm and the piggery also need to be supplied with water.","Voda sa používa v pekárňach a pivovaroch. Vodou zásobované musia byť aj oslie farmy, ovčie farmy a chlievy.","tribes_encyclopedia","../../data/tribes/wares/water/helptexts.lua:12"
"Bakery","pekáreň","Wheat is produced by farms and consumed by bakeries, micro breweries and breweries. Cattle farms also need to be supplied with wheat.","Pšenica sa pestuje sa na farmách a spotrebúva v pekárňach, mikropivovaroch a pivovaroch. Musia sa ňou zásobovať aj kravíny.","tribes_encyclopedia","../../data/tribes/wares/wheat/helptexts.lua:6"
"Bread Paddle","pekárska lopata","The bread paddle is the tool of the baker, each baker needs one.","Pekárska lopta je nástroj pekára a každý pekár potrebuje vlastnú.","tribes_encyclopedia","../../data/tribes/wares/bread_paddle/helptexts.lua:4"
"Blackroot Farmer","pestovateľ čierneho koreňa","Therefore the forester and the blackroot farmer use them. They are produced by the toolsmith.","Používajú ich preto horári a pestovatelia čierneho koreňa. Vyrába ich kováč nástrojov.","tribes_encyclopedia","../../data/tribes/wares/shovel/helptexts.lua:6"
"Fortress","pevnosť","Your territory can be expanded by building various military buildings – Sentry, Fortress, Blockhouse, etc.","Svoje územie môžete rozšíriť postavením rôznych vojenských budov – strážnic, pevností, vojenských zrubov atď.","texts","../../data/txts/tips/general_game.lua:14"
"Pitta Bread","pita","Such buildings usually have greater demands than the basic kind of that building – for instance, deep mines need snacks instead of rations. You will have to enhance your tavern to an inn in order to produce snacks out of pitta bread AND a second kind of food (meat or fish) AND beer.","Takéto budovy zvyknú mať väčšie požiadavky pre svoj chod ako ich základné podoby – hlbinné bane napríklad potrebujú namiesto prídelov desiaty. Desiaty sa vyrábajú za spotreby pity A ďalšieho druhu jedla (rýb alebo mäsa) A piva v hostinci, ktorý je vylepšenou podobou krčmy.","scenario_bar01.wmf","../../data/campaigns/bar01.wmf/scripting/texts.lua:97"
"Pitta Bread","pita","North of the great mountain is a large plain – why don’t we use the space Mother Nature gave us and build a farm? I sure would enjoy a freshly baked pitta bread for a change…","Na sever od veľkej hory sa rozprestiera rozsiahla rovina – prečo nevyužiť priestor, ktorý nám matka príroda ponúka, a nepostaviť tam farmu? Minimálne ja by som pre zmenu ocenil čerstvo upečenú pitu…","scenario_bar01.wmf","../../data/campaigns/bar01.wmf/scripting/texts.lua:402"
"Pitta Bread","pita","Bakes pitta bread for soldiers and miners alike.","Pečie pitu pre vojakov aj baníkov.","tribes_encyclopedia","../../data/tribes/buildings/productionsites/barbarians/bakery/helptexts.lua:16"
"Pitta Bread","pita","If all needed wares are delivered in time, this building can produce a pitta bread in %s on average.","Ak sa všetok potrebný tovar dodá načas, táto budova dokáže vyrobiť jednu pitu v priemere za asi %s.","tribes_encyclopedia","../../data/tribes/buildings/productionsites/barbarians/bakery/helptexts.lua:26"
"Pitta Bread","pita","Besides pitta bread and meat, fish is also a foodstuff for the Barbarians. It is used in the taverns, inns and big inns and at the training sites (training camp and battle arena).","Okrem pity a mäsa patria medzi potraviny Barbarov aj ryby. Používajú sa v krčmách, hostincoch a veľkých hostincoch, ako aj vo výcvikových stavbách (výcvikový tábor a zápasnícka aréna).","tribes_encyclopedia","../../data/tribes/wares/fish/helptexts.lua:6"
"Pitta Bread","pita","A meal is made out of pitta bread, strong beer and fish/meat in a big inn. This substantial food is exactly what workers in a deeper mine need.","Obedy sa vyrábajú z pity, silného piva a mäsa/rýb vo veľkom hostinci. Toto výživné jedlo je presne to, čo potrebujú pracovníci v hlbočizných baniach.","tribes_encyclopedia","../../data/tribes/wares/meal/helptexts.lua:4"
"Pitta Bread","pita","A bigger morsel than the ration to provide miners in deep mines. It is produced in an inn or a big inn out of fish/meat, pitta bread and beer.","Väčšie sústo ako prídel, ktoré sa podáva baníkom v hlbinných baniach. Vyrába sa v hostinci alebo veľkom hostinci z rýb/mäsa, pity a piva.","tribes_encyclopedia","../../data/tribes/wares/snack/helptexts.lua:4"
"Beer","pivo","Of course, it is dark and cold in such depths and only a few venture voluntarily into these places. We should reward this bravery with greater rations for them. And a pint of beer or two will keep their spirits high.","Samozrejme, v takých hĺbkach je tma a zima a len málokto sa tam odváži dobrovoľne vstúpiť. Za takúto statočnosť by sme ich mali odmeniť väčším prídelom jedla. A krčahom piva či dvomi na zlepšenie nálady.","scenario_bar01.wmf","../../data/campaigns/bar01.wmf/scripting/texts.lua:448"
"Beer","pivo","One of these training sites is the battle arena. It is a big and expensive building, and it trains soldiers in evade. Since soldiers get very hungry during their workout, this building needs a lot of food and strong beer. In a real game, you should have a good infrastructure before you build it.","Jednou z týchto výcvikových budov je zápasnícka aréna. Je to veľká a drahá budova, ktorá slúži na výcvik vojakov v uhýbaní. Pretože vojaci počas cvičenia poriadne vyhladnú, táto budova požaduje množstvo jedla a silného piva. Prv ako ju postavíte v skutočnej hre, uistite sa, že máte vybudovanú vhodnú infraštruktúru.","scenario_tutorial02_warfare.wmf","../../data/campaigns/tutorial02_warfare.wmf/scripting/texts.lua:65"
"Beer","pivo","A meal is made out of pitta bread, strong beer and fish/meat in a big inn. This substantial food is exactly what workers in a deeper mine need.","Obedy sa vyrábajú z pity, silného piva a mäsa/rýb vo veľkom hostinci. Toto výživné jedlo je presne to, čo potrebujú pracovníci v hlbočizných baniach.","tribes_encyclopedia","../../data/tribes/wares/meal/helptexts.lua:4"
"view","pohľad","Simply right-click-and-hold anywhere on the map, then drag the mouse and instead of the cursor, the view will be moved. Try it.","Jednoducho podržte pravé tlačidlo myši hocikde na mape, potom potiahnite myš a namiesto kurzora sa presunie zobrazenie mapy. Vyskúšajte si to.","scenario_tutorial01_basic_control.wmf","../../data/campaigns/tutorial01_basic_control.wmf/scripting/texts.lua:200"
"User","používateľ","Server sent a user update for a user that does not exist.","Server poslal aktualizáciu pre neexistujúceho užívateľa.","widelands","../../src/network/network_gaming_messages.cc:139"
"Outpost","pozorovatelňa","An Outpost for Exile","Osada vo vyhnanstve","maps","../../data/campaigns/campaigns.conf:96 ../../data/campaigns/emp02.wmf/elemental:9"
"Outpost","pozorovatelňa","Build up stronger military buildings, such as an outpost, a barrier or a tower, on the eastern frontier.","Postavte silnejšie vojenské budovy, ako napríklad pozorovateľnu, hradbu alebo vežu, na východnej hranici.","scenario_emp02.wmf","../../data/campaigns/emp02.wmf/scripting/texts.lua:87"
"Outpost","pozorovatelňa","On this island, we will start our new life. We will build up an outpost for our exile, which perhaps will become a new, beautiful home for every one of us.","Na tomto ostrove začneme nový život. Vybudujeme tu osadu vo vyhnanstve, ktorá sa možno stane novým domovom pre každého z nás.","scenario_emp02.wmf","../../data/campaigns/emp02.wmf/scripting/texts.lua:114"
"Outpost","pozorovatelňa","Your outpost discovered an aggressor.","Vaša pozorovateľňa odhalila útočníka.","tribes","../../data/tribes/buildings/militarysites/empire/outpost/init.lua:43 ../../data/tribes/buildings/militarysites/frisians/outpost/init.lua:49"
"Outpost","pozorovatelňa","Your outpost is under attack.","Nepriateľ útočí na vašu pozorovateľňu.","tribes","../../data/tribes/buildings/militarysites/empire/outpost/init.lua:44 ../../data/tribes/buildings/militarysites/frisians/outpost/init.lua:50"
"outpost","pozorovateľňa","An Outpost for Exile","Osada vo vyhnanstve","maps","../../data/campaigns/campaigns.conf:96 ../../data/campaigns/emp02.wmf/elemental:9"
"outpost","pozorovateľňa","Build up stronger military buildings, such as an outpost, a barrier or a tower, on the eastern frontier.","Postavte silnejšie vojenské budovy, ako napríklad pozorovateľnu, hradbu alebo vežu, na východnej hranici.","scenario_emp02.wmf","../../data/campaigns/emp02.wmf/scripting/texts.lua:87"
"outpost","pozorovateľňa","On this island, we will start our new life. We will build up an outpost for our exile, which perhaps will become a new, beautiful home for every one of us.","Na tomto ostrove začneme nový život. Vybudujeme tu osadu vo vyhnanstve, ktorá sa možno stane novým domovom pre každého z nás.","scenario_emp02.wmf","../../data/campaigns/emp02.wmf/scripting/texts.lua:114"
"outpost","pozorovateľňa","Your outpost is under attack.","Nepriateľ útočí na vašu pozorovateľňu.","tribes","../../data/tribes/buildings/militarysites/empire/outpost/init.lua:44 ../../data/tribes/buildings/militarysites/frisians/outpost/init.lua:50"
"Work Area","pracovná plocha","Well done! Let’s see how messages work in a real game, shall we? For this, I’ll take all rocks away from the poor stonemasons in the quarries. They will then send a message each that they can’t find any in their work areas the next time they try to do some work.","Výborne! Teraz sa pozrime, ako správy fungujú v skutočnej hre. Demonštrujem to tak, že úbohým kamenárom v kameňolomoch vezmem všetky skaly. Keď sa pri najbližšej príležitosti pokúsia pracovať, každý z nich odošle správu, že vo svojej pracovnej oblasti nemôže žiadne nájsť.","scenario_tutorial01_basic_control.wmf","../../data/campaigns/tutorial01_basic_control.wmf/scripting/texts.lua:419"
"Work Area","pracovná plocha","Keep an eye on your fishers. After fish resources are exhausted in their work area, they will stop fishing.","Sledujte činnosť svojich rybárov. Keď sa v ich pracovnej oblasti minú zdroje rýb, prestanú chytať ryby.","texts","../../data/txts/tips/barbarians.lua:4 ../../data/txts/tips/empire.lua:4"
"Work Area","pracovná plocha","Some buildings, such as the farm, have a very small work area. If the building is surrounded with trees or roads, production will stop.","Niektoré budovy, ako napríklad farma, majú veľmi malú pracovnú oblasť. Ak je budova obklopená stromami alebo cestami, zastaví sa jej produkcia.","texts","../../data/txts/tips/general_game.lua:67"
"Work Area","pracovná plocha","The fisher working out of this fisher’s house can’t find any fish in his work area. Remember that you can increase the number of existing fish by building a fish breeder’s house.","Rybár pracujúci mimo tohto rybárskeho domu nedokáže vo svojej pracovnej oblasti nájsť žiadne ryby. Nezabúdajte, že počet rýb sa dá zvýšiť postavením rybnikárskeho domu.","tribes","../../data/tribes/buildings/productionsites/atlanteans/fishers_house/init.lua:59"
"Work Area","pracovná plocha","The woodcutter working at this woodcutter’s house can’t find any trees in his work area. You should consider dismantling or destroying the building or building a forester’s house.","Drevorubač pracujúci v tomto drevorubačskom dome nedokáže vo svojej pracovnej oblasti nájsť žiadne stromy. Porozmýšľajte nad rozobratím alebo zničením budovy, prípadne postavením lesníckej chatrče.","tribes","../../data/tribes/buildings/productionsites/atlanteans/woodcutters_house/init.lua:54"
"Work Area","pracovná plocha","The hunter working out of this hunter’s hut can’t find any game in his work area. Remember that you can build a gamekeeper’s hut to release more game into the wild.","Lovec pracujúci mimo tejto loveckej chatrče nedokáže vo svojej pracovnej oblasti nájsť žiadnu divú zver. Nezabúdajte, že ak chcete vypúšťať zver do divočiny, môžete postaviť hájnickú chatrč.","tribes","../../data/tribes/buildings/productionsites/barbarians/hunters_hut/init.lua:68"
"Work Area","pracovná plocha","The lumberjack working at this lumberjack’s hut can’t find any trees in his work area. You should consider dismantling or destroying the building or building a ranger’s hut.","Drevorubač pracujúci v tejto drevorubačskej chatrči nedokáže vo svojej pracovnej oblasti nájsť žiadne stromy. Zvážte, či by nebolo vhodné budovu rozobrať alebo zničiť, prípadne postaviť lesnícku chatrč.","tribes","../../data/tribes/buildings/productionsites/barbarians/lumberjacks_hut/init.lua:61"
"Work Area","pracovná plocha","The lumberjack working at this lumberjack’s house can’t find any trees in his work area. You should consider dismantling or destroying the building or building a forester’s house.","Drevorubač pracujúci v tomto drevorubačskom dome nedokáže vo svojej pracovnej oblasti nájsť žiadne stromy. Zvážte, či by nebolo vhodné budovu rozobrať alebo zničiť, prípadne postaviť horáreň.","tribes","../../data/tribes/buildings/productionsites/empire/lumberjacks_house/init.lua:54"
"Work Area","pracovná plocha","The forester’s house needs free space within the work area to plant the trees.","Horáreň potrebuje vo svojej pracovnej oblasti voľné miesto na sadenie stromov.","tribes_encyclopedia","../../data/tribes/buildings/productionsites/atlanteans/foresters_house/helptexts.lua:21"
"Work Area","pracovná plocha","The ranger’s hut needs free space within the work area to plant the trees.","Lesnícka chatrč vyžaduje vo svojej pracovnej oblasti voľné miesto na sadenie stromov.","tribes_encyclopedia","../../data/tribes/buildings/productionsites/barbarians/rangers_hut/helptexts.lua:19"
"Work Area","pracovná plocha","The forester’s house needs free space within the work area to plant the trees.","Horáreň potrebuje vo svojej pracovnej oblasti voľné miesto na sadenie stromov.","tribes_encyclopedia","../../data/tribes/buildings/productionsites/empire/foresters_house/helptexts.lua:21"
