"glossary_term","glossary_translation","source","target","file","location"
"road","cesta","Now, about this road. Remember: we are already in road building mode since you just ordered the quarry. You can either make it longer by one field at a time by left-clicking multiple times on neighboring fields for perfect control over the route the road takes, like so:","Teraz prejdime k stavbe cesty. Nezabúdajte: keďže ste práve umiestnili kameňolom, sme už v režime stavania ciest. Klikaním ľavým tlačidlom na susedné políčka môžete postupne predlžovať cestu o jedno políčko, čo vám umožní ovládať smer cesty.","scenario_tutorial01_basic_control.wmf","../../data/campaigns/tutorial01_basic_control.wmf/scripting/texts.lua:268"
"road","cesta","Excellent! To enter road building mode for any flag, left-click on a flag and select","Výborne! Do režimu stavania ciest od hociktorej vlajky sa dostanete kliknutím ľavým tlačidlom na vlajku a výberom","scenario_tutorial01_basic_control.wmf","../../data/campaigns/tutorial01_basic_control.wmf/scripting/texts.lua:278"
"road","cesta","If you decide that you do not want to build a road at this time, you can cancel road building by clicking on the starting flag of the road and selecting","Ak sa rozhodnete, že tentoraz nechcete postaviť cestu, môžete ju zrušiť kliknutím na počiatočnú vlajku cesty a zvolením","scenario_tutorial01_basic_control.wmf","../../data/campaigns/tutorial01_basic_control.wmf/scripting/texts.lua:280"
"road","cesta","Now, about this road. I’ll enter the road building mode and then make it longer by one field at a time by left-clicking multiple times on neighboring fields for perfect control over the route the road takes, like so:","Teraz prejdime k stavbe cesty. Aktivujem režim stavania ciest a postupne budem predlžovať cestu o jedno políčko tak, že niekoľkokrát za sebou kliknem ľavým tlačidlom na susedné políčka, čo mi umožní ovládať smer cesty.","scenario_tutorial01_basic_control.wmf","../../data/campaigns/tutorial01_basic_control.wmf/scripting/texts.lua:282"
"road","cesta","Now please rebuild the road between your quarry and your headquarters.","Teraz znovu postavte cestu medzi kameňolomom a ústredím.","scenario_tutorial01_basic_control.wmf","../../data/campaigns/tutorial01_basic_control.wmf/scripting/texts.lua:306"
"road","cesta","Connect your quarry construction site to your headquarters with a road. You would have been put directly into road building mode after ordering a new site. But now, you aren’t.","Spojte cestou stavenisko kameňolomu s ústredím. Keby ste boli umiestnili nové stavenisko, režim stavania ciest by bol aktivovaný. Momentálne však nie je.","scenario_tutorial01_basic_control.wmf","../../data/campaigns/tutorial01_basic_control.wmf/scripting/texts.lua:313"
"road","cesta","To build a completely new road, just click on the flag in front of your construction site, click on the build road icon and then click on the flag in front of your headquarters. Wait for the completion of the quarry.","Úplne novú cestu postavíte kliknutím na vlajku pred staveniskom, potom na ikonu stavania ciest a nakoniec na vlajku pred ústredím. Počkajte, kým sa dokončí výstavba kameňolomu.","scenario_tutorial01_basic_control.wmf","../../data/campaigns/tutorial01_basic_control.wmf/scripting/texts.lua:314"
"road","cesta","Your workers do not like to walk across country. You have to build a road from your headquarters to the construction site so that carriers can transport wares. The simplest way is to click on the construction site’s flag, choose ‘Build road’, and then click on the destination flag (the one in front of your headquarters), just like I’ve demonstrated.","Pracovníci neradi prechádzajú po teréne. Nosiči budú prenášať výrobky, len keď postavíte cestu od ústredia k stavenisku. Najjednoduchším spôsobom, ako to urobiť, je kliknúť na vlajku staveniska, na tlačidlo „Postaviť cestu“ a potom kliknúť na cieľovú vlajku (tú pred ústredím), presne ako som to ukazoval.","scenario_tutorial01_basic_control.wmf","../../data/campaigns/tutorial01_basic_control.wmf/scripting/texts.lua:322"
"road","cesta","Build a second quarry near the rocks and connect it to your road network.","Postavte druhý kameňolom pri skalách a pripojte ho k cestnej sieti.","scenario_tutorial01_basic_control.wmf","../../data/campaigns/tutorial01_basic_control.wmf/scripting/texts.lua:342"
"road","cesta","You can connect the new road to any flag of your existing road network. You can create junctions everywhere, not only in front of buildings.","Novú cestu môžete pripojiť k hociktorej vlajke patriacej do existujúcej cestnej sieti. Križovatky môžete vytvárať všade, nielen pred budovami.","scenario_tutorial01_basic_control.wmf","../../data/campaigns/tutorial01_basic_control.wmf/scripting/texts.lua:349"
"road","cesta","We have tried to build a road, but the mountain is too wide and too steep. We therefore have only one possibility: we need to establish a sea lane between these two parts.","Skúšali sme postaviť cestu, no hora je príliš strmá a široká. Zostáva nám preto iba jedna možnosť: medzi oboma časťami musíme zriadiť námornú trasu.","scenario_tutorial03_seafaring.wmf","../../data/campaigns/tutorial03_seafaring.wmf/scripting/texts.lua:35"
"road","cesta","The shipyard is a medium building. Although it can be built everywhere on the map, the shipwright only works when he is close to the water and there are no trees or roads at the shoreline.","Lodenica sa radí medzi stredné budovy. Hoci ju možno postaviť hocikde na mape, lodiar bude pracovať len v blízkosti vody a keď breh neblokujú stromy ani cesty.","scenario_tutorial03_seafaring.wmf","../../data/campaigns/tutorial03_seafaring.wmf/scripting/texts.lua:97"
"road","cesta","The stock menu window has four tabs. The first (and currently selected) one shows you all your current wares, including those on roads, at flags and inside buildings waiting for processing.","V okne Zásoby sú štyri karty. Na prvej (a zároveň aktuálne vybratej) sa zobrazujú všetky vaše výrobky v danom momente vrátane tých na cestách, vlajkách a tých, ktoré čakajú na spracovanie vnútri budov.","scenario_tutorial04_economy.wmf","../../data/campaigns/tutorial04_economy.wmf/scripting/texts.lua:139"
"road","cesta","The second tab shows you all your workers, again those on roads and in buildings summed up.","Na druhej karte sa zobrazujú všetci vaši pracovníci, opäť vrátane tých na cestách aj v budovách.","scenario_tutorial04_economy.wmf","../../data/campaigns/tutorial04_economy.wmf/scripting/texts.lua:141"
"road","cesta","Widelands records every game you play in two files. One of these files has a .wrpl.wgf extension and contains an initial savegame. The other file has a .wrpl extension and contains all commands that were issued by all players, such as building a road or attacking an enemy. The rest of the filenames will tell you the time you started the game.","Widelands zaznamenáva každú hru, ktorú hráte, v dvoch súboroch. Jeden z týchto súborov má príponu .wrpl.wgf a obsahuje začiatočný stav hry. Druhý súbor má príponu .wrpl a obsahuje všetky povely, ktoré vydali hráči, ako napríklad stavba cesty alebo útok na nepriateľa. Zvyšok z názvu týchto súborov vám prezradí čas, kedy ste začali hru.","texts","../../data/txts/help/common_helptexts.lua:26"
"road","cesta","Split your roads into shorter sections by planting some flags. This will speed up transportation of your wares.","Rozdeľte svoje cesty na kratšie úseky umiestnením vlajok. Tak sa preprava vašich tovarov zrýchli.","texts","../../data/txts/tips/general_game.lua:22"
"road","cesta","Removing a road while holding Ctrl lets you remove all flags up to the first junction.","Ak pri zrušení cesty podržíte Ctrl, odstránia sa všetky vlajky až po prvú križovatku.","texts","../../data/txts/tips/general_game.lua:47"
"road","cesta","Horses help to carry items along busy roads. They are reared in a horse farm.","Kone pomáhajú nosiť predmety po rušných cestách. Chovajú sa v stajni.","tribes_encyclopedia","../../data/tribes/workers/atlanteans/horse/helptexts.lua:3"
"road","cesta","Oxen help to carry items along busy roads. They are reared in a cattle farm.","Voly pomáhajú nosiť predmety po rušných cestách. Chovajú sa v kravíne.","tribes_encyclopedia","../../data/tribes/workers/barbarians/ox/helptexts.lua:3"
"road","cesta","Donkeys help to carry items along busy roads. They are reared in a donkey farm.","Osly pomáhajú nosiť predmety po rušných cestách. Chovajú sa na oslej farme.","tribes_encyclopedia","../../data/tribes/workers/empire/donkey/helptexts.lua:3"
"road","cesta","Start building road after placing a flag","Začať stavbu ciest po umiestnení vlajky","widelands","../../src/ui_fsmenu/options.cc:210"
"Bread","chlieb","Food is very important for mines and military training areas. Establish a well working food environment by building at least one farm, one blackroot farm and a mill. The two kinds of flour together with water from a well will be baked into bread in a bakery, so build a bakery and a well, too.","Jedlo je veľmi dôležité pre bane a výcvikové oblasti. Zriaďte dobre fungujúce potravinárske prostredie postavením aspoň jednej farmy, jednej farmy s čiernym koreňom a mlynu. Tieto dva druhy múky sa spolu s vodou zo studne použijú na výrobu chleba v pekárni, takže postavte aj pekáreň a studňu.","scenario_atl01.wmf","../../data/campaigns/atl01.wmf/scripting/texts.lua:57"
"Bread","chlieb","Build a bakery to bake bread from cornmeal, blackroot flour and water","Postavte pekáreň na výrobu chleba z kukuričnej múky, čiernokoreňovej múky a vody.","scenario_atl01.wmf","../../data/campaigns/atl01.wmf/scripting/texts.lua:62"
"Bread","chlieb","Isn’t it lovely, the view of golden fields, growing peacefully, dancing to the wind? And I believe the baker is just on his way here, with his most delicious bread reserved for our chieftain alone!","Nie je krásny – ten pohľad na zlaté polia, pokojne rastúce, tancujúce do vetra? Nuž verím, že pekár je práve na ceste sem so svojím najchutnejším chlebom vyhradeným pre samého náčelníka!","scenario_bar01.wmf","../../data/campaigns/bar01.wmf/scripting/texts.lua:420"
"Bread","chlieb","This corn is processed in the mill into fine cornmeal that every Atlantean baker needs for a good bread. Also horse and spider farms need to be provided with corn.","Táto kukurica sa spracúva v mlyne na drobnú kukuričnú múku, ktorú potrebuje každý atlantídsky pekár na pečenie chleba. Kukuricu treba zadovážiť aj stajniam a pavúčim farmám.","tribes_encyclopedia","../../data/tribes/wares/corn/helptexts.lua:4"
"Bread","chlieb","Cornmeal is produced in a mill out of corn and is one of three parts of the Atlantean bread produced in bakeries.","Kukuričná múka sa vyrába v mlyne z kukurice a je jednou z troch častí atlantídskeho chleba, ktorý sa vyrába v pekárňach.","tribes_encyclopedia","../../data/tribes/wares/cornmeal/helptexts.lua:4"
"Bread","chlieb","Besides bread and meat, fish is also a foodstuff for the Empire. Fish are used in taverns, inns and training sites (arena, colosseum, training camp).","Okrem chleba a mäsa patria medzi potraviny Impéria aj ryby. Ryby sa spotrebúvajú v krčmách, hostincoch a výcvikových stavbách (aréna, koloseum, výcvikový tábor).","tribes_encyclopedia","../../data/tribes/wares/fish/helptexts.lua:8"
"Bread","chlieb","A real meal is made in inns out of bread and fish/meat. It satisfies the needs of miners in deep mines.","Obed sa vyrába v hostincoch z chleba a rýb/mäsa. Uspokojí potreby baníkov pracujúcich v hlbinných baniach.","tribes_encyclopedia","../../data/tribes/wares/meal/helptexts.lua:6"
"Citadel","citadela","Expanding is as simple as building a military building at the edge of your territory. The Barbarians have a selection of different military buildings: sentries, barriers, towers, fortresses and citadels. The bigger the building, the more expensive it is to build, but the more land it will conquer around itself and the more soldiers can be stationed there. The buildings also vary in their vision range: buildings with a tower see farther than others.","Svoje územie jednoducho rozšírite tak, že na jeho kraji postavíte vojenskú budovu. Barbari majú niekoľko odlišných vojenských budov: strážnice, hradby, veže, pevnosti a citadely. Čím je budova väčšia, tým nákladnejšie je ju postaviť, ale aj tým viac územia si okolo seba podmaní a tým viac vojakov v nej možno umiestniť. Budovy sa okrem toho líšia vo svojom dohľade: budovy s vežou dovidia ďalej ako tie ostatné.","scenario_tutorial01_basic_control.wmf","../../data/campaigns/tutorial01_basic_control.wmf/scripting/texts.lua:448"
"Citadel","citadela","Citadels can’t be built directly. Instead, you’ll have to construct a fortress first and then enhance it to a citadel. To do so, click on the fortress, then choose the ‘Enhance to Citadel’ button.","Citadely nemožno postaviť priamo. Najprv musíte postaviť pevnosť a potom ju vylepšiť na citadelu. Vykonáte tak kliknutím na pevnosť a následne na tlačidlo „Vylepšiť na citadelu“.","scenario_tutorial02_warfare.wmf","../../data/campaigns/tutorial02_warfare.wmf/scripting/texts.lua:184"
"Citadel","citadela","Enhance your fortress to a citadel now.","Teraz vylepšite svoju pevnosť na citadelu.","scenario_tutorial02_warfare.wmf","../../data/campaigns/tutorial02_warfare.wmf/scripting/texts.lua:186"
"Citadel","citadela","Your citadel is under attack.","Nepriateľ útočí na vašu citadelu.","tribes","../../data/tribes/buildings/militarysites/barbarians/citadel/init.lua:51"
"Snack","desiata","Such buildings usually have greater demands than the basic kind of that building – for instance, deep mines need snacks instead of rations. You will have to enhance your tavern to an inn in order to produce snacks out of pitta bread AND a second kind of food (meat or fish) AND beer.","Takéto budovy zvyknú mať väčšie požiadavky pre svoj chod ako ich základné podoby – hlbinné bane napríklad potrebujú namiesto prídelov desiaty. Desiaty sa vyrábajú za spotreby pity A ďalšieho druhu jedla (rýb alebo mäsa) A piva v hostinci, ktorý je vylepšenou podobou krčmy.","scenario_bar01.wmf","../../data/campaigns/bar01.wmf/scripting/texts.lua:97"
"Snack","desiata","Prepares rations for scouts and rations, snacks and meals to feed all miners.","Pripravuje prídely pre prieskumníkov, ako aj prídely, desiaty a obedy, ktoré sa podávajú všetkým baníkom.","tribes_encyclopedia","../../data/tribes/buildings/productionsites/barbarians/big_inn/helptexts.lua:16"
"Snack","desiata","Prepares rations for scouts and rations and snacks to feed the miners in the basic and deep mines.","Pripravuje prídely pre prieskumníkov, ako aj prídely a desiaty, ktoré sa podávajú baníkom v základných a hlbinných baniach.","tribes_encyclopedia","../../data/tribes/buildings/productionsites/barbarians/inn/helptexts.lua:16"
"Snack","desiata","Produces beer of the lower grade. This beer is a vital component of the snacks that inns and big inns prepare for miners in deep mines.","Vyrába pivo nižšieho stupňa. Toto pivo je dôležitou zložkou desiat, ktoré sa pripravujú v hostincoch a veľkých hostincoch pre baníkov v hlbinných baniach.","tribes_encyclopedia","../../data/tribes/buildings/productionsites/barbarians/micro_brewery/helptexts.lua:13"
"Snack","desiata","Prepares rations for scouts and rations and snacks to feed the miners in all mines.","Pripravuje prídely pre prieskumníkov, ako aj prídely a desiaty, ktoré sa podávajú baníkom vo všetkých baniach.","tribes_encyclopedia","../../data/tribes/buildings/productionsites/empire/inn/helptexts.lua:16"
"Snack","desiata","The Barbarian bakers are best in making this flat and tasty pitta bread. It is made out of wheat and water following a secret recipe. Pitta bread is used in the taverns, inns and big inns to prepare rations, snacks and meals. It is also consumed at training sites (training camp and battle arena).","Barbarskí pekári vynikajú v tvorbe tohto plochého a chutného chleba pita. Vyrába sa z pšenice a vody na základe tajného receptu. Pita sa používa v krčmách, hostincoch a veľkých hostincoch na prípravu prídelov, desiat a obedov. Ďalej sa spotrebováva vo výcvikových stavbách (výcvikový tábor a zápasnícka aréna).","tribes_encyclopedia","../../data/tribes/wares/bread_barbarians/helptexts.lua:4"
"Snack","desiata","Meat is used in the taverns, inns and big inns to prepare rations, snacks and meals for the miners. It is also consumed at the training sites (training camp and battle arena).","Mäso sa používa v krčmách, hostincoch a veľkých hostincoch na prípravu prídelov, desiat a obedov pre baníkov. Okrem toho sa spotrebúva vo výcvikových stavbách (výcvikový tábor a zápasnícka aréna).","tribes_encyclopedia","../../data/tribes/wares/meat/helptexts.lua:10"
"diamonds","diamanty","May Satul warm you, Jundlina. Have you considered mining for resources in the mountains around us? We are running short of quartz and diamonds for our buildings. Also, we could use more iron, gold and especially coal. If we find an ample supply of those commodities, we could start producing weapons and tools; this would help enormously. Of course, we would need smelters, a weapon smithy, an armor smithy and a toolsmithy. And maybe even more.","Nech vás hreje Satul, Jundlína! Premýšľali ste nad ťažbou v okolitých horách? Míňajú sa nám zásoby kremeňa a diamantov, bez ktorých nemôžete stavať budovy. Zišlo by sa aj viac železa, zlata a obzvlášť uhlia. Ak sa nám podarí nájsť hojné zásoby týchto surovín, mohli by sme začať výrobu zbraní a nástrojov; nesmierne by nám to pomohlo. Samozrejme, potrebovali by sme tavičov, vyhňu na zbrane, vyhňu na zbroje a vyhňu na nástroje. Ba možno aj viac.","scenario_atl01.wmf","../../data/campaigns/atl01.wmf/scripting/texts.lua:303"
"Planks","dosky","Atlanteans use logs also as the base for planks, which are used in nearly every building. Besides the sawmill, the charcoal kiln, the toolsmithy and the smokery also need logs for their work.","Atlantíďania používajú kmene ako základný materiál na výrobu dosiek, ktoré sa používajú takmer v každej budove. Okrem píly ich na vykonávanie svojej činnosti potrebuje uhliarska pec, vyhňa na nástroje a udiareň.","tribes_encyclopedia","../../data/tribes/wares/log/helptexts.lua:6"
"Planks","dosky","The weapon smithy and the shipyard also use planks to produce the different tridents and mighty ships.","Vyhne na zbrane a lodenice ich používajú na výrobu rozličných trojzubcov a mohutných lodí.","tribes_encyclopedia","../../data/tribes/wares/planks/helptexts.lua:8"
"Wooden Spear","drevená kopija","The helmet is the basic defense of a warrior. It is produced in an armor smithy. In combination with a wooden spear, it is the equipment to fit out young soldiers. Helmets are also used in training camps – together with food – to train soldiers from health level 0 to level 1.","Helma poskytuje bojovníkom základnú ochranu. Vyrába sa vo vyhni na zbroje. Spolu s drevenou kopijou tvorí výbavu mladých vojakov. Helmy sa tiež používajú vo výcvikových táboroch – spolu s jedlom – na výcvik vojakov v zdraví z úrovne 0 na úroveň 1.","tribes_encyclopedia","../../data/tribes/wares/armor_helmet/helptexts.lua:4"
"Lumberjack’s Hut","drevorubačská chatrč","I see you have already built a quarry and two lumberjack’s huts. That is a good beginning if we want to stay here longer.","Všimol som si, že ste už postavili kameňolom a dve drevorubačské chatrče. Je to dobrý začiatok, keď tu chceme zostať dlhšie.","scenario_bar01.wmf","../../data/campaigns/bar01.wmf/scripting/texts.lua:255"
"Lumberjack’s Hut","drevorubačská chatrč","There you go. I will explain about all those symbols in a minute. First, let me show you how to make a lumberjack’s hut and how to connect it with a road. There is a sweet spot for a lumberjack right next to those trees. I’ll describe the steps I will take and then ask you to click on the ‘OK’ button for me to demonstrate.","No prosím. Za okamih objasním všetky tie symboly. Najprv vám ukážem, ako postaviť drevorubačskú chatrč a ako ju spojiť s cestou. Hneď pri tamtých stromoch je pre ňu skvelé miesto. Opíšem kroky, ktoré urobím a potom vás požiadam, aby ste klikli na tlačidlo „OK“, aby som ich mohol predviesť.","scenario_tutorial01_basic_control.wmf","../../data/campaigns/tutorial01_basic_control.wmf/scripting/texts.lua:65"
"Lumberjack’s Hut","drevorubačská chatrč","That won’t do yet. I still need to connect the lumberjack’s hut to the rest of my road network. After ordering the construction site, I was automatically put into road building mode, so all I have to do is click on the blue flag in front of my headquarters.","To nebude stačiť. Ešte musím spojiť chatrč drevorubača so zvyškom cestnej siete. Po tom, čo som postavil stavenisko, dostal som sa automaticky do režimu stavania ciest, takže všetko, čo musím urobiť, je kliknúť na modrú vlajku pred ústredím.","scenario_tutorial01_basic_control.wmf","../../data/campaigns/tutorial01_basic_control.wmf/scripting/texts.lua:85"
"Lumberjack’s Hut","drevorubačská chatrč","That won’t do yet. I still need to connect the lumberjack’s hut to the rest of my road network. You have disabled the option ‘Start building road after placing a flag’ (to change that, choose ‘Options’ in the Widelands main menu). Therefore, I have entered the road building mode manually. I will tell you later how to do that. To build the road, all I have to do now is click on the blue flag in front of my headquarters.","To nebude stačiť. Ešte musím spojiť chatrč drevorubača so zvyškom cestnej siete. Máte vypnutú možnosť „Začať stavbu ciest po umiestnení vlajky“ (môžete ju zmeniť zvolením položky „Možnosti“ z hlavného menu). Preto som aktivoval režim stavania ciest manuálne. Ako to spraviť vám poviem neskôr. Aby som postavil cestu, všetko, čo teraz musím urobiť, je kliknúť na modrú vlajku pred ústredím.","scenario_tutorial01_basic_control.wmf","../../data/campaigns/tutorial01_basic_control.wmf/scripting/texts.lua:96"
"Lumberjack’s Hut","drevorubačská chatrč","The lumberjack working at this lumberjack’s hut can’t find any trees in his work area. You should consider dismantling or destroying the building or building a ranger’s hut.","Drevorubač pracujúci v tejto drevorubačskej chatrči nedokáže vo svojej pracovnej oblasti nájsť žiadne stromy. Zvážte, či by nebolo vhodné budovu rozobrať alebo zničiť, prípadne postaviť lesnícku chatrč.","tribes","../../data/tribes/buildings/productionsites/barbarians/lumberjacks_hut/init.lua:61"
"Lumberjack’s House","drevorubačský dom","Build 2 lumberjack’s houses and a sawmill","Postavte dva drevorubačské domy a pílu","scenario_emp01.wmf","../../data/campaigns/emp01.wmf/scripting/texts.lua:46"
"Lumberjack’s House","drevorubačský dom","Two Lumberjack’s Houses and a Sawmill","Dva drevorubačské domy a píla","scenario_emp01.wmf","../../data/campaigns/emp01.wmf/scripting/texts.lua:48"
"Lumberjack’s House","drevorubačský dom","Build two more lumberjack’s houses and a sawmill as soon as there is enough space for them.","Postavte ďalšie dva drevorubačské domy a pílu, akonáhle pre ne bude dostatok miesta.","scenario_emp01.wmf","../../data/campaigns/emp01.wmf/scripting/texts.lua:49"
"Lumberjack’s House","drevorubačský dom","I got the message that our first lumberjack has started his work today. Perhaps it would be a good idea to wait until he has cleared enough space for constructing two more lumberjack’s houses, so that we can harvest the logs faster.","Doniesla sa ku mne správa, že náš prvý drevorubač začal dnes pracovať. Možno by bolo dobré počkať, kým vyprázdni dostatok miesta na postavenie ďalších dvoch drevorubačských domov. Mohli by sme tak urýchliť ťažbu dreva.","scenario_emp01.wmf","../../data/campaigns/emp01.wmf/scripting/texts.lua:171"
"Lumberjack’s House","drevorubačský dom","Build three lumberjack’s houses, a forester’s house and a sawmill.","Postavte tri drevorubačské domy, horáreň a pílu.","scenario_emp02.wmf","../../data/campaigns/emp02.wmf/scripting/texts.lua:30"
"Lumberjack’s House","drevorubačský dom","But until that day, many years may pass! For now, we must concentrate on the present, and build a few lumberjack’s houses and a sawmill to produce some basic building materials.","Do tohto dňa však môže prejsť mnoho rokov. Zatiaľ sa musíme sústrediť na prítomnosť a postaviť zopár drevorubačských domov a pílu na výrobu základných stavebných materiálov.","scenario_emp02.wmf","../../data/campaigns/emp02.wmf/scripting/texts.lua:125"
"Woodcutter’s House","drevorubačský dom","The woodcutter working at this woodcutter’s house can’t find any trees in his work area. You should consider dismantling or destroying the building or building a forester’s house.","Drevorubač pracujúci v tomto drevorubačskom dome nedokáže vo svojej pracovnej oblasti nájsť žiadne stromy. Porozmýšľajte nad rozobratím alebo zničením budovy, prípadne postavením lesníckej chatrče.","tribes","../../data/tribes/buildings/productionsites/atlanteans/woodcutters_house/init.lua:54"
