"glossary_term","glossary_translation","source","target","file","location"
"Soldier","vojak","The enemy defeated your soldiers at the blockhouse.","Nepriateľ porazil vaše vojsko vo vojenskom zrube.","tribes","../../data/tribes/buildings/militarysites/empire/blockhouse/init.lua:39"
"Soldier","vojak","Your soldiers defeated the enemy at the blockhouse.","Vaše vojsko porazilo nepriateľov vo vojenskom zrube.","tribes","../../data/tribes/buildings/militarysites/empire/blockhouse/init.lua:40"
"Soldier","vojak","Your soldiers have occupied your outpost.","Vaši vojaci obsadili vašu pozorovateľňu.","tribes","../../data/tribes/buildings/militarysites/empire/outpost/init.lua:42 ../../data/tribes/buildings/militarysites/frisians/outpost/init.lua:48"
"Soldier","vojak","The enemy defeated your soldiers at the outpost.","Nepriateľ porazil vaše vojsko v pozorovateľni.","tribes","../../data/tribes/buildings/militarysites/empire/outpost/init.lua:45 ../../data/tribes/buildings/militarysites/frisians/outpost/init.lua:51"
"Soldier","vojak","Your soldiers defeated the enemy at the outpost.","Vaše vojsko porazilo nepriateľov v pozorovateľni.","tribes","../../data/tribes/buildings/militarysites/empire/outpost/init.lua:46 ../../data/tribes/buildings/militarysites/frisians/outpost/init.lua:52"
"Soldier","vojak","Smoked meat is made out of meat in a smokery. It is delivered to the mines and training sites (labyrinth and dungeon) where the miners and soldiers prepare a nutritious lunch for themselves.","Údené mäso sa vyrába z mäsa v udiarni. Dodáva sa do baní a výcvikových stavieb (labyrint a kobka), kde si baníci a vojaci pre seba pripravujú výživné obedy.","tribes_encyclopedia","../../data/tribes/wares/smoked_meat/helptexts.lua:4"
"Soldier","vojak","%1% soldiers (+%2%)","%1% vojaci (+%2%)","widelands","../../src/logic/map_objects/tribes/militarysite.cc:373"
"Soldier","vojak","%1%(+%2%) soldiers (+%3%)","%1%(+%2%) vojaci (+%3%)","widelands","../../src/logic/map_objects/tribes/militarysite.cc:386"
"Military Site","vojenská budova","Build military sites to expand your territory","Postavte vojenské budovy a rozšírte si svoje územie","scenario_atl01.wmf","../../data/campaigns/atl01.wmf/scripting/texts.lua:48"
"Military Site","vojenská budova","However, destroying a military building is always linked with a risk: the land is still yours, but it is no longer protected. Any enemy that builds his own military sites can take over that land without a fight, causing your buildings to burst into flames. Furthermore, some parts of the land can now be hidden under the fog of war. You should therefore only dismantle military buildings deep inside your territory where you are safe from enemies.","Zničenie vojenskej budovy sa však spája s istým rizikom: územie ostane patriť vám, no prestane byť chránené. Ak na tomto území nepriateľ postaví vojenskú budovu, podmaní si ho bez boja a vaše budovy zhoria. Navyše niektoré časti územia môže zakryť vojnová hmla. Vojenské budovy by ste z tohto dôvodu mali rozoberať len hlboko vo vnútri svojho územia.","scenario_tutorial02_warfare.wmf","../../data/campaigns/tutorial02_warfare.wmf/scripting/texts.lua:161"
"Military Site","vojenská budova","You can control the number of soldiers stationed at a military site with the arrow buttons. If you want to get even your last soldier out, you will have to destroy it. However, it then will no longer protect your territory, which will make it vulnerable to hostile attacks.","Počet vojakov umiestnených vo vojenskej budove môžete ovládať pomocou tlačidiel so šípkami. Ak chcete, aby aj posledný vojak opustil budovu, musíte ju zničiť. Potom však vaše územie ostane nechránené pred útokmi nepriateľov.","scenario_tutorial02_warfare.wmf","../../data/campaigns/tutorial02_warfare.wmf/scripting/texts.lua:171"
"Military Site","vojenská budova","If you’re low on soldiers to occupy new military sites, use the downward arrow button to decrease the capacity. You can also click on a soldier to send him away.","Ak nemáte dostatok vojakov, ktorí by obsadzovali nové vojenské budovy, môžete znížiť kapacitu kliknutím na tlačidlo so šípkou nadol. Zároveň môžete poslať niektorého vojaka preč, ak naňho kliknete.","tribes_encyclopedia","../../data/tribes/buildings/militarysites/atlanteans/castle/helptexts.lua:24 ../../data/tribes/buildings/militarysites/atlanteans/guardhall/helptexts.lua:21 ../../data/tribes/buildings/militarysites/atlanteans/guardhouse/helptexts.lua:21 ../../data/tribes/buildings/militarysites/atlanteans/tower/helptexts.lua:21 ../../data/tribes/buildings/militarysites/atlanteans/tower_high/helptexts.lua:21 ../../data/tribes/buildings/militarysites/atlanteans/tower_small/helptexts.lua:21 ../../data/tribes/buildings/militarysites/barbarians/barrier/helptexts.lua:21 ../../data/tribes/buildings/militarysites/barbarians/citadel/helptexts.lua:21 ../../data/tribes/buildings/militarysites/barbarians/fortress/helptexts.lua:21 ../../data/tribes/buildings/militarysites/barbarians/sentry/helptexts.lua:21 ../../data/tribes/buildings/militarysites/barbarians/tower/helptexts.lua:21 ../../data/tribes/buildings/militarysites/empire/barrier/helptexts.lua:21 ../../data/tribes/buildings/militarysites/empire/blockhouse/helptexts.lua:21 ../../data/tribes/buildings/militarysites/empire/castle/helptexts.lua:21 ../../data/tribes/buildings/militarysites/empire/fortress/helptexts.lua:21 ../../data/tribes/buildings/militarysites/empire/outpost/helptexts.lua:21 ../../data/tribes/buildings/militarysites/empire/sentry/helptexts.lua:21 ../../data/tribes/buildings/militarysites/empire/tower/helptexts.lua:21 ../../data/tribes/buildings/militarysites/frisians/fortress/helptexts.lua:21 ../../data/tribes/buildings/militarysites/frisians/outpost/helptexts.lua:21 ../../data/tribes/buildings/militarysites/frisians/sentinel/helptexts.lua:21 ../../data/tribes/buildings/militarysites/frisians/tower/helptexts.lua:21 ../../data/tribes/buildings/militarysites/frisians/wooden_tower/helptexts.lua:21 ../../data/tribes/buildings/militarysites/frisians/wooden_tower_high/helptexts.lua:21"
"War Mill","vojenský závod","This is a dangerous weapon the Barbarians are able to produce. It is produced in the war mill. Only trained soldiers are able to wield such a weapon. It is used – together with food – in the training camp to train soldiers from attack level 3 to 4.","Túto nebezpečnú zbraň vyrábajú Barbari vo vojenskom závode. S takouto zbraňou dokážu narábať len vycvičení vojaci. Používa sa – spolu s jedlom – vo výcvikovom tábore na výcvik vojakov v útoku z úrovne 3 na úroveň 4.","tribes_encyclopedia","../../data/tribes/wares/ax_battle/helptexts.lua:4"
"War Mill","vojenský závod","The broad ax is produced by the ax workshop and the war mill. It is used in the training camp – together with food – to train soldiers with a fundamental fighting knowledge from attack level 1 to attack level 2.","Široká sekera sa vyrába vo výrobni sekier a vojenskom závode. Používa sa vo výcvikovom tábore – spolu s jedlom – na výcvik vojakov so základnými bojovnými znalosťami z úrovne útoku 1 na 2.","tribes_encyclopedia","../../data/tribes/wares/ax_broad/helptexts.lua:4"
"War Mill","vojenský závod","The bronze ax is considered a weapon that is hard to handle. Only skilled soldiers can use it. It is produced at the war mill and used in the training camp – together with food – to train soldiers from attack level 2 to level 3.","Bronzová sekera sa považuje za zbraň, s ktorou sa nezaobchádza ľahko. Môžu ju používať len skúsení vojaci. Vyrába sa vo vojenskom závode a používa sa vo výcvikovom tábore – spolu s jedlom – na výcvik vojakov v útoku z úrovne 2 na úroveň 3.","tribes_encyclopedia","../../data/tribes/wares/ax_bronze/helptexts.lua:4"
"War Mill","vojenský závod","Young soldiers are proud to learn to fight with this powerful weapon. It is heavier and sharper than the ordinary ax. It is produced in ax workshops and war mills. In training camps, it is used – together with food – to train soldiers from attack level 0 to level 1.","Mladí vojaci majú česť naučiť sa bojovať s touto mocnou zbraňou. Vyrába sa vo výrobni sekier a vojenskom závode. Vo výcvikových táboroch sa používa – spolu s jedlom – na výcvik vojakov v útoku z úrovne 0 na úroveň 1.","tribes_encyclopedia","../../data/tribes/wares/ax_sharp/helptexts.lua:4"
"War Mill","vojenský závod","The warrior’s ax is the most dangerous of all Barbarian weapons. Only a few soldiers ever were able to handle this huge and powerful ax. It is produced in a war mill and used – together with food – in a training camp to train soldiers from attack level 4 to level 5.","Bojovnícka sekera je spomedzi všetkých barbarských zbraní tá najnebezpečnejšia. V celej histórii s ňou bolo schopných zaobchádzať len niekoľko vojakov. Vyrába sa vo vojenskom závode a používa sa vo výcvikovom tábore – spolu s jedlom – na výcvik vojakov v útoku z úrovne 4 na úroveň 5.","tribes_encyclopedia","../../data/tribes/wares/ax_warriors/helptexts.lua:4"
"War Mill","vojenský závod","It is used to produce weapons and tools in the metal workshop, ax workshop, war mill and helm smithy.","Používa sa na výrobu zbraní a nástrojov v kovodielni, výrobni sekier, vojenskom závode a vyhni na helmy.","tribes_encyclopedia","../../data/tribes/wares/iron/helptexts.lua:8"
"Helm Smithy","vyhňa na helmy","Build a helm smithy to the west of the mountains to provide your soldiers with better armor.","Na západ od hôr postavte vyhňu na helmy, ktorá vám umožní poskytnúť vojakom lepšiu ochranu.","scenario_bar02.wmf","../../data/campaigns/bar02.wmf/scripting/texts.lua:99 ../../data/campaigns/bar02.wmf/scripting/texts.lua:136"
"Helm Smithy","vyhňa na helmy","A helmet is a basic tool to protect soldiers. It is produced in the helm smithy and used in the training camp – together with food – to train soldiers from health level 0 to level 1.","Helma je základný nástroj na ochranu vojakov. Vyrába sa vo vyhni na helmy a používa sa vo výcvikovom tábore – spolu s jedlom – na výcvik vojakov v zdraví z úrovne 0 na úroveň 1.","tribes_encyclopedia","../../data/tribes/wares/helmet/helptexts.lua:4"
"Helm Smithy","vyhňa na helmy","This is the most enhanced Barbarian armor. It is produced in the helm smithy and used in the training camp – together with food – to train soldiers from health level 2 to level 3.","Toto je najlepšia zbroj, akú môžu mať Barbari k dispozícii. Vyrába sa vo vyhni na helmy a používa sa vo výcvikovom tábore – spolu s jedlom – na výcvik vojakov v zdraví z úrovne 2 na úroveň 3.","tribes_encyclopedia","../../data/tribes/wares/helmet_mask/helptexts.lua:4"
"Helm Smithy","vyhňa na helmy","A warhelm is an enhanced armor for Barbarian soldiers. It is produced in a helm smithy and used in a training camp – together with food – to train soldiers from health level 1 to level 2.","Vojenská helma je vylepšená zbroj pre barbarských vojakov. Vyrába sa vo vyhni na helmy a používa sa vo výcvikovom tábore – spolu s jedlom – na výcvik vojakov v zdraví z úrovne 1 na úroveň 2.","tribes_encyclopedia","../../data/tribes/wares/helmet_warhelm/helptexts.lua:4"
"Toolsmithy","vyhňa na nástroje","May Satul warm you, Jundlina. Have you considered mining for resources in the mountains around us? We are running short of quartz and diamonds for our buildings. Also, we could use more iron, gold and especially coal. If we find an ample supply of those commodities, we could start producing weapons and tools; this would help enormously. Of course, we would need smelters, a weapon smithy, an armor smithy and a toolsmithy. And maybe even more.","Nech vás hreje Satul, Jundlína! Premýšľali ste nad ťažbou v okolitých horách? Míňajú sa nám zásoby kremeňa a diamantov, bez ktorých nemôžete stavať budovy. Zišlo by sa aj viac železa, zlata a obzvlášť uhlia. Ak sa nám podarí nájsť hojné zásoby týchto surovín, mohli by sme začať výrobu zbraní a nástrojov; nesmierne by nám to pomohlo. Samozrejme, potrebovali by sme tavičov, vyhňu na zbrane, vyhňu na zbroje a vyhňu na nástroje. Ba možno aj viac.","scenario_atl01.wmf","../../data/campaigns/atl01.wmf/scripting/texts.lua:303"
"Toolsmithy","vyhňa na nástroje","It is used in the toolsmithy, armor smithy and weapon smithy.","Používa sa vo vyhni na nástroje, vyhni na zbroje a vyhni na zbrane.","tribes_encyclopedia","../../data/tribes/wares/iron/helptexts.lua:6"
"Toolsmithy","vyhňa na nástroje","Imperial lumberjacks fell the trees; foresters take care of the supply of trees. Logs are also used by the charcoal kiln, the toolsmithy and the sawmill.","Imperiálni drevorubači rúbu stromy; horári sa zase starajú o zásobu stromov. Kmene sa ďalej používajú v uhliarskej peci, vyhni na nástroje a píle.","tribes_encyclopedia","../../data/tribes/wares/log/helptexts.lua:12"
"Toolsmithy","vyhňa na nástroje","Spidercloth is made out of spider silk in a weaving mill. It is used in the toolsmithy and the shipyard. Also some higher developed buildings need spidercloth for their construction.","Pavúčia látka sa vyrába z pavúčieho hodvábu v tkáčovni. Používa sa vo vyhni na nástroje a v lodenici. Okrem toho je potrebná pri stavbe niektorých dokonalejších budov.","tribes_encyclopedia","../../data/tribes/wares/spidercloth/helptexts.lua:4"
"Weapon Smithy","vyhňa na zbrane","The ores have to be smelted at a smelting works before they can be used. The refined materials are then used in the weapon smithy, the armor smithy and the toolsmithy.","Predtým, ako tieto rudy možno použiť, je potrebné ich taviť v taviarni. Vylepšené materiály sa potom spotrebúvajú vo vyhniach na zbrane, zbroje a nástroje.","scenario_atl01.wmf","../../data/campaigns/atl01.wmf/scripting/texts.lua:88"
"Weapon Smithy","vyhňa na zbrane","May Satul warm you, Jundlina. Have you considered mining for resources in the mountains around us? We are running short of quartz and diamonds for our buildings. Also, we could use more iron, gold and especially coal. If we find an ample supply of those commodities, we could start producing weapons and tools; this would help enormously. Of course, we would need smelters, a weapon smithy, an armor smithy and a toolsmithy. And maybe even more.","Nech vás hreje Satul, Jundlína! Premýšľali ste nad ťažbou v okolitých horách? Míňajú sa nám zásoby kremeňa a diamantov, bez ktorých nemôžete stavať budovy. Zišlo by sa aj viac železa, zlata a obzvlášť uhlia. Ak sa nám podarí nájsť hojné zásoby týchto surovín, mohli by sme začať výrobu zbraní a nástrojov; nesmierne by nám to pomohlo. Samozrejme, potrebovali by sme tavičov, vyhňu na zbrane, vyhňu na zbroje a vyhňu na nástroje. Ba možno aj viac.","scenario_atl01.wmf","../../data/campaigns/atl01.wmf/scripting/texts.lua:303"
"Weapon Smithy","vyhňa na zbrane","The Atlantean fires in smelting works, armor smithies and weapon smithies are fed with coal.","Atlantíďania prikladajú do ohňov v taviarňach, vyhniach na zbroje a vyhniach na zbrane uhlie.","tribes_encyclopedia","../../data/tribes/wares/coal/helptexts.lua:6"
"Weapon Smithy","vyhňa na zbrane","The fires of the Empire smelting works, armor smithies and weapon smithies are usually fed with coal.","Do ohňov v imperiálnych taviarňach, vyhniach na zbroje a vyhniach na zbrane sa zvyčajne prikladá uhlie.","tribes_encyclopedia","../../data/tribes/wares/coal/helptexts.lua:10"
"Weapon Smithy","vyhňa na zbrane","The weapon smithy and the shipyard also use planks to produce the different tridents and mighty ships.","Vyhne na zbrane a lodenice ich používajú na výrobu rozličných trojzubcov a mohutných lodí.","tribes_encyclopedia","../../data/tribes/wares/planks/helptexts.lua:8"
"Weapon Smithy","vyhňa na zbrane","This spear has an iron spike. It is produced in a weapon smithy and used in a training camp – together with food – to train soldiers from attack level 0 to attack level 1.","Táto kopija má železný hrot. Vyrába sa vo vyhni na zbrane a používa sa vo výcvikovom tábore – spolu s jedlom – na výcvik vojakov v útoku z úrovne 0 na úroveň 1.","tribes_encyclopedia","../../data/tribes/wares/spear/helptexts.lua:4"
"Weapon Smithy","vyhňa na zbrane","This is an advanced spear with a steel tip. It is produced in a weapon smithy and used in a training camp – together with food – to train soldiers from attack level 1 to level 2.","Toto je vylepšená kopija s oceľovým hrotom. Vyrába sa vo vyhni na zbrane a používa sa vo výcvikovom tábore – spolu s jedlom – na výcvik vojakov v útoku z úrovne 1 na úroveň 2.","tribes_encyclopedia","../../data/tribes/wares/spear_advanced/helptexts.lua:4"
"Weapon Smithy","vyhňa na zbrane","This is a strong spear with a steel-tip and a little blade. It is produced in the weapon smithy and used in the training camp – together with food – train soldiers from attack level 2 to level 3.","Toto je silná kopija s oceľovým hrotom a malou čepeľou. Vyrába sa vo vyhni na zbrane a používa sa vo výcvikovom tábore – spolu s jedlom – na výcvik vojakov v útoku z úrovne 2 na úroveň 3.","tribes_encyclopedia","../../data/tribes/wares/spear_heavy/helptexts.lua:4"
"Weapon Smithy","vyhňa na zbrane","This wooden spear is the basic weapon in the Empire military system. It is produced in the weapon smithy. In combination with a helmet, it is the equipment to fit out young soldiers.","Táto drevená kopija je základnou zbraňou vo vojenskom systéme Impéria. Vyrába sa vo vyhni na zbrane. V kombinácii s helmou tvorí výbavu mladých vojakov.","tribes_encyclopedia","../../data/tribes/wares/spear_wooden/helptexts.lua:4"
"Weapon Smithy","vyhňa na zbrane","The double trident is one of the best tridents produced by the Atlantean weapon smithy. It is used in a dungeon – together with food – to train soldiers from attack level 2 to level 3.","Dvojitý trojzubec je jedným z najlepších trojzubcov, ktoré sa vyrábajú vo vyhni na zbrane. Používa sa v kobke – spolu s jedlom – na výcvik vojakov v útoku z úrovne 2 na úroveň 3.","tribes_encyclopedia","../../data/tribes/wares/trident_double/helptexts.lua:4"
"Weapon Smithy","vyhňa na zbrane","This is the most dangerous weapon of the Atlantean military. Only the best of the best soldiers may use it. It is produced in the weapon smithy and used in the dungeon – together with food – to train soldiers from attack level 3 to level 4.","Toto je najnebezpečnejšia zbraň atlantídskej armády. Môžu ju používať len tí najlepší z najlepších vojakov. Vyrába sa vo vyhni na zbrane a používa sa v kobke – spolu s jedlom – na trénovanie útoku vojakov z úrovne 3 na úroveň 4.","tribes_encyclopedia","../../data/tribes/wares/trident_heavy_double/helptexts.lua:4"
"Weapon Smithy","vyhňa na zbrane","This is the basic weapon of the Atlantean soldiers. Together with a tabard, it makes up the equipment of young soldiers. Light tridents are produced in the weapon smithy as are all other tridents.","Toto je základná zbraň atlantídskych vojakov. Spolu s kabátcom tvorí výzbroj mladých vojakov. Ľahké trojzubce, ako aj všetky ostatné trojzubce, sa vyrábajú vo vyhni na zbrane.","tribes_encyclopedia","../../data/tribes/wares/trident_light/helptexts.lua:4"
"Weapon Smithy","vyhňa na zbrane","The long trident is the first trident in the training of soldiers. It is produced in the weapon smithy and used in the dungeon – together with food – to train soldiers from attack level 0 to level 1.","Dlhý trojzubec je prvým trojzubcom vo výcviku vojakov. Vyrába sa vo vyhni na zbrane a používa sa v kobke – spolu s jedlom – na výcvik vojakov v útoku z úrovne 0 na úroveň 1.","tribes_encyclopedia","../../data/tribes/wares/trident_long/helptexts.lua:4"
"Armor Smithy","vyhňa na zbroje","The ores have to be smelted at a smelting works before they can be used. The refined materials are then used in the weapon smithy, the armor smithy and the toolsmithy.","Predtým, ako tieto rudy možno použiť, je potrebné ich taviť v taviarni. Vylepšené materiály sa potom spotrebúvajú vo vyhniach na zbrane, zbroje a nástroje.","scenario_atl01.wmf","../../data/campaigns/atl01.wmf/scripting/texts.lua:88"
"Armor Smithy","vyhňa na zbroje","Build an armor smithy and a weapon smithy","Postavte vyhňu na zbroje a vyhňu na zbrane","scenario_atl01.wmf","../../data/campaigns/atl01.wmf/scripting/texts.lua:91"
"Armor Smithy","vyhňa na zbroje","May Satul warm you, Jundlina. Have you considered mining for resources in the mountains around us? We are running short of quartz and diamonds for our buildings. Also, we could use more iron, gold and especially coal. If we find an ample supply of those commodities, we could start producing weapons and tools; this would help enormously. Of course, we would need smelters, a weapon smithy, an armor smithy and a toolsmithy. And maybe even more.","Nech vás hreje Satul, Jundlína! Premýšľali ste nad ťažbou v okolitých horách? Míňajú sa nám zásoby kremeňa a diamantov, bez ktorých nemôžete stavať budovy. Zišlo by sa aj viac železa, zlata a obzvlášť uhlia. Ak sa nám podarí nájsť hojné zásoby týchto surovín, mohli by sme začať výrobu zbraní a nástrojov; nesmierne by nám to pomohlo. Samozrejme, potrebovali by sme tavičov, vyhňu na zbrane, vyhňu na zbroje a vyhňu na nástroje. Ba možno aj viac.","scenario_atl01.wmf","../../data/campaigns/atl01.wmf/scripting/texts.lua:303"
"Armor Smithy","vyhňa na zbroje","Basic armor for Empire soldiers. It is produced in the armor smithy and used in the training camp – together with food – to train soldiers from health level 1 to level 2.","Základná zbroj imperiálnych vojakov. Vyrába sa vo vyhni na zbroje a používa sa vo výcvikovom tábore – spolu s jedlom – na výcvik vojakov v zdraví z úrovne 1 na úroveň 2.","tribes_encyclopedia","../../data/tribes/wares/armor/helptexts.lua:4"
"Armor Smithy","vyhňa na zbroje","The chain armor is a medium armor for Empire soldiers. It is produced in an armor smithy and used in a training camp – together with food – to train soldiers from health level 2 to level 3.","Krúžková zbroj je stredným brnením vojakov Impéria. Vyrába sa vo vyhni na zbroje a používa sa vo výcvikovom tábore – spolu s jedlom – na výcvik vojakov v zdraví z úrovne 2 na úroveň 3.","tribes_encyclopedia","../../data/tribes/wares/armor_chain/helptexts.lua:4"
"Armor Smithy","vyhňa na zbroje","The gilded armor is the strongest armor an Empire soldier can have. It is produced in the armor smithy and used in the training camp – together with food – to train soldiers from health level 3 to level 4.","Pozlátená zbroj je najsilnejšie brnenie, aké vojak Impéria môže mať. Vyrába sa vo vyhni na zbroje a používa sa vo výcvikovom tábore – spolu s jedlom – na výcvik vojakov v zdraví z úrovne 3 na úroveň 4.","tribes_encyclopedia","../../data/tribes/wares/armor_gilded/helptexts.lua:4"
"Armor Smithy","vyhňa na zbroje","The helmet is the basic defense of a warrior. It is produced in an armor smithy. In combination with a wooden spear, it is the equipment to fit out young soldiers. Helmets are also used in training camps – together with food – to train soldiers from health level 0 to level 1.","Helma poskytuje bojovníkom základnú ochranu. Vyrába sa vo vyhni na zbroje. Spolu s drevenou kopijou tvorí výbavu mladých vojakov. Helmy sa tiež používajú vo výcvikových táboroch – spolu s jedlom – na výcvik vojakov v zdraví z úrovne 0 na úroveň 1.","tribes_encyclopedia","../../data/tribes/wares/armor_helmet/helptexts.lua:4"
"Armor Smithy","vyhňa na zbroje","The Atlantean fires in smelting works, armor smithies and weapon smithies are fed with coal.","Atlantíďania prikladajú do ohňov v taviarňach, vyhniach na zbroje a vyhniach na zbrane uhlie.","tribes_encyclopedia","../../data/tribes/wares/coal/helptexts.lua:6"
"Armor Smithy","vyhňa na zbroje","The fires of the Empire smelting works, armor smithies and weapon smithies are usually fed with coal.","Do ohňov v imperiálnych taviarňach, vyhniach na zbroje a vyhniach na zbrane sa zvyčajne prikladá uhlie.","tribes_encyclopedia","../../data/tribes/wares/coal/helptexts.lua:10"
"Armor Smithy","vyhňa na zbroje","Armor and weapons are embellished with gold in the armor smithy and the weapon smithy.","Zbroje a zbrane sa vo vyhni na zbroje a vyhni na zbrane zdobia zlatom.","tribes_encyclopedia","../../data/tribes/wares/gold/helptexts.lua:12"
"Armor Smithy","vyhňa na zbroje","It is used in the toolsmithy, armor smithy and weapon smithy.","Používa sa vo vyhni na nástroje, vyhni na zbroje a vyhni na zbrane.","tribes_encyclopedia","../../data/tribes/wares/iron/helptexts.lua:6"
"Armor Smithy","vyhňa na zbroje","These advanced shields are used by the best soldiers of the Atlanteans. They are produced in the armor smithy and used in the labyrinth – together with food – to train soldiers from defense level 1 to level 2.","Tieto vylepšené štíty používajú tí najlepší atlantídski vojaci. Vyrábajú sa vo vyhni na zbroje a používajú sa v labyrinte – spolu s jedlom – na výcvik vojakov v obrane z úrovne 1 na úroveň 2.","tribes_encyclopedia","../../data/tribes/wares/shield_advanced/helptexts.lua:4"
