"glossary_term","glossary_translation","source","target","file","location"
"AI","AI","Large plots are rare on those small islands. Prioritize construction of large buildings on them. Sometimes you will need big military buildings to expand all the way to the next island. The AI will perform poorly.","Veľké parcely sa na týchto ostrovčekoch vyskytujú zriedkavo. Stavajte na nich preto prioritne veľké budovy. Niekedy je na ovládnutie ďalších ostrovov nutné postaviť veľké vojenské budovy. Umelá inteligencia vykazuje slabý výkon.","maps","../../data/maps/Archipelago_Sea.wmf/elemental:11"
"AI","AI","Each player has a different obstacle to expansion, and there’s always more than one way to overcome it. While the AI can be defeated here without building a single ship, players are advised to make ports and shipyards a priority – expeditions are universally useful and are often the fastest way to gold deposits.","Každý hráč začína s odlišnou prekážkou rozpínania, pričom stále existuje viac ako jeden spôsob, ako ju prekonať. Aj keď umelú inteligenciu tu možno poraziť bez jedinej lode, hráčom sa odporúča, aby považovali prístavy a lodenice za prioritu – výpravy sú užitočné a sú často najrýchlejším spôsobom, ako nájsť ložiská zlata.","maps","../../data/maps/River_Explorers.wmf/elemental:10"
"AI","AI","The black player is surrounded in the center with no resources, so there are three different ways to use this map: without the black player for a normal 4 players’ map, with a black AI to add a complication to the expansion of the other players, or you can play as a challenge with the black player against the other 4 (VERY difficult).","Čierny hráč je obkľúčený ostatnými hráčmi v strede mapy a nemá k dispozícii žiadne zdroje. Mapu možno hrať troma rôznymi spôsobmi: bez čierneho hráča ako obyčajnú mapu pre 4 hráčov, s umelou inteligenciou na mieste čierneho hráča, ktorá ostatným hráčom skomplikuje expanziu, alebo si môžete trúfnuť hrať za čierneho hráča proti ostatným 4 (VEĽMI náročná výzva).","maps","../../data/maps/Wisent_Valley.wmf/elemental:11"
"Al’thunran","Al’thunran","We can see the raging flames that swallow Al’thunran from here, miles away.","Odtiaľto, na míle ďaleko, vidno zúrivé plamene, ktoré hltajú Al'thunran.","scenario_bar01.wmf","../../data/campaigns/bar01.wmf/scripting/texts.lua:171"
"Al’thunran","Al’thunran","Thron seeks to believe that Kalitath is tired of fighting and would be willing to join us once we march to re-establish law and order in Al’thunran. But I don’t think so. Kalitath is son to one of the mightiest generals of our forces and his family never quite liked the thought of bowing before the banner of Chat’Karuth. Why should he march with Chat’Karuth’s son to reclaim his heritage and the throne?","Thron verí, že Kalitath je unavený z bojov a bude ochotný pripojiť sa k nám pri pochode za nastolenie práv a poriadku v Al'thunran. Ale ja si to nemyslím. Kalitath je synom jedného z najmocnejších generálov našej armády a jeho rodine sa nikdy nepáčila myšlienka klaňať sa pred Chat'Karuthovou zástavou. Prečo by mal pochodovať s jeho synom, aby získal späť jeho dedičstvo a trón?","scenario_bar02.wmf","../../data/campaigns/bar02.wmf/scripting/texts.lua:184"
"Al’thunran","Al’thunran","The frontier line of my forces has expanded to the edge of the forests. We have a long and cold winter and so many miles behind us. The fortification that we erected around Ondun will guarantee us a fast supply of men and goods, and once Al’thunran is in my hands, the two cities will be linked by a good and defensible infrastructure. Still, I hope I will not walk alone on this mission, I hope Kalitath son of Kun will follow my call.","Pohraničná línia mojich jednotiek sa rozšírila na okraj lesov. Ďaleko pred nami nás čaká dlhá a studená zima. Opevnenie, ktoré sme postavili okolo Ondunu, nám zabezpečí rýchly prísun vojska a tovaru. Keď získam Al'thunran, obe mestá prepojím dobrou infraštruktúrou s možnosťou obrany. Stále dúfam, že na túto misiu nie som sám, dúfam, že Kalitath, syn Kuna, odpovie na moje volanie.","scenario_bar02.wmf","../../data/campaigns/bar02.wmf/scripting/texts.lua:200"
"Archive","Archív","You have two messages at the moment. This one, which you are currently reading, and the one that informed you that a new headquarters was added to your economy. Let’s learn how to archive messages: first, select the message that you wish to archive by clicking on it in the list. Then, click the","Momentálne máte dve správy. Túto, ktorú práve čítate, a tú, ktorá vás oboznámila so skutočnosťou, že sa vaša ekonomika rozrástla o nové ústredie. Naučme sa archivovať správy: najprv vyberte správu, ktorú chcete archivovať, kliknutím na príslušnú položku v zozname. Potom ju kliknutím na","scenario_tutorial01_basic_control.wmf","../../data/campaigns/tutorial01_basic_control.wmf/scripting/texts.lua:378"
"Archive","Archív","Manage your messages more efficiently: press ‘N’ for News to access the messages window, then use ‘G’ for Go To, and the Delete key to archive messages.","Spravujte svoje správy efektívnejšie: stlačením klávesu „N“ (nové správy) sa dostanete do okna správ, „G“ aktivujete „Ísť na“ a Delete môžete správy archivovať.","texts","../../data/txts/tips/general_game.lua:39"
"Atlantis","Atlantída","After landing on a mysterious island close to Atlantis, the remaining Atlanteans struggle to make a new home for themselves.","Po vylodení na tajuplnom ostrove neďaleko Atlantídy, zostávajúci Atlantíďania sa zo všetkých síl usilujú pre seba vytvoriť nový domov.","maps","../../data/campaigns/atl01.wmf/elemental:11"
"Atlantis","Atlantída","This story is taking place during the reign of King Askandor, the 43rd successor of King Ajanthul. He had been a good king, ruling Atlantis with wisdom and foresight. But with age, he became afraid of dying and so he began looking for a cure for death even though most clerics warned him against it. Some said that endless life was only for the gods and that to seek for it was forbidden.","Tento príbeh sa odohráva počas vlády kráľa Askandora, 43. nástupcu kráľa Ajanthula. Bol dobrým kráľom; vládol Atlantíde s rozumom a opatrnosťou. Ale ako starol, popadol ho strach zo smrti, nuž začal na ňu hľadať liek, aj keď ho pred tým väčšina duchovných varovala. Niektorí vraveli, že nekonečný život je určený len pre bohov a hľadať ho je zakázané.","scenario_atl01.wmf","../../data/campaigns/atl01.wmf/scripting/texts.lua:150"
"Atlantis","Atlantída","But not even this changed the mind of the god. The water kept on rising. Nearly driven insane by guilt, pain and anger, Jundlina became a heretic: Secretly, she gathered people of the common folk who were not in line with the decision of the clerics to accept the god’s will. Together with them, she set the temple on fire and stole a ship to flee from the god’s influence over Atlantis. This small group started praying to Satul, the fire god and the worst enemy of Lutas.","Ani to však nezmenilo mienku boha. Voda pokračovala v stúpaní. Takmer dohnaná k šialenstvu vinou, bolesťou a hnevom, Jundlína sa stala kacírkou. Tajne zhromaždila ľudí z obyčajného ľudu, ktorí nesúhlasili s rozhodnutím duchovných prijať vôľu boha. Spolu s nimi podpálila chrám a ukradla loď na únik od vplyvu boha nad Atlantídou. Táto skupinka sa začala modliť k Satulovi, bohu ohňa a najhoršiemu nepriateľovi Lutasa.","scenario_atl01.wmf","../../data/campaigns/atl01.wmf/scripting/texts.lua:172"
"Atlantis","Atlantída","Leaving the dying Atlantis and their past behind, they started on a quest to find a place sheltered by the fire and protected from the sea.","Zanechajúc umierajúcu Atlantídu a svoju minulosť za sebou, začali výpravu s cieľom nájsť miesto kryté ohňom a chránené pred morom.","scenario_atl01.wmf","../../data/campaigns/atl01.wmf/scripting/texts.lua:174"
"Atlantis","Atlantída","We left Atlantis and sailed east. We entered the forbidden sea on the sixth day without noticing any pursuers from Atlantis and without Lutas having smashed our ship. Now, we are out of his reach. One day later, we sighted an island which seems to have one of these fire spitting mountains on it. I deemed this a sign from the fire god and we landed on its shore.","Opustili sme Atlantídu a vyrazili na východ. V šiesty deň sme vstúpili do zakázaného mora bez toho, aby sme si všimli nejakých prenasledovateľov z Atlantídy a aby nám Lutas zdemoloval loď. Teraz sme za jeho dosahom. O deň nato sme spozorovali ostrov, na ktorom sa zdá byť jedna z tých hôr chrliacich oheň. Považovala som to za znamenie boha ohňa, a preto sme pristáli na jeho brehu.","scenario_atl01.wmf","../../data/campaigns/atl01.wmf/scripting/texts.lua:184"
"Atlantis","Atlantída","We spent the last week building two watchtowers on the mountains close to our landing area; and, of course, a hall for us all. We have very talented constructors in our group – still, the buildings do not match the art we had on Atlantis. I hope they will withstand the next rain. At least, the towers will warn us if a ship from Atlantis follows us and if the island is inhabited, we will see attackers a long time before they arrive.","Posledný týždeň sme strávili stavaním dvoch strážnych veží v horách neďaleko od miesta, kde sme sa vylodili, a, samozrejme, haly pre všetkých. V našej skupine máme veľmi talentovaných staviteľov – aj napriek tomu umenie našich budov nedosahuje úroveň toho, ktoré sme mali na Atlantíde. Dúfam, že odolajú ďalšiemu dažďu. Prinajmenšom nás veže varujú pred loďami z Atlantídy a ak je ostrov obývaný, útočníkov zbadáme dlho predtým, ako dorazia.","scenario_atl01.wmf","../../data/campaigns/atl01.wmf/scripting/texts.lua:187"
"Atlantis","Atlantída","May Satul warm you, Jundlina! I agree with what Loftomor proposes. We need a good supply of building materials for we have to expand our territory swiftly. I will not feel safe on this island as long as we have not seen all its shores. I brought plenty of good men from Atlantis. The military might is available. We only need some housing to live in.","Nech vás hreje Satul, Jundlína! Súhlasím s Loftomorovým návrhom. Budeme potrebovať dobrú zásobu stavebných materiálov, pretože si musíme rýchlo rozšíriť územie. Na tomto ostrove sa nebudem cítiť v bezpečí, kým nepreskúmame každý jeho breh. Priviedol som so sebou množstvo dobrých mužov z Atlantídy. Vojenská moc je k dispozícii. Potrebujeme len nejaký príbytok.","scenario_atl01.wmf","../../data/campaigns/atl01.wmf/scripting/texts.lua:209"
"Atlantis","Atlantída","May Satul warm you, Jundlina. My name is Opol, and I am the highest weaver of the guild abandoning Atlantis and Lutas with you. I come with sad news indeed: we have no more spidercloth. Not a single piece is to be found in our warehouses. Could you not help the weavers’ guild by arranging the building of a weaving mill and a spider farm? The spiders deliver the finest silk and we will produce the finest spidercloth from it.","Nech vás hreje Satul, Jundlína. Volám sa Opol a som najvyšším tkáčom v cechu, ktorý s vami opustil Atlantídu a Lutasa. Prichádzam vskutku so smutnou správou: došla nám pavúčia látka. V našich skladoch nenájdete ani jediný kúsok. Nepomohli by ste tkáčskemu cechu postavením tkáčovne a pavúčej farmy? Pavúky poskytujú to najlepšie vlákno a my z neho vyrobíme tú najlepšiu pavúčiu látku.","scenario_atl01.wmf","../../data/campaigns/atl01.wmf/scripting/texts.lua:268"
"Atlanteans","Atlantíďania","When their God lost faith in the Atlanteans and drowned their island, one woman’s struggle for justice and a second chance for her people would become the stuff of legends. Leading the remaining Atlanteans into a new future in a new part of the World, Jundlina became the most powerful human of her time, but at a high cost: her humanity and soul.","Keď boh stratil dôveru k Atlantíďanom a potopil ich ostrov, boj jednej ženy za spravodlivosť a druhú šancu pre jej ľud sa stal základom mnohých legiend. Vedúc zostávajúcich Atlantíďanov v ústrety novej budúcnosti v novej časti sveta, Jundlína sa stala najsilnejším človekom svojej doby, ale za vysokú cenu: jej ľudskosť a dušu.","maps","../../data/campaigns/campaigns.conf:48"
"Atlanteans","Atlantíďania","The clerics retreated into meditation and the reason for the rising water was soon to be found: the god Lutas had lost faith in the Atlanteans because of the boldness of their king. He decided to withdraw the rights that were granted to King Ajanthul and his children. And so, he called them back below the sea again.","Duchovní sa oddali rozjímaniu a čoskoro zistili dôvod, prečo voda stúpa: boh Lutas stratil dôveru k Atlantíďanom pre drzosť ich kráľa. Rozhodol sa stiahnuť práva, ktoré udelil kráľovi Ajanthulovi a jeho deťom. A preto ich opäť volá pod morskú hladinu.","scenario_atl01.wmf","../../data/campaigns/atl01.wmf/scripting/texts.lua:160"
"Atlanteans","Atlantíďania","Ahh, but I think this is impossible to change. The preparing and eating of food is something deeply ingrained in us Atlanteans – it is a ceremony that we just need for our well-being. So I guess we cannot take this away from the individuals completely.","Ach, nemyslím si však, že je to možné zmeniť. Príprava a jedenie jedla je niečo hlboko zakorenené v nás Atlantíďanoch – je to obrad, ktorý potrebujeme pre svoje blaho. Preto si myslím, že to nemožno jednotlivcom úplne vziať.","scenario_atl01.wmf","../../data/campaigns/atl01.wmf/scripting/texts.lua:237"
"Atlanteans","Atlantíďania","There are three different tribes in Widelands: the Barbarians, the Empire and the Atlanteans. All tribes have a different economy, strength and weaknesses, but the general gameplay is the same for all. We will play the Barbarians for now.","Hra Widelands ponúka tri odlišné kmene: Barbarov, Impérium a Atlantíďanov. Všetky kmene sa líšia ekonomikou, silnými či slabými stránkami, ale vo všeobecnosti zdieľajú rovnaké herné princípy. Zatiaľ budeme hrať za Barbarov.","scenario_tutorial01_basic_control.wmf","../../data/campaigns/tutorial01_basic_control.wmf/scripting/texts.lua:40"
"Atlanteans","Atlantíďania","Fish is one of the biggest food resources of the Atlanteans. It has to be smoked in a smokery before being delivered to mines, training sites and scouts.","Ryby sú jedným z najväčších zdrojov potravy Atlantíďanov. Pred dodaním baniam, výcvikovým stavbám a prieskumníkom sa musia sa vyúdiť v udiarni.","tribes_encyclopedia","../../data/tribes/wares/fish/helptexts.lua:4"
"Atlanteans","Atlantíďania","These advanced shields are used by the best soldiers of the Atlanteans. They are produced in the armor smithy and used in the labyrinth – together with food – to train soldiers from defense level 1 to level 2.","Tieto vylepšené štíty používajú tí najlepší atlantídski vojaci. Vyrábajú sa vo vyhni na zbroje a používajú sa v labyrinte – spolu s jedlom – na výcvik vojakov v obrane z úrovne 1 na úroveň 2.","tribes_encyclopedia","../../data/tribes/wares/shield_advanced/helptexts.lua:4"
"Barbarians","Barbari","After losing an important battle against the barbarians which lead to the loss of a big part of the Empire’s territory, Lutius leaves Fremil to start a new life. But his destiny takes his ship into a heavy storm, which nearly destroys it. Only with a lot of luck he manages to beach his damaged ship on an unknown desert strand and save his people. For now.","Porážka v dôležitej bitke proti barbarom, ktorá viedla k strate veľkej časti územia impéria, donútila Lutia opustiť Fremil a začať nový život. Osud však zavedie jeho loď do prudkej búrky, ktorá ju takmer zničí. S nemalým šťastím sa mu podarí so svojou poškodenou loďou nabehnúť na neznáme pusté pobrežie a zachrániť tak svoj ľud. Nateraz.","maps","../../data/campaigns/emp01.wmf/elemental:9"
"Barbarians","Barbari","Three weeks later, I returned to Fremil to speak with our king. He was furious at the Barbarians, yet forbade any attack on these tribes. He believed that our army was too weak to survive in a war against the Barbarians.","O tri týždne neskôr som sa vrátil do Fremilu, aby som hovoril s kráľom. Hoci zúril na Barbarov, napriek tomu zakázal na tieto kmene útočiť. Podľa neho bolo naše vojsko na boj s Barbarmi prislabé.","scenario_emp01.wmf","../../data/campaigns/emp01.wmf/scripting/texts.lua:90"
"Barbarians","Barbari","Still, I saw no way that I could erase my shame without fighting against these Barbarians. So, I left Fremil by boat to find a new world and a new life for myself, somewhere in the south. Now I am sailing on the Gulf of Perl with my family, some of my friends and a few of my best warriors.","Tú potupu by som však bez boja proti Barbarom nedokázal prekonať. Opustil som preto loďou Fremil a vydal sa hľadať pre seba nový svet a nový život, kdesi na juhu. Teraz sa, spolu s rodinou, niektorými mojimi priateľmi a najlepšími bojovníkmi, plavím po Perlskom zálive.","scenario_emp01.wmf","../../data/campaigns/emp01.wmf/scripting/texts.lua:93"
"Barbarians","Barbari","You have established a working economy, trained new soldiers and driven the Barbarians from the island.","Zriadili ste fungujúcu ekonomiku, vycvičili nových vojakov a vyhnali Barbarov z ostrova.","scenario_emp02.wmf","../../data/campaigns/emp02.wmf/scripting/texts.lua:269"
"Barbarians","Barbari","The message was addressed to me, begging me to come back to Fremil. It says that the Empire is at war with the Barbarians. They were attacked from the north by the tribe that I was forbidden to attack. It is clear to me what I must do…","Správa bola adresovaná mne a obsahovala prosbu, aby som sa vrátil do Fremilu. Píše sa v nej, že sa Impérium dostalo do vojny s Barbarmi. Napadol ich zo severu presne ten kmeň, na ktorý som mal zakázané útočiť. Je mi jasné, čo mám urobiť…","scenario_emp02.wmf","../../data/campaigns/emp02.wmf/scripting/texts.lua:287"
"Barbarians","Barbari","There are three different tribes in Widelands: the Barbarians, the Empire and the Atlanteans. All tribes have a different economy, strength and weaknesses, but the general gameplay is the same for all. We will play the Barbarians for now.","Hra Widelands ponúka tri odlišné kmene: Barbarov, Impérium a Atlantíďanov. Všetky kmene sa líšia ekonomikou, silnými či slabými stránkami, ale vo všeobecnosti zdieľajú rovnaké herné princípy. Zatiaľ budeme hrať za Barbarov.","scenario_tutorial01_basic_control.wmf","../../data/campaigns/tutorial01_basic_control.wmf/scripting/texts.lua:40"
"Barbarians","Barbari","The defense is the percentage that is subtracted from the attack value. The Barbarians cannot train in this skill and therefore have always defense level 0, which means that the damage is always reduced by %1%%%. If an attacker with an attack value of 3500 points hits a Barbarian soldier, the Barbarian will lose 3500·%2%%% = %3% health.","Obrana je percento, ktoré sa odráta z hodnoty útoku. Barbarov nemožno cvičiť v tejto schopnosti, preto ich obrana navždy zostane na úrovni 0, čo znamená, že škoda sa vždy zníži o %1% %%. Ak útočník s hodnotou útoku 3500 bodov zasiahne barbarského vojaka, ten Barbar príde o 3500·%2% %% = %3% bodov zdravia.","scenario_tutorial02_warfare.wmf","../../data/campaigns/tutorial02_warfare.wmf/scripting/texts.lua:52"
"Barbarians","Barbari","The initial setting depends on the type of the building. For the Barbarians, the sentry is the only building that prefers rookies by default. You should change this setting to fit your current needs.","Počiatočné nastavenie závisí od typu budovy. Jedinou barbarskou budovou, ktorá predvolene uprednostňuje nováčikov, je strážnica. Toto nastavenie by ste mali prispôsobiť svojim aktuálnym potrebám.","scenario_tutorial02_warfare.wmf","../../data/campaigns/tutorial02_warfare.wmf/scripting/texts.lua:135"
"Barbarians","Barbari","The Barbarian metal workshop is the basic production site in a series of three buildings and creates all the tools that Barbarians need. The others are for weapons.","Barbarská kovodielňa je základná produkčná stavba v sérii troch budov, ktorá vyrába všetky potrebné nástroje. Ostatné budovy slúžia na výrobu zbraní.","tribes_encyclopedia","../../data/tribes/buildings/productionsites/barbarians/metal_workshop/helptexts.lua:18"
"Barbarians","Barbari","The ax is the basic weapon of the Barbarians. All young soldiers are equipped with it.","Sekera je základnou zbraňou Barbarov, ktorou je vyzbrojený každý mladý vojak.","tribes_encyclopedia","../../data/tribes/wares/ax/helptexts.lua:4"
"Barbarians","Barbari","Only this beer is acceptable for the soldiers in a battle arena. Some say that the whole power of the Barbarians lies in this ale. It helps to train the soldiers’ evade level from 0 to 1 to 2. Strong beer is also used in big inns to prepare meals.","Vojaci v zápasníckej aréne pripúšťajú len toto pivo. Hovorí sa, že sa v ňom ukrýva celá sila Barbarov. Pomáha pri výcviku vojakov v uhýbaní z úrovne 0 na 1 a na 2. Silné pivo sa tiež používa na prípravu obedov vo veľkých hostincoch.","tribes_encyclopedia","../../data/tribes/wares/beer_strong/helptexts.lua:4"
"Barbarians","Barbari","Besides pitta bread and meat, fish is also a foodstuff for the Barbarians. It is used in the taverns, inns and big inns and at the training sites (training camp and battle arena).","Okrem pity a mäsa patria medzi potraviny Barbarov aj ryby. Používajú sa v krčmách, hostincoch a veľkých hostincoch, ako aj vo výcvikových stavbách (výcvikový tábor a zápasnícka aréna).","tribes_encyclopedia","../../data/tribes/wares/fish/helptexts.lua:6"
"Chat’Karuth","Chat’Karuth","Thron seeks to believe that Kalitath is tired of fighting and would be willing to join us once we march to re-establish law and order in Al’thunran. But I don’t think so. Kalitath is son to one of the mightiest generals of our forces and his family never quite liked the thought of bowing before the banner of Chat’Karuth. Why should he march with Chat’Karuth’s son to reclaim his heritage and the throne?","Thron verí, že Kalitath je unavený z bojov a bude ochotný pripojiť sa k nám pri pochode za nastolenie práv a poriadku v Al'thunran. Ale ja si to nemyslím. Kalitath je synom jedného z najmocnejších generálov našej armády a jeho rodine sa nikdy nepáčila myšlienka klaňať sa pred Chat'Karuthovou zástavou. Prečo by mal pochodovať s jeho synom, aby získal späť jeho dedičstvo a trón?","scenario_bar02.wmf","../../data/campaigns/bar02.wmf/scripting/texts.lua:184"
"Main Menu","Hlavné menu","It seems like you destroyed a construction site for a quarry we wanted to build. Since we need the granite, I suggest you reload the game from a previous savegame. Luckily, these are created from time to time. To do so, you have to go back to the main menu and choose ‘Single Player’ → ‘Load Game’. And please be a bit more careful next time.","Zdá sa, že ste zničili stavenisko kameňolomu, ktorý sme chceli postaviť. Keďže potrebujeme žulu, odporúčam, aby ste načítali predošlú uloženú hru. Hra sa, našťastie, z času na čas ukladá automaticky. Vráťte sa do hlavného menu a kliknite na „Jeden hráč“ → „Načítať hru“. A nabudúce si, prosím vás, dajte väčší pozor.","scenario_tutorial01_basic_control.wmf","../../data/campaigns/tutorial01_basic_control.wmf/scripting/texts.lua:331"
"Main Menu","Hlavné menu","To leave this game and return to the main menu, click on the","Ak chcete opustiť hru a vrátiť sa do hlavého menu, kliknite na","scenario_tutorial01_basic_control.wmf","../../data/campaigns/tutorial01_basic_control.wmf/scripting/texts.lua:481"
"Main Menu","Hlavné menu","Using the Watch Replay option in the main menu, a previously played game will be precisely reconstructed for you to watch. Note, however, that even small changes in the game data files or the Widelands executable can cause a replay to become incompatible and to ‘go out of sync’. This is similar to how network games will suffer from desynchronization problems if one of the players has a different version of the game.","Možnosť „Sledovať záznam“ v hlavnej ponuke vám umožňuje prehrať predošlú hru v presne rovnakej podobe, ako bola hraná. Všimnite si však, že aj malé zmeny v herných dátových súboroch alebo spúšťači Widelands môžu spôsobiť stratu kompatibility alebo synchronizácie záznamu. Je to, ako keď v sieťovej hre nastanú synchronizačné problémy pre odlišnú verziu hry jedného z hráčov.","texts","../../data/txts/help/common_helptexts.lua:27"
