"glossary_term","glossary_translation","source","target","file","location"
"resources","grondstoffen","Use the river wisely. Your opponents will do the same. You will find the main ore resources deep in the desert.","Gebruik de rivier verstandig – je tegenstanders zullen hetzelfde doen.  De belangrijkste vindplaatsen voor ertsen liggen diep in de woestijn.","maps","../../data/maps/The_Nile.wmf/elemental:11"
"resources","grondstoffen","When the wind swelled up and the first dunes were formed on these abandoned twin lagoons, nobody could have expected that two tribes that are desperately searching for more resources to support their endlessly ongoing wars, would end up in this forgotten place at the same time and for the same well-known reason.","Toen de wind aanzwol en de eerste duinen werden gevormd op deze afgelegen tweelinglagunes had niemand kunnen vermoeden dat twee stammen, wanhopig op zoek naar meer delfstoffen om hun eindeloze oorlogen te ondersteunen, terecht zouden komen op deze vergeten plek op hetzelfde moment en om dezelfde bekende reden.","maps","../../data/maps/Twin_Lagoons.wmf/elemental:10"
"resources","grondstoffen","Build a forester’s house to preserve the wood resources of this island.","Bouw een boswachterhuis om de beschikbaarheid van hout op het eiland te behouden.","scenario_emp01.wmf","../../data/campaigns/emp01.wmf/scripting/texts.lua:55"
"resources","grondstoffen","To make matters even worse, all the land we can see is blocked by rocks and trees. I fear we won’t find the resources we need to build a new ship.","En wat het nog erger maakt, zover het oog reikt is al het land ingenomen door rotsen en bomen. Ik vrees dat we niet aan de materialen zullen geraken die we nodig hebben om een nieuw schip te bouwen.","scenario_emp03.wmf","../../data/campaigns/emp03.wmf/scripting/texts.lua:218"
"resources","grondstoffen","Now that we have all resources ready for building a ship, we should explore the surrounding islands.","Nu we alle benodigdheden klaarhebben om een schip te bouwen zouden we de omliggende eilanden moeten verkennen.","scenario_emp03.wmf","../../data/campaigns/emp03.wmf/scripting/texts.lua:415"
"resources","grondstoffen","Excuse me Lutius, but I think the most critical resources in the current state of our economy are logs.","Sorry Lutius, maar ik denk dat boomstammen nu de meest kritische grondstof in onze economie zijn.","scenario_emp04.wmf","../../data/campaigns/emp04.wmf/scripting/texts.lua:563"
"resources","grondstoffen","Dismantling the quarry: A builder will walk from the headquarters to dismantle the quarry piece by piece. Thereby, you regain some of the resources you used for the construction.","Je kan de steengroeve ontmantelen: het hoofdkwartier zal een bouwvakker sturen om de steengroeve stukje bij beetje te ontmantelen.  Op die manier kan je een deel van de geïnvesteerde bouwmaterialen terugwinnen.","scenario_tutorial01_basic_control.wmf","../../data/campaigns/tutorial01_basic_control.wmf/scripting/texts.lua:545"
"resources","grondstoffen","The citadel can house 12 soldiers, and it is the biggest military building the Barbarians can build. It also costs a lot of resources and takes a long time to build. It is most suited to guard strategically important points like constricted points or mountains.","Een citadel kan twaalf soldaten huisvesten, het is het grootste militaire gebouw waarover de Barbaren beschikken.  Het kost ook veel materialen en heeft veel tijd nodig om te bouwen.  De citadel is best geschikt om gebieden van strategisch belang te bewaken, zoals nauwe doorgangen of bergen.","scenario_tutorial02_warfare.wmf","../../data/campaigns/tutorial02_warfare.wmf/scripting/texts.lua:252"
"resources","grondstoffen","In this game, you start out on a small piece of land with just a few resources. Using these, you’ll create an empire with many thousands of inhabitants. On your way towards this goal, you will have to establish an economic infrastructure, explore the land around you and face rivaling tribes.","Je begint in dit spel op een klein stuk land met slechts enige voorraden. Door deze te benutten zul je een imperium creëren met vele duizenden inwoners. Op jouw weg naar dit doel moet je een efficiënte infrastructuur neerzetten, het land om je heen verkennen en rivaliserende stammen het hoofd bieden.","texts","../../data/txts/help/common_helptexts.lua:21"
"resources","grondstoffen","Keep an eye on your fishers and build a fish breeder’s house. After fish resources are exhausted in their work area, the fish supply cannot be regenerated.","Let goed op je vissers en bouw een viskwekerij. Als de visreserve in hun werkgebied is uitgeput kan je die niet meer terug aanvullen.","texts","../../data/txts/tips/atlanteans.lua:4"
"resources","grondstoffen","Keep an eye on your fishers. After fish resources are exhausted in their work area, they will stop fishing.","Let goed op je vissers. Als de visreserves zijn uitgeput in het werkgebied zal de productie stoppen.","texts","../../data/txts/tips/barbarians.lua:4 ../../data/txts/tips/empire.lua:4"
"resources","grondstoffen","Fish is one of the two major food resources of the Amazons. It is used by the food preserver to prepare rations for the workers digging for gold dust and granite. It is also consumed at the training sites (training glade and warriors’ gathering) and for recruiting new soldiers.","Vis is een van de twee basis voedselbronnen voor de Amazons. Het wordt gebruikt door de voedsel inmaker om rantsoenen te bereiden voor de werkers die naar goudstof en graniet graven. Het wordt ook genuttigd op de trainingsplekken (trainingsbaan en de krijgers verzamelplek) en om nieuwe soldaten te ronselen.","tribes_encyclopedia","../../data/tribes/initialization/amazons/units.lua:223"
"resources","grondstoffen","Fish is one of the biggest food resources of the Atlanteans. It has to be smoked in a smokery before being delivered to mines, training sites and scouts.","Vis is één van de grootste voedselbronnen voor de Atlantiërs. Het moet worden gerookt in een rokerij voordat het naar de mijnen, trainingsgebouwen en verkenners gaat.","tribes_encyclopedia","../../data/tribes/initialization/atlanteans/units.lua:476"
"resources","grondstoffen","Discovers resources for mining.","Ontdekt delfstoffen voor mijnbouw.","tribes_encyclopedia","../../data/tribes/initialization/atlanteans/units.lua:1038"
"resources","grondstoffen","Discovers resources for mining.","Ontdekt delfstoffen voor mijnbouw.","tribes_encyclopedia","../../data/tribes/initialization/barbarians/units.lua:698"
"resources","grondstoffen","Discovers resources for mining.","Ontdekt delfstoffen voor mijnbouw.","tribes_encyclopedia","../../data/tribes/initialization/empire/units.lua:766"
"resource","grondstoffen","Fish is a very important food resource for the Frisians. It is fished from the shore or reared in aqua farms.","Vis is voor de Friezen een zeer belangrijke voedselbron. Het wordt vanaf de kust gevist of gekweekt door vistelers.","tribes_encyclopedia","../../data/tribes/initialization/frisians/units.lua:242"
"resources","grondstoffen","Discovers resources for mining.","Ontdekt delfstoffen voor mijnbouw.","tribes_encyclopedia","../../data/tribes/initialization/frisians/units.lua:825"
"plot","grondvlak","The sentry is the only military site that fits on a small building plot. If your lumberjack has cleared enough space, you can also build a bigger military building.","De wachtpost is het enige militaire gebouw dat op een kleine bouwlocatie past.  Als je houthakker al voldoende ruimte heeft vrijgemaakt kan je ook een groter militair gebouw neerzetten.","scenario_tutorial01_basic_control.wmf","../../data/campaigns/tutorial01_basic_control.wmf/scripting/texts.lua:568"
"plot","grondvlak","Remember that big buildings (green icon) cannot be built on small (red) or medium (yellow) building plots, but buildings can be built on a building plot that provides more space than they need. You should always keep that in mind when you search for a suitable place.","Denk eraan dat je op kleine (rood symbool) of middelgrote (geel) bouwlocaties geen grote gebouwen (groen) kan zetten, maar een kleiner gebouw past wel op een bouwlocatie die ruimer is dan nodig.  Hou dat in het achterhoofd als je op zoek gaat naar een geschikte plek.","scenario_tutorial01_basic_control.wmf","../../data/campaigns/tutorial01_basic_control.wmf/scripting/texts.lua:569"
"port space","havenlocatie","When you have found a suitable port space, build a port there.","Bouw een haven zodra je er een geschikte plek voor gevonden hebt.","scenario_tutorial03_seafaring.wmf","../../data/campaigns/tutorial03_seafaring.wmf/scripting/texts.lua:202"
"inns","herbergen","A real meal is made in inns out of bread and fish/meat. It satisfies the needs of miners in deep mines.","Een echt maal wordt in de herberg gemaakt met brood en vis of vlees. Het vult de magen van de mijnwerkers in de diepe mijnen.","tribes_encyclopedia","../../data/tribes/initialization/empire/units.lua:273"
"idle","inactief","As you can see, it is not that hard. When you build a waterway, the closest idle ferry will assign itself to it.","Zoals je ziet is het niet zo moeilijk. Wanneer je een waterweg aanlegt, wordt de dichtstbijzijnde vrije veerboot eraan toegewezen.","scenario_tutorial03_seafaring.wmf","../../data/campaigns/tutorial03_seafaring.wmf/scripting/texts.lua:305"
"idle","inactief","Seafaring: Show Idle Ships","Zeevaart: Laat niet gebruikte schepen zien","widelands","../../src/wlapplication_options.cc:659"
"interface","interface","The ‘General’ tab contains information about all the basic interface controls for Widelands. Furthermore, you can find tips that are relevant for your tribe there.","In het tabblad ‘Algemeen’ staat informatie over de basisbediening van Widelands. Je vindt er ook tips die voor jouw stam relevant zijn.","scenario_tutorial04_economy.wmf","../../data/campaigns/tutorial04_economy.wmf/scripting/texts.lua:283"
"map","kaart","Remember that the map has rotational symmetry. For example, when you have found a spot to the top-left of your headquarters, the corresponding spot will be to the bottom-right of the headquarters of your team mate.","Onthoud dat de map een roteerbare symmetrie heeft: Als je een plek linksboven je hoofdkwartier hebt gevonden, dan zal de corresponderende plek zich rechtsonder het hoofdkwartier van je teamgenoot bevinden.","mp_scenario_smugglers.wmf","../../data/maps/MP_Scenarios/Smugglers.wmf/scripting/texts.lua:16"
"map","kaart","Do you really want to delete the map ‘%s’?","wil je echt de map ' %s '  verwijderen ?","widelands","../../src/ui_fsmenu/addons/packager_box.cc:441"
"small","klein","The whimsical Gods didn’t answer our prayers. Instead, the increasing sunlight heated up the Earth a thousandfold and melted glaciers and people were plunged into the deep. But now – high in the majestic mountains, on the last scrap of land – two surviving tribes are sheltering. Even though the Gods showed mercy and the climate thus turned cooler again, the water is still rising and rising. Onto the last secure place – the highest mountain range where the amount of gold and the space to live merely suffice for one tribe – only two opposite paths lead. But remember, be careful… this last living space is also a hard and small place to live.","Guitige Goden verhoorden onze gebeden niet.  Integendeel: de hetere Zon verwarmde de aarde duizendmaal en smolt de gletsjers en gooide mensen in het diepe.  Maar nu – hoog in de majestueuze bergen, op het laatste strookje land – hebben twee overlevende stammen onderdak gevonden.  Hoewel de Goden genade toonden en het klimaat lieten afkoelen, is het water nog steeds aan het stijgen en stijgen.  Naar de laatste veilige plek – de hoogste bergketen waar de goudvoorraad en de ruimte net volstaan voor één stam – leiden slechts twee tegengestelde paden.  Maar denk eraan: wees voorzichtig…  Deze laatste leefruimte is ook een harde en benauwde plek om te leven.","maps","../../data/maps/Last_Bastion.wmf/elemental:10"
"click","klik","Then, to move the marble columns out of your headquarters, you will have to click on the remove button there.","Om daarna alle marmerzuilen uit je hoofdkwartier te verhuizen, druk je op de knop om ze te verwijderen.","scenario_tutorial04_economy.wmf","../../data/campaigns/tutorial04_economy.wmf/scripting/texts.lua:526"
"button","knop","The second one is the more common and faster one: press-and-hold the right mouse button anywhere on the map, then move your mouse around and you’ll see the view scroll.","De tweede wordt meer gebruikt en is sneller: klik ergens op de kaart met rechts, houd ingedrukt en beweeg de muis, en je zal het scherm zien verschuiven.","scenario_tutorial01_basic_control.wmf","../../data/campaigns/tutorial01_basic_control.wmf/scripting/texts.lua:245"
"warehouses","magazijnen","Although ports act as warehouses, you should not build more than necessary: they cost quartz, diamonds and gold, which makes them quite expensive.","Hoewel havens dienstdoen als magazijn bouw je er best niet meer dan nodig: ze kosten kwarts, diamanten en goud en zijn daardoor erg duur.","scenario_tutorial03_seafaring.wmf","../../data/campaigns/tutorial03_seafaring.wmf/scripting/texts.lua:65"
"warehouses","magazijnen","You get points for precious wares in your warehouses. The player with the highest number of wares at the end of 4 hours wins the game.","Je krijgt punten voor waardevolle goederen in je opslagplaatsen. Na vier uur wint de speler met het hoogste aantal goederen het spel.","win_conditions","../../data/scripting/win_conditions/collectors.lua:20"
"warehouses","magazijnen","The tribe or team that can defeat all others wins the game! This means the opponents do not have any headquarters, ports or warehouses left.","De stam of team die alle andere verslaat wint het spel! Dit betekend dat de tegenstanders geen enkel hoofdkwartier, haven of pakhuis meer over hebben.","win_conditions","../../data/scripting/win_conditions/defeat_all.lua:17"
"medium","middelgroot","After the production of enough wheat, we can dismantle the farm and build a sheep farm to produce wool. When the sheep farm starts working, we could find or free up space for a medium building to build a weaving mill to use our wool for weaving cloth. But for the moment being, let’s start by producing a reasonable amount of wheat.","Na het verbouwen van voldoende graan kunnen we de boerderij afbreken en een schaapskooi bouwen om wol te produceren. Zodra de schaapskooi werkt kunnen we een stukje grond zoeken of vrij maken, voor een gemiddeld gebouw, om een weverij te bouwen zodat we de wol kunnen gebruiken om kleding te weven. Maar voor het moment daar gelaten, laten we beginnen door eerst een behoorlijke hoeveelheid graan te verbouwen.","scenario_emp03.wmf","../../data/campaigns/emp03.wmf/scripting/texts.lua:375"
"medium","middelgroot","The chain armor is a medium armor for Empire soldiers. It is produced in an armor smithy and used in a training camp – together with food – to train soldiers from health level 2 to level 3.","De maliënkolder is een middelsterk harnas voor soldaten van het Imperium. Hij wordt gemaakt in de harnassmederij en wordt gebruikt in het trainingskamp - samen met voedsel - om soldaten te trainen van levenspuntenniveau 2 naar 3.","tribes_encyclopedia","../../data/tribes/initialization/empire/units.lua:577"
"mine","mijn","A friend of mine explored the island on his own and he told me of a big lake at the top of the mountain. I suggest we build the ships in this lake and wait until the island drowns beneath us. Then we can sail away. It is a bold plan, but I think it could work.","Een vriend van mij heeft het eiland zelfstandig verkend en vertelde me van een groot meer bovenop de berg. Ik stel voor dat we de schepen in dit meer bouwen en wachten totdat het eiland onder ons vandaan zinkt. Dan kunnen we weg zeilen. Het is een gedurfd plan, maar ik denk dat het kan werken.","scenario_atl01.wmf","../../data/campaigns/atl01.wmf/scripting/texts.lua:468"
"mine","mijn","Sire, I’ve got good news for you: As I walked to the east, I found a larger mountain. I am not absolutely sure – a geologist should check if I am right – but I believe we could mine marble from some places on the mountain.","Sire, ik heb goed nieuws voor u: toen ik naar het oosten liep, vond ik een grotere berg. Ik weet het niet helemaal zeker, een geoloog moet maar kijken of ik gelijk heb, maar ik denk dat we marmer kunnen uitgraven op enkele plaatsen in de berg.","scenario_emp02.wmf","../../data/campaigns/emp02.wmf/scripting/texts.lua:182"
"mine","mijn","Our wood and reed supplies are ensured. Now, we must take care of our brick supply. Bricks are burned in a brick kiln out of granite and clay, so we first need to produce those. On the mainland, we used to cut granite out of rocks, but I don’t see any here. Perhaps these hills contain enough stones to mine some granite.","Onze hout- en rietaanvoer zijn verzekerd. Nu moeten we zorgen voor onze steenaanvoer. Bakstenen worden in een steenoven gebakken uit graniet en klei, dus die moeten we eerst produceren. Op het vasteland hakten we graniet uit rotsen, maar ik zie er hier geen. Misschien bevatten deze heuvels genoeg stenen om wat graniet te delven.","scenario_fri01.wmf","../../data/campaigns/fri01.wmf/scripting/texts.lua:163"
"mine","mijn","We must start by building all the basic buildings. I see no mountains nearby where we might mine coal. We’d better build a charcoal kiln to burn logs into charcoal. We improve the kilns with clay so they don’t consume so much wood. Our neighbors used to envy us for this clever technique, which they couldn’t copy.","We moeten beginnen met het bouwen van alle basisgebouwen. Ik zie geen bergen in de buurt waar we kolen kunnen winnen. We kunnen beter een houtskoolmeiler bouwen om boomstammen te verbranden tot houtskool. We verbeteren de ovens met klei zodat ze niet zoveel hout verbruiken. Onze buren waren jaloers op ons voor deze slimme techniek, die ze niet konden kopiëren.","scenario_fri02.wmf","../../data/campaigns/fri02.wmf/scripting/texts.lua:163"
"mine","mijn","There is one more thing I’d like to teach you now: Expanding your territory. The place that we started with around our headquarters is barely enough for a basic building infrastructure, and we do not have access to mountains, which we need to mine minerals and coal. So, we have to expand our territory.","Er is nog één ding dat ik je nu wil onderwijzen: het uitbreiden van je grondgebied.  De ruimte rond het hoofdkwartier waar we mee gestart zijn volstaat nauwelijks om een elementaire bouwinfrastructuur op te zetten, en we hebben geen toegang tot de bergen die we nodig hebben om mineralen en kolen te delven.  Dus moeten we ons terrein uitbreiden.","scenario_tutorial01_basic_control.wmf","../../data/campaigns/tutorial01_basic_control.wmf/scripting/texts.lua:576"
"mine","mijn","Look at this valley here in the far south. We have found a mountain with gold down here and would like to mine ores from it as well. But the streams separating it from our main colony are too wide to build bridges and too narrow for ships to pass them. Our roads would have to take long curves, which slows down ware transport a lot.","Kijk naar deze vallei hier in het verre zuiden. We hebben een berg vol met goud gevonden en willen graag het gouderts ontginnen. Maar de stromingen die ons afscheiden van de hoofdkolonie zijn te wijd om bruggen over te bouwen maar te smal om er met een schip door te varen. Onze weg zal veel omleidingen moeten hebben wat het vervoer van goederen erg gaat vertragen.","scenario_tutorial03_seafaring.wmf","../../data/campaigns/tutorial03_seafaring.wmf/scripting/texts.lua:248"
"watchwindow","observatievenster","Use single watchwindow mode","Gebruik één venster met tabs voor aparte observatie","widelands","../../src/ui_fsmenu/options.cc:270"
"dismantle","ontmantelen","After the production of enough wheat, we can dismantle the farm and build a sheep farm to produce wool. When the sheep farm starts working, we could find or free up space for a medium building to build a weaving mill to use our wool for weaving cloth. But for the moment being, let’s start by producing a reasonable amount of wheat.","Na het verbouwen van voldoende graan kunnen we de boerderij afbreken en een schaapskooi bouwen om wol te produceren. Zodra de schaapskooi werkt kunnen we een stukje grond zoeken of vrij maken, voor een gemiddeld gebouw, om een weverij te bouwen zodat we de wol kunnen gebruiken om kleding te weven. Maar voor het moment daar gelaten, laten we beginnen door eerst een behoorlijke hoeveelheid graan te verbouwen.","scenario_emp03.wmf","../../data/campaigns/emp03.wmf/scripting/texts.lua:375"
"dismantle","ontmantelen","Well done so far. We have produced enough wheat. Now dismantle the farm and build the next building in the production chain.","Dat is al goed gedaan, we hebben voldoende tarwe. Ontmantel nu de boerderij en zet het volgende gebouw in de productieketen.","scenario_emp03.wmf","../../data/campaigns/emp03.wmf/scripting/texts.lua:398"
"dismantle","ontmantelen","If there are difficulties with building all the buildings needed, we should think about all we have learned so far. We can cut down all the rocks. We should perhaps optimize our roads to free up some building sites, or even dismantle some military buildings to obtain more space for our economy.","Als er moeilijkheden opduiken om al die gebouwen te plaatsen moeten we terugdenken aan alles wat we al geleerd hebben. We kunnen alle rotsen uithouwen. Ons wegennetwerk zouden we kunnen verbeteren om bouwlocaties vrij te maken, en eventueel kunnen we militaire gebouwen slopen om onze economie meer plaats te geven.","scenario_emp03.wmf","../../data/campaigns/emp03.wmf/scripting/texts.lua:450"
"dismantle","ontmantelen","For example, it might be a good idea to produce a reasonable amount of a ware and afterwards dismantle the building to gain space for another building.","Zo kan het een goed idee zijn om een bepaalde hoeveelheid van een goed te produceren en daarna het gebouw af te breken om plaats te maken voor een ander.","scenario_emp03.wmf","../../data/campaigns/emp03.wmf/scripting/texts.lua:489"
"dismantle","ontmantelen","Brother, I’m really worried that I have to deliver bad news again. As you can see, our farms aren’t producing anything and we can’t dismantle them.","Broeder, het bezorgt mij dat ik weer slecht nieuws moet brengen. Zoals je kunt zien, produceren onze boerderijen niets en kunnen we ze niet afbreken.","scenario_emp04.wmf","../../data/campaigns/emp04.wmf/scripting/texts.lua:333"
"dismantle","ontmantelen","This situation was caused by the sad fact that our people lost the instructions on how to construct and operate farms. Therefore they have zero productivity and the constructors don’t know how to dismantle them either.","Deze toestand is het gevolg van het trieste feit dat onze mensen de vaardigheden om boerderijen te bouwen en te beheren kwijt zijn geraakt. Daarom hebben ze geen productiviteit en weten onze bouwvakkers niet hoe ze uit elkaar te halen.","scenario_emp04.wmf","../../data/campaigns/emp04.wmf/scripting/texts.lua:336"
"dismantle","ontmantelen","A building is being dismantled at this dismantle site, returning some of the resources that were used during this building’s construction to your tribe’s stores.","Op deze ontmantelingswerf wordt een gebouw gedemonteerd, waardoor een deel van de grondstoffen die tijdens de bouw van dit gebouw zijn gebruikt, teruggaat naar de voorraad van je stam.","tribes_encyclopedia","../../data/tribes/initialization/amazons/units.lua:1629 ../../data/tribes/initialization/atlanteans/units.lua:2015 ../../data/tribes/initialization/barbarians/units.lua:1804 ../../data/tribes/initialization/empire/units.lua:2275 ../../data/tribes/initialization/frisians/units.lua:2202"
"dismantle","ontmantelen","If built directly, dismantle yields:","Indien direct gebouwd, sloopopbrengsten:","tribes_encyclopedia","../../data/tribes/scripting/help/building_help.lua:734"
"dismantle","ontmantelen","If enhanced, dismantle yields:","Indien verbeterd, sloopopbrengsten:","tribes_encyclopedia","../../data/tribes/scripting/help/building_help.lua:739"
"harvesting","oogsten","I noticed that the construction of the sawmill is complete, so we can begin to refine the logs that the lumberjacks are harvesting into planks.","Ik zag dat de bouw van de houtzagerij voltooid is, dus we kunnen beginnen de stammen die de houthakkers hebben geoogst te verwerken tot planken.","scenario_emp01.wmf","../../data/campaigns/emp01.wmf/scripting/texts.lua:183"
"harvesting","oogsten","Line from the harvesting song ‘The Wealth of the Fields’","Regel uit het oogstlied ‘De Rijkdom van de Velden’","tribes_encyclopedia","../../data/tribes/initialization/barbarians/units.lua:1476"
"save","opslaan","After losing an important battle against the barbarians which lead to the loss of a big part of the Empire’s territory, Lutius leaves Fremil to start a new life. But his destiny takes his ship into a heavy storm, which nearly destroys it. Only with a lot of luck he manages to beach his damaged ship on an unknown desert strand and save his people. For now.","Na een belangrijke slag te hebben verloren tegen de barbaren, waardoor een groot deel van het Imperiaal territorium verloren ging, verliet Lutius Fremil om een nieuw leven te beginnen.  Maar het lot leidde zijn schip in een zware storm die hen bijna deed vergaan.  Slechts met veel geluk slaagt hij erin om zijn beschadigde schip op een onbekende woestijnkust te doen stranden en zijn mensen te redden. Voorlopig toch.","maps","../../data/campaigns/emp01.wmf/elemental:9"
