"glossary_term","glossary_translation","source","target","file","location"
"Ferry","Veerbootkapitein","And if your waterways present a significant shortcut between your road networks, your economy will tend to send many wares over the waterway. As a waterway can hold only one ferry – unlike roads, which receive a second carrier if they are very busy –, and as they often tend to be rather longer than the two or three fields recommended for roads, there is always a risk of waterways becoming severe bottlenecks in your economy. Try to build several of them in parallel to distribute the strain. If this is not possible, it is in some cases even more efficient not to use waterways.","En wanneer waterwegen aanzienlijk korter zijn dan dezelfde route over land, zullen veel waren over de waterwegen worden vervoerd. Omdat een waterweg slechts één veerboot kan bevatten – in tegenstelling tot wegen, die een tweede drager ontvangen als ze het erg druk hebben – en omdat ze vaak langer zijn dan de twee of drie velden die worden aanbevolen voor wegen, bestaat er altijd een risico dat waterwegen ernstige knelpunten in je economie worden. Probeer er meerdere parallel te bouwen om de belasting te verdelen. Als dit niet mogelijk is, is het in sommige gevallen zelfs efficiënter om geen waterwegen te gebruiken.","scenario_tutorial03_seafaring.wmf","../../data/campaigns/tutorial03_seafaring.wmf/scripting/texts.lua:328"
"Ferry","Veerbootkapitein","Do remember to stop your ferry yard when you don’t need any new ferries to be produced. As long as a ferry services a waterway, its lifetime is unlimited, but unemployed ferries will rot away and eventually sink.","Denk eraan dat je de productie van veerboten stillegt als je er genoeg hebt. Veerboten die regelmatig worden gebruikt slijten niet, maar ongebruikte veerboten zullen wegrotten en uiteindelijk zinken.","scenario_tutorial03_seafaring.wmf","../../data/campaigns/tutorial03_seafaring.wmf/scripting/texts.lua:338"
"Ferry Yard","Veerbootwerf","Do remember to stop your ferry yard when you don’t need any new ferries to be produced. As long as a ferry services a waterway, its lifetime is unlimited, but unemployed ferries will rot away and eventually sink.","Denk eraan dat je de productie van veerboten stillegt als je er genoeg hebt. Veerboten die regelmatig worden gebruikt slijten niet, maar ongebruikte veerboten zullen wegrotten en uiteindelijk zinken.","scenario_tutorial03_seafaring.wmf","../../data/campaigns/tutorial03_seafaring.wmf/scripting/texts.lua:338"
"Scout","Verkenner","A small bite to keep the workers digging for gold dust and granite strong and working. The scout also consumes rations on her scouting trips.","Een klein hapje om de werkers die goudstof en graniet zoeken fit en aan het werk te houden. De scout eet ook rantsoen tijdens haar verkenningstochten.","tribes_encyclopedia","../../data/tribes/initialization/amazons/units.lua:246"
"Fortress","Vesting","The mountains have an abundance of flat ground. Unfortunately, most of it is vertical – use the little building space you have wisely. A fortress at the mouth of a narrow mountain pass can be a formidable obstacle to an enemy army – use the terrain to your advantage. Chop all trees and expand wherever you can – it’s the only way to find all the precious farm spaces.","Aan de bergen ontbreekt het vlakke grond. Erger nog, het meeste is vertikaal – gebruik het kleine beetje bouw ruimte dat je hebt wijselijk. Een kasteel aan het begin van een smalle bergpas kan een enorm obstakel zijn voor een vijandelijk leger – gebruik je omgeving in je voordeel. Kap alle bomen en breidt uit waar je kan – het is je enige mogelijkheid om die kostbare landbouwgrond te vinden.","maps","../../data/maps/Dolomites.wmf/elemental:11"
"Fortress","Vesting","Still, it would not hurt to accumulate some grout for our further campaign; thus we could, in times of need, build a fortress such as the world has never seen before!","Toch zou het niet schaden om wat mortel te produceren voor onze verdere campagne; dan zouden we, als we het nodig hebben, een fort kunnen bouwen zoals de wereld nog nooit gezien heeft!","scenario_bar01.wmf","../../data/campaigns/bar01.wmf/scripting/texts.lua:452"
"Fortress","Vesting","I have sent men to meet with Kalitath in his fortress. He has barricaded the former main entrance to the capital and is trying to set up a siege ring around Al’thunran. He will not let anyone enter or leave the city while the ring is intact. Until now, he has not answered any of my messages. But the time I spend waiting won’t be lost. I will train my soldiers further and prepare for battle.","Ik heb mensen gestuurd om met Kalitath te praten in zijn burcht. Hij heeft de voormalige toegang tot de hoofdstad gebarricadeerd en probeert een belegeringsring rond Al’thunran op te zetten. Hij zal niemand de stad in of uit laten gaan zolang de ring intact is. Tot nu heeft hij nog geen van mijn berichten beantwoord. Maar de tijd die ik wacht zal niet verloren zijn. Ik zal mijn soldaten verder trainen en me klaar maken voor de strijd.","scenario_bar02.wmf","../../data/campaigns/bar02.wmf/scripting/texts.lua:202"
"Fortress","Vesting","Your fortress discovered an aggressor.","Jouw fort heeft een aanvaller ontdekt.","tribes","../../data/tribes/buildings/militarysites/amazons/fortress/init.lua:61"
"Fortress","Vesting","Your fortress is under attack.","Jouw fort is onder aanval.","tribes","../../data/tribes/buildings/militarysites/amazons/fortress/init.lua:63"
"Fortress","Vesting","Your fortress discovered an aggressor.","Jouw fort ontdekte een aanvaller.","tribes","../../data/tribes/buildings/militarysites/barbarians/fortress/init.lua:79"
"Fortress","Vesting","Your fortress is under attack.","Jouw fort is onder aanval.","tribes","../../data/tribes/buildings/militarysites/barbarians/fortress/init.lua:81"
"Fortress","Vesting","Your fortress discovered an aggressor.","Jouw fort heeft een aanvaller ontdekt.","tribes","../../data/tribes/buildings/militarysites/empire/fortress/init.lua:75"
"Fortress","Vesting","Your fortress is under attack.","Jouw fort is onder aanval.","tribes","../../data/tribes/buildings/militarysites/empire/fortress/init.lua:77"
"Fortress","Vesting","Your fortress discovered an aggressor.","Jouw fort heeft een aanvaller ontdekt.","tribes","../../data/tribes/buildings/militarysites/frisians/fortress/init.lua:60"
"Outpost","Voorpost","On this island, we will start our new life. We will build up an outpost for our exile, which perhaps will become a new, beautiful home for every one of us.","Op dit eiland zullen we ons nieuwe leven beginnen. We zullen een thuishaven in ballingschap bouwen, die wellicht ooit een nieuw en mooi thuis zal bieden aan eenieder van ons.","scenario_emp02.wmf","../../data/campaigns/emp02.wmf/scripting/texts.lua:114"
"Fruit","Vruchten","Nothing but fruit all day… Couldn’t you hurry up a bit?","Niets dan fruit de hele dag... Kun je niet een beetje opschieten?","tribes_encyclopedia","../../data/tribes/initialization/frisians/units.lua:1918"
"Well","Waterput","The jewel of the alps, the dolomites mountain range has been declared a world heritage site for its pristine beauty. This map is an as-faithful-as-reasonable reconstruction of the area delimited by Cortina d’Ampezzo in the north-east and Canazei in the south-west. If you have to be pitted in a duel to the death with your enemies, it may as well be in a beautiful place.","Het pronkstuk van de Aplen, de bergketen Dolomieten is tot wereld erfgoed verklaard vanwege de ongerepte schoonheid. Deze kaart is een zo-goed-als-mogelijke reconstruntie van het gebied afgebakend door Cortina d’Ampezzo in het noord-oosten en Canazei in het zuid-westen. Als je wordt lek geprikt door je vijand in een duel tot de dood erop volgt, dan kan dat even goed op een schitterende plek.","maps","../../data/maps/Dolomites.wmf/elemental:10"
"Well","Waterput","Your well established smuggling routes suddenly got busy: two other tribes have appeared and now a rivalry among smugglers has started. Which team will be the first to smuggle a certain number of wares?","Jouw goed verankerde smokkelroutes krijgen het plotseling druk: twee andere stammen zijn verschenen en er is nu rivaliteit onder smokkelaars begonnen.  Welk team zal de eerste zijn om een bepaald aantal goederen te smokkelen?","maps","../../data/maps/MP_Scenarios/Smugglers.wmf/elemental:11"
"Well","Waterput","But all seemed well. Only the horses seemed to feel something was wrong. During the nights, they went crazy and were full of fear. It was not long before the horse breeder Xydra figured out what was wrong with them: the sea level in front of their stable was rising with ever increasing speed.","Maar alles leek goed. Alleen de paarden leken te voelen dat er iets verkeerd zat. In de nachtelijke uren werden ze gek van angst. Het duurde niet lang voor paardenfokker Xydra ontdekt had wat er verkeerd met ze was: de zeespiegel voor hun stal was aan het rijzen, en steeg steeds sneller.","scenario_atl01.wmf","../../data/campaigns/atl01.wmf/scripting/texts.lua:156"
"Well","Waterput","Our building infrastructure is finished and I spent some days making sure that everybody is working well together. Now, there are other pressing matters. I called Colionder, my personal cook, before me to get his help with sorting some things out.","Onze bouwinfrastructuur is klaar en ik heb enkele dagen gekeken of iedereen goed samenwerkt. Nu zijn er andere dringende zaken. Ik heb Colionder, mijn persoonlijke kok, bij me geroepen voor advies over enkele dingen.","scenario_atl01.wmf","../../data/campaigns/atl01.wmf/scripting/texts.lua:217"
"Well","Waterput","This is good news indeed, Opol. Our economy is developing very well. Go back to your work now, Opol, and may Satul warm you and all your guild members!","Dat is inderdaad goed nieuws Opol. Onze economie ontwikkelt zich goed. Ga terug naar je werk Opol, en moge Satul jou en je gildeleden verwarmen!","scenario_atl01.wmf","../../data/campaigns/atl01.wmf/scripting/texts.lua:291"
"Well","Waterput","Today I saw the first recruits gathering in front of the new barracks. If everything goes well, they should receive their training soon.","Vandaag zag ik de eerste rekruten samenkomen aan de poorten van onze nieuwe kazerne. Als alles goed gaat zullen ze er binnenkort hun training aanvatten.","scenario_atl01.wmf","../../data/campaigns/atl01.wmf/scripting/texts.lua:342"
"Well","Waterput","I received an invitation from Sidolus. The first day of training in the newly finished labyrinth will be tomorrow. The dungeon is done as well and will start its work soon. I am looking forward to tomorrow; I am very interested in how our soldiers are trained, and I wonder if the additional workload will keep them from bullying the civilian population.","Ik ontving een uitnodiging van Sidolus. De eerste trainingsdag in het net voltooide labyrint zal morgen zijn. De kerker is ook al klaar en zal zijn werk spoedig aanvangen. Ik kijk uit naar morgen, ik ben erg geïnteresseerd hoe onze soldaten worden getraind en ben benieuwd of de extra belasting ze ervan zal weerhouden het volk lastig te vallen.","scenario_atl01.wmf","../../data/campaigns/atl01.wmf/scripting/texts.lua:373"
"Well","Waterput","So you want to prepare us for a longer stay in these forests, Thron? Well, I see the wisdom in doing so, yet my heart is yearning for a glorious return to Al’thunran. Too long have we waited while our brethren have fought on the battlefield, and our axes and swords have turned rusty over time.","Dus je wilt ons voorbereiden op een langer verblijf in deze bossen, Thron? Ik zie de wijsheid in deze actie, mijn hart verlangt echter naar een glorieuze terugkeer naar Al'Thunran. Te lang hebben we gewacht, terwijl onze broeders vochten op het slagveld, en onze bijlen en zwaarden zijn met de tijd roestig geworden.","scenario_bar01.wmf","../../data/campaigns/bar01.wmf/scripting/texts.lua:302"
"Well","Waterput","Chieftain, this is a disgrace! It is well that we can produce grout for mighty fortifications and great buildings now – only this does not prevent our roofs from becoming leaky! Maybe the young ones like spending their nights in the rain, but I just can’t find any sleep with these raindrops dripping on my face!","Opperhoofd, dit is een schande! Het is goed dat we mortel kunnen maken voor machtige verdedigingen en grote gebouwen - alleen behoudt dit onze daken er niet van om te lekken! Misschien houden de jongeren er van hun nachten in de regen door te brengen, maar ik kan de slaap niet vatten met regendruppels die op mijn gezicht druppelen!","scenario_bar01.wmf","../../data/campaigns/bar01.wmf/scripting/texts.lua:460"
"Well","Waterput","Wonderful! Our roofs are not dripping anymore, and we have all the material we need for, well, whichever monumental building we see fit!","Fantastisch! Onze daken lekken niet meer en we hebben alles wat we nodig hebben voor, wel, eigenlijk elk monumentaal gebouw dat we willen!","scenario_bar01.wmf","../../data/campaigns/bar01.wmf/scripting/texts.lua:471"
"Well","Waterput","Our geologists found a lot more deposits of iron ore, coal and even gold. We should enhance our current mines as soon as our miners are more experienced. We should build up some more mines, a bigger food infrastructure to always supply our men with sufficient food and a further processing economy. But that’s still not everything – most of our soldiers are quite young and neither have a good weapon nor are they well trained. We should build up training sites to prepare them for their future tasks.","Onze geologen hebben nog meer voorraden ijzererts, kool en zelfs goud gevonden. We zouden onze mijnen moeten verbeteren zodra onze mijnwerkers meer ervaring hebben. We zouden nog enkele mijnen moeten bouwen, een grotere voedingsinfrastructuur om onze mensen altijd te voorzien van voldoende voedsel en meer verwerkingseconomie. Maar dat is nog niet alles – de meeste van onze soldaten zijn behoorlijk jong en geen enkele heeft een goed wapen of is goed geoefend. We zouden oefenlocaties moeten bouwen om ze voor te bereiden op hun toekomstige taken.","scenario_bar02.wmf","../../data/campaigns/bar02.wmf/scripting/texts.lua:318"
"Well","Waterput","He told me about the blockhouse. Well, I don’t think we need more blockhouses – instead, we might concentrate on other things now.","Hij vertelde me over het blokhuis. Wel, ik denk niet dat we meer blokhuizen nodig hebben – misschien moeten we ons nu op andere dingen concentreren.","scenario_emp01.wmf","../../data/campaigns/emp01.wmf/scripting/texts.lua:156"
"Well","Waterput","Lutius, this may seem very tricky, but we can do it. First of all, we need patience as well as speed and a plan to succeed in this part of the world.","Lutius, de situatie ziet er misschien netelig uit, maar ik geloof dat we het kunnen klaarspelen. In de eerste plaats hebben we geduld nodig, maar als we willen slagen in dit deel van de wereld ook snelheid en een plan van aanpak.","scenario_emp03.wmf","../../data/campaigns/emp03.wmf/scripting/texts.lua:272"
"Well","Waterput","I think I have heard the wind carrying some weird but well known sounds from the north. If I’m not totally wrong, I have heard some Barbarian war drums. So, we should better go and have a look at what is going on up there.","Ik denk dat de winden ons bizarre maar welgekende klanken vanuit het noorden toebliezen. Tenzij ik mij zwaar vergis heb ik barbaarse strijdtrommels gehoord. We zouden best eens gaan kijken wat daar aan de hand is.","scenario_emp03.wmf","../../data/campaigns/emp03.wmf/scripting/texts.lua:424"
"Well","Waterput","Lutius. Well done. Well done. We have discovered all possible port locations in the complete region. Now we can strengthen our economy and we will manage to sail home soon.","Goed gedaan Lutius, goed gedaan. We hebben alle mogelijke havenlocaties in de regio ontdekt. Nu zullen we onze economie kunnen versterken, en binnenkort zijn we in staat om naar huis te varen.","scenario_emp03.wmf","../../data/campaigns/emp03.wmf/scripting/texts.lua:530"
"Well","Waterput","We need some cloth as well for producing armor in our armor smithy. We need it to build some of the training buildings for our soldiers. And most important and most imminent of all, we need it to send out expeditions.","We gebruiken ook doek voor de productie van pantsers in de harnassmederij, en bij de constructie van sommige trainingsgebouwen voor soldaten. En bovenal, en meest acuut, hebben we ook doek nodig om expedities uit te zenden.","scenario_emp03.wmf","../../data/campaigns/emp03.wmf/scripting/texts.lua:541"
"Well","Waterput","Unfortunately, we lost our holy shrine of Neptune in the great storm, so we can’t worship him well. I think we should search the whole region to see if we can recover all six pieces of the shrine.","Helaas is tijdens de grote storm ons heilige schrijn, gewijd aan Neptunus, verloren gegaan, en nu kunnen we de god niet meer op gepaste wijze aanbidden. Ik denk dat we de ruime omgeving moeten afspeuren, in de hoop dat we alle zes stukken van het schrijn kunnen recupereren.","scenario_emp03.wmf","../../data/campaigns/emp03.wmf/scripting/texts.lua:567"
"Well","Waterput","Sire, we need to train some of our people to serve in your great army. It is important to increase the number of our soldiers as fast as we can. And we should train them well to improve their fighting abilities.","Mijn heer, we moeten meer van onze mensen opleiden om ons grote leger te versterken. Het is van belang om het aantal soldaten zo spoedig mogelijk op te krikken. We moeten ze ook goed trainen om hun krijgsvaardigheden te verbeteren.","scenario_emp03.wmf","../../data/campaigns/emp03.wmf/scripting/texts.lua:611"
"Well","Waterput","Oh no! Amalea is right. In fact, I can’t see any productivity at all. And the road network seems to be completely in shambles as well. Who might be responsible for this chaos?","Oh nee! Amalea heeft gelijk. Bij nader inzien kan ik nergens enige productiviteit bekennen. En het wegennet is ook een compleet fiasco. Wie mag er verantwoordelijk zijn voor deze chaos?","scenario_emp04.wmf","../../data/campaigns/emp04.wmf/scripting/texts.lua:248"
"Well","Waterput","Lutius, well done so far. I just got the news that we have finished the basic buildings to obtain some construction materials.","Lutius, we boeken vooruitgang. Ik vernam zonet dat we de gebouwen klaarhebben om in basisbouwmaterialen te voorzien.","scenario_emp04.wmf","../../data/campaigns/emp04.wmf/scripting/texts.lua:383"
"Well","Waterput","Well done, well done. Our road network looks a lot more structured than before.","Goed gedaan, goed gedaan. Ons wegennet ziet er nu veel beter gestructureerd uit dan voorheen.","scenario_emp04.wmf","../../data/campaigns/emp04.wmf/scripting/texts.lua:405"
"Well","Waterput","But according to our recent experiences, I assume that something will be wrong with our mines as well. It’s probably a good idea to send a geologist to check whether there are enough resources in the vicinity of our mines.","Maar gelet op onze recente ervaringen ga ik er al vanuit dat er ook met de mijnen iets mis zal zijn. Het lijkt mij een goed idee om een geoloog sturen om na te kijken of er in de buurt van onze mijnen voldoende grondstoffen te vinden zijn.","scenario_emp04.wmf","../../data/campaigns/emp04.wmf/scripting/texts.lua:500"
"Well","Waterput","General, although we have started recruiting new soldiers, we still need to train them well. It is important to increase the strength of our soldiers as fast as we can.","Generaal, hoewel we nu gestart zijn met het rekruteren van nieuwe soldaten, moeten we ze ook goed trainen. Het is van belang om onze soldaten zo snel we kunnen sterker te maken.","scenario_emp04.wmf","../../data/campaigns/emp04.wmf/scripting/texts.lua:687"
"Well","Waterput","Thank you Lutius, you have served our goddess well. You will not only be gifted with the improvements to your technology but with some of the goods you need so desperately as well. Furthermore, we will pray for you and join your party to safeguard our land from the Barbarians.","Dank je Lutius, je hebt onze godin goed gediend. Niet alleen zullen je de technologische verbeteringen worden geschonken, maar ook een aantal van de goederen waar je zo'n nood aan hebt. Verder zullen we voor je bidden en je compagnie bijstaan om ons land te vrijwaren van de Barbaren.","scenario_emp04.wmf","../../data/campaigns/emp04.wmf/scripting/texts.lua:771"
"Well","Waterput","If you did not prepare well enough to master this challenge in time, you can reload the scenario from the backup savegame automatically created for you shortly before you reached the enemy’s headquarters.","Als je je niet goed genoeg hebt voorbereid om deze uitdaging op tijd aan te kunnen, kun je het scenario opnieuw laden vanuit het back-up savegame die automatisch voor je is aangemaakt kort voordat je het hoofdkwartier van de vijand bereikte.","scenario_fri01.wmf","../../data/campaigns/fri01.wmf/scripting/texts.lua:117"
"Well","Waterput","We should start by taking care of our wood production. Trees don’t seem to grow well on this island; better build at least two houses for foresters and one for a woodcutter.","We moeten beginnen met het verzorgen van onze houtproductie. Bomen lijken niet goed te groeien op dit eiland; laten we twee huizen bouwen voor boswachters en één voor een houtvester.","scenario_fri01.wmf","../../data/campaigns/fri01.wmf/scripting/texts.lua:153"
"Well","Waterput","Also, build a well – nobody likes to drink salt water, and it is no good for making clay.","Bouw ook een put – niemand drinkt graag zout water en het is ongeschikt om klei te maken.","scenario_fri01.wmf","../../data/campaigns/fri01.wmf/scripting/texts.lua:172"
"Well","Waterput","You did well. Our entire building material production is working now. Let’s wait until we have gathered some more materials. We could expand our territory some more, to see what else can be found on this island.","Goed gedaan. Onze hele productie van bouwmaterialen werkt nu. Laten we wachten tot we wat meer materialen hebben verzameld. We zouden ons grondgebied nog verder kunnen uitbreiden om te zien wat er nog meer op dit eiland te vinden is.","scenario_fri01.wmf","../../data/campaigns/fri01.wmf/scripting/texts.lua:179"
"Well","Waterput","Build an iron mine and perhaps a gold mine. As they produce only ores, we will need a furnace to smelt them. Also build a blacksmithy to ensure we won’t run out of tools – and yes, a small armor smithy as well. It produces helmets as well as swords. I hope we won’t meet enemies here, but it’s better to be prepared.","Bouw een ijzermijn en misschien een goudmijn. Omdat ze alleen ertsen produceren, hebben we een smeltoven nodig om ze te smelten. Bouw ook een smederij om ervoor te zorgen dat we niet zonder gereedschap komen te zitten – en ja, ook een kleine harnassmederij. Deze produceert zowel helmen als zwaarden. Ik hoop dat we hier geen vijanden tegenkomen, maar het is beter om voorbereid te zijn.","scenario_fri01.wmf","../../data/campaigns/fri01.wmf/scripting/texts.lua:250"
"Well","Waterput","Our mines are working well. We can now produce all the tools we need, and some weapons as well.","Onze mijnen werken goed. We kunnen nu alle gereedschappen produceren die we nodig hebben, en ook enkele wapens.","scenario_fri01.wmf","../../data/campaigns/fri01.wmf/scripting/texts.lua:257"
"Well","Waterput","Soldiers are trained in two steps in defense and health. They get fur garments studded with iron and also gold to cushion blows; and helmets forged from iron, and gold as well, to lengthen their life in battle.","Soldaten worden in twee stappen getraind in verdediging en levenspunten. Ze krijgen bontkleding versierd met ijzer en ook goud om klappen op te vangen; en helmen gesmeed van ijzer en ook goud om hun leven in de strijd te verlengen.","scenario_fri01.wmf","../../data/campaigns/fri01.wmf/scripting/texts.lua:321"
"Well","Waterput","Despair not, I did espy some hope! The easternmost tip of the island, as well as the space where the fiends’ headquarters stood, seems well suited to build a port on. If we manage to construct a ship, and fill it with all we need to build a new settlement, we may be able to escape.","Wanhoop niet, ik zie een uitweg! Het meest oostelijke punt van het eiland, en de plek waar het hoofdkwartier van de vijand stond, lijkt zeer geschikt om een haven op te bouwen. Als we erin slagen een schip te bouwen en het te vullen met alles wat we nodig hebben om een nieuwe nederzetting te bouwen, kunnen we misschien ontsnappen.","scenario_fri01.wmf","../../data/campaigns/fri01.wmf/scripting/texts.lua:401"
"Well","Waterput","All wares and workers that are loaded onto the expedition as well as some of the soldiers in the port will be carried over to the next scenario.","Alle goederen en werkers die zijn ingeladen voor de expeditie zullen , net als de soldaten in de haven, worden meegenomen naar het volgende scenario onderdeel.","scenario_fri01.wmf","../../data/campaigns/fri01.wmf/scripting/texts.lua:417"
"Well","Waterput","Build a quarry, a reed farm, a clay pit, a well, a charcoal kiln, a brick kiln, and houses for a woodcutter and a forester.","Bouw een steengroeve, een rietboerderij, een kleiput, een put, een houtskoolmeiler, een steenoven en huizen voor een houtvester en een boswachter.","scenario_fri02.wmf","../../data/campaigns/fri02.wmf/scripting/texts.lua:28"
