"glossary_term","glossary_translation","source","target","file","location"
"Armor Smithy","Fucina di armature","The gilded armor is the strongest armor an Empire soldier can have. It is produced in the armor smithy and used in the training camp – together with food – to train soldiers from health level 3 to level 4.","L'armatura dorata è l'armatura più resistente che un soldato dell'Impero può ottenere. Viene prodotta dall'armaiolo e usata nel campo d'addestramento - insieme al cibo - per allenare i soldati da un livello di salute pari a 3 portandoli ad un livello di salute di 4.","tribes_encyclopedia","../../data/tribes/initialization/empire/units.lua:586"
"Weapon Smithy","Fucina di armi","The ores have to be smelted at a smelting works before they can be used. The refined materials are then used in the weapon smithy, the armor smithy and the toolsmithy.","I minerali devono essere fusi in fonderia prima di poter essere utilizzati. I materiali raffinati sono utilizzati nelle fucine di armi, corazze e utensili.","scenario_atl01.wmf","../../data/campaigns/atl01.wmf/scripting/texts.lua:86"
"Weapon Smithy","Fucina di armi","This is the basic weapon of the Atlantean soldiers. Together with a tabard, it makes up the equipment of young soldiers. Light tridents are produced in the weapon smithy as are all other tridents.","Questa è l'arma di base per un soldato atlantideo. Insieme ad un tabarro, costituisce l'equipaggiamento dei giovani soldati. I tridenti leggeri sono prodotti nella fucina delle armi insieme a tutti gli altri tridenti.","tribes_encyclopedia","../../data/tribes/initialization/atlanteans/units.lua:790"
"Weapon Smithy","Fucina di armi","The long trident is the first trident in the training of soldiers. It is produced in the weapon smithy and used in the dungeon – together with food – to train soldiers from attack level 0 to level 1.","Il tridente lungo è il primo tridente utilizzato nell'allenamento dei soldati. È prodotto nella fucina d'armi ed utilizzato nella segreta - insieme al cibo - per addestrare i soldati dal livello 0 al livello 1 di attacco.","tribes_encyclopedia","../../data/tribes/initialization/atlanteans/units.lua:799"
"Weapon Smithy","Fucina di armi","The double trident is one of the best tridents produced by the Atlantean weapon smithy. It is used in a dungeon – together with food – to train soldiers from attack level 2 to level 3.","Il tridente doppio è uno dei migliori tridenti prodotto dalla fucina d'armi atlantidea. È usata in una segreta - insieme al cibo - per addestrare i soldati dal livello 2 al livello 3 di attacco.","tribes_encyclopedia","../../data/tribes/initialization/atlanteans/units.lua:817"
"Weapon Smithy","Fucina di armi","This is the most dangerous weapon of the Atlantean military. Only the best of the best soldiers may use it. It is produced in the weapon smithy and used in the dungeon – together with food – to train soldiers from attack level 3 to level 4.","Questa è l'arma più pericolosa nelle forze armate atlantidee. Solo i migliori soldati possono utilizzarla. È prodotta nella fucina delle armi ed utilizzata nella segreta - insieme al cibo - per addestrare i soldati dal livello 3 al livello 4 di attacco.","tribes_encyclopedia","../../data/tribes/initialization/atlanteans/units.lua:826"
"Toolsmithy","Fucina di strumenti","May Satul warm you, Jundlina. Have you considered mining for resources in the mountains around us? We are running short of quartz and diamonds for our buildings. Also, we could use more iron, gold and especially coal. If we find an ample supply of those commodities, we could start producing weapons and tools; this would help enormously. Of course, we would need smelters, a weapon smithy, an armor smithy and a toolsmithy. And maybe even more.","Possa Satul riscaldare te, Jundlina! Hai preso in considerazione di estrarre risorse minerarie dalle montagne intorno a noi? Stiamo finendo il quarzo ed i diamanti per i nostri edifici. Potremmo inoltre utilizzare più ferro, oro e specialmente carbone. Se trovassimo un'ampia disponibilità di queste materie prime, potremmo cominciare a produrre armi ed attrezzi: ci aiuterebbe enormemente. Naturalmente avremmo bisogno di fonderie, una fucina di armi, una fucina di armature ed una fucina di utensili. E magari anche altro.","scenario_atl01.wmf","../../data/campaigns/atl01.wmf/scripting/texts.lua:301"
"Toolsmithy","Fucina di strumenti","May Satul warm you, Jundlina! We have completed a toolsmithy and now our toolsmiths will produce new tools in an instant.","Possa Satul riscaldarti, Jundlina! Abbiamo costruito una fucina  di strumenti ed ora i nostri fabbri potranno produrre nuovi attrezzi in un attimo.","scenario_atl01.wmf","../../data/campaigns/atl01.wmf/scripting/texts.lua:317"
"Gardener","Giardiniere","The third material necessary for improved buildings is reed, used to cover roofs. Reed fields are planted by a gardener around his building, the reed yard.","Il terzo materiale necessario per gli edifici più complessi è la canna, usata per coprire i tetti. I canneti possono essere piantati intorno al loro edificio, il giardino delle canne.","scenario_bar01.wmf","../../data/campaigns/bar01.wmf/scripting/texts.lua:121"
"Gardener","Giardiniere","The gardener working at this reed yard has no cleared soil to plant his seeds.","Il contadino che coltiva la canna non ha terreni liberi per piantare i suoi semi.","tribes","../../data/tribes/buildings/productionsites/barbarians/reed_yard/init.lua:67"
"Reed Yard","Giardino delle canne","The gardener working at this reed yard has no cleared soil to plant his seeds.","Il contadino che coltiva la canna non ha terreni liberi per piantare i suoi semi.","tribes","../../data/tribes/buildings/productionsites/barbarians/reed_yard/init.lua:67"
"Gulf of Perl","Golfo delle perle","Still, I saw no way that I could erase my shame without fighting against these Barbarians. So, I left Fremil by boat to find a new world and a new life for myself, somewhere in the south. Now I am sailing on the Gulf of Perl with my family, some of my friends and a few of my best warriors.","Ciononostante non vedevo altro modo per cancellare la mia vergogna se non combattere contro i barbari. Così lasciai Fremil con una barca, per trovarmi un mondo nuovo, ed una nuova vita, da qualche parte nel sud. Ora sto navigando sul golfo Perl con la mia famiglia, alcuni dei miei amici e alcuni dei miei migliori guerrieri.","scenario_emp01.wmf","../../data/campaigns/emp01.wmf/scripting/texts.lua:90"
"Gulf of Perl","Golfo delle perle","It seems as if sailing on the Gulf of Perl was one of our biggest mistakes. Nature was against us and drove us into a dark, wild storm. I really don’t know how many hours have passed since the waves rose higher than our boat, but still it would be suicide to go outside.","Sembra che veleggiare sul golfo Perl sia stato uno dei nostri più gravi errori. La natura era contro di noi e ci ha spinto in una selvaggia e buia tempesta. Io davvero non so quante ore siano passate da quando sono cominciate le onde più alte della nostra barca, ma sarebbe un suicidio andare fuori.","scenario_emp01.wmf","../../data/campaigns/emp01.wmf/scripting/texts.lua:99"
"Granite","Granito","Build a quarry in the south to cut some granite and marble out of the rocks.","Costruisci una cava a sud per estrarre alcune pietre e marmo dalle rocce.","scenario_emp01.wmf","../../data/campaigns/emp01.wmf/scripting/texts.lua:64"
"Granite","Granito","Sire, I just thought about the rocks standing on the south shore of this land. Perhaps we could cut out some useful granite and beautiful marble.","Mio Signore, vorrei parlarti delle rocce che stanno arenate sulla riva sud di questa terra. Forse potremmo estrarre alcune utili pietre e del bellissimo marmo.","scenario_emp01.wmf","../../data/campaigns/emp01.wmf/scripting/texts.lua:201"
"Granite","Granito","Cuts raw pieces of granite out of rocks in the vicinity.","Estrae del marmo e delle pietre dalle rocce nelle vicinanze.","tribes_encyclopedia","../../data/tribes/initialization/barbarians/units.lua:580"
"Granite","Granito","Cuts raw pieces of granite out of rocks in the vicinity.","Estrae del marmo e delle pietre dalle rocce nelle vicinanze.","tribes_encyclopedia","../../data/tribes/initialization/barbarians/units.lua:1137"
"Granite","Granito","Cuts blocks of granite and marble out of rocks in the vicinity.","Estrae del marmo e delle pietre dalle rocce nelle vicinanze.","tribes_encyclopedia","../../data/tribes/initialization/empire/units.lua:634"
"Granite","Granito","Cuts blocks of granite and marble out of rocks in the vicinity.","Estrae del marmo e delle pietre dalle rocce nelle vicinanze.","tribes_encyclopedia","../../data/tribes/initialization/empire/units.lua:1247"
"Granite","Granito","Carves marble and granite out of the rock in mountain terrain.","Estrae del marmo e delle pietre dalle rocce nel terreno montuoso.","tribes_encyclopedia","../../data/tribes/initialization/empire/units.lua:1805 ../../data/tribes/initialization/empire/units.lua:1827"
"Sentries","Guardiole","Build military buildings (like sentries or barriers) to expand your territory.","Costruisci edifici militari (come sentinelle o barricate) per espandere il tuo territorio.","scenario_bar01.wmf","../../data/campaigns/bar01.wmf/scripting/texts.lua:33"
"Help","Guida","As your road network gets longer and more complicated, you should employ horses to help out your carriers. Horses are bred at horse farms using water and corn. A warehouse will also help to ensure that your transportation system does not collapse.","Non appena la tua rete stradale diventa più lunga e complicata, dovresti impiegare dei cavalli per aiutare i tuoi trasportatori. I cavalli si riproducono nelle stalle utilizzando acqua e grano. Un magazzino ti aiuterà anche ad assicurare che il tuo sistema di trasporto non collassi.","scenario_atl01.wmf","../../data/campaigns/atl01.wmf/scripting/texts.lua:119"
"Help","Guida","Guilt-ridden, the king committed suicide. Without a monarch, the people turned to the clerics, but they had no substantial help to offer. Most accepted their fate while others tried to change the god’s mind by offering animals in his temple. But to no avail…","Travolto dal senso di colpa, il re si suicidò. Senza un monarca, il popolo si rivolse al clero, che non aveva però sostanziali aiuti da offrire. I più accettarono il loro fato, mentre altri provarono a far cambiare proposito al dio Lutas offrendogli animali nel tempio. Ma senza successo...","scenario_atl01.wmf","../../data/campaigns/atl01.wmf/scripting/texts.lua:166"
"Help","Guida","Our building infrastructure is finished and I spent some days making sure that everybody is working well together. Now, there are other pressing matters. I called Colionder, my personal cook, before me to get his help with sorting some things out.","La nostra infrastruttura è completata ed ho atteso alcuni giorni per essere sicuro che funzionasse correttamente. Adesso ci sono altre questioni urgenti. Ho convocato Colionder, il mio cuoco personale, presso di me per richiedere il suo aiuto nel sistemare alcune cose.","scenario_atl01.wmf","../../data/campaigns/atl01.wmf/scripting/texts.lua:217"
"Help","Guida","May Satul warm you, Jundlina. My name is Opol, and I am the highest weaver of the guild abandoning Atlantis and Lutas with you. I come with sad news indeed: we have no more spidercloth. Not a single piece is to be found in our warehouses. Could you not help the weavers’ guild by arranging the building of a weaving mill and a spider farm? The spiders deliver the finest silk and we will produce the finest spidercloth from it.","Possa Satul riscaldarti, Jundlina. Il mio nome è Opol, e sono il sommo tessitore della gilda, che ha abbandonato Atlantide e Lutas insieme a te. Vengo purtroppo con dolenti notizie: non abbiamo più stoffa di ragno. Neanche un solo scampolo si trova più nei nostri magazzini. Non potresti aiutare la gilda dei tessitori, pianificando la costruzione di uno stabilimento tessile e di un allevamento di ragni? Dai ragni si ottiene un'eccellente seta e potremmo così produrre stoffa di ragno delle migliori.","scenario_atl01.wmf","../../data/campaigns/atl01.wmf/scripting/texts.lua:266"
"Help","Guida","May Satul warm you, Jundlina. Have you considered mining for resources in the mountains around us? We are running short of quartz and diamonds for our buildings. Also, we could use more iron, gold and especially coal. If we find an ample supply of those commodities, we could start producing weapons and tools; this would help enormously. Of course, we would need smelters, a weapon smithy, an armor smithy and a toolsmithy. And maybe even more.","Possa Satul riscaldare te, Jundlina! Hai preso in considerazione di estrarre risorse minerarie dalle montagne intorno a noi? Stiamo finendo il quarzo ed i diamanti per i nostri edifici. Potremmo inoltre utilizzare più ferro, oro e specialmente carbone. Se trovassimo un'ampia disponibilità di queste materie prime, potremmo cominciare a produrre armi ed attrezzi: ci aiuterebbe enormemente. Naturalmente avremmo bisogno di fonderie, una fucina di armi, una fucina di armature ed una fucina di utensili. E magari anche altro.","scenario_atl01.wmf","../../data/campaigns/atl01.wmf/scripting/texts.lua:301"
"Help","Guida","People are complaining about crowded streets and slow transportation. We need to help out our carriers on the roads. I have decided to build a horse farm so that the horses can help with the heavy wares.","La gente si sta lamentando delle strade affollate e dei trasporti lenti. Dobbiamo dare una mano ai nostri trasportatori sulle strade. Ho deciso di costruire una stalla, così i cavalli potranno essere d'aiuto con le merci pesanti.","scenario_atl01.wmf","../../data/campaigns/atl01.wmf/scripting/texts.lua:382"
"Help","Guida","But they fear that the war around Al’thunran will set an end to this life. Therefore, they have decided to join us, hoping that we can help each other.","Ma temono che la guerra ad Al'thunran marcherà la fine di questo stile di vita. Pertanto, hanno deciso di unirsi a noi, sperando che possiamo aiutarci a vicenda.","scenario_bar01.wmf","../../data/campaigns/bar01.wmf/scripting/texts.lua:534"
"Help","Guida","As your roads grow longer and your economy bigger, you should make good use of your oxen to help transport wares more quickly.","Man mano che le strade si allungano e l'economia cresce, dovrai fare un buon uso dei tuoi buoi per spostare le merci più rapidamente.","scenario_bar02.wmf","../../data/campaigns/bar02.wmf/scripting/texts.lua:48"
"Help","Guida","Our mining economy seems to work fine, that is already good news! Anyway, there are still a lot of men and women waiting in our hall to get a task, so they can help our soldiers to prepare for the war to come.","La nostra economia mineraria sembra funzionare bene, questa è davvero una buona notizia! Comunque, ci sono ancora un sacco di uomini e donne in attesa di ottenere un lavoro, in modo che possano aiutare i nostri soldati a prepararsi per la guerra a venire.","scenario_bar02.wmf","../../data/campaigns/bar02.wmf/scripting/texts.lua:315"
"Help","Guida","It really seems as if we have landed under the only palm trees existing in this far-away sandy desert. I fear we won’t find the help we need to get our ship repaired in good time.","Sembra d'essere approdati sotto le uniche palme esistenti in questo deserto sabbioso. Temo che non troveremo l'aiuto necessario per riparare la nostra nave in tempo utile.","scenario_emp01.wmf","../../data/campaigns/emp01.wmf/scripting/texts.lua:117"
"Help","Guida","Lower the demand for marble columns in the economy settings to four. This will help to save some marble for buildings.","Nelle impostazioni dell'economia, riduci la domanda di colonne di marmo a 4: sarà più facile conservare alcuni pezzi di marmo per le costruzioni!","scenario_emp03.wmf","../../data/campaigns/emp03.wmf/scripting/texts.lua:75"
"Help","Guida","Yes my fellow soldiers, we have done it! We have met all the challenges that were put in front of us. But my heart is still with our home. We shall set sail as soon as possible to help defend the Empire from the Barbarian tribe.","Ebbene sì, miei compagni d'armi: ce l'abbiamo fatta! Abbiamo affrontato e superato ogni ostacolo che ci è stato posto dinanzi. Ma il mio cuore è rivolto alla nostra dimora. E salperemo il prima possibile per difendere anche noi il nostro impero dalla tribù barbarica.","scenario_emp03.wmf","../../data/campaigns/emp03.wmf/scripting/texts.lua:624"
"Help","Guida","You have completed this mission. You may move on to the next scenario now to help us build a new home, far from the false God’s vengeful reach…","Hai completato questa missione. Ora puoi passare al prossimo scenario ed aiutarci a costruire una nuova dimora, lontana dalla vendicativa portata di un falso dio.","scenario_fri01.wmf","../../data/campaigns/fri01.wmf/scripting/texts.lua:427"
"Help","Guida","This was the last tutorial I had prepared for you. I’ve now taught you everything I know. There are still secrets hidden in this world even I don’t know about. I will now search for a quiet place to spend my sunset years. If you have still questions, the Widelands community will surely help you. You can find it at:","Questo è l'ultimo tutoria che avevo preparato per te. Ora ti ho insegnato tutto quanto potevo. Ci sono ancora segreti nascosti in questo mondo, che neanch'io conosco. Ora sono alla ricerca di un posto tranquillo dove passare i miei anni del tramonto. Se hai ancora dubbi, la comunità di Widelands certamente ti aiuterà. Puoi trovarla su:","scenario_tutorial04_economy.wmf","../../data/campaigns/tutorial04_economy.wmf/scripting/texts.lua:551"
"Help","Guida","You can find help about gameplay or the editor by using the help button on the bottom menu, or by pressing %1%.","Puoi trovare dei consigli e degli aiuti riguardanti il gameplay o l'editor usando il pulsante d'aiuto al fondo del menù, oppure digitando %1%.","texts","../../data/txts/README.lua:17"
"Help","Guida","Documentation, Help and Wiki","Documentazione, Aiuto e Wiki","texts","../../data/txts/developers.lua:3"
"Help","Guida","If you need more documentation or help for Widelands or the Widelands Editor, be sure to visit our homepage at %s. You can find online help in our wiki there.","Se hai bisogno di una documentazione più accurate o di aiuto per Widelands o il suo editor, assicurati di visitare e consultare la nostra homepage a %s. Lì potrai trovare aiuto online nella nostra Wiki.","texts","../../data/txts/help/common_helptexts.lua:11"
"Help","Guida","You can find general help for the editor as well as a short tutorial on our wiki at %s.","Puoi trovare aiuto, ed un breve tutorial, relativi all'editor su %s.","texts","../../data/txts/tips/editor.lua:8"
"Help","Guida","Horses help to carry items along busy roads. They are reared in a horse farm.","I cavalli aiutano a trasportare oggetti per le strade trafficate. Vengono allevati in un allevamento di cavalli.","tribes_encyclopedia","../../data/tribes/initialization/atlanteans/units.lua:903"
"Help","Guida","Donkeys help to carry items along busy roads. They are reared in a donkey farm.","Gli asini aiutano a trasportare oggetti per le strade trafficate. Vengono allevati in un allevamento di asini.","tribes_encyclopedia","../../data/tribes/initialization/empire/units.lua:617"
"Help","Guida","Show the help window","Mostra la finestra di aiuto","widelands","../../src/ui_fsmenu/launch_mpg.cc:65"
"How to","How-to","In this tutorial, you will learn how to navigate in Widelands and how to build buildings and roads.","In questo tutorial imparerai a muoverti in Widelands e a costruire edifici e strade.","maps","../../data/campaigns/tutorial01_basic_control.wmf/elemental:10"
"How to","How-to","In this tutorial, you will be taught the secrets of warfare: how to create soldiers, how to train them and how to lead them in battle. Scouting will be also covered.","In questo tutorial ti saranno svelati i segreti dellarte bellica: come reclutare soldati, come addestrarli e come guidarli in battaglia. Sarà tratatta anche l'esplorazione.","maps","../../data/campaigns/tutorial02_warfare.wmf/elemental:10"
"How to","How-to","In this tutorial, you will get to know seafaring, which is how to handle ships and ports, and how to use ferries and waterways.","In questo tutorial conoscerai i viaggi in mare, cioè come gestire navi e porti, e come usare traghetti e vie d'acqua.","maps","../../data/campaigns/tutorial03_seafaring.wmf/elemental:10"
"How to","How-to","Objectives and how to handle them","Obiettivi e come gestirli","scenario_tutorial01_basic_control.wmf","../../data/campaigns/tutorial01_basic_control.wmf/scripting/texts.lua:37"
"How to","How-to","There you go. Now, let me show you how to make a lumberjack’s hut and how to connect it with a road. There is a sweet spot for a lumberjack right next to those trees. I’ll describe the steps I will take and then demonstrate them.","Ecco fatto! Ora posso farti vedere come costruire una capanna per il taglialegna, e come collegarla ad una strada. C'è un posticino perfetto per lui vicino a quegli alberi. Descriverò i diversi passaggi mentre li porto avanti.","scenario_tutorial01_basic_control.wmf","../../data/campaigns/tutorial01_basic_control.wmf/scripting/texts.lua:91"
"How to","How-to","That won’t do yet. I still need to connect the lumberjack’s hut to the rest of my road network. You have disabled the option ‘Start building road after placing a flag’ (to change that, choose ‘Options’ in the Widelands main menu). Therefore, I have entered the road building mode manually. I will tell you later how to do that. To build the road, all I have to do now is click on the blue flag in front of my headquarters.","Non funzionerà ancora. Ho ancora bisogno di collegare la capanna del boscaiolo al resto della mia rete stradale. Hai disabilitato l'opzione 'Comincia a costruire una strada dopo aver piazzato una bandiera' (per cambiare questa opzione, vai sulle opzioni dal menù principale). Più tardi ti spiegherò come, ma per ora sono entrato manualmente in modalità costruzione di strade. Quindi tutto quello che devo fare è cliccare sulla bandiera blu di fronte al mio quartier generale.","scenario_tutorial01_basic_control.wmf","../../data/campaigns/tutorial01_basic_control.wmf/scripting/texts.lua:125"
"How to","How-to","I wanted to teach you how to build new flags, but it seems you have already found out on your own. Well done!","Volevo insegnarti a costruire nuove bandiere, ma sembra che tu abbia già trovato il sistema per conto tuo. Ben fatto!","scenario_tutorial01_basic_control.wmf","../../data/campaigns/tutorial01_basic_control.wmf/scripting/texts.lua:171"
"How to","How-to","Granite can be mined in granite mines, but the easier way is to build a quarry next to some rocks lying around. As it happens, there is a pile of them just to the west (left) of your headquarters. I will teach you now how to move your view over there.","Il granito può essere estratto nelle miniere, ma il modo più facile è costruire una cava vicino a delle rocce. Si dà il caso che ce ne sia un mucchio proprio a ovest (sinistra) del tuo quartier generale. Ti spiegherò come muovere la tua visuale per vederle.","scenario_tutorial01_basic_control.wmf","../../data/campaigns/tutorial01_basic_control.wmf/scripting/texts.lua:254"
"How to","How-to","You have two messages at the moment. This one, which you are currently reading, and the one that informed you that a new headquarters was added to your economy. Let’s learn how to archive messages:","Hai due messaggi adesso: quello che stai leggendo ora, e quello che ti informa sull'aggiunta di un Quartier generale alla tua economia. Vediamo come si archiviano i messaggi:","scenario_tutorial01_basic_control.wmf","../../data/campaigns/tutorial01_basic_control.wmf/scripting/texts.lua:501"
"How to","How-to","However, since you now know how to control Widelands, you can also start a game (or continue this one) and discover more by yourself.","Tuttavia, siccome adesso sai controllare Widelands, puoi anche cominciare una partita, o continuare questa, e scoprire di più per conto tuo.","scenario_tutorial01_basic_control.wmf","../../data/campaigns/tutorial01_basic_control.wmf/scripting/texts.lua:603"
"How to","How-to","Well done. Now you know how to draw back your soldiers from the places where you don’t need them. It is time to tell you how to reinforce your front line.","Ben fatto. Ora sai come ritirare I soldati dai posti in cui non ti servono. È tempo di mostrarti come rinforzare la tua linea del fronte.","scenario_tutorial02_warfare.wmf","../../data/campaigns/tutorial02_warfare.wmf/scripting/texts.lua:238"
"How to","How-to","Thank you for playing this tutorial. I hope you enjoyed it and you learned how to create and train soldiers, how to control where they go and how to defeat an enemy. Did you see how easily you could overwhelm your enemy? Having trained soldiers is a huge advantage.","Grazie per aver giocato questo tutorial. Spero tu ti sia divertito e abbia imparato come creare e addestrare soldati, come controllare dove vanno e sconfiggere i nemici. Hai visto quanto è stato facile sopraffare il tuo nemico? Avere soldati addestrati è un vantaggio immenso.","scenario_tutorial02_warfare.wmf","../../data/campaigns/tutorial02_warfare.wmf/scripting/texts.lua:282"
