"glossary_term","glossary_translation","source","target","file","location"
"Mine","Miniera","Iron ore, gold ore and coal are mined in the respective mines. The crystal mine will dig for quartz and diamonds – all of them are precious materials and very rarely found. It will produce a lot of granite while searching for them.","Il ferro grezzo, l'oro grezzo e il carbone sono estratti nelle rispettive miniere. Dalle miniere di cristallo si estraggono quarzi e diamanti - sono tutti materiali preziosi e trovati molto raramente. Mentre li si ricerca, vengono prodotte molto granito.","scenario_atl01.wmf","../../data/campaigns/atl01.wmf/scripting/texts.lua:87"
"Mine","Miniera","A friend of mine explored the island on his own and he told me of a big lake at the top of the mountain. I suggest we build the ships in this lake and wait until the island drowns beneath us. Then we can sail away. It is a bold plan, but I think it could work.","Un mio amico ha esplorato l'isola per conto suo e mi ha detto di un grande lago in cima alla montagna. Suggerisco di costruire le navi in questo lago e aspettare fino a che l'isola non affondi sotto di noi. Poi potremo salpare. È un piano ardito, però penso che possa funzionare.","scenario_atl01.wmf","../../data/campaigns/atl01.wmf/scripting/texts.lua:455"
"Mine","Miniera","Start building mines on the mountain","Comincia a costruire le miniere sulla montagna","scenario_bar01.wmf","../../data/campaigns/bar01.wmf/scripting/texts.lua:42"
"Mine","Miniera","Mines can only be built on mountain terrain. Suitable places for mines are displayed as orange mine symbols.","Le miniere possono essere costruite soltanto su terreni di montagna. I luoghi adatti per le miniere sono rappresentati da simboli arancioni.","scenario_bar01.wmf","../../data/campaigns/bar01.wmf/scripting/texts.lua:59"
"Mine","Miniera","You may of course enhance all mines to deep mines instantly given you have the workers – bigger mines work a bit faster, smaller mines need cheaper food. It’s up to you which strategy you prefer.","Ovviamente potrai migliorare tutte le tue miniere a miniere profonde istantaneamente se hai  i lavoratori – le miniere più grandi sono leggermente più veloci ma necessitano più cibo. Puoi decidere tu quale strategia adottare.","scenario_bar01.wmf","../../data/campaigns/bar01.wmf/scripting/texts.lua:98"
"Mine","Miniera","So now that we have both the mines and the food to sustain them, we should bring what our brave miners gain for us into a more useful state. The iron ore has to be melted into iron so that it is ready to be forged into whatever we want. And we need the coal to keep the smelter’s ovens burning.","Ora che abbiamo sia le miniere che il cibo per mantenerli, dovremmo trasformare ciò che i nostri coraggiosi minatori traggono in una forma più utile. I minerali devono essere fusi in ferro pronto da forgiare in qualunque cosa noi vogliamo. E ci serve il carbone per mantenere accesi gli altoforni.","scenario_bar01.wmf","../../data/campaigns/bar01.wmf/scripting/texts.lua:437"
"Mine","Miniera","Expand your territory to the mountains, send geologists to search for ore and coal and build a mining economy with mines, taverns, smelting works and metal workshop.","Espandi il tuo territorio fino alle montagne, invia i geologi alla ricerca di oro e carbone e costruisci un'economia mineraria con delle miniere, taverne, fonderie, officina del fabbro","scenario_bar02.wmf","../../data/campaigns/bar02.wmf/scripting/texts.lua:76"
"Mine","Miniera","The traitor left his armies dying where they lay when he saw that he would not keep my forces back. Kalitath disappeared in the confusion of the war, but I don’t care now. Shall he flee and be forgotten for all times as a tribal leader that would not bow before the wooden throne, that is mine to take now.","Il traditore ha lasciato il suo esercito a morire lì dove è, appena ha visto che non riusciva a respingere le mie forze. Kalitath è scomparso nella confusione della battaglia, ma al momento non mi importa. Possa egli fuggire ed essere dimenticato per sempre come il capotribù che non si inchino davanti al trono di legno, di cui mi impossesserò.","scenario_bar02.wmf","../../data/campaigns/bar02.wmf/scripting/texts.lua:222"
"Mine","Miniera","It’s up to you what you want to build. But remember – coal and iron mines need beer, marble and gold mines need wine and all mines need at least rations, which are produced out of bread OR meat OR fish.","Sei libero di decidere cosa costruire. Ma ricorda - le miniere di carbone e ferro hanno bisogno di birra, quelle di marmo ed oro necessitano di vino e tutte le miniere hanno bisogno almeno di razioni, che sono prodotte dal pane, dalla carne o dal pesce.","scenario_emp02.wmf","../../data/campaigns/emp02.wmf/scripting/texts.lua:78"
"Mine","Miniera","It’s nice, and of course a good idea, to build up mines, which will give us a more comfortable life, but the people working in the mines are unhappy with the current situation. They have to do hard work and have no time for making their own food.","È bello, e naturalmente una buona idea, costruire miniere, che ci daranno una vita più comoda,<br> ma le persone che lavorano nelle miniere non sono soddisfatte della situazione attuale. Devono fare un duro lavoro, e non hanno tempo per preparare il proprio cibo.","scenario_emp02.wmf","../../data/campaigns/emp02.wmf/scripting/texts.lua:215"
"Mine","Miniera","Hi, it’s me again! This time, I have sent you a message. Messages are sent to you by Widelands to inform you about important events: empty mines, attacks on your tribe, won or lost military buildings, resources found…","Ciao, sono di nnuovo io!  Questa volta, ti ho mandato un messaggio. I messaggi ti vengono mandati da Widelands per informarti di eventi importanti: miniere esaurite, attacchi contro la tua tribù, edifici militari conquistati o persi, risorse trovate...","scenario_tutorial01_basic_control.wmf","../../data/campaigns/tutorial01_basic_control.wmf/scripting/texts.lua:376"
"Mine","Miniera","There is one more thing I’d like to teach you now: Expanding your territory. The place that we started with around our headquarters is barely enough for a basic building infrastructure, and we do not have access to mountains, which we need to mine minerals and coal. So, we have to expand our territory.","C'è ancora una cosa che vorrei insegnarti: espandere il tuo territorio. Lo spazio con il quale siamo partiti, intorno al nostro quartier generale, basta a malapena per un'infrastruttura di base e non abbiamo accesso alle montagne, di cui abbiamo bisogno per estrarre minerali e carbone. Dobbiamo pertanto espandere il nostro territorio.","scenario_tutorial01_basic_control.wmf","../../data/campaigns/tutorial01_basic_control.wmf/scripting/texts.lua:447"
"Mine","Miniera","To make our mines work, we need rations again – the more, the better.","Per far funzionare le nostre miniere, ci servono nuove razioni - più sono, meglio è.","scenario_tutorial04_economy.wmf","../../data/campaigns/tutorial04_economy.wmf/scripting/texts.lua:199"
"Mine","Miniera","This mine exploits all of the resource down to the deepest level. But even after having done so, it will still have a %s chance of finding some more coal.","Questa minier a sfrutta tutte le risorse fino al livello più profondo. Ma anche quando è esaurita, avrà ancora un %s di possibilità di trovare altro carbone.","tribes_encyclopedia","../../data/tribes/buildings/productionsites/barbarians/coalmine_deeper/helptexts.lua:22"
"Mine","Miniera","This mine exploits all of the resource down to the deepest level. But even after having done so, it will still have a %s chance of finding some more gold ore.","Questa minier a sfrutta tutte le risorse fino al livello più profondo. Ma anche quando è esaurita, avrà ancora un %s di possibilità di trovare altro minerale aurifero.","tribes_encyclopedia","../../data/tribes/buildings/productionsites/barbarians/goldmine_deeper/helptexts.lua:18"
"Mine","Miniera","This mine exploits all of the resource down to the deepest level. But even after having done so, it will still have a %s chance of finding some more iron ore.","Questa minier a sfrutta tutte le risorse fino al livello più profondo. Ma anche quando è esaurita, avrà ancora un %s di possibilità di trovare altro ferro grezzo.","tribes_encyclopedia","../../data/tribes/buildings/productionsites/barbarians/ironmine_deeper/helptexts.lua:18"
"Mine","Miniera","Fish is one of the biggest food resources of the Atlanteans. It has to be smoked in a smokery before being delivered to mines, training sites and scouts.","Il pesce è una delle più grandi fonti di cibo degli Atlantidei. Deve essere affumicato in un affumicatore prima di essere consegnato alle miniere, ai luoghi di addestramento ed agli esploratori.","tribes_encyclopedia","../../data/tribes/wares/fish/helptexts.lua:4"
"Mine","Miniera","Smoked meat is made out of meat in a smokery. It is delivered to the mines and training sites (labyrinth and dungeon) where the miners and soldiers prepare a nutritious lunch for themselves.","La carne affumicata è prodotta partendo dalla carne in un affumicatore. Viene consegnata alle miniere e ai siti di addestramento (labirinti e segrete), dove i minatori e i soldati si preparano un nutriente pasto.","tribes_encyclopedia","../../data/tribes/wares/smoked_meat/helptexts.lua:4"
"Mine","Miniera","Works deep in the mines to obtain coal, iron, gold or precious stones.","Lavora nel profondo delle miniere per estrarre carbone, ferro, oro o pietre preziose.","tribes_encyclopedia","../../data/tribes/workers/atlanteans/miner/helptexts.lua:3"
"Mine","Miniera","Works deep in the mines to obtain coal, iron, gold or marble.","Lavora in profondità nelle miniere per ottenere carbone, ferro, oro o marmo.","tribes_encyclopedia","../../data/tribes/workers/empire/miner/helptexts.lua:3 ../../data/tribes/workers/empire/miner_master/helptexts.lua:3"
"Mine","Miniera","should mine resource %s, which does not exist in world; tribe is not compatible with world","dovrebbe estrarre dalle miniere la risorsa %s, che non esiste nel mondo; la tribù non è compatibile con il mondo","widelands","../../src/logic/map_objects/tribes/worker.cc:117"
"Gold Mine","Miniera d'oro","It’s up to you what you want to build. But remember – coal and iron mines need beer, marble and gold mines need wine and all mines need at least rations, which are produced out of bread OR meat OR fish.","Sei libero di decidere cosa costruire. Ma ricorda - le miniere di carbone e ferro hanno bisogno di birra, quelle di marmo ed oro necessitano di vino e tutte le miniere hanno bisogno almeno di razioni, che sono prodotte dal pane, dalla carne o dal pesce.","scenario_emp02.wmf","../../data/campaigns/emp02.wmf/scripting/texts.lua:78"
"Coal Mine","Miniera di carbone","Coal is mined in coal mines or produced out of logs by a charcoal kiln.","Il carbone viene estratto nelle miniere di carbone o prodotto a partire da tronchi nella carbonaia.","tribes_encyclopedia","../../data/tribes/wares/coal/helptexts.lua:4"
"Crystal Mine","Miniera di cristallo","Iron ore, gold ore and coal are mined in the respective mines. The crystal mine will dig for quartz and diamonds – all of them are precious materials and very rarely found. It will produce a lot of granite while searching for them.","Il ferro grezzo, l'oro grezzo e il carbone sono estratti nelle rispettive miniere. Dalle miniere di cristallo si estraggono quarzi e diamanti - sono tutti materiali preziosi e trovati molto raramente. Mentre li si ricerca, vengono prodotte molto granito.","scenario_atl01.wmf","../../data/campaigns/atl01.wmf/scripting/texts.lua:87"
"Iron Mine","Miniera di ferro","It’s up to you what you want to build. But remember – coal and iron mines need beer, marble and gold mines need wine and all mines need at least rations, which are produced out of bread OR meat OR fish.","Sei libero di decidere cosa costruire. Ma ricorda - le miniere di carbone e ferro hanno bisogno di birra, quelle di marmo ed oro necessitano di vino e tutte le miniere hanno bisogno almeno di razioni, che sono prodotte dal pane, dalla carne o dal pesce.","scenario_emp02.wmf","../../data/campaigns/emp02.wmf/scripting/texts.lua:78"
"Iron Mine","Miniera di ferro","Iron ore is mined in iron mines. It is smelted in a smelting works to retrieve the iron.","Il ferro grezzo è estratto nelle miniere di ferro. È fuso nelle fonderie per ottenere ferro.","tribes_encyclopedia","../../data/tribes/wares/iron_ore/helptexts.lua:4"
"Granite Mine","Miniera di granito","Granite can be mined in granite mines, but the easier way is to build a quarry next to some rocks lying around. As it happens, there is a pile of them just to the west (left) of your headquarters. I will teach you now how to move your view over there.","Il granito può essere estratto nelle miniere, ma il modo più facile è costruire una cava vicino a delle rocce. Si dà il caso che ce ne sia un mucchio proprio a ovest (sinistra) del tuo quartier generale. Ti spiegherò come muovere la tua visuale per vederle.","scenario_tutorial01_basic_control.wmf","../../data/campaigns/tutorial01_basic_control.wmf/scripting/texts.lua:180"
"Deep Mine","Miniera profonda","Such buildings usually have greater demands than the basic kind of that building – for instance, deep mines need snacks instead of rations. You will have to enhance your tavern to an inn in order to produce snacks out of pitta bread AND a second kind of food (meat or fish) AND beer.","Certi edifici solitamente hanno maggiori esigenze rispetto agli edifici base – per esempio, le miniere profonde necessitano dei pasti invece che delle razioni. Dovrai espandere la tua taverna in una locanda allo scopo di produrre pasti dal pane pane arabo E un secondo tipo di alimenti (carne o pesce) E birra.","scenario_bar01.wmf","../../data/campaigns/bar01.wmf/scripting/texts.lua:97"
"Deep Mine","Miniera profonda","You may of course enhance all mines to deep mines instantly given you have the workers – bigger mines work a bit faster, smaller mines need cheaper food. It’s up to you which strategy you prefer.","Ovviamente potrai migliorare tutte le tue miniere a miniere profonde istantaneamente se hai  i lavoratori – le miniere più grandi sono leggermente più veloci ma necessitano più cibo. Puoi decidere tu quale strategia adottare.","scenario_bar01.wmf","../../data/campaigns/bar01.wmf/scripting/texts.lua:98"
"Deep Mine","Miniera profonda","A bigger morsel than the ration to provide miners in deep mines. It is produced in an inn or a big inn out of fish/meat, pitta bread and beer.","Un boccone più grande della razione da fornire ai minatori nelle miniere profonde. È prodotto in una locanda o in una grande locanda a partire da pesce/carne, pane pitta e birra.","tribes_encyclopedia","../../data/tribes/wares/snack/helptexts.lua:4"
"Mill","Mulino","Blackroots are a special kind of root produced at blackroot farms and processed in mills. The Atlanteans like their strong taste and use their flour for making bread.","Le radici nere sono uno speciale tipo di radici prodotte nelle fattorie di radici nere e lavorate nei mulini. Gli Atlantidei amano il loro forte sapore e usano la loro farina per produrre pane.","tribes_encyclopedia","../../data/tribes/wares/blackroot/helptexts.lua:4"
"Mill","Mulino","Blackroot Flour is produced in mills out of blackroots. It is used in bakeries to make a tasty bread.","La farina di radici nere è prodotta nei mulini a partire dalla radici nere. È usata nei forni per produrre un pane gustoso.","tribes_encyclopedia","../../data/tribes/wares/blackroot_flour/helptexts.lua:4"
"Mill","Mulino","Flour is produced by the mill out of wheat and is needed in the bakery to produce the tasty Empire bread.","La farina di radici nere è prodotta nei mulini a partire dalla radici nere. È usata nei forni per produrre un pane gustoso.","tribes_encyclopedia","../../data/tribes/wares/flour/helptexts.lua:4"
"Weaving Mill","Mulino di tessitura","The weavers produce spidercloth and tabards in the weaving mill. Spidercloth is needed for the construction of some buildings and clothing, while tabards are the uniforms of soldiers. The weaving mill needs gold thread and spider silk as raw material. Spider silk is produced by the spider farm, while gold thread is produced by the gold spinning mill out of gold.","I tessitori producono tessuto di ragno e tabards nella tessitura. Il tessuto di ragno è necessaria per la costruzione di alcuni edifici e abbigliamento, mentre pettorine sono le uniformi dei soldati. La tessitura ha bisogno di filo di ragno e di seta d'oro come materia prima. La seta di ragno è prodotta da allevamento dei ragni, mentre filo d'oro è prodotta dal mulino di filatura dell'oro.","scenario_atl01.wmf","../../data/campaigns/atl01.wmf/scripting/texts.lua:75"
"Weaving Mill","Mulino di tessitura","Golden tabards are produced in Atlantean weaving mills out of gold thread. They are used in the labyrinth – together with food – to train soldiers from health level 0 to level 1.","I tabarri dorati vengono prodotti nei mulini di tessitura atlantidei a partire dal filo d'oro. Sono usati nel Labirinto - insieme al cibo - per addestrare i soldati in Salute dal livello 0 al livello 1.","tribes_encyclopedia","../../data/tribes/wares/tabard_golden/helptexts.lua:4"
"Weaving Mill","Mulino di tessitura","Wool is the hair of sheep. Weaving mills use it to make cloth.","La lana è il pelo delle pecore. I mulini di tessitura la usano per produrre tessuto.","tribes_encyclopedia","../../data/tribes/wares/wool/helptexts.lua:4"
"Ship","Nave","In this tutorial, you will get to know seafaring, which is how to handle ships and ports.","In questo tutorial imparerai a conoscere la navigazione in mare, ossia la gestione di navi e porti.","maps","../../data/campaigns/tutorial03_seafaring.wmf/elemental:10"
"Ship","Nave","Defend your transport lines, or use ships to bypass the opponent. Then remove all enemy activity.","Difendi le tue linee di trasporto, o utilizza le navi per aggirare l'avversario. Quindi rimuovi tutte le attività nemiche.","maps","../../data/maps/Twin_Lagoons_v2.wmf/elemental:11"
"Ship","Nave","Build 3 ships to escape from the island","Costruisci tre navi per fuggire dall'isola","scenario_atl01.wmf","../../data/campaigns/atl01.wmf/scripting/texts.lua:129"
"Ship","Nave","There is a lake at the top of the island. Build three ships in these waters and you might be able to rescue your people before the island is swallowed completely by the ocean.","C'è un lago sulla cima dell'isola. Costruisci tre navi in queste acque e potresti essere in grado di salvare il tuo popolo quando l'isola sprofonderà completamente nell'oceano.","scenario_atl01.wmf","../../data/campaigns/atl01.wmf/scripting/texts.lua:132"
"Ship","Nave","Ostur, we have no time. The water rises too fast, and if we build the ships on the shore they will vanish in the sea before they can float. I fear we are doomed!","Ostur, non abbiamo tempo. L'acqua sale troppo velocemente e se costruiamo le navi sulla riva spariranno nel mare prima che possano galleggiare. Temo che siamo spacciati!","scenario_atl01.wmf","../../data/campaigns/atl01.wmf/scripting/texts.lua:441"
"Ship","Nave","A friend of mine explored the island on his own and he told me of a big lake at the top of the mountain. I suggest we build the ships in this lake and wait until the island drowns beneath us. Then we can sail away. It is a bold plan, but I think it could work.","Un mio amico ha esplorato l'isola per conto suo e mi ha detto di un grande lago in cima alla montagna. Suggerisco di costruire le navi in questo lago e aspettare fino a che l'isola non affondi sotto di noi. Poi potremo salpare. È un piano ardito, però penso che possa funzionare.","scenario_atl01.wmf","../../data/campaigns/atl01.wmf/scripting/texts.lua:455"
"Ship","Nave","Build a shipyard to produce the ships to sail on.","Costruisci un cantiere navale per costruire delle navi su cui salpare.","scenario_emp03.wmf","../../data/campaigns/emp03.wmf/scripting/texts.lua:97"
"Ship","Nave","Welcome back. In this tutorial, you are going to learn the most important things about seafaring, that is ships, ports, and expedition.","Bentornato. In questo tutorial, imparerai le cose più importanti sui viaggi in mare, cioè navi, porti, e spedizioni.","scenario_tutorial03_seafaring.wmf","../../data/campaigns/tutorial03_seafaring.wmf/scripting/texts.lua:23"
"Ship","Nave","Very good. Your shipyard is finished and your shipwright immediately started working. For the construction of ships, he needs logs, planks and spidercloth, which will be transported to the shipyard.","Molto bene. Il tuo cantiere navale è completato e il tuo maestro d'ascia ha cominciato immediatamente a lavorare. Per costruire le navi, gli servono tavole, tronchi, e tessuto di ragno, che verranno trasportati al cantiere navale.","scenario_tutorial03_seafaring.wmf","../../data/campaigns/tutorial03_seafaring.wmf/scripting/texts.lua:106"
"Ship","Nave","We should wait until we have two ships. That should be enough for now.","Dovremmo aspettare finché non abbiamo due navi. Dovrebbe essere sufficiente per ora.","scenario_tutorial03_seafaring.wmf","../../data/campaigns/tutorial03_seafaring.wmf/scripting/texts.lua:109"
"Ship","Nave","You need to stop your shipyard when you have enough ships. Otherwise, your shipwright will consume all your logs and spidercloth, producing dozens of ships.","Ti conviene fermare il tuo cantiere navale quando hai abbastanza navi. Altrimenti consumerà tutti i tronchi e il tessuto di ragno, producendo dozzine di navi.","scenario_tutorial03_seafaring.wmf","../../data/campaigns/tutorial03_seafaring.wmf/scripting/texts.lua:110"
"Ship","Nave","In this scenario, you’ve learned everything about seafaring: how to build ports and ships and how to send out an expedition. Remember that expeditions are sometimes the fastest way to reach essential resources – and sometimes the only one.","Il questo scenario hai imparato tutto sui viaggi in mare: come costruire porti e navi e come inviare spedizioni. Ricorda che le spedizioni sono talvolta la via più rapida per raggiungere risorse essenziali - e talvolta l'unica.","scenario_tutorial03_seafaring.wmf","../../data/campaigns/tutorial03_seafaring.wmf/scripting/texts.lua:187"
"Ship","Nave","On this map, there is no enemy to fear. As always, you can continue playing and watch how the ships deliver wares to the island when you construct some buildings there. There is also another island where you can build a port.","Su questa mappa non ci sono nemici da temere. Come sempre, puoi continuare a giocare e guardare come le navi trasportano merci all'isola quando ci costruisci ddegli edifici. C'è anche un'altra isola dove puoi costruire un porto.","scenario_tutorial03_seafaring.wmf","../../data/campaigns/tutorial03_seafaring.wmf/scripting/texts.lua:189"
"Ship","Nave","Constructs ships that are used for overseas colonization and for trading between ports.","Costruisce navi che sono usate per stabilire colonie e per trasportare risorse fra i porti","tribes_encyclopedia","../../data/tribes/buildings/productionsites/atlanteans/shipyard/helptexts.lua:16 ../../data/tribes/buildings/productionsites/barbarians/shipyard/helptexts.lua:16 ../../data/tribes/buildings/productionsites/empire/shipyard/helptexts.lua:16 ../../data/tribes/buildings/productionsites/frisians/shipyard/helptexts.lua:16"
"Ship","Nave","Produces cloth for ships and soldiers.","Produce tessuti per navi e soldati.","tribes_encyclopedia","../../data/tribes/workers/empire/weaver/helptexts.lua:3"
"Ship","Nave","No use for ships on this map!","Le navi non servono in questa mappa!","widelands","../../src/logic/map_objects/tribes/production_program.cc:745"
"Metal Workshop","Officina metallica","Enhance your metal workshop to an ax workshop in order to produce weapons, and build up a second metal workshop to ensure the production of tools. When the blacksmith reaches his next level (master blacksmith), you can even enhance the ax workshop to a war mill, which will produce additional weapons.","Migliora la tua officina in una fabbrica d'asce per produrre armi e costruisci un'altra officina per garantire la produzione di attrezzi. Quando il fabbro raggiunge il suo prossimo livello (mastro fabbro), puoi anche migliorarla in una fucina da guerra, che produce ulteriori armi.","scenario_bar02.wmf","../../data/campaigns/bar02.wmf/scripting/texts.lua:94 ../../data/campaigns/bar02.wmf/scripting/texts.lua:124"
"Immovable","Oggetto inamovibile","Just like with animals, you can also select multiple immovables or ground textures with Ctrl + mouse click.","Come con gli animali, puoi selezionare anche molteplici immobili o terreni con Ctrl + click del mouse.","texts","../../data/txts/tips/editor.lua:15"
"Immovable","Oggetto inamovibile","These immovables are used by the win condition “Artifacts”.","Questi oggetti inamovibili sono usati nella condizione di vittoria "artefatti"","world","../../data/world/init.lua:105"
"Thatch Reed","Paglia di canne","The third material necessary for improved buildings is thatch reed, used to cover roofs. Thatch reed is planted by a gardener around his building, the reed yard.","Il terzo materiale necessario per gli edifici avanzati è la paglia, usata per coprire i tetti. La paglia viene piantata da un giardiniere intorno alla sua abitazione, il cortile delle canne.","scenario_bar01.wmf","../../data/campaigns/bar01.wmf/scripting/texts.lua:133"
"Bread Paddle","Pala da fornaio","The bread paddle is the tool of the baker, each baker needs one.","La pala per il pane è l'attrezzo del fornaio, ogni fornaio ne deve avere una.","tribes_encyclopedia","../../data/tribes/wares/bread_paddle/helptexts.lua:4"
