"glossary_term","glossary_translation","source","target","file","location"
"Soldier","Soldato","Young soldiers are proud to learn to fight with this powerful weapon. It is heavier and sharper than the ordinary ax. It is produced in ax workshops and war mills. In training camps, it is used – together with food – to train soldiers from attack level 0 to level 1.","I giovani soldati sono orgogliosi di imparare a combattere con questa potente arma. È più pesante e affilata di un'ascia ordinaria. È prodotta nelle Fabbriche di asce e Fucine da guerra. Si usa nei campi di addestramento - insieme al cibo - per addestrare i soldati in attacco dal livello 0 al livello 1.","tribes_encyclopedia","../../data/tribes/wares/ax_sharp/helptexts.lua:4"
"Soldier","Soldato","The warrior’s ax is the most dangerous of all Barbarian weapons. Only a few soldiers ever were able to handle this huge and powerful ax. It is produced in a war mill and used – together with food – in a training camp to train soldiers from attack level 4 to level 5.","L'ascia del guerriero è la più pericolosa fra tutte le armi dei Barbari. Solamente pochi soldati furono veramente in grado di gestire quest'enorme e potente ascia. Viene prodotta in una fabbrica da guerra e usata - insieme al cibo - in un campo d'addestramento per istruire i soldati da ul livello di attaco 4 ad un livello di attacco 5.","tribes_encyclopedia","../../data/tribes/wares/ax_warriors/helptexts.lua:4"
"Soldier","Soldato","Only this beer is acceptable for the soldiers in a battle arena. Some say that the whole power of the Barbarians lies in this ale. It helps to train the soldiers’ evade level from 0 to 1 to 2. Strong beer is also used in big inns to prepare meals.","Solo questa birra è considerata accettabile per i soldati nell' Arena di Battaglia. In molti dicono che l'intera potenza dei Barbari risale in questa birra. Aiuta a allenare il livello di evasione dei soldati da 0 a 1 a 2. La birra forte e anche usata nelle grandi locande per preparare le pasti","tribes_encyclopedia","../../data/tribes/wares/beer_strong/helptexts.lua:4"
"Soldier","Soldato","This tasty bread is made in bakeries out of cornmeal, blackroot flour and water. It is appreciated as basic food by miners, scouts and soldiers in training sites (labyrinth and dungeon).","Questo pane saporito è prodotto nei forni a partire dalla farina di mais, farina di radici nere ed acqua. È apprezzato come cibo di base per i minatori, gli esploratori ed i soldati nei luoghi di addestramento (labirinto e segreta).","tribes_encyclopedia","../../data/tribes/wares/bread_atlanteans/helptexts.lua:4"
"Soldier","Soldato","This steel shield is produced in the armor smithy and used in the labyrinth – together with food – to train soldiers from defense level 0 to level 1.","Questo scudo d'acciaio è prodotto nella fucina delle armature ed utilizzato nel labirinto - insieme al cibo - per addestrare i soldati dal livello 0 al livello 1 di difesa.","tribes_encyclopedia","../../data/tribes/wares/shield_steel/helptexts.lua:4"
"Soldier","Soldato","Smoked meat is made out of meat in a smokery. It is delivered to the mines and training sites (labyrinth and dungeon) where the miners and soldiers prepare a nutritious lunch for themselves.","La carne affumicata è prodotta partendo dalla carne in un affumicatore. Viene consegnata alle miniere e ai siti di addestramento (labirinti e segrete), dove i minatori e i soldati si preparano un nutriente pasto.","tribes_encyclopedia","../../data/tribes/wares/smoked_meat/helptexts.lua:4"
"Soldier","Soldato","This spear has an iron spike. It is produced in a weapon smithy and used in a training camp – together with food – to train soldiers from attack level 0 to attack level 1.","Una lancia con una punta di ferro. È prodotta nella fucina di armi ed è usata nel campo di addestramento - insieme al cibo - per addestrare i soldati in attacco dal livello 0 al livelllo 1.","tribes_encyclopedia","../../data/tribes/wares/spear/helptexts.lua:4"
"Soldier","Soldato","This is an advanced spear with a steel tip. It is produced in a weapon smithy and used in a training camp – together with food – to train soldiers from attack level 1 to level 2.","Questa è una lancia avanzata con una punta in acciaio. È prodotta in una fucina di armi  ed è usata nel campo di addestramento - insieme al cibo - per addestrare i soldati in attacco dal livello 1 al livelllo 2.","tribes_encyclopedia","../../data/tribes/wares/spear_advanced/helptexts.lua:4"
"Soldier","Soldato","This is a strong spear with a steel-tip and a little blade. It is produced in the weapon smithy and used in the training camp – together with food – train soldiers from attack level 2 to level 3.","Questa è una potente lancia con una punta in acciaio e affilata. È prodotta nella fucina di armi ed è usata nel campo di addestramento - insieme al cibo - per addestrare i soldati in attacco dal livello 2 al livelllo 3.","tribes_encyclopedia","../../data/tribes/wares/spear_heavy/helptexts.lua:4"
"Soldier","Soldato","This is the best and sharpest weapon the Empire weaponsmith creates for the soldiers. It is used in the training camp – together with food – to train soldiers from attack level 3 to level 4.","Questa è l'arma migliore che i fabbri dell'impero sono in grado di creare. È usata nel campo di addestramento - insieme al cibo - per addestrare i soldati in attacco dal livello 3 al livelllo 4.","tribes_encyclopedia","../../data/tribes/wares/spear_war/helptexts.lua:4"
"Soldier","Soldato","Golden tabards are produced in Atlantean weaving mills out of gold thread. They are used in the labyrinth – together with food – to train soldiers from health level 0 to level 1.","I tabarri dorati vengono prodotti nei mulini di tessitura atlantidei a partire dal filo d'oro. Sono usati nel Labirinto - insieme al cibo - per addestrare i soldati in Salute dal livello 0 al livello 1.","tribes_encyclopedia","../../data/tribes/wares/tabard_golden/helptexts.lua:4"
"Soldier","Soldato","The double trident is one of the best tridents produced by the Atlantean weapon smithy. It is used in a dungeon – together with food – to train soldiers from attack level 2 to level 3.","Il tridente doppio è uno dei migliori tridenti prodotto dalla fucina d'armi atlantidea. È usata in una segreta - insieme al cibo - per addestrare i soldati dal livello 2 al livello 3 di attacco.","tribes_encyclopedia","../../data/tribes/wares/trident_double/helptexts.lua:4"
"Soldier","Soldato","This is the most dangerous weapon of the Atlantean military. Only the best of the best soldiers may use it. It is produced in the weapon smithy and used in the dungeon – together with food – to train soldiers from attack level 3 to level 4.","Questa è l'arma più pericolosa nelle forze armate atlantidee. Solo i migliori soldati possono utilizzarla. È prodotta nella fucina delle armi ed utilizzata nella segreta - insieme al cibo - per addestrare i soldati dal livello 3 al livello 4 di attacco.","tribes_encyclopedia","../../data/tribes/wares/trident_heavy_double/helptexts.lua:4"
"Soldier","Soldato","The long trident is the first trident in the training of soldiers. It is produced in the weapon smithy and used in the dungeon – together with food – to train soldiers from attack level 0 to level 1.","Il tridente lungo è il primo tridente utilizzato nell'allenamento dei soldati. È prodotto nella fucina d'armi ed utilizzato nella segreta - insieme al cibo - per addestrare i soldati dal livello 0 al livello 1 di attacco.","tribes_encyclopedia","../../data/tribes/wares/trident_long/helptexts.lua:4"
"Soldier","Soldato","Produces weapons for soldiers and tools for workers.","Produce armi per i soldati e strumenti per i lavoratori","tribes_encyclopedia","../../data/tribes/workers/barbarians/blacksmith/helptexts.lua:3 ../../data/tribes/workers/barbarians/blacksmith_master/helptexts.lua:3"
"Soldier","Soldato","Produces the finest ales to keep soldiers strong and happy in training.","Produce le migliori birre per mantenere i guerrieri forti e felici durante l'addestramento.","tribes_encyclopedia","../../data/tribes/workers/barbarians/brewer_master/helptexts.lua:3"
"Soldier","Soldato","%1% soldiers (+%2%)","%1% soldati (+%2%)","widelands","../../src/logic/map_objects/tribes/militarysite.cc:373"
"Soldier","Soldato","%1%(+%2%) soldiers (+%3%)","%1%(+%2%) soldati (+%3%)","widelands","../../src/logic/map_objects/tribes/militarysite.cc:386"
"Building Space","Spazio edificabile","It is easier to understand what type of buildings can be built on which field when the symbols for the building spaces are enabled.","E' più facile capire quali tipi di edifici possono essere costruiti su quale campo quando i simboli per gli spazi di costruzione sono attivi.","scenario_tutorial01_basic_control.wmf","../../data/campaigns/tutorial01_basic_control.wmf/scripting/texts.lua:52"
"Building Space","Spazio edificabile","Make sure that you are showing the building spaces, then just click on the space were you want the building to be, choose it from the window that appears, and it is placed. Maybe this is a good time to explain about all those building space symbols we activated earlier.","Assicurati di avere la visualizzazione degli spazi edificabili attivata, poi semplicemente clicca sullo spazio in cui vuoi costruire l'edificio, sceglilo dalla finestra che appare, e verrà collocato.
Ora potrebbe essere un buon momento per spiegare cosa sono tutti quei simboli di spazi edificabili che abbiamo attivato in precedenza.","scenario_tutorial01_basic_control.wmf","../../data/campaigns/tutorial01_basic_control.wmf/scripting/texts.lua:240"
"Building Space","Spazio edificabile","The quarry is a small building like the lumberjack’s hut. You can therefore build it on any field that shows a red, yellow or green house when the building spaces symbols are enabled (Press Space for that).","La cava è  un edificio piccolo, come la capanna ddel taglialegna. Quindi lo puoi costruire su qualsiasi campo con un simbolo rosso, giallo o verde (premi la barra spaziatrice per visualizzare i simboli)","scenario_tutorial01_basic_control.wmf","../../data/campaigns/tutorial01_basic_control.wmf/scripting/texts.lua:254"
"Building Space","Spazio edificabile","Space key behaves like in normal game. It switches if building spaces are shown on or off.","Il tasto SPAZIO si comporta come in una partita normale. Attiva e disattiva la visualizzazione degli spazi di costruzione.","texts","../../data/txts/tips/editor.lua:31"
"port space","Spazio per il porto","Find a port space on the small island","Trova dello spazio per un porto sulla piccola isola","scenario_emp03.wmf","../../data/campaigns/emp03.wmf/scripting/texts.lua:84"
"port space","Spazio per il porto","blue port space icon.","l'icona blu dello spazio portuale.","scenario_tutorial03_seafaring.wmf","../../data/campaigns/tutorial03_seafaring.wmf/scripting/texts.lua:60"
"port space","Spazio per il porto","Build a port next to your castle, on the blue port space icon.","Costruisci un porto accanto al tuo castello, sull'icona blu per lo spazio di costruzione di un porto.","scenario_tutorial03_seafaring.wmf","../../data/campaigns/tutorial03_seafaring.wmf/scripting/texts.lua:73"
"port space","Spazio per il porto","Ports are built like normal buildings, but are only available on blue port spaces. Just click on a field with the icon and the building menu automatically offers you to build a port.","I porti si costruiscono come gli altri edifici, ma possono essere costruiti solo sugli spazi portuali blu. Clicca su un campo con l'icona e il menù di costruzione ti darà automaticamente la possibilità di costruire un porto.","scenario_tutorial03_seafaring.wmf","../../data/campaigns/tutorial03_seafaring.wmf/scripting/texts.lua:74"
"port space","Spazio per il porto","Search for an island with a mountain, and look for a port space there. Colonize the island.","Cerca un'isola con una montagna e cerca lì uno spazio per un porto. Colonizza l'isola.","scenario_tutorial03_seafaring.wmf","../../data/campaigns/tutorial03_seafaring.wmf/scripting/texts.lua:168"
"port space","Spazio per il porto","When you have found a suitable port space, build a port there.","Quando hai trovato uno spazio adatto per un porto, costruiscilo lì.","scenario_tutorial03_seafaring.wmf","../../data/campaigns/tutorial03_seafaring.wmf/scripting/texts.lua:176"
"Expedition","Spedizione","Each player has a different obstacle to expansion, and there’s always more than one way to overcome it. While the AI can be defeated here without building a single ship, players are advised to make ports and shipyards a priority – expeditions are universally useful and are often the fastest way to gold deposits.","Ogni giocatore ha un ostacolo differente all'espansione, e vi è sempre più di un sistema per superarlo. Anche se l'IA può essere sconfitta senza costruire neanche una nave, consigliamo ai giocatori di costruire appena possibile porti e cantieri navali - le spedizioni sono incredibilmente utili e sono spesso la via più rapida per giungere ai depositi d'oro.","maps","../../data/maps/River_Explorers.wmf/elemental:10"
"Expedition","Spedizione","In this scenario, you’ve learned everything about seafaring: how to build ports and ships and how to send out an expedition. Remember that expeditions are sometimes the fastest way to reach essential resources – and sometimes the only one.","Il questo scenario hai imparato tutto sui viaggi in mare: come costruire porti e navi e come inviare spedizioni. Ricorda che le spedizioni sono talvolta la via più rapida per raggiungere risorse essenziali - e talvolta l'unica.","scenario_tutorial03_seafaring.wmf","../../data/campaigns/tutorial03_seafaring.wmf/scripting/texts.lua:187"
"Snack","Spuntino","Such buildings usually have greater demands than the basic kind of that building – for instance, deep mines need snacks instead of rations. You will have to enhance your tavern to an inn in order to produce snacks out of pitta bread AND a second kind of food (meat or fish) AND beer.","Certi edifici solitamente hanno maggiori esigenze rispetto agli edifici base – per esempio, le miniere profonde necessitano dei pasti invece che delle razioni. Dovrai espandere la tua taverna in una locanda allo scopo di produrre pasti dal pane pane arabo E un secondo tipo di alimenti (carne o pesce) E birra.","scenario_bar01.wmf","../../data/campaigns/bar01.wmf/scripting/texts.lua:97"
"Snack","Spuntino","Prepares rations for scouts and rations, snacks and meals to feed all miners.","Prepara razioni, spuntini e pasti per nutrire esploratori e minatori","tribes_encyclopedia","../../data/tribes/buildings/productionsites/barbarians/big_inn/helptexts.lua:16"
"Snack","Spuntino","Prepares rations for scouts and rations and snacks to feed the miners in the basic and deep mines.","Prepara razioni e spuntini per nutrire esploratori e minatori in miniere di base e profonde.","tribes_encyclopedia","../../data/tribes/buildings/productionsites/barbarians/inn/helptexts.lua:16"
"Snack","Spuntino","Produces beer of the lower grade. This beer is a vital component of the snacks that inns and big inns prepare for miners in deep mines.","Produce birra a bassa gradazione. Questa birra è un componente vitale degli spuntini che le locande e locande grandi preparano per i minatori nelle miniere profonde.","tribes_encyclopedia","../../data/tribes/buildings/productionsites/barbarians/micro_brewery/helptexts.lua:13"
"Snack","Spuntino","Prepares rations for scouts and rations and snacks to feed the miners in all mines.","Prepara razioni per gli esploratori e razioni e spuntini per i minatori di tutte le miniere.","tribes_encyclopedia","../../data/tribes/buildings/productionsites/empire/inn/helptexts.lua:16"
"General Statistics","Statistiche Generali","You can see the number of wares traded at any time in the general statistics menu. Good luck!","Puoi vedere il numero di beni commerciati in qualsiasi momento nel menù generale delle statistiche. Buona fortuna!","mp_scenario_smugglers.wmf","../../data/maps/MP_Scenarios/Smugglers.wmf/scripting/texts.lua:17"
"Building Statistics","Statistiche sugli edifici","Similar to this are the building statistics, which are also toggled via a button on the ‘Watch’ tab of any field. The hotkey for it is ‘s’. This will display information about the productivity of buildings or the progress of construction sites.","Simili a queste sono le statistiche di costruzione che sono anche attivate/disattivate tramite un pulsante sulla scheda di osservazione di ogni campo. Il tasto di scelta rapida è 's'. Questo visualizzerà una stringa di informazioni riguardo la produttività degli edifici o il progresso dei siti di costruzione.","scenario_tutorial01_basic_control.wmf","../../data/campaigns/tutorial01_basic_control.wmf/scripting/texts.lua:359"
"Building Statistics","Statistiche sugli edifici","Open the building statistics window.","Apri la finestra delle statistiche degli edifici.","scenario_tutorial04_economy.wmf","../../data/campaigns/tutorial04_economy.wmf/scripting/texts.lua:58"
"Building Statistics","Statistiche sugli edifici","The building statistics window gives you an overview over the buildings you have.","La finestra delle statistiche degli edifici ti dà una visione d'insieme degli edifici che hai.","scenario_tutorial04_economy.wmf","../../data/campaigns/tutorial04_economy.wmf/scripting/texts.lua:65"
"Building Statistics","Statistiche sugli edifici","You closed the building statistics window!","Hai chiuso la finestra delle statistiche sull'edificio!","scenario_tutorial04_economy.wmf","../../data/campaigns/tutorial04_economy.wmf/scripting/texts.lua:96"
"Ware Statistics","Statistiche sui beni","When you have finished, close the ware statistics window.","Quando hai finito, chiudi la finestra delle statistiche sulle merci.","scenario_tutorial04_economy.wmf","../../data/campaigns/tutorial04_economy.wmf/scripting/texts.lua:350"
"Tabard","Tabarro","The weavers produce spidercloth and tabards in the weaving mill. Spidercloth is needed for the construction of some buildings and clothing, while tabards are the uniforms of soldiers. The weaving mill needs gold thread and spider silk as raw material. Spider silk is produced by the spider farm, while gold thread is produced by the gold spinning mill out of gold.","I tessitori producono tessuto di ragno e tabards nella tessitura. Il tessuto di ragno è necessaria per la costruzione di alcuni edifici e abbigliamento, mentre pettorine sono le uniformi dei soldati. La tessitura ha bisogno di filo di ragno e di seta d'oro come materia prima. La seta di ragno è prodotta da allevamento dei ragni, mentre filo d'oro è prodotta dal mulino di filatura dell'oro.","scenario_atl01.wmf","../../data/campaigns/atl01.wmf/scripting/texts.lua:75"
"Tabard","Tabarro","We offer to also produce the tabards for young soldiers and the golden tabards for officers for you in exchange. You will need them for sure as soon as you want to recruit new soldiers.","In cambio ci offriamo di produrre i tabarri per i giovani soldati ed i tabarri dorati per gli ufficiali. Ne avrai sicuramente bisogno non appena vorrai reclutare nuovi soldati.","scenario_atl01.wmf","../../data/campaigns/atl01.wmf/scripting/texts.lua:271"
"Tabard","Tabarro","Weaves spidercloth for buildings and ships’ sails, and tabards to equip and train the soldiers.","Tesse il tessuto di ragno per gli edifici e per le vele delle navi, e i tabarri per equipaggiare e addestrare i soldati","tribes_encyclopedia","../../data/tribes/buildings/productionsites/atlanteans/weaving_mill/helptexts.lua:16"
"Golden Tabard","Tabarro dorato","We offer to also produce the tabards for young soldiers and the golden tabards for officers for you in exchange. You will need them for sure as soon as you want to recruit new soldiers.","In cambio ci offriamo di produrre i tabarri per i giovani soldati ed i tabarri dorati per gli ufficiali. Ne avrai sicuramente bisogno non appena vorrai reclutare nuovi soldati.","scenario_atl01.wmf","../../data/campaigns/atl01.wmf/scripting/texts.lua:271"
"Lumberjack","Taglialegna","I got the message that our first lumberjack has started his work today. Perhaps it would be a good idea to wait until he has cleared enough space for constructing two more lumberjack’s houses, so that we can harvest the logs faster.","Ho ricevuto il messaggio che il nostro boscaiolo ha iniziato il suo lavoro oggi. Forse sarebbe una buona idea aspettare fino a che non avrà fatto abbastanza spazio per costruire altre due case del boscaiolo, in modo che sia possibile raccogliere più velocemente i tronchi.","scenario_emp01.wmf","../../data/campaigns/emp01.wmf/scripting/texts.lua:171"
"Lumberjack","Taglialegna","Great work, the citadel is finished. But what’s that? A hostile tribe has settled next to us while the citadel was under construction! Do you see how they took away a part of our land? And our lumberjack has now lost his place of work. This is what I was talking about. Let’s take our land back and defeat the enemy!","Bel lavoro, la cittadella è stata completata. Ma ora che succede? una tribù ostile si è stabilita vicino a noi mentre la cittadella era in costruzione! Vedi come hanno catturato parte della nostra terra? E il nostro tagialegna ha perso la sua sede di lavoro. È di questo che parlavo. Riprendiamoci la nostra terra e sconfiggiamo il nemico!","scenario_tutorial02_warfare.wmf","../../data/campaigns/tutorial02_warfare.wmf/scripting/texts.lua:204"
"Woodcutter","Taglialegna","The woodcutter working at this woodcutter’s house can’t find any trees in his work area. You should consider dismantling or destroying the building or building a forester’s house.","Il boscaiolo che lavora in questa capanna non riesce trovare nessun albero nella sua area di lavoro. Dovresti considerare la possibilità di smantellare o distruggere l'edificio o costruire una capanna per la guardia forestale.","tribes","../../data/tribes/buildings/productionsites/atlanteans/woodcutters_house/init.lua:54"
"Lumberjack","Taglialegna","The lumberjack working at this lumberjack’s hut can’t find any trees in his work area. You should consider dismantling or destroying the building or building a ranger’s hut.","Controlli","tribes","../../data/tribes/buildings/productionsites/barbarians/lumberjacks_hut/init.lua:61"
"Lumberjack","Taglialegna","The felling ax is the tool of the lumberjack to chop down trees.","L'ascia da disboscamento è lo strumento usato dal tglialegna per abbattere alberi.","tribes_encyclopedia","../../data/tribes/wares/felling_ax/helptexts.lua:4"
"Stonecutter","Tagliapietre","Picks are used by stonecutters and miners. They are produced by the toolsmith.","I picconi sono utilizzati da scalpellini e dei minatori. Sono prodotti dal fabbro.","tribes_encyclopedia","../../data/tribes/wares/pick/helptexts.lua:4"
"Terrain","Terreno","Mines can only be built on mountain terrain. Suitable places for mines are displayed as orange mine symbols.","Le miniere possono essere costruite soltanto su terreni di montagna. I luoghi adatti per le miniere sono rappresentati da simboli arancioni.","scenario_bar01.wmf","../../data/campaigns/bar01.wmf/scripting/texts.lua:59"
"territory","Territorio","It’s a pleasure to settle in the beauty of this fissured countryside. But the ways to encompass these large territories are long and meandering, so it is easy to err into the land of the foreign clans.","È un piacere insediarsi nello splendore di questo paesaggio fratturato. Ma le strade per circondare questi estesi territori sono lunghe e serpeggianti, pertanto è facile sconfinare nei territori delle tribù straniere.","maps","../../data/maps/Calvisson.wmf/elemental:10"
"Weaver","Tessitore","The weavers produce spidercloth and tabards in the weaving mill. Spidercloth is needed for the construction of some buildings and clothing, while tabards are the uniforms of soldiers. The weaving mill needs gold thread and spider silk as raw material. Spider silk is produced by the spider farm, while gold thread is produced by the gold spinning mill out of gold.","I tessitori producono tessuto di ragno e tabards nella tessitura. Il tessuto di ragno è necessaria per la costruzione di alcuni edifici e abbigliamento, mentre pettorine sono le uniformi dei soldati. La tessitura ha bisogno di filo di ragno e di seta d'oro come materia prima. La seta di ragno è prodotta da allevamento dei ragni, mentre filo d'oro è prodotta dal mulino di filatura dell'oro.","scenario_atl01.wmf","../../data/campaigns/atl01.wmf/scripting/texts.lua:75"
"Cloth","Tessuto","Produces cloth for ships and soldiers.","Produce tessuti per navi e soldati.","tribes_encyclopedia","../../data/tribes/workers/empire/weaver/helptexts.lua:3"
"Tower","Torre","We spent the last week building two watchtowers on the mountains close to our landing area; and, of course, a hall for us all. We have very talented constructors in our group – still, the buildings do not match the art we had on Atlantis. I hope they will withstand the next rain. At least, the towers will warn us if a ship from Atlantis follows us and if the island is inhabited, we will see attackers a long time before they arrive.","Abbiamo passato le ultime due settimane costruendo due torri di guarda sulle montagne vicino alla nostra area di sbarco; ed ovviamente una residenza per tutti noi. Abbiamo nel nostro gruppo dei costruttori molto talentuosi - eppure, gli edifici non eguagliano l'arte che avevamo su Atlantide. Spero possano superare la prossima pioggia. Almeno le torri ci avvertiranno se una nave proveniente da Atlantide ci sa seguito e, se l'isola è abitata, avvisteremo gli aggressori molto tempo prima che arrivino.","scenario_atl01.wmf","../../data/campaigns/atl01.wmf/scripting/texts.lua:187"
