"glossary_term","glossary_translation","source","target","file","location"
"Water","Acqua","Build a fisher’s house close to water to get raw fish","Costruisci una casa del pescatore per ottenere del pesce crudo.","scenario_atl01.wmf","../../data/campaigns/atl01.wmf/scripting/texts.lua:62"
"Smokery","Affumicatoio","The other two important food wares are smoked fish and smoked meat. Raw meat is delivered from a hunter. A fisher gets the fish out of the sea while a fish breeder makes sure that a school of fish does not go extinct by breeding more. Make sure that there are always fish left, otherwise the fish breeder won’t be able to breed new ones. The smoking happens in a smokery, you will need at least two of those.","Gli altri due beni alimentari importanti sono il pesce affumicato e la carne affumicata. La carne cruda è procurata da un cacciatore. Un pescatore prende il pesce da mare mentre un allevatore di pesci si assicura che la riserva di pesci non si estinga allevandone di più. Assicurati che ci siano sempre dei pesci rimasti, altrimenti l'allevatore di pesci non sarà in grado di allevarne altri. L'affumicatura avviene in un affumicatio, ne avrai bisogno di almeno due.","scenario_atl01.wmf","../../data/campaigns/atl01.wmf/scripting/texts.lua:56"
"Smokery","Affumicatoio","Build a tavern, a fisher’s house, a smokery, a berry farm and a fruit collector’s house.","Costruisci una taverna, una casa del pescatore, una casa dell'affumicatore, una fattoria di bacche e una casa del raccoglitore di frutta.","scenario_fri01.wmf","../../data/campaigns/fri01.wmf/scripting/texts.lua:59"
"Smokery","Affumicatoio","We need to build a tavern for preparing rations. To get the raw food, we have to build a fisher’s house, and as nobody likes raw fish, a smokery to smoke it. Furthermore, build a berry farm which will plant berry bushes, and a fruit collector’s house so the bushes will be harvested.","Dobbiamo costruire una taverna per preparare delle razioni. Per procurarci il cibo da cucinare, dobbiamo costruire una casa del pescatore e, dato che nessuno apprezza il pesce crudo, una casa dell'affumicatore per affumicarlo. In più, costruiremo una fattoria di bacche in cui piantare arbusti di bacche ed una casa del raccoglitore di frutta così da poter fare il raccolto dei frutti degli arbusti.","scenario_fri01.wmf","../../data/campaigns/fri01.wmf/scripting/texts.lua:220"
"Smokery","Affumicatoio","Fish is one of the biggest food resources of the Atlanteans. It has to be smoked in a smokery before being delivered to mines, training sites and scouts.","Il pesce è una delle più grandi fonti di cibo degli Atlantidei. Deve essere affumicato in un affumicatore prima di essere consegnato alle miniere, ai luoghi di addestramento ed agli esploratori.","tribes_encyclopedia","../../data/tribes/initialization/atlanteans/units.lua:476"
"Smokery","Affumicatoio","As no Atlantean likes raw fish, smoking it in a smokery is the most common way to make it edible.","Dal momento che nessun Atlantideo ama il pesce crudo, affumicarlo in un affumicatore è il sistema più comune per renderlo commestibile.","tribes_encyclopedia","../../data/tribes/initialization/atlanteans/units.lua:485"
"Smokery","Affumicatoio","Smoked meat is made out of meat in a smokery. It is delivered to the mines and training sites (labyrinth and dungeon) where the miners and soldiers prepare a nutritious lunch for themselves.","La carne affumicata è prodotta partendo dalla carne in un affumicatore. Viene consegnata alle miniere e ai siti di addestramento (labirinti e segrete), dove i minatori e i soldati si preparano un nutriente pasto.","tribes_encyclopedia","../../data/tribes/initialization/atlanteans/units.lua:506"
"Smokery","Affumicatoio","This hook pole is used by the smoker to suspend all the meat and fish from the top of the smokery. It is created by the toolsmith.","Questo palo uncinato è utilizzato dall'affumicatore per appendere la carne ed il pesce in alto, nell'affumicatore. È prodotto dal fabbro di attrezzi.","tribes_encyclopedia","../../data/tribes/initialization/atlanteans/units.lua:739"
"Ironwood Tree","Albero di legno ferro","This ironwood tree is ready for harvesting ironwood by a master woodcutter. Other tribes can harvest it for normal logs.","Quest'albero del legno ferro è pronto per essere tagliato da un mastro taglialegna. Altre tribù possono usarlo per farne normali tronchi.","tribes_encyclopedia","../../data/tribes/initialization/amazons/units.lua:911 ../../data/tribes/initialization/amazons/units.lua:939 ../../data/tribes/initialization/amazons/units.lua:967 ../../data/tribes/initialization/amazons/units.lua:995"
"Horse Farm","Allevamento di cavalli","People are complaining about crowded streets and slow transportation. We need to help out our carriers on the roads. I have decided to build a horse farm so that the horses can help with the heavy wares.","La gente si sta lamentando delle strade affollate e dei trasporti lenti. Dobbiamo dare una mano ai nostri trasportatori sulle strade. Ho deciso di costruire una stalla, così i cavalli potranno essere d'aiuto con le merci pesanti.","scenario_atl01.wmf","../../data/campaigns/atl01.wmf/scripting/texts.lua:382"
"Spider Farm","Allevamento di ragni","May Satul warm you, Jundlina! The weaving mill, gold spinning mill and spider farm buildings are complete and are starting their work at this very moment. The weavers’ guild is very grateful for your support and we will stand by our word and deliver the first tabard very soon.","Possa Satul riscaldarti, Jundlina! Lo stabilimento tessile, lo stabilimento di filatura dell'oro e l'allevamento dei ragni sono completi, e stanno iniziando proprio ora la produzione. La gilda dei tessitori ti è assai grata per il tuo  supporto: manterremo la nostra parola e molto presto consegneremo il primo tabarro.","scenario_atl01.wmf","../../data/campaigns/atl01.wmf/scripting/texts.lua:285"
"Reindeer Farm","Allevamento di renne","Build a barracks, a reindeer farm and a sewing room.","Costruisci una caserma, una fattoria delle renne e una sala da cucito.","scenario_fri01.wmf","../../data/campaigns/fri01.wmf/scripting/texts.lua:83"
"Pig Breeder","Allevatore di maiali","The pig breeder needs %1% on average to raise and slaughter a pig.","L'alllevatore di maiali impiega in media %1% per crescere e macellare un maiale.","tribes_encyclopedia","../../data/tribes/initialization/empire/units.lua:1726"
"Al’thunran","Al’thunran","We can see the raging flames that swallow Al’thunran from here, miles away.","Da qui possiamo vedere in lontananza le fiamme infuriate che inghiottono Al'thunran.","scenario_bar01.wmf","../../data/campaigns/bar01.wmf/scripting/texts.lua:156"
"Al’thunran","Al’thunran","So you want to prepare us for a longer stay in these forests, Thron? Well, I see the wisdom in doing so, yet my heart is yearning for a glorious return to Al’thunran. Too long have we waited while our brethren have fought on the battlefield, and our axes and swords have turned rusty over time.","Allora vuoi prepararci a una lunga permanenza in queste foreste, Thron? Beh, vedo saggezza nel farlo, ma il mio cuore desidera un glorioso ritorno ad Al'thunran. Troppo a lungo abbiamo atteso mentre il nostro popolo combatteva, e le nostre asce e spade si sono arrugginite nel tempo.","scenario_bar01.wmf","../../data/campaigns/bar01.wmf/scripting/texts.lua:302"
"Al’thunran","Al’thunran","When I gazed at the horizon, I still saw crimson lights flicker in the distance. It is incredible with how much passion my brethren fight this war. I fear the moment I will see Al’thunran again – will there be anything but ashes and wasted ruins left of our once beautiful capital when we get there?","Quando ho guardato l'orizzonte, Ho visto ancora luci cremisi di lampade in lontananza. È incredibile con quanta passione i miei fratelli combattono questa guerra. Temo il momento in qui vedrò di nuovo Al'thunran - quando ci arriveremo ci sarà qualcosa oltre alle ceneri e alle rovine devastate della nostra capitale una volta bella?","scenario_bar01.wmf","../../data/campaigns/bar01.wmf/scripting/texts.lua:508"
"Al’thunran","Al’thunran","But they fear that the war around Al’thunran will set an end to this life. Therefore, they have decided to join us, hoping that we can help each other.","Ma temono che la guerra ad Al'thunran marcherà la fine di questo stile di vita. Pertanto, hanno deciso di unirsi a noi, sperando che possiamo aiutarci a vicenda.","scenario_bar01.wmf","../../data/campaigns/bar01.wmf/scripting/texts.lua:534"
"Al’thunran","Al’thunran","The news that a patrol brought is not good to hear. Our spies tell us that the war tribes still rage in battle, but some of the elder soldiers and tribe leaders seem to grow tired of this senseless war. Kalitath, son of Kun is the first war leader to leave Al’thunran, thus leaving his side weak and vulnerable. As my scouts report, he has set foot on the lower grounds around the capital, securing the outer fortification rings.","Le notizie che ci ha portato una pattuglia non sono bella da ascoltare. Le nostre spie ci dicono che le tribù sono ancora impegnate in una rabbiosa battaglia, ma alcuni dei soldati più anziani e dei capitribù sembrano stanchi di questa guerra insensata. Kalitath, figlio di Kun, è il primo condottiero a lasciare Al'thunran, lasciando così il suo lato debole e vulnerabile. Come riportato dal mio esploratore, egli ha messo piede nelle terre attorno alla capitale, mettendo in sicurezza gli anelli esterni della fortificazione.","scenario_bar02.wmf","../../data/campaigns/bar02.wmf/scripting/texts.lua:170"
"Al’thunran","Al’thunran","Thron seeks to believe that Kalitath is tired of fighting and would be willing to join us once we march to re-establish law and order in Al’thunran. But I don’t think so. Kalitath is son to one of the mightiest generals of our forces and his family never quite liked the thought of bowing before the banner of Chat’Karuth. Why should he march with Chat’Karuth’s son to reclaim his heritage and the throne?","Thron cerca di credere che Kalitath sia stanco di combattere e sia disposto a unirsi a noi, prima di marcire insieme per ristabilire la legge e l'ordine in Al'thunran. Ma io non la penso così. Kalitath è figlio di uno dei generali più potenti delle nostre forze e alla sua famiglia non piaceva molto l'idea di inchinarsi davanti la bandiera di Chat'Karuth. Perché avrebbe dovuto marciare con suo figlio per reclamare il suo patrimonio e il trono?","scenario_bar02.wmf","../../data/campaigns/bar02.wmf/scripting/texts.lua:178"
"Al’thunran","Al’thunran","The frontier line of my forces has expanded to the edge of the forests. We have a long and cold winter and so many miles behind us. The fortification that we erected around Ondun will guarantee us a fast supply of men and goods, and once Al’thunran is in my hands, the two cities will be linked by a good and defensible infrastructure. Still, I hope I will not walk alone on this mission, I hope Kalitath son of Kun will follow my call.","I nostri confini hanno raggiunto i bordi della foresta. Abbiamo alle nostre spalle un inverno lungo e rigido e tante miglia. Le fortificazioni che abbiamo eretto intorno ad Ondun ci garantiranno un rapido rifornimento di uomini e merci ed una volta che Al'thunran sarà nelle mie mani, le due città saranno collegate da un'infrastruttura valida e difendibile. Spero ancora che non sarò da solo in questa missione, che Kalitat, il figlio di Kun, risponda alla mia chiamata.","scenario_bar02.wmf","../../data/campaigns/bar02.wmf/scripting/texts.lua:194"
"Al’thunran","Al’thunran","I have sent men to meet with Kalitath in his fortress. He has barricaded the former main entrance to the capital and is trying to set up a siege ring around Al’thunran. He will not let anyone enter or leave the city while the ring is intact. Until now, he has not answered any of my messages. But the time I spend waiting won’t be lost. I will train my soldiers further and prepare for battle.","Ho inviato degli uomini a incontrare Kalitath nella sua fortezza. Egli ha barricato la precedente entrata principale della capitale e sta provando a disporre un anello d'assedio attorno ad Al'thunran. Non lascerà entrare o uscire nessuno dalla città fintanto che l'anello d'assedio sarà intatto. Fino ad ora non ha riposto a nessuno dei miei messaggi. Tuttavia il tempo che passo ad aspettare una risposta non viene sprecato. Migliorerò l'addestramento dei miei soldati e mi preparerò per la battaglia.","scenario_bar02.wmf","../../data/campaigns/bar02.wmf/scripting/texts.lua:202"
"Al’thunran","Al’thunran","The first fortification Thron ordered has just been completed. At the moment, he seeks to bring trust and belief to those who live inside the walls of our new habitat that we named ‘Ondun’, which means ‘those who wait’ in the old tongue. But Thron is not yet satisfied – and I fully understand his fears: the forests are deep, and the frontier to Al’thunran is near. I am sure that there are a thousand greater dangers out there than the unknown tracks.","La prima fortificazione che Thron ci ha ordinato di costruire è appena stata completata. Al momento sta cercando di rafforzare la fiducia di coloro che vivono all'interno delle mura del nostro nuovo habitat che abbiamo chiamato 'Ondun', che significa 'coloro che aspettano' nella lingua antica. Tuttavia Thron non è ancora soddisfatto – e comprendo bene le sue paure: la foresta è profonda e il confine con Al'thunran è vicino. Sono sicuro che là fuori ci sono migliaia di pericoli ben più grandi delle tracce sconosciute","scenario_bar02.wmf","../../data/campaigns/bar02.wmf/scripting/texts.lua:269"
"Al’thunran","Al’thunran","I have just spoken to the leader of our patrol. He told me that they found some mountains to the north-east and east of our territory. With a bit of luck this will open up a new chance for rearming our men, because as far as I remember, most of the mountains west of Al’thunran hold coal and some metal ores.","Ho appena parlato con il comandante della pattuglia. Mi ha detto che hanno trovato alcune montagne a nod-est e a est del nostro territorio. Con un po' di fortuna questo ci permetterà di ri-armare i nostri uomini perchè, per quanto riesco a ricordare, la maggior parte delle montagne ad ovest di Al'thunran contengono miniere di carbone e di qualche metallo.","scenario_bar02.wmf","../../data/campaigns/bar02.wmf/scripting/texts.lua:281"
"Al’thunran","Al’thunran","So be it, the generals are out and about arranging my troops, and Boldreth himself will lead the first strike. I will ride by his side, to free Al’thunran of this war and return peace to our capital.","E sia, i generali sono fuori a preparare le mie truppe e lo stesso Boldreth guiderà il primo assalto. Cavalcherò al suo fianco, per liberare Al'thunran da questa guerra e riportare la pace nella nostra capitale.","scenario_bar02.wmf","../../data/campaigns/bar02.wmf/scripting/texts.lua:341"
"Battle Arena","Arena di battaglia","Barracks train basic soldiers while training sites like a training camp or a battle arena are used for training soldiers in their different attributes. These attributes are important in fights and the better a soldier is, the higher is the chance to win a fight.","Le caserme addestrano soldati di base, mentre strutture come i campi di addestramento o le arene di battaglia servono a migliorare i differenti attributi dei soldati. Questi attributi sono importanti nei combattimenti e più alto è il loro valore, maggiore è la possibilità di vincere il combattimento.","scenario_bar02.wmf","../../data/campaigns/bar02.wmf/scripting/texts.lua:112"
"Battle Arena","Arena di battaglia","While we’re waiting for the battle arena, you’ll probably notice some soldiers walking around. They are automatically exchanged from time to time. I’ll teach you about that later.","Mentre aspettiamo che l'arena venga completata, avrai probabilmente notato dei soldati che si muovono in giro. Sono scambiati automaticamente di tanto in tanto. Più tardi ti spiegherò come.","scenario_tutorial02_warfare.wmf","../../data/campaigns/tutorial02_warfare.wmf/scripting/texts.lua:68"
"Warrior’s Ax","Ascia da guerriero","The warrior’s ax is the most dangerous of all Barbarian weapons. Only a few soldiers ever were able to handle this huge and powerful ax. It is produced in a war mill and used – together with food – in a training camp to train soldiers from attack level 4 to level 5.","L'ascia del guerriero è la più pericolosa fra tutte le armi dei Barbari. Solamente pochi soldati furono veramente in grado di gestire quest'enorme e potente ascia. Viene prodotta in una fucina da guerra e usata - insieme al cibo - in un campo di addestramento per addestrare i soldati in attacco dal livello 4 al livello 5.","tribes_encyclopedia","../../data/tribes/initialization/barbarians/units.lua:504"
"Atlantean","Atlantideo","A special tournament in Atlantean culture is the so-called ‘Island Hopping’, where two or more groups try to reach the center island as fast as possible, to be the first erecting a castle on the top of the central mountain.","Un torneo speciale nella cultura atlantidea è il cosiddetto "Salto delle isole", dove due o più gruppi provano a raggiungere l'isola centrale il più velocemente possibile per essere i primi a costruire un castello sulla cima della montagna centrale.","maps","../../data/maps/MP_Scenarios/Island_Hopping.wmf/elemental:9"
"Atlantean","Atlantideo","Island Hopping is a traditional tournament in Atlantean culture. The rules of the game are simple: you start with a headquarters on an island. When you finish a castle at the end of the first island, you are granted a second headquarters on a second island, which will contain all wares from your first headquarters.","Il Salto delle Isole è un tradizione torneo della cultura Atlantidea. Le regole del gioco sono semplici: cominci con un quartier generale su un'isola. Quando finisci di costruire un castello alla fine della prima isola ricevi un secondo quartier generale sulla seconda isola contenente tutte le merci del tuo primo quartier generale.","mp_scenario_island_hopping.wmf","../../data/maps/MP_Scenarios/Island_Hopping.wmf/scripting/texts.lua:9"
"Atlantean","Atlantideo","The double trident is one of the best tridents produced by the Atlantean weapon smithy. It is used in a dungeon – together with food – to train soldiers from attack level 2 to level 3.","Il tridente doppio è uno dei migliori tridenti prodotto dalla fucina d'armi atlantidea. È usata in una segreta - insieme al cibo - per addestrare i soldati dal livello 2 al livello 3 di attacco.","tribes_encyclopedia","../../data/tribes/initialization/atlanteans/units.lua:817"
"Atlantean","Atlantideo","This is the most dangerous weapon of the Atlantean military. Only the best of the best soldiers may use it. It is produced in the weapon smithy and used in the dungeon – together with food – to train soldiers from attack level 3 to level 4.","Questa è l'arma più pericolosa nelle forze armate atlantidee. Solo i migliori soldati possono utilizzarla. È prodotta nella fucina delle armi ed utilizzata nella segreta - insieme al cibo - per addestrare i soldati dal livello 3 al livello 4 di attacco.","tribes_encyclopedia","../../data/tribes/initialization/atlanteans/units.lua:826"
"Atlantis","Atlantis","After landing on a mysterious island close to Atlantis, the remaining Atlanteans struggle to make a new home for themselves.","Dopo l'approdo su una misteriosa isola vicina ad Atlantide, i rimanenti Atlantidei lottano per creare una nuova casa per loro stessi.","maps","../../data/campaigns/atl01.wmf/elemental:11"
"Atlantis","Atlantis","On the hidden and lost island of Atlantis, a proud tribe settled since the world was very young. Ruled by the bloodline of King Ajanthul – the first human to be empowered by the sea god Lutas to breathe above sea level – and the wise clerics, who provided the link to Lutas – they prospered and became civilized.","Sull'isola nascosta e sperduta di Atlantide, una fiera tribù si insediò sin da quando il mondo era molto giovane. Governata dalla discendenza di Re Ajanthul - il primo umano ad essere autorizzato dal dio del mare Lutas a respirare sopra il livello del mare – e dai saggi ecclesiastici – che mantenevano il legame con Lutas - essi prosperarono e divennero civilizzati.","scenario_atl01.wmf","../../data/campaigns/atl01.wmf/scripting/texts.lua:146"
"Atlantis","Atlantis","This story is taking place during the reign of King Askandor, the 43rd successor of King Ajanthul. He had been a good king, ruling Atlantis with wisdom and foresight. But with age, he became afraid of dying and so he began looking for a cure for death even though most clerics warned him against it. Some said that endless life was only for the gods and that to seek for it was forbidden.","Questa storia si svolge durante il regno di Re Askandor, il 43esimo successore di Re Ajanthul. Era stato un buon re, governando gli Atlantidei con saggezza e lungimiranza. Ma l'avanzare dell'età portò con sé la paura di morire ed egli cominciò quindi a cercare un rimedio per la morte, nonostante la maggior parte dei religiosi lo avessero ammonito a non farlo. Dicevano che la vita eterna fosse solo per gli dei e che la sua ricerca fosse proibita.","scenario_atl01.wmf","../../data/campaigns/atl01.wmf/scripting/texts.lua:148"
"Atlantis","Atlantis","But not even this changed the mind of the god. The water kept on rising. Nearly driven insane by guilt, pain and anger, Jundlina became a heretic: Secretly, she gathered people of the common folk who were not in line with the decision of the clerics to accept the god’s will. Together with them, she set the temple on fire and stole a ship to flee from the god’s influence over Atlantis. This small group started praying to Satul, the fire god and the worst enemy of Lutas.","Ma neanche questo fece cambiare idea al dio. L'acqua continuò a salire. Quasi impazzita dal senso di colpa, dal dolore e dalla rabbia, Jundlina divenne un'eretica: segretamente, riunì persone del popolo che non erano d'accordo con la decisione dei religiosi di accettare la volontà del dio. Insieme a loro, diede fuoco al tempio e rubò una nave per fuggire dalle influenze del dio di Atlantide. Questo piccolo gruppo iniziò a pregare Satul, dio del fuoco e peggior nemico di Lutas.","scenario_atl01.wmf","../../data/campaigns/atl01.wmf/scripting/texts.lua:170"
"Atlantis","Atlantis","Leaving the dying Atlantis and their past behind, they started on a quest to find a place sheltered by the fire and protected from the sea.","Lasciandosi la morente Atlantide ed il loro passato alle spalle, cominciarono una ricerca per trovare un luogo al riparo dal fuoco e protetto dal mare.","scenario_atl01.wmf","../../data/campaigns/atl01.wmf/scripting/texts.lua:172"
"Atlantis","Atlantis","We left Atlantis and sailed east. We entered the forbidden sea on the sixth day without noticing any pursuers from Atlantis and without Lutas having smashed our ship. Now, we are out of his reach. One day later, we sighted an island which seems to have one of these fire spitting mountains on it. I deemed this a sign from the fire god and we landed on its shore.","Abbiamo lasciato Atlantide e veleggiato verso est. Siamo entrati nel mare proibito durante il sesto giorno senza notare alcun inseguitore da Atlantide e senza che Lutas abbia distrutto la nostra nave. Adesso siamo fuori dalla sua portata. Il giorno dopo, abbiamo avvistato un isola che sembrava avere una di quelle montagne sputa-fuoco. Ho giudicato che fosse un segno del dio del fuoco e siamo approdati sulle sue coste.","scenario_atl01.wmf","../../data/campaigns/atl01.wmf/scripting/texts.lua:182"
"Atlantis","Atlantis","We spent the last week building two watchtowers on the mountains close to our landing area; and, of course, a hall for us all. We have very talented constructors in our group – still, the buildings do not match the art we had on Atlantis. I hope they will withstand the next rain. At least, the towers will warn us if a ship from Atlantis follows us and if the island is inhabited, we will see attackers a long time before they arrive.","Abbiamo passato l'ultima settimana costruendo due torri di guarda sulle montagne vicino alla nostra zona di approdo, ed ovviamente un salone per tutti noi. Abbiamo dei costruttori molto talentuosi nel nostro gruppo – eppure, gli edifici non eguagliano il pregio che avevamo ad Atlantide. Spero possano superare la prossima pioggia. Quanto meno, le torri ci avvertiranno se una nave proveniente da Atlantide ci seguisse e, se l'isola è abitata, avvisteremo gli aggressori molto tempo prima del loro arrivo.","scenario_atl01.wmf","../../data/campaigns/atl01.wmf/scripting/texts.lua:185"
"Atlantis","Atlantis","May Satul warm you, Jundlina! I agree with what Loftomor proposes. We need a good supply of building materials for we have to expand our territory swiftly. I will not feel safe on this island as long as we have not seen all its shores. I brought plenty of good men from Atlantis. The military might is available. We only need some housing to live in.","Possa Satul riscaldarti, Jundlina! Sono d'accordo con le proposte di Loftomor. Abbiamo bisogno di una buona fornitura di materiali da costruzione, dobbiamo espandere rapidamente il nostro territorio. Non mi sentirò sicuro su quest'isola fintanto che non avrò visto tutte le sue coste. Ho portato una moltitudine di buoni uomini da Atlantide. La forza militare è disponibile. Abbiamo solo bisogno di qualche alloggio in cui schierarli.","scenario_atl01.wmf","../../data/campaigns/atl01.wmf/scripting/texts.lua:207"
