"glossary_term","glossary_translation","source","target","file","location"
"back","indietro","Nothing is left of that beauty I remember, only ruins remain of the old capital. I am sorrowful but also relieved. I never hoped to see Al’thunran’s old beauty again – it was only a few months ago that I wondered whether I would ever be able to set my feet there again. Now the old town is back in my hands, and I will not hesitate to rebuild it with all the strength my people have. I can’t wait to see it again in its old beauty.","Nulla è rimasto di quella bellezza che ricordo, restano solo le rovine della vecchia capitale. Sono addolorato, ma anche sollevato. Non ho mai sperato di vedere di nuovo la bellezza della vecchia Al'thunran - era solo pochi mesi fa, che mi sono chiesto se i miei piedi avessero percorso quelli luoghi ancora. Ora la vecchia città è di nuovo nelle mie mani, e io non esiterò a ricostruirla con tutta la forza che la mia gente possiede. Non vedo l'ora di vederlo di nuovo nella sua vecchia bellezza.","scenario_bar02.wmf","../../data/campaigns/bar02.wmf/scripting/texts.lua:331"
"back","indietro","At first, I was naive and hoped that they were peaceful, but as soon as one of them saw me, they charged towards me and started attacking me with their throwing spears. Thanks be to the Gods that I was able to flee and hide myself, before retreating back to our colony under cover of darkness.","In un primo momento, sono stato ingenuo e speravo che fossero pacifici, ma appena uno di loro mi ha visto si è rivolto verso di me ed hanno cominciato ad attaccarmi lanciando le loro lance. Grazie agli Dei sono stato in grado di fuggire e nascondermi, prima di ritirarmi di nuovo nella nostra colonia col favore delle tenebre.","scenario_emp02.wmf","../../data/campaigns/emp02.wmf/scripting/texts.lua:243"
"back","indietro","There are still a few Barbarians hiding on our island, but I am sure that we will find them soon. Every Barbarian who doesn’t attack us will be put in a boat with the other peaceful ones, and sent back to their country.","Ci sono ancora alcuni Barbari che si nascondono sulla nostra isola, ma sono certo che li troveremo presto. Ciascun Barbaro che non ci attacchi sarà messo in una barca con gli altri pacifisti, e verrà rispedito alla loro patria.","scenario_emp02.wmf","../../data/campaigns/emp02.wmf/scripting/texts.lua:267"
"back","indietro","Today a pigeon landed on our island. It brought a message which fills me with dark thoughts and brings back my fears.","Oggi un piccione è atterrato sulla nostra isola. Ha portato un messaggio che mi riempie di pensieri scuri e riporta le mie paure.","scenario_emp02.wmf","../../data/campaigns/emp02.wmf/scripting/texts.lua:285"
"back","indietro","The message was addressed to me, begging me to come back to Fremil. It says that the Empire is at war with the Barbarians. They were attacked from the north by the tribe that I was forbidden to attack. It is clear to me what I must do…","Il messaggio è stato indirizzato a me, pregandomi di tornare a Fremil. Si dice che l'Impero è in guerra con i barbari. Sono stati attaccati da nord da parte della tribù che mi era proibito di attaccare. È chiaro per me che cosa devo fare...","scenario_emp02.wmf","../../data/campaigns/emp02.wmf/scripting/texts.lua:288"
"back","indietro","I really don’t know if and how we will get back home. And the war is going on without us. I hope my fellow soldiers are defending our empire well.","Non so se e come riusciremo a tornare a casa. E la guerra sta procedendo senza di noi. Spero che i miei prodi soldati stiano difendendo con onore il nostro impero.","scenario_emp03.wmf","../../data/campaigns/emp03.wmf/scripting/texts.lua:221"
"back","indietro","First, we need to find some more resources to back up our growing economy. I have spotted an island with some mountains in the south. Perhaps we can find some valuable resources like iron there.","Innanzitutto, dobbiamo trovare più risorse a supporto della nostra crescente economia. Ho scoperto l'esistenza di un'isola montagnosa che si staglia a sud; potrebbe nascondere preziose risorse, quali il ferro, ad esempio.","scenario_emp03.wmf","../../data/campaigns/emp03.wmf/scripting/texts.lua:418"
"back","indietro","I have seen some advanced weapons in our warehouses. Perhaps it would be possible to smelt them back into metal? But that seems like a waste of the precious swords…","Ho visto alcune armi avanzate nei nostri magazzini. Sarebbe forse possibile fonderli nuovamente nei metalli di cui sono composte? Anche se potrebbe sembrare uno spreco delle preziose spade…","scenario_fri02.wmf","../../data/campaigns/fri02.wmf/scripting/texts.lua:194"
"back","indietro","You can also reload the game from a previous savegame. Luckily, these are created from time to time. To do so, you will have to go back to the main menu and choose ‘Single Player’ → ‘Load Game’. And please be a bit more careful next time.","Puoi anche ricaricare la partita da un salvataggio precedente. Fortunatamente i salvataggi vengono creati, di tanto in tanto. Per farlo, basta tornare al menu principale e scegliere 'Giocatore singolo' → 'Carica partita'. Mi raccomando però, fai attenzione la prossima volta!","scenario_tutorial01_basic_control.wmf","../../data/campaigns/tutorial01_basic_control.wmf/scripting/texts.lua:408"
"back","indietro","Well done. Now you know how to draw back your soldiers from the places where you don’t need them. It is time to tell you how to reinforce your front line.","Ben fatto. Ora sai come ritirare I soldati dai posti in cui non ti servono. È tempo di mostrarti come rinforzare la tua linea del fronte.","scenario_tutorial02_warfare.wmf","../../data/campaigns/tutorial02_warfare.wmf/scripting/texts.lua:238"
"back","indietro","Great work, the citadel is finished. But what’s that? A hostile tribe has settled next to us while the citadel was under construction! Do you see how they took away a part of our land? And our lumberjack has now lost his place of work. This is what I was talking about. Let’s take our land back and defeat the enemy!","Bel lavoro, la cittadella è stata completata. Ma ora che succede? una tribù ostile si è stabilita vicino a noi mentre la cittadella era in costruzione! Vedi come hanno catturato parte della nostra terra? E il nostro tagialegna ha perso la sua sede di lavoro. È di questo che parlavo. Riprendiamoci la nostra terra e sconfiggiamo il nemico!","scenario_tutorial02_warfare.wmf","../../data/campaigns/tutorial02_warfare.wmf/scripting/texts.lua:262"
"back","indietro","Welcome back. In this tutorial, you are going to learn the most important things about seafaring, that is ships, ports, and expedition.","Bentornato. In questo tutorial, imparerai le cose più importanti sui viaggi in mare, cioè navi, porti, e spedizioni.","scenario_tutorial03_seafaring.wmf","../../data/campaigns/tutorial03_seafaring.wmf/scripting/texts.lua:15"
"back","indietro","But I don’t want to rush you: you have just arrived here and you would probably like to have a closer look at your camp. I will also take a short break and be back soon.","Ma non voglio metterti fretta: sei appena arrivato qui, e probabilmente vorresti dare un'occhiata più da vicino al tuo accampamento. Farò anche una breve pausa e sarò presto di ritorno.","scenario_tutorial03_seafaring.wmf","../../data/campaigns/tutorial03_seafaring.wmf/scripting/texts.lua:28"
"back","indietro","Welcome back. In this tutorial, I’ll tell you what you can do to check how well your economy works.","Bentornato. In questo tutorial ti dirò che cosa si può fare per controllare come funziona la tua economia.","scenario_tutorial04_economy.wmf","../../data/campaigns/tutorial04_economy.wmf/scripting/texts.lua:13"
"back","indietro","The stonemason pauses %s before going back to work again.","Il tagliapietre fa una pausa di %s prima di ritornare al lavoro.","tribes_encyclopedia","../../data/tribes/initialization/barbarians/units.lua:1141"
"workers","lavoratori","This is where ferries come in. Ferries are small rowboats that can carry only one ware at a time, and no workers (other than the one who rows it and who never leaves his boat).","In questi casi possiamo usare i traghetti, piccole barche a remi che possono trasportare una sola merce alla volta e nessun lavoratore (a parte quello che rema e che non lascia mai la barca).","scenario_tutorial03_seafaring.wmf","../../data/campaigns/tutorial03_seafaring.wmf/scripting/texts.lua:260"
"tab","linguetta","Just click on any house symbol next to the rocks, select the small buildings tab in the window that opens up, then click on the quarry symbol.","Clicca su un qualsiasi simbolo di edificio vicino alle rocce, seleziona la linnguetta degli edifici piccoli nella finestra che si apre, e poi clicca sul simbolo della cava.","scenario_tutorial01_basic_control.wmf","../../data/campaigns/tutorial01_basic_control.wmf/scripting/texts.lua:314"
"tab","linguetta","The fourth tab shows the same thing for workers.","La quarta scheda mostra la stessa cosa per i lavoratori.","scenario_tutorial04_economy.wmf","../../data/campaigns/tutorial04_economy.wmf/scripting/texts.lua:169"
"tab","linguetta","The third tab tells you that there are no rations left in your headquarters – that’s not good!","La terza scheda ti dice che non rimangono razioni nel tuo quartier generale – non va bene!","scenario_tutorial04_economy.wmf","../../data/campaigns/tutorial04_economy.wmf/scripting/texts.lua:170"
"Level","livello","Sire, we have all buildings available for training our soldiers, but we should increase our efforts to train them to the highest level and to train more of them.","Mio signore, tutti gli edifici sono pronti per l'addestramento dei soldati, ma sarebbe opportuno aumentare i nostri sforzi per far raggiungere loro il massimo del proprio potenziale, e aumentare il numero stesso di soldati addestrati.","scenario_emp03.wmf","../../data/campaigns/emp03.wmf/scripting/texts.lua:600"
"Level","livello","I recommend to train at least one soldier to the highest level in health, defense and attack. Until then, the enemy is just too strong for us.","Raccomando di addestrare almeno un soldato ai massimi livelli di salute, difesa ed attacco. Fino ad allora il nemico sarà decisamente troppo forte per noi.","scenario_fri01.wmf","../../data/campaigns/fri01.wmf/scripting/texts.lua:342"
"Level","livello","No Level Ground","Non c'è terreno pianeggiante","tribes","../../data/tribes/buildings/productionsites/frisians/clay_pit/init.lua:84"
"attack level","livello di attacco","The long trident is the first trident in the training of soldiers. It is produced in the weapon smithy and used in the dungeon – together with food – to train soldiers from attack level 0 to level 1.","Il tridente lungo è il primo tridente utilizzato nell'allenamento dei soldati. È prodotto nella fucina d'armi ed utilizzato nella segreta - insieme al cibo - per addestrare i soldati dal livello 0 al livello 1 di attacco.","tribes_encyclopedia","../../data/tribes/initialization/atlanteans/units.lua:799"
"attack level","livello di attacco","The double trident is one of the best tridents produced by the Atlantean weapon smithy. It is used in a dungeon – together with food – to train soldiers from attack level 2 to level 3.","Il tridente doppio è uno dei migliori tridenti prodotto dalla fucina d'armi atlantidea. È usata in una segreta - insieme al cibo - per addestrare i soldati dal livello 2 al livello 3 di attacco.","tribes_encyclopedia","../../data/tribes/initialization/atlanteans/units.lua:817"
"attack level","livello di attacco","This is the most dangerous weapon of the Atlantean military. Only the best of the best soldiers may use it. It is produced in the weapon smithy and used in the dungeon – together with food – to train soldiers from attack level 3 to level 4.","Questa è l'arma più pericolosa nelle forze armate atlantidee. Solo i migliori soldati possono utilizzarla. È prodotta nella fucina delle armi ed utilizzata nella segreta - insieme al cibo - per addestrare i soldati dal livello 3 al livello 4 di attacco.","tribes_encyclopedia","../../data/tribes/initialization/atlanteans/units.lua:826"
"attack level","livello di attacco","Young soldiers are proud to learn to fight with this powerful weapon. It is heavier and sharper than the ordinary ax. It is produced in ax workshops and war mills. In training camps, it is used – together with food – to train soldiers from attack level 0 to level 1.","I giovani soldati sono orgogliosi di imparare a combattere con questa potente arma. È più pesante e affilata di un'ascia ordinaria. È prodotta nelle Fabbriche di asce e Fucine da guerra. Si usa nei campi di addestramento - insieme al cibo - per addestrare i soldati in attacco dal livello 0 al livello 1.","tribes_encyclopedia","../../data/tribes/initialization/barbarians/units.lua:468"
"attack level","livello di attacco","The broad ax is produced by the ax workshop and the war mill. It is used in the training camp – together with food – to train soldiers with a fundamental fighting knowledge from attack level 1 to attack level 2.","L'ascia larga è prodotta dalla fabbrica di asce e dalla fucina da guerra. È usata nel campo di addestramento - insieme al cibo - per addestrare i soldati con una conoscenza fondamentale di combattimento in attacco dal livello 1 al livello 2.","tribes_encyclopedia","../../data/tribes/initialization/barbarians/units.lua:477"
"attack level","livello di attacco","The bronze ax is considered a weapon that is hard to handle. Only skilled soldiers can use it. It is produced at the war mill and used in the training camp – together with food – to train soldiers from attack level 2 to level 3.","L'ascia di bronzo è considerata un'arma difficile da maneggiare. Solo soldati abili sono in grado di usarla.  È prodotta dalla fucina da guerra ed è usata nel campo di addestramento - insieme al cibo - per addestrare i soldati dal livello 2 al livello 3.","tribes_encyclopedia","../../data/tribes/initialization/barbarians/units.lua:486"
"attack level","livello di attacco","The warrior’s ax is the most dangerous of all Barbarian weapons. Only a few soldiers ever were able to handle this huge and powerful ax. It is produced in a war mill and used – together with food – in a training camp to train soldiers from attack level 4 to level 5.","L'ascia del guerriero è la più pericolosa fra tutte le armi dei Barbari. Solamente pochi soldati furono veramente in grado di gestire quest'enorme e potente ascia. Viene prodotta in una fucina da guerra e usata - insieme al cibo - in un campo di addestramento per addestrare i soldati in attacco dal livello 4 al livello 5.","tribes_encyclopedia","../../data/tribes/initialization/barbarians/units.lua:504"
"attack level","livello di attacco","This spear has an iron spike. It is produced in a weapon smithy and used in a training camp – together with food – to train soldiers from attack level 0 to attack level 1.","Una lancia con una punta di ferro. È prodotta nella fucina di armi ed è usata nel campo di addestramento - insieme al cibo - per addestrare i soldati in attacco dal livello 0 al livelllo 1.","tribes_encyclopedia","../../data/tribes/initialization/empire/units.lua:523"
"attack level","livello di attacco","This is an advanced spear with a steel tip. It is produced in a weapon smithy and used in a training camp – together with food – to train soldiers from attack level 1 to level 2.","Questa è una lancia avanzata con una punta in acciaio. È prodotta in una fucina di armi  ed è usata nel campo di addestramento - insieme al cibo - per addestrare i soldati in attacco dal livello 1 al livelllo 2.","tribes_encyclopedia","../../data/tribes/initialization/empire/units.lua:532"
"attack level","livello di attacco","This is a strong spear with a steel-tip and a little blade. It is produced in the weapon smithy and used in the training camp – together with food – train soldiers from attack level 2 to level 3.","Questa è una potente lancia con una punta in acciaio e affilata. È prodotta nella fucina di armi ed è usata nel campo di addestramento - insieme al cibo - per addestrare i soldati in attacco dal livello 2 al livelllo 3.","tribes_encyclopedia","../../data/tribes/initialization/empire/units.lua:541"
"attack level","livello di attacco","This is the best and sharpest weapon the Empire weaponsmith creates for the soldiers. It is used in the training camp – together with food – to train soldiers from attack level 3 to level 4.","Questa è l'arma migliore che i fabbri dell'impero sono in grado di creare. È usata nel campo di addestramento - insieme al cibo - per addestrare i soldati in attacco dal livello 3 al livelllo 4.","tribes_encyclopedia","../../data/tribes/initialization/empire/units.lua:550"
"health level","livello di salute","Golden tabards are produced in Atlantean weaving mills out of gold thread. They are used in the labyrinth – together with food – to train soldiers from health level 0 to level 1.","I tabarri dorati vengono prodotti nei mulini di tessitura atlantidei a partire dal filo d'oro. Sono usati nel Labirinto - insieme al cibo - per addestrare i soldati in Salute dal livello 0 al livello 1.","tribes_encyclopedia","../../data/tribes/initialization/atlanteans/units.lua:871"
"health level","livello di salute","The helmet is the basic defense of a warrior. It is produced in an armor smithy. In combination with a wooden spear, it is the equipment to fit out young soldiers. Helmets are also used in training camps – together with food – to train soldiers from health level 0 to level 1.","L' elmo offre la difesa base per un guerriero. È prodotto nella fucina di armature. Insieme alla lancia di legno, è l' equipaggiamento base per i giovani guerrieri. Gli elmi vengono anche usati nel campo di addestramento - insieme al cibo - per allenare i soldati dal livello 0 di salute al livello 1","tribes_encyclopedia","../../data/tribes/initialization/empire/units.lua:559"
"health level","livello di salute","Basic armor for Empire soldiers. It is produced in the armor smithy and used in the training camp – together with food – to train soldiers from health level 1 to level 2.","Armatura di base per i soldati imperiali. È prodotta nella fucina di armature e si usa nel campo di addestramento - insieme al cibo - per addestrare i soldati in salute dal livello 1 al livello 2","tribes_encyclopedia","../../data/tribes/initialization/empire/units.lua:568"
"health level","livello di salute","The chain armor is a medium armor for Empire soldiers. It is produced in an armor smithy and used in a training camp – together with food – to train soldiers from health level 2 to level 3.","L'armatura di maglia è un'armatura media per i soldati imperiali. È prodotta nella fucina di armature e si usa nel campo di addestramento - insieme al cibo - per addestrare i soldati in salute dal livello 2 al livello 3.","tribes_encyclopedia","../../data/tribes/initialization/empire/units.lua:577"
"location","luogo","Jump to the location corresponding to the current message","Salta alla posizione corrispondente al messaggio corrente","tribes_encyclopedia","../../data/tribes/scripting/help/controls.lua:125"
"location","luogo","Select the new map size, then click the map to split it at the desired location. When increasing the map size, new columns/rows will be inserted to the east/south of the selected point. When shrinking the map, the desired number of columns/rows will be removed from the east/south of the splitting location.","Seleziona la nuova dimensione della mappa, quindi fai click sul punto dove vuoi effettuare la modifica. Quando si aumenta la dimensione della mappa, verranno inserite nuove colonne/righe a est/sud del punto selezionato. Quando si riduce la dimensione della mappa, il numero di colonne/righe indicato verrà rimosso da est/sud del punto indicato.","widelands","../../src/editor/ui_menus/tool_resize_options_menu.cc:50"
"warehouses","magazzini","The tribe or team that can defeat all others wins the game! This means the opponents do not have any headquarters, ports or warehouses left.","La tribù o la squadra che riesce a sconfiggere tutti gli altri vince il gioco! Ciò significa che gli avversari non possiedono nessun quartier generale, porto o magazzino.","win_conditions","../../data/scripting/win_conditions/defeat_all.lua:17"
"map","mappa","Original map names","Nomi originali delle mappe","widelands","../../src/editor/ui_menus/main_menu_load_or_save_map.cc:109"
"map","mappa","Translated map names","Nomi delle mappe tradotti","widelands","../../src/editor/ui_menus/main_menu_load_or_save_map.cc:113"
"map","mappa","The interactive add-ons packager allows you to create, edit, and delete add-ons. You can bundle maps designed with the Widelands Map Editor as an add-on using the graphical interface and share them with other players, without having to write a single line of code.","Il pacchetto di estensioni interattive ti permette di creare, modificare e cancellare estensioni. Puoi raggruppare mappe create con l'editor di mappe di Widelands sotto forma di estensione usando l'interfaccia grafica e condividendola con altri giocatori, senza dover scrivere una singola stringa di codice.","widelands","../../src/ui_fsmenu/addons/manager.cc:338"
"map","mappa","Show original map names","Mostra i nomi originali delle mappe","widelands","../../src/ui_fsmenu/mapselect.cc:83"
"maximum","massimo","There is another way how you can control the strength of a military building: by the number of soldiers stationed there. Just click on the arrow buttons to decrease or increase the desired number of soldiers. Every building has a maximum capacity. In case of the barrier, it is five, for example.","C'è un altro modo in cui puoi controllare la forza di un edificio militare: il numero dei soldati in esso stazionati. Clicca sui pulsanti con le freccie per aumentare o diminuire il numero di soldati desiderato. Ogni edificio ha una capacità massima. Nel caso del fortino, per esempio, è cinque.","scenario_tutorial02_warfare.wmf","../../data/campaigns/tutorial02_warfare.wmf/scripting/texts.lua:200"
"building material","materiale da costruzione","Supply basic building material for your economy:","Fornisci dei materiali di base per la costruzione per la tua economia:","scenario_atl01.wmf","../../data/campaigns/atl01.wmf/scripting/texts.lua:32"
"building material","materiale da costruzione","Logs are an important basic building material. They are produced by felling trees.","I tronchi sono un importante risorsa base per gli edifici. Vengono prodotti abbattendo gli alberi.","tribes_encyclopedia","../../data/tribes/initialization/amazons/units.lua:88 ../../data/tribes/initialization/atlanteans/units.lua:429 ../../data/tribes/initialization/barbarians/units.lua:111 ../../data/tribes/initialization/empire/units.lua:124 ../../data/tribes/initialization/frisians/units.lua:98"
"building materials","materiali da costruzione","Start collecting basic building materials, and fortify the camp.","Inizia a raccogliere i materiali di base per la costruzione, e fortifica l'insediamento.","scenario_bar02.wmf","../../data/campaigns/bar02.wmf/scripting/texts.lua:21"
"building materials","materiali da costruzione","Stockpile some building materials in your headquarters. Gather at least:","Fai scorta di materiale da costruzione nel tuo Quartier generale. Accumula almeno:","scenario_fri01.wmf","../../data/campaigns/fri01.wmf/scripting/texts.lua:44"
"medium","medio","After the production of enough wheat, we can dismantle the farm and build a sheep farm to produce wool. When the sheep farm starts working, we could find or free up space for a medium building to build a weaving mill to use our wool for weaving cloth. But for the moment being, let’s start by producing a reasonable amount of wheat.","Quando avremo abbastanza grano, potremo smantellare la fattoria e sostituirla con un allevamento di pecore. Appena l'allevamento inizierà a produrre lana, troveremo uno spazio per un edificio di medie dimensioni e costruiremo uno stabilimento tessile, così da usare la lana per tessere. Per adesso però preoccupiamoci di produrre abbastanza grano!","scenario_emp03.wmf","../../data/campaigns/emp03.wmf/scripting/texts.lua:375"
"medium","medio","You can build four things on fields in Widelands: flags, small houses, medium houses and big houses. But not every field can hold everything. The build space symbols ease recognition:","Puoi costruire quattro tipi di cose in Widelands: bandiere, edifici piccoli, edifici medi ed edifici grandi. Ma non tutti gli spazi possono accomodare qualsiasi cosa. I simboli degli spazi edificabili rendono più facile il riconoscimento:","scenario_tutorial01_basic_control.wmf","../../data/campaigns/tutorial01_basic_control.wmf/scripting/texts.lua:325"
"medium","medio","Remember that big buildings (green icon) cannot be built on small (red) or medium (yellow) building plots, but buildings can be built on a building plot that provides more space than they need. You should always keep that in mind when you search for a suitable place.","Ricorda che gli edifici grandi (icona verde) non possono essere costruiti sugli spazi edificabili piccoli (rossi) o medi (gialli), ma gli edifici si possono costruire su spazi edificabili che provvedono più spazio di quanto non sia necessario. Dovresti sempre tenerlo in considerazione quando cerchi uno spazio adatto.","scenario_tutorial01_basic_control.wmf","../../data/campaigns/tutorial01_basic_control.wmf/scripting/texts.lua:569"
