"glossary_term","glossary_translation","source","target","file","location"
"Snacks","Spuntini","Such buildings usually have greater demands than the basic kind of that building – for instance, deep mines need snacks instead of rations. You will have to enhance your tavern to an inn in order to produce snacks out of pitta bread AND a second kind of food (meat or fish) AND beer.","Certi edifici solitamente hanno maggiori esigenze rispetto agli edifici base – per esempio, le miniere profonde necessitano dei pasti invece che delle razioni. Dovrai espandere la tua taverna in una locanda allo scopo di produrre pasti dal pane arabo E un secondo tipo di alimenti (carne o pesce) E birra.","scenario_bar01.wmf","../../data/campaigns/bar01.wmf/scripting/texts.lua:91"
"Weaving Mill","Stabilimento tessile","%s, may Satul warm you! The weaving mill and spider farm are complete and the weavers’ guild can start their work again. I promise we will deliver the finest cloth and some tabards soon. Maybe we can build a gold spinning mill later on to make better tabards as well.","%s, possa Satul riscaldarti! Lo stabilmento tessile e l'allevamento di ragni sono completi, e la gilda dei tessitori può ricominciare a lavorare. Prometto che presto consegneremo stoffa delle migliori, ed alcuni tabarri. Più avanti potremmo costruire anche uno stabilimento di filatura dell'oro per produrre migliori tabarri.","scenario_atl02.wmf","../../data/campaigns/atl02.wmf/scripting/texts.lua:320"
"Weaving Mill","Stabilimento tessile","The storm flood seems to be coming from the west. If we hurry, we will just make it! We only need to build a port and a shipyard – oh, and a weaving mill to weave the durable cloth, which is made from reed and fur, for the sails. Then we can launch an expedition from the port. Pray to the gods and make haste!","L'onda di tempesta sembra provenire da ovest. Se ci affrettiamo, ce la faremo appena! Dobbiamo soltanto costruire un porto ed un cantiere navale – oh, e uno stabilimento di tessitura per produrre stoffe durevoli, fatte di canne e pelliccia, per le vele. Potremo finalmente avviare una spedizione dal porto. Prega gli dei e sbrigati!","scenario_fri01.wmf","../../data/campaigns/fri01.wmf/scripting/texts.lua:404"
"Weaving Mill","Stabilimento tessile","No, the spiders are not fed with corn. We feed it to fat grasshoppers, which in turn are digested by our spiders. We put them on a special device to gain the spider silk once a day. There is no need to spin this again. The thread can directly be used by the weaving mill. Oh hello, here is one of our nice spiders … Hey! Why are you running away?","No, i ragni non sono alimentati con mais. Li nutriamo con grasse cavallette, poi digerite dai nostri ragni. Li mettiamo su uno speciale dispositivo per ottenere seta di ragno una volta al giorno. Non c'è bisogno di filarla: il filo può essere direttamente utilizzato dallo stabilmento tessile. Oh salve, ecco qui uno dei miei simpatici ragni... Ehi! Perché stai scappando?","tribes_encyclopedia","../../data/tribes/initialization/atlanteans/units.lua:1764"
"General Statistics","Statistiche generali","You can see the number of wares traded at any time in the general statistics menu. Good luck!","Puoi vedere il numero di beni commerciati in qualsiasi momento nel menù generale delle statistiche. Buona fortuna!","mp_scenario_smugglers.wmf","../../data/maps/MP_Scenarios/Smugglers.wmf/scripting/texts.lua:17"
"Building Statistics","Statistiche sugli edifici","Open the building statistics window","Apri la finestra delle statistiche dell'edificio","scenario_tutorial04_economy.wmf","../../data/campaigns/tutorial04_economy.wmf/scripting/texts.lua:47 ../../data/campaigns/tutorial04_economy.wmf/scripting/texts.lua:49"
"Building Statistics","Statistiche sugli edifici","You closed the building statistics window!","Hai chiuso la finestra delle statistiche sull'edificio!","scenario_tutorial04_economy.wmf","../../data/campaigns/tutorial04_economy.wmf/scripting/texts.lua:97"
"Ware Statistics","Statistiche sulle merci","You closed the ware statistics window!","Hai chiuso la finestra delle statistiche sui beni!","scenario_tutorial04_economy.wmf","../../data/campaigns/tutorial04_economy.wmf/scripting/texts.lua:411 ../../data/campaigns/tutorial04_economy.wmf/scripting/texts.lua:434"
"Status","Stato","Let me also describe what the numbers in the status string mean. This string can contain up to three numbers, e.g. ‘1 (+5) soldier (+2)’.","Lascia che ti spieghi anche il significato dei numeri nella stringa delle statistiche. Questa stringa può contenere fino a 3 numeri, per esempio '1 (+5) soldati (+2)’.","scenario_tutorial02_warfare.wmf","../../data/campaigns/tutorial02_warfare.wmf/scripting/texts.lua:202"
"Spidercloth","Stoffa di ragno","Swift now, we need a house for Ostur next to the lake, and we need planks, logs and spidercloth for the construction there. Forget about everything else, we need those wares on top of the mountain before our warehouses are all swallowed by the sea.","Presto adesso, ci serve una casa per Ostur vicino al lago, ed abbiamo bisogno di tavole, tronchi e tessuto di ragno per le costruzioni lassù. Dimenticate tutto il resto, dobbiamo avere questi materiali sulla cima della montagna prima che i nostri magazzini siano tutti inghiottiti dal mare.","scenario_atl01.wmf","../../data/campaigns/atl01.wmf/scripting/texts.lua:477"
"Spidercloth","Stoffa di ragno","Very good. Your shipyard is finished and your shipwright immediately started working. For the construction of ships, he needs logs, planks and spidercloth, which will be transported to the shipyard.","Molto bene. Il tuo cantiere navale è completato e il tuo maestro d'ascia ha cominciato immediatamente a lavorare. Per costruire le navi, gli servono tavole, tronchi, e tessuto di ragno, che verranno trasportati al cantiere navale.","scenario_tutorial03_seafaring.wmf","../../data/campaigns/tutorial03_seafaring.wmf/scripting/texts.lua:96"
"Spidercloth","Stoffa di ragno","You need to stop your shipyard when you have enough ships. Otherwise, your shipwright will consume all your logs and spidercloth, producing dozens of ships.","Ti conviene fermare il tuo cantiere navale quando hai abbastanza navi. Altrimenti consumerà tutti i tronchi e il tessuto di ragno, producendo dozzine di navi.","scenario_tutorial03_seafaring.wmf","../../data/campaigns/tutorial03_seafaring.wmf/scripting/texts.lua:121"
"Spidercloth","Stoffa di ragno","Weaves spidercloth for buildings and ships’ sails, and tabards to equip and train the soldiers.","Tesse il tessuto di ragno per gli edifici e per le vele delle navi, e i tabarri per equipaggiare e addestrare i soldati","tribes_encyclopedia","../../data/tribes/initialization/atlanteans/units.lua:1776"
"Tavern","Taverna","But when the mines will have to be enhanced, rations won’t keep the miners happy. Better take precautions – build a second tavern, then consider enhancing one to a drinking hall.","Quando però le miniere dovranno essere potenziate, i minatori non saranno felici delle razioni. Meglio prendere preacuzioni – costruisci una seconda tavena, quindi considera la possibilità di potenziarne una a sala dell'idromele.","scenario_fri01.wmf","../../data/campaigns/fri01.wmf/scripting/texts.lua:233"
"territory","Territorio","If you fail to deliver these wares, the Empire shall treat you like enemies. And so as to prevent you wasting your precious metal, I forbid you to expand your territory from this moment on until you have given us your gift. Fail to obey, and the Empire shall treat you like enemies.","Se mancherete di consegnare questi beni, l'Impero dovrà trattarvi come nemici. Ed in modo da prevenire che dilapidiate i vostri preziosi metalli, vi proibisco di espandervi da questo momento in poi, finché non ci avrete consegnato il vostro omaggio. Mancate di obbedire, e l'Impero vi tratterà come nemici.","scenario_fri02.wmf","../../data/campaigns/fri02.wmf/scripting/texts.lua:307"
"Cloth","Tessuto","%s, may Satul warm you! The weaving mill and spider farm are complete and the weavers’ guild can start their work again. I promise we will deliver the finest cloth and some tabards soon. Maybe we can build a gold spinning mill later on to make better tabards as well.","%s, possa Satul riscaldarti! Lo stabilmento tessile e l'allevamento di ragni sono completi, e la gilda dei tessitori può ricominciare a lavorare. Prometto che presto consegneremo stoffa delle migliori, ed alcuni tabarri. Più avanti potremmo costruire anche uno stabilimento di filatura dell'oro per produrre migliori tabarri.","scenario_atl02.wmf","../../data/campaigns/atl02.wmf/scripting/texts.lua:320"
"Cloth","Tessuto","Now turn all the wheat into at least 50 bales of wool and then use the wool to weave cloth in order to build a ship.","Ora trasforma tutto il tuo grano in almeno 50 balle di lana e quindi usa la lana per tessere stoffe, per poter infine costruire una nave.","scenario_emp03.wmf","../../data/campaigns/emp03.wmf/scripting/texts.lua:112"
"Cloth","Tessuto","After the production of enough wheat, we can dismantle the farm and build a sheep farm to produce wool. When the sheep farm starts working, we could find or free up space for a medium building to build a weaving mill to use our wool for weaving cloth. But for the moment being, let’s start by producing a reasonable amount of wheat.","Quando avremo abbastanza grano, potremo smantellare la fattoria e sostituirla con un allevamento di pecore. Appena l'allevamento inizierà a produrre lana, troveremo uno spazio per un edificio di medie dimensioni e costruiremo uno stabilimento tessile, così da usare la lana per tessere. Per adesso però preoccupiamoci di produrre abbastanza grano!","scenario_emp03.wmf","../../data/campaigns/emp03.wmf/scripting/texts.lua:375"
"Cloth","Tessuto","The storm flood seems to be coming from the west. If we hurry, we will just make it! We only need to build a port and a shipyard – oh, and a weaving mill to weave the durable cloth, which is made from reed and fur, for the sails. Then we can launch an expedition from the port. Pray to the gods and make haste!","L'onda di tempesta sembra provenire da ovest. Se ci affrettiamo, ce la faremo appena! Dobbiamo soltanto costruire un porto ed un cantiere navale – oh, e uno stabilimento di tessitura per produrre stoffe durevoli, fatte di canne e pelliccia, per le vele. Potremo finalmente avviare una spedizione dal porto. Prega gli dei e sbrigati!","scenario_fri01.wmf","../../data/campaigns/fri01.wmf/scripting/texts.lua:404"
"Wood Hardener","Trattamento del legno","We need a wood hardener, and we need one now!","Ci serve un indurente per il legno, e ci serve ora!","scenario_bar01.wmf","../../data/campaigns/bar01.wmf/scripting/texts.lua:441"
"Logs","Tronchi","Naturally, trees only grow at a slow rate. To make sure you have enough logs, you have to build rangers.","In natura gli alberi crescono lentamente. Per essere sicuro di avere abbastanza legna, devi costruire delle capanne delle guardie forestali.","scenario_bar01.wmf","../../data/campaigns/bar01.wmf/scripting/texts.lua:24"
"Logs","Tronchi","Coal can be obtained by building a charcoal kiln or a coal mine. Burning charcoal out of logs is slow. You should only build a charcoal kiln when no coal is available.","Il carbone può essere ottenuto costruendo una carbonaia o una miniera di carbone. Bruciare legna per il carbone richiede tempo. Dovresti costruire una carbonaia solo quando il carbone non è disponibile.","scenario_bar01.wmf","../../data/campaigns/bar01.wmf/scripting/texts.lua:112"
"Logs","Tronchi","Saws logs to produce planks.","Sega il legno per produrre tavole.","tribes_encyclopedia","../../data/tribes/initialization/atlanteans/units.lua:934"
"Tutorial","Tutorial","This was the last tutorial I had prepared for you. I’ve now taught you everything I know. There are still secrets hidden in this world even I don’t know about. I will now search for a quiet place to spend my sunset years. If you have still questions, the Widelands community will surely help you. You can find it at:","Questo è l'ultimo tutoria che avevo preparato per te. Ora ti ho insegnato tutto quanto potevo. Ci sono ancora segreti nascosti in questo mondo, che neanch'io conosco. Ora sono alla ricerca di un posto tranquillo dove passare i miei anni del tramonto. Se hai ancora dubbi, la comunità di Widelands certamente ti aiuterà. Puoi trovarla su:","scenario_tutorial04_economy.wmf","../../data/campaigns/tutorial04_economy.wmf/scripting/texts.lua:551"
"Upload","Upload","It is forbidden to upload add-ons containing harmful or malicious content or spam. By uploading an add-on, you assert that the add-on is of your own creation or you have the add-on’s author(s) permission to submit it in their stead.","È vietato caricare estensioni dai contenuti pericolosi o dannosi o spam. Caricando un'estensione, affermi che essa è di tua creazione o che hai ottenuto il permesso di caricarla da parte di chi l'ha creata.","widelands","../../src/ui_fsmenu/addons/manager.cc:394"
"Upload","Upload","It is forbidden to upload add-ons containing harmful or malicious content or spam. By uploading an add-on, you assert that the add-on is of your own creation or you have the add-on’s author(s) permission to submit it in their stead.","È vietato caricare estensioni dai contenuti pericolosi o dannosi o spam. Caricando un'estensione, affermi che essa è di tua creazione o che hai ottenuto il permesso di caricarla da parte di chi l'ha creata.","widelands","../../src/ui_fsmenu/addons/manager.cc:394"
"Upload","Upload","Click to log in. You can then comment and vote on add-ons and upload your own add-ons.","Clicca per accedere. Potrai commentare e votare le estensioni e caricarne di tue.","widelands","../../src/ui_fsmenu/addons/manager.cc:767"
"Upload","Upload","Click to log in. You can then comment and vote on add-ons and upload your own add-ons.","Clicca per accedere. Potrai commentare e votare le estensioni e caricarne di tue.","widelands","../../src/ui_fsmenu/addons/manager.cc:767"
"Upload","Upload","Please log in to upload add-ons","Accedi per caricare estensioni","widelands","../../src/ui_fsmenu/addons/manager.cc:771"
"Upload","Upload","Please log in to upload add-ons","Accedi per caricare estensioni","widelands","../../src/ui_fsmenu/addons/manager.cc:771"
"Upload","Upload","Please log in to upload content","Accedi per caricare contenuti","widelands","../../src/ui_fsmenu/addons/manager.cc:773"
"Upload","Upload","Please log in to upload content","Accedi per caricare contenuti","widelands","../../src/ui_fsmenu/addons/manager.cc:773"
"Upload","Upload","Do you really want to upload the add-on ‘%s’ to the server?","Vuoi davvero caricare l'estensione ‘%s’ sul server?","widelands","../../src/ui_fsmenu/addons/manager.cc:1391"
"Upload","Upload","Do you really want to upload the add-on ‘%s’ to the server?","Vuoi davvero caricare l'estensione ‘%s’ sul server?","widelands","../../src/ui_fsmenu/addons/manager.cc:1391"
"Old","Vecchio","By the Gods! One of our scouts has discovered a mighty castle at the center of the old plateau. The castle must be quite old and seems to have been built in a foreign style. It’s quite obvious that this is not barbarian craft.","Per tutti gli dei! Uno dei nostri esploratori ha scoperto un possente castello al centro dell'antico altopiano. Il castello deve essere abbastanza antico e sembra essere stato costruito in uno stile straniero. è chiaro che non è opera di barbari.","map_the_green_plateau.wmf","../../data/maps/SP_Scenarios/The_Green_Plateau.wmf/scripting/texts.lua:67"
"Old","Vecchio","An old legend tells that these seven kingdoms, that have flourished for ages in prosperity, will someday collapse into a devastating war. Has your latest betrayal been one too many and will the prophecy come true?","Un'antica leggenda narra che questi sette regni, fioriti e prosperi per secoli, un giorno cadranno in una guerra devastante. Forse il tuo ultimo tradimento è stato di troppo e la profezia si avvererà?","maps","../../data/maps/Kings_and_Queens.wmf/elemental:10"
"Old","Vecchio","Some say that impenetrable lands to the far north scared away even the most courageous settlers and the bravest of the brave warriors. Big and old forests, full of big and predatory game, cut across by wetlands and hills were shrouded in mystery. The ones who had managed to come back mentioned tremendous buildings, decorated with carvings and gold from majestic mountain ranges somewhere amongst the wilderness. Dozens of years after only some crumbly ruins remain of these good old times, covered with moss and trees. Their shapes give only an idea about the craftsmanship of ancient constructors. Nobody knows why they (have) disappeared. Nobody knows why. People say that now nothing is blocking the road to wealth. But many will die pulled apart by wolves, engulfed by swamp… encircled by hostile tribes.","Alcuni dicono che le impenetrabili terre nel remoto nord abbiano scoraggiato anche i coloni più audaci e i guerrieri più coraggiosi. Vaste e antiche foreste, popolate da grandi animali e predatori, inframmezzate da paludi e colline, erano avvolte nel mistero. Coloro che erano riusciti a tornare indietro menzionavano tremendi edifici, decorati con intarsi e oro dalle maestose catene montuose da qualche parte nelle terre selvagge. Dozzine di anni dopo, solo quualche rovina diroccata rimane di questi tempi gloriosi, coperta di muschio e alberi. Le loro forme danno solo una vaga impressione dell'abilità degli antichi costruttori. Nessuno sa perchè sono scomparsi. Nessuno lo sa. La gente dice che ora non c'è più nulla a sbarrare la strada verso la ricchezza. Ma molti moriranno sbranati dai lupi, sprofondati nelle paludi... circondati da tribù ostili.","maps","../../data/maps/The_Far_North.wmf/elemental:10"
"Old","Vecchio","And yet another of these buildings. We know now that the tribe that built them once had complete control over the island. But I am no longer so scared of potential enemies. We know so much of this island already and there is no trace of this old economy to be found. I am starting to relax, but I will not let our guard down as we continue to explore this beautiful island. But without obvious dangers, I am feeling very much at home here already.","Ed ecco di nuovo un altro di questi edifici. Ora sappiamo che la tribù che li costruì una volta aveva il completo controllo dell'isola. Ma non sono più così spaventata dai potenziali nemici. Conosciamo già così tanto di quest'isola e di questa antica civiltà non resta più alcuna traccia da scoprire. Sto cominciando a rilassarmi, ma non permetterò di abbassare la guardia mentre continuiamo ad esplorare questa magnifica isola. Ma senza pericoli evidenti mi sto sentendo già molto a casa qui.","scenario_atl01.wmf","../../data/campaigns/atl01.wmf/scripting/texts.lua:428"
"Old","Vecchio","While it is certainly no worthy task for a warrior, at least it is something to do! Thron, what would you say about my taking a few of our most restless warriors and venturing somewhat closer to the great mountain of Kal’mavrath – maybe we will find some more big rocks to please the old man?","Anche se non è certamente un compito degno di un guerriero, almeno è qualcosa da fare! Thron, cosa ne diresti di prendere alcuni dei guerrieri più irrequeti e avventurarci più vicini alla grande montagna di Kal'mavrath - forse troveremo qualche grande roccia per accontentarlo?","scenario_bar01.wmf","../../data/campaigns/bar01.wmf/scripting/texts.lua:318"
"Old","Vecchio","For now, we are resting at the borders of the old forest and preparing for the coming days.","Per adesso riposiamo ai confini dell'antica foresta e prepariamoci per i giorni a venire.","scenario_bar02.wmf","../../data/campaigns/bar02.wmf/scripting/texts.lua:161"
"Old","Vecchio","The first fortification Thron ordered has just been completed. At the moment, he seeks to bring trust and belief to those who live inside the walls of our new habitat that we named ‘Ondun’, which means ‘those who wait’ in the old tongue. But Thron is not yet satisfied – and I fully understand his fears: the forests are deep, and the frontier to Al’thunran is near. I am sure that there are a thousand greater dangers out there than the unknown tracks.","La prima fortificazione che Thron ci ha ordinato di costruire è appena stata completata. Al momento sta cercando di rafforzare la fiducia di coloro che vivono all'interno delle mura del nostro nuovo habitat che abbiamo chiamato 'Ondun', che significa 'coloro che aspettano' nella lingua antica. Tuttavia Thron non è ancora soddisfatto – e comprendo bene le sue paure: la foresta è profonda e il confine con Al'thunran è vicino. Sono sicuro che là fuori ci sono migliaia di pericoli ben più grandi delle tracce sconosciute","scenario_bar02.wmf","../../data/campaigns/bar02.wmf/scripting/texts.lua:269"
"Old","Vecchio","An old Barbarian proverb<br> meaning that you need to take some risks sometimes.","Un antico proverbio barbarico<br> che vuol significare che, ogni tanto, devi prenderti qualche rischio.","tribes_encyclopedia","../../data/tribes/initialization/barbarians/units.lua:1411 ../../data/tribes/initialization/barbarians/units.lua:1430"
"heroes","Veterani","In every military building, you can set the preference for heroes (trained soldiers) or rookies. From time to time, a soldier will walk out of the building and be replaced by a stronger/weaker one automatically – this is what you saw earlier.","In ogni edificio militare, puoi impostare la preferenza per eroi (soldati addestrati) o reclute. Occasionalmente, un soldato uscirà dall'edificio per essere rimpiazzato da uno più forte/più debole automaticamente - questo è ciò che hai visto prima.","scenario_tutorial02_warfare.wmf","../../data/campaigns/tutorial02_warfare.wmf/scripting/texts.lua:189"
"seafaring","Viaggiare in mare","My soldiers report they have found a port space! Now we need to build a port and start an expedition. Of course, we’ll have to build a complete seafaring economy first, with a shipyard and a weaving mill. But don’t waste too much time perfecting our economy – all that matters is that we get to the North soon.","I miei soldati segnalano di aver trovato un luogo adatto ad un porto! Ora dobbiamo costruire un porto ed avviare una spedizione. Prima dobbiamo naturalmente costruire un'intera economia marittima, con un cantiere navale ed uno stabilimento tessile. Ma non perdiamo troppo tempo nel perfezionare la nostra economia – tutto ciò che importa è raggiungere presto il Nord.","scenario_fri03.wmf","../../data/campaigns/fri03.wmf/scripting/texts.lua:141"
"seafaring","Viaggiare in mare","Toggle seafaring statistics","Commuta statistiche sui viaggi marittimi","tribes_encyclopedia","../../data/tribes/scripting/help/controls.lua:80"
"seafaring","Viaggiare in mare","Show seafaring messages only","Mostra solamente i messaggi relativi alla navigazione in mare","tribes_encyclopedia","../../data/tribes/scripting/help/controls.lua:119"
"seafaring","Viaggiare in mare","Messages: Show Seafaring Messages","Messaggi: Mostra messaggi su viaggi marittimi","widelands","../../src/wlapplication_options.cc:619"
"seafaring","Viaggiare in mare","Show seafaring messages only","Mostra solamente i messaggi relativi alla navigazione in mare","widelands","../../src/wui/game_message_menu.cc:549"
"Vine Farmer","Vignaiolo","This basket is needed by the vine farmer for harvesting the grapes. It is produced by the toolsmith.","Il cesto è necessario al coltivatore di vite per raccogliere l'uva. È prodotto dal fabbro.","tribes_encyclopedia","../../data/tribes/initialization/empire/units.lua:480"
"Widelands","Widelands","That won’t do yet. I still need to connect the lumberjack’s hut to the rest of my road network. You have disabled the option ‘Start building road after placing a flag’ (to change that, choose ‘Options’ in the Widelands main menu). Therefore, I have entered the road building mode manually. I will tell you later how to do that. To build the road, all I have to do now is click on the blue flag in front of my headquarters.","Non funzionerà ancora. Ho ancora bisogno di collegare la capanna del boscaiolo al resto della mia rete stradale. Hai disabilitato l'opzione 'Comincia a costruire una strada dopo aver piazzato una bandiera' (per cambiare questa opzione, vai sulle opzioni dal menù principale). Più tardi ti spiegherò come, ma per ora sono entrato manualmente in modalità costruzione di strade. Quindi tutto quello che devo fare è cliccare sulla bandiera blu di fronte al mio quartier generale.","scenario_tutorial01_basic_control.wmf","../../data/campaigns/tutorial01_basic_control.wmf/scripting/texts.lua:125"
"training","addestramento","This tutorial explains the handling of military and training site buildings and will introduce fighting.","Questo tutorial spiega la gestione degli edifici militari e di allenamento e introdurrà il combattimento.","maps","../../data/campaigns/bar02.wmf/elemental:9"
"training","addestramento","Build a barracks to start training soldiers.","Costruisci una caserma per iniziare a reclutare soldati.","scenario_emp02.wmf","../../data/campaigns/emp02.wmf/scripting/texts.lua:97"
"training","addestramento","The needed wares are also delivered there. For successful training, you need pitta bread and strong beer, as well as either fish or meat.","Anche le merci necessarie stanno venendo consegnate. Per addestrare i soldati, ti serviranno pane pitta e birra forte, oltre a carne o pesce.","scenario_tutorial02_warfare.wmf","../../data/campaigns/tutorial02_warfare.wmf/scripting/texts.lua:89"
