"glossary_term","glossary_translation","source","target","file","location"
"Water","Acqua","Build a fisher’s house close to water to get raw fish","Costruisci una casa del pescatore per ottenere del pesce crudo.","scenario_atl01.wmf","../../data/campaigns/atl01.wmf/scripting/texts.lua:64"
"Water","Acqua","There is a lake at the top of the island. Build three ships in these waters and you might be able to rescue your people before the island is swallowed completely by the ocean.","C'è un lago sulla cima dell'isola. Costruisci tre navi in queste acque e potresti essere in grado di salvare il tuo popolo quando l'isola sprofonderà completamente nell'oceano.","scenario_atl01.wmf","../../data/campaigns/atl01.wmf/scripting/texts.lua:132"
"Cattle Farm","Allevamento di bovini","Oxen are bred in cattle farms out of wheat and water.","I buoi sono allevati negli allevamenti di bovini utilizzando grano ed acqua.","scenario_bar01.wmf","../../data/campaigns/bar01.wmf/scripting/texts.lua:145"
"Horse Farm","Allevamento di cavalli","As your road network gets longer and more complicated, you should employ horses to help out your carriers. Horses are bred at horse farms using water and corn. A warehouse will also help to ensure that your transportation system does not collapse.","Non appena la tua rete stradale diventa più lunga e più complicata, dovresti impiegare dei cavalli per aiutare i tuoi trasportatori. I cavalli sono allevati nelle stalle utilizzando acqua e grano. Anche un magazzino ti aiuterà ad assicurare che il tuo sistema di trasporto non collassi.","scenario_atl01.wmf","../../data/campaigns/atl01.wmf/scripting/texts.lua:121"
"Horse Farm","Allevamento di cavalli","People are complaining about crowded streets and slow transportation. We need to help out our carriers on the roads. I have decided to build a horse farm so that the horses can help with the heavy wares.","La gente si sta lamentando delle strade affollate e dei trasporti lenti. Abbiamo bisogno di aiutare i nostri trasportatori sulle strade. Ho deciso di costruire una stalla, così i cavalli possono aiutare con le merci pesanti.","scenario_atl01.wmf","../../data/campaigns/atl01.wmf/scripting/texts.lua:369"
"Spider Farm","Allevamento di ragni","Build a spider farm and a weaving mill","Costruisci una fattoria di ragni e un mulino per la tessitura","scenario_atl01.wmf","../../data/campaigns/atl01.wmf/scripting/texts.lua:72"
"Spider Farm","Allevamento di ragni","The weavers produce spidercloth and tabards in the weaving mill. Spidercloth is needed for the construction of some buildings and clothing, while tabards are the uniforms of soldiers. The weaving mill needs gold thread and spider silk as raw material. Spider silk is produced by the spider farm, while gold thread is produced by the gold spinning mill out of gold.","I tessitori producono tessuto di ragno e tabards nella tessitura. Il tessuto di ragno è necessaria per la costruzione di alcuni edifici e abbigliamento, mentre pettorine sono le uniformi dei soldati. La tessitura ha bisogno di filo di ragno e di seta d'oro come materia prima. La seta di ragno è prodotta da allevamento dei ragni, mentre filo d'oro è prodotta dal mulino di filatura dell'oro.","scenario_atl01.wmf","../../data/campaigns/atl01.wmf/scripting/texts.lua:75"
"Spider Farm","Allevamento di ragni","This corn is processed in the mill into fine cornmeal that every Atlantean baker needs for a good bread. Also horse and spider farms need to be provided with corn.","Questo mais è trasformato nel mulino in una delicata farina di mais, necessaria ad ogni fornaio atlantideo per un buon pane. Anche gli allevamenti di cavalli e di ragni necessitano del mais.","tribes_encyclopedia","../../data/tribes/wares/corn/helptexts.lua:4"
"Spider Farm","Allevamento di ragni","Spider silk is produced by spiders, which are bred by spider farms. It is processed into spidercloth in a weaving mill.","La tela di ragno è secreta dai ragni, che sono allevati negli allevamenti di ragni. È processata in tessuto di ragno in un mulino di tessitura.","tribes_encyclopedia","../../data/tribes/wares/spider_silk/helptexts.lua:4"
"Pig Breeder","Allevatore di maiali","The pig breeder needs %1% on average to raise and slaughter a pig.","L'alllevatore di maiali impiega in media %1% per crescere e macellare un maiale.","tribes_encyclopedia","../../data/tribes/buildings/productionsites/empire/piggery/helptexts.lua:26"
"Archive","Archivia","On MacOS, you can find the file called COPYING in the archive you downloaded from the website.","Su MacOS, puoi trovare il file chiamato COPYING nell'archivio che hai scaricato dal sito.","texts","../../data/txts/LICENSE.lua:21"
"Battle Arena","Arena di battaglia","Build a barracks, a battle arena and a training camp to the west of the mountains.","Costruisci una caserma, un'arena di combattimenti e un campo di addestramento a ovest delle montagne","scenario_bar02.wmf","../../data/campaigns/bar02.wmf/scripting/texts.lua:113"
"Battle Arena","Arena di battaglia","Barracks train basic soldiers while training sites like a training camp or a battle arena are used for training soldiers in their different attributes. These attributes are important in fights and the better a soldier is, the higher is the chance to win a fight.","Le caserme addestrano soldati di base, mentre strutture come i campi di addestramento o le arene di combattimento servono a migliorare i differenti attributi dei soldati. Questi attributi sono importanti nei combattimenti e più alto è il loro valore, maggiore è la possibilità di vincere il combattimento.","scenario_bar02.wmf","../../data/campaigns/bar02.wmf/scripting/texts.lua:114"
"Battle Arena","Arena di battaglia","While we’re waiting for the battle arena, you’ll probably notice some soldiers walking around. They are automatically exchanged from time to time. I’ll teach you about that later.","Mentre aspettiamo che l'arena venga completata, avrai probabilmente notato dei soldati che si muovono in giro. Sono scambiati automaticamente di tanto in tanto. Più tardi ti spiegherò come.","scenario_tutorial02_warfare.wmf","../../data/campaigns/tutorial02_warfare.wmf/scripting/texts.lua:69"
"Armor","Armatura","Forges armor and helmets that are used for training soldiers’ health in the training camp.","Forgia armature ed elmi che sono usati per addestrare i soldati nel campo di addestramento.","tribes_encyclopedia","../../data/tribes/buildings/productionsites/empire/armorsmithy/helptexts.lua:16"
"Armor","Armatura","Equips the soldiers with all necessary weapons and armor parts.","Equipaggia i soldati con tutte le armi e armature necessarie.","tribes_encyclopedia","../../data/tribes/buildings/trainingsites/atlanteans/dungeon/helptexts.lua:19 ../../data/tribes/buildings/trainingsites/atlanteans/labyrinth/helptexts.lua:19"
"Armor","Armatura","Equips the soldiers with all necessary weapons and armor parts.","Equipaggia i soldati con tutte le armi e armature necessarie.","tribes_encyclopedia","../../data/tribes/buildings/trainingsites/barbarians/trainingcamp/helptexts.lua:16"
"Armor","Armatura","Equips the soldiers with all necessary weapons and armor parts.","Equipaggia i soldati con tutte le armi e armature necessarie.","tribes_encyclopedia","../../data/tribes/buildings/trainingsites/empire/trainingcamp/helptexts.lua:19"
"Armor","Armatura","Weapons, armor and tools are made of iron.","Armi, armature e strumenti sono fatti di ferro.","tribes_encyclopedia","../../data/tribes/wares/iron/helptexts.lua:10"
"Armor","Armatura","Produces armor for the soldiers.","Produce armature per i soldati.","tribes_encyclopedia","../../data/tribes/workers/atlanteans/armorsmith/helptexts.lua:5"
"Armor","Armatura","Produces armor for the soldiers.","Produce armature per i soldati.","tribes_encyclopedia","../../data/tribes/workers/empire/armorsmith/helptexts.lua:3"
"Ax","Ascia","So you want to prepare us for a longer stay in these forests, Thron? Well, I see the wisdom in doing so, yet my heart is yearning for a glorious return to Al’thunran. Too long have we waited while our brethren have fought on the battlefield, and our axes and swords have turned rusty over time.","Allora vuoi prepararci a una lunga permanenza in queste foreste, Thron? Beh, vedo saggezza nel farlo, ma il mio cuore desidera un glorioso ritorno ad Al'thunran. Troppo a lungo abbiamo atteso mentre il nostro popolo combatteva, e le nostre asce e spade si sono arrugginite nel tempo.","scenario_bar01.wmf","../../data/campaigns/bar01.wmf/scripting/texts.lua:320"
"Ax","Ascia","To train in the training camp, our soldiers need food like in the battle arena, but no strong beer. Instead, they need different axes for attack training and helmets for health training.","Per addestrarsi nel campo di addestramento, i nostri soldati necessitano di cibo come nell'arena di battaglia, ma non di birra. Invece, gli servono diversi tipi di asce per addestrarsi in attacco, e di elmi per la salute.","scenario_tutorial02_warfare.wmf","../../data/campaigns/tutorial02_warfare.wmf/scripting/texts.lua:122"
"Ax","Ascia","Produces axes, sharp axes and broad axes.","Produce asce, asce affilate e asce larghe.","tribes_encyclopedia","../../data/tribes/buildings/productionsites/barbarians/ax_workshop/helptexts.lua:13"
"Ax","Ascia","Produces all the axes that the Barbarians use for warfare.","Produce tutte le asce che utilizzano i Barbari per la guerra.","tribes_encyclopedia","../../data/tribes/buildings/productionsites/barbarians/warmill/helptexts.lua:16"
"Sharp Ax","Ascia affilata","Produces axes, sharp axes and broad axes.","Produce asce, asce affilate e asce larghe.","tribes_encyclopedia","../../data/tribes/buildings/productionsites/barbarians/ax_workshop/helptexts.lua:13"
"Warrior’s Ax","Ascia da guerriero","The warrior’s ax is the most dangerous of all Barbarian weapons. Only a few soldiers ever were able to handle this huge and powerful ax. It is produced in a war mill and used – together with food – in a training camp to train soldiers from attack level 4 to level 5.","L'ascia del guerriero è la più pericolosa fra tutte le armi dei Barbari. Solamente pochi soldati furono veramente in grado di gestire quest'enorme e potente ascia. Viene prodotta in una fabbrica da guerra e usata - insieme al cibo - in un campo d'addestramento per istruire i soldati da ul livello di attaco 4 ad un livello di attacco 5.","tribes_encyclopedia","../../data/tribes/wares/ax_warriors/helptexts.lua:4"
"Donkey","Asino","Breeds cute and helpful donkeys for adding them to the transportation system.","Addestra muli laboriosi e simpatici per aggiungerli al sistema di trasporto.","tribes_encyclopedia","../../data/tribes/buildings/productionsites/empire/donkeyfarm/helptexts.lua:16"
"Donkey","Asino","Donkeys help to carry items along busy roads. They are reared in a donkey farm.","Gli asini aiutano a trasportare oggetti per le strade trafficate. Vengono allevati in un allevamento di asini.","tribes_encyclopedia","../../data/tribes/workers/empire/donkey/helptexts.lua:3"
"Donkey","Asino","Breeds cute and helpful donkeys for adding them to the transportation system.","Addestra muli laboriosi e simpatici per aggiungerli al sistema di trasporto.","tribes_encyclopedia","../../data/tribes/workers/empire/donkeybreeder/helptexts.lua:3"
"Atlanteans","Atlantidei","Like all other tribes, the Atlanteans are also able to train soldiers: the dungeon trains attack – the major attribute of the Atlanteans – and the labyrinth trains evasion, health and defense. The items produced by the industry are used to train better soldiers in the two training sites.","Come tutte le altre tribù, anche gli Atlantici sono in grado di addestrare soldati: nelle Segrete si produce Attacco - l'attributo maggiore degli Atlantici - e il Labirinto produce Furtività, Salute e Difesa. Gli oggetti prodotti dalle industrie sono usati per reclutare soldati migliori nei due siti d'addestramento.","scenario_atl01.wmf","../../data/campaigns/atl01.wmf/scripting/texts.lua:111"
"Atlanteans","Atlantidei","Ahh, but I think this is impossible to change. The preparing and eating of food is something deeply ingrained in us Atlanteans – it is a ceremony that we just need for our well-being. So I guess we cannot take this away from the individuals completely.","Ahh, ma penso che sia impossibile cambiare. La preparazione e il consumo del cibo è qualcosa di profondamente radicato in noi atlantidini - è solo una cerimonia di cui abbiamo bisogno per il nostro benessere. Quindi immagino che non possiamo portarla via completamente dagli individui.","scenario_atl01.wmf","../../data/campaigns/atl01.wmf/scripting/texts.lua:237"
"Atlantean","Atlantideo","A special tournament in Atlantean culture is the so-called ‘Island Hopping’, where two or more groups try to reach the center island as fast as possible, to be the first erecting a castle on the top of the central mountain.","Un torneo speciale nella cultura atlantidea è il cosiddetto "Salto delle isole", dove due o più gruppi provano a raggiungere l'isola centrale il più velocemente possibile per essere i primi a costruire un castello sulla cima della montagna centrale.","maps","../../data/maps/MP_Scenarios/Island_Hopping.wmf/elemental:9"
"Atlantean","Atlantideo","Island Hopping is a traditional tournament in Atlantean culture. The rules of the game are simple: you start with a headquarters on an island. When you finish a castle at the end of the first island, you are granted a second headquarters on a second island, which will contain all wares from your first headquarters.","Il Salto delle Isole è un tradizione torneo della cultura Atlantidea. Le regole del gioco sono semplici: cominci con un quartier generale su un'isola. Quando finisci di costruire un castello alla fine della prima isola ricevi un secondo quartier generale sulla seconda isola contenente tutte le merci del tuo primo quartier generale.","mp_scenario_island_hopping.wmf","../../data/maps/MP_Scenarios/Island_Hopping.wmf/scripting/texts.lua:9"
"Atlantean","Atlantideo","Breeds the strong Atlantean horses for adding them to the transportation system.","Alleva i cavalli atlantidei per aiutare il trasporto di merci","tribes_encyclopedia","../../data/tribes/buildings/productionsites/atlanteans/horsefarm/helptexts.lua:16"
"Atlantean","Atlantideo","The Atlantean fires in smelting works, armor smithies and weapon smithies are fed with coal.","I fuochi degli atlantidei nelle fonderie, fucine di armature e fucine di armi sono alimentati a carbone.","tribes_encyclopedia","../../data/tribes/wares/coal/helptexts.lua:6"
"Atlantean","Atlantideo","Cornmeal is produced in a mill out of corn and is one of three parts of the Atlantean bread produced in bakeries.","La farina di mais è prodotta in un mulino a partire dal mais ed è una delle tre parti del pane degli Atlantidei prodotto nei forni","tribes_encyclopedia","../../data/tribes/wares/cornmeal/helptexts.lua:4"
"Atlantean","Atlantideo","Golden tabards are produced in Atlantean weaving mills out of gold thread. They are used in the labyrinth – together with food – to train soldiers from health level 0 to level 1.","I tabarri dorati vengono prodotti nei mulini di tessitura atlantidei a partire dal filo d'oro. Sono usati nel Labirinto - insieme al cibo - per addestrare i soldati in Salute dal livello 0 al livello 1.","tribes_encyclopedia","../../data/tribes/wares/tabard_golden/helptexts.lua:4"
"Atlantean","Atlantideo","The double trident is one of the best tridents produced by the Atlantean weapon smithy. It is used in a dungeon – together with food – to train soldiers from attack level 2 to level 3.","Il tridente doppio è uno dei migliori tridenti prodotto dalla fucina d'armi atlantidea. È usata in una segreta - insieme al cibo - per addestrare i soldati dal livello 2 al livello 3 di attacco.","tribes_encyclopedia","../../data/tribes/wares/trident_double/helptexts.lua:4"
"Atlantean","Atlantideo","This is the most dangerous weapon of the Atlantean military. Only the best of the best soldiers may use it. It is produced in the weapon smithy and used in the dungeon – together with food – to train soldiers from attack level 3 to level 4.","Questa è l'arma più pericolosa nelle forze armate atlantidee. Solo i migliori soldati possono utilizzarla. È prodotta nella fucina delle armi ed utilizzata nella segreta - insieme al cibo - per addestrare i soldati dal livello 3 al livello 4 di attacco.","tribes_encyclopedia","../../data/tribes/wares/trident_heavy_double/helptexts.lua:4"
"Atlantean","Atlantideo","Breeds the strong Atlantean horses for adding them to the transportation system.","Alleva i cavalli atlantidei per aiutare il trasporto di merci","tribes_encyclopedia","../../data/tribes/workers/atlanteans/horsebreeder/helptexts.lua:3"
"Atlantis","Atlantis","After landing on a mysterious island close to Atlantis, the remaining Atlanteans struggle to make a new home for themselves.","Dopo l'approdo su una misteriosa isola vicina ad Atlantide, i rimanenti Atlantidei lottano per creare una nuova casa per loro stessi.","maps","../../data/campaigns/atl01.wmf/elemental:11"
"Atlantis","Atlantis","On the hidden and lost island of Atlantis, a proud tribe settled since the world was very young. Ruled by the bloodline of King Ajanthul – the first human to be empowered by the sea god Lutas to breathe above sea level – and the wise clerics, who provided the link to Lutas – they prospered and became civilized.","Sull'isola persa e nascosta di Atlantide, una fiera tribù si insediò sin da quando il mondo era molto giovane. Governata dalla discendenza di Re Ajanthul - il primo umano ad essere autorizzato dal dio del mare Lutas a respirare sopra il livello del mare - e i saggi ecclesiastici - che fornirono il collegamento con Lutas - prosperarono e divennero civilizzati.","scenario_atl01.wmf","../../data/campaigns/atl01.wmf/scripting/texts.lua:148"
"Atlantis","Atlantis","This story is taking place during the reign of King Askandor, the 43rd successor of King Ajanthul. He had been a good king, ruling Atlantis with wisdom and foresight. But with age, he became afraid of dying and so he began looking for a cure for death even though most clerics warned him against it. Some said that endless life was only for the gods and that to seek for it was forbidden.","Questa storia si svolge durante il regno di Re Askandor, il 43esimo successore di Re Ajanthul. Era stato un buon re, governando gli Atlantidei con saggezza e lungimiranza. Ma con l'età era diventato timoroso di morire e perciò cominciò a cercare una cura per la morte, nonostante la maggior parte dei religiosi lo avessero avvertito. Alcuni dicevano che la vita eterna fosse solo per gli dei e che la sua ricerca fosse proibita.","scenario_atl01.wmf","../../data/campaigns/atl01.wmf/scripting/texts.lua:150"
"Atlantis","Atlantis","But not even this changed the mind of the god. The water kept on rising. Nearly driven insane by guilt, pain and anger, Jundlina became a heretic: Secretly, she gathered people of the common folk who were not in line with the decision of the clerics to accept the god’s will. Together with them, she set the temple on fire and stole a ship to flee from the god’s influence over Atlantis. This small group started praying to Satul, the fire god and the worst enemy of Lutas.","Ma neanche questo ha fatto cambiare idea al dio. L'acqua continuava a salire. Quasi impazzita dal senso di colpa, dolore e rabbia, Jundlina è diventata un'eretica: Segretamente, ha riunito persone del popolo che non erano in linea con la decisione dei religiosi ad accettare la volontà del dio. Insieme a loro, diede fuoco al tempio e rubò una nave per fuggire dalle influenze del dio di Atlantide. Questo piccolo gruppo ha iniziato a pregare Satul, il dio del fuoco ed il peggiore nemico di Lutas.","scenario_atl01.wmf","../../data/campaigns/atl01.wmf/scripting/texts.lua:172"
"Atlantis","Atlantis","Leaving the dying Atlantis and their past behind, they started on a quest to find a place sheltered by the fire and protected from the sea.","Lasciandosi la morente Atlantide ed il loro passato alle spalle, cominciarono una ricerca per trovare un luogo al riparo dal fuoco e protetto dalle acque.","scenario_atl01.wmf","../../data/campaigns/atl01.wmf/scripting/texts.lua:174"
"Atlantis","Atlantis","We left Atlantis and sailed east. We entered the forbidden sea on the sixth day without noticing any pursuers from Atlantis and without Lutas having smashed our ship. Now, we are out of his reach. One day later, we sighted an island which seems to have one of these fire spitting mountains on it. I deemed this a sign from the fire god and we landed on its shore.","Abbiamo lasciato Atlantide e veleggiato verso est. Siamo entrati nel mare proibito durante il sesto giorno senza notare alcun inseguitore da Atlantide e senza che Lutas abbia sfracellato la nostra nave. Adesso siamo fuori dalla sua portata. Il giorno dopo, abbiamo avvistato un isola che sembrava avere una di quelle montagne sputa-fuoco. Ho giudicato che fosse un segno del dio del fuoco e siamo approdati sulle sue coste.","scenario_atl01.wmf","../../data/campaigns/atl01.wmf/scripting/texts.lua:184"
"Atlantis","Atlantis","We spent the last week building two watchtowers on the mountains close to our landing area; and, of course, a hall for us all. We have very talented constructors in our group – still, the buildings do not match the art we had on Atlantis. I hope they will withstand the next rain. At least, the towers will warn us if a ship from Atlantis follows us and if the island is inhabited, we will see attackers a long time before they arrive.","Abbiamo passato le ultime due settimane costruendo due torri di guarda sulle montagne vicino alla nostra area di sbarco; ed ovviamente una residenza per tutti noi. Abbiamo nel nostro gruppo dei costruttori molto talentuosi - eppure, gli edifici non eguagliano l'arte che avevamo su Atlantide. Spero possano superare la prossima pioggia. Almeno le torri ci avvertiranno se una nave proveniente da Atlantide ci sa seguito e, se l'isola è abitata, avvisteremo gli aggressori molto tempo prima che arrivino.","scenario_atl01.wmf","../../data/campaigns/atl01.wmf/scripting/texts.lua:187"
"Attack","Attacco","Build a tower at the north-east border of your territory to get greater visual range and to protect your people from sudden attacks by enemies.","Costruisci una torre al confine nord-est del tuo territorio per ottenere una visuale maggiore e proteggere il tuo popolo dagli attacchi a sorpresa dei nemici","scenario_bar02.wmf","../../data/campaigns/bar02.wmf/scripting/texts.lua:60"
"Attack","Attacco","Three weeks later, I returned to Fremil to speak with our king. He was furious at the Barbarians, yet forbade any attack on these tribes. He believed that our army was too weak to survive in a war against the Barbarians.","Tre settimane più tardi, sono tornato a Fremil per parlare con il nostro re. Era furioso con i barbari, ma non permise di attaccarli. Egli credeva che il nostro esercito fosse troppo debole per sopravvivere in una guerra contro i barbari.","scenario_emp01.wmf","../../data/campaigns/emp01.wmf/scripting/texts.lua:90"
"Attack","Attacco","Sire, I fear we are not safe in this foreign land. Who knows what terrible creatures live beyond this forest, in that mighty desert? What if these creatures enter the woods and await the time to attack us?","Sire, temo che non siamo al sicuro in questa terra straniera. Chissà quali terribili creature vivono oltre questa foresta, in quel maestoso deserto. E se queste creature entrassero nei boschi ed attendessero per attaccarci?","scenario_emp01.wmf","../../data/campaigns/emp01.wmf/scripting/texts.lua:129"
"Attack","Attacco","As soon as you have enough soldiers, attack and completely destroy the Barbarian buildings.","Appena hai abbastanza soldati, attacca e distruggi completamente gli edifici barbari.","scenario_emp02.wmf","../../data/campaigns/emp02.wmf/scripting/texts.lua:98"
"Attack","Attacco","The message was addressed to me, begging me to come back to Fremil. It says that the Empire is at war with the Barbarians. They were attacked from the north by the tribe that I was forbidden to attack. It is clear to me what I must do…","Il messaggio è stato indirizzato a me, pregandomi di tornare a Fremil. Si dice che l'Impero è in guerra con i barbari. Sono stati attaccati da nord da parte della tribù che mi era proibito di attaccare. E 'chiaro per me che cosa devo fare...","scenario_emp02.wmf","../../data/campaigns/emp02.wmf/scripting/texts.lua:287"
"Attack","Attacco","Hi, it’s me again! This time, I have sent you a message. Messages are sent to you by Widelands to inform you about important events: empty mines, attacks on your tribe, won or lost military buildings, resources found…","Ciao, sono di nnuovo io!  Questa volta, ti ho mandato un messaggio. I messaggi ti vengono mandati da Widelands per informarti di eventi importanti: miniere esaurite, attacchi contro la tua tribù, edifici militari conquistati o persi, risorse trovate...","scenario_tutorial01_basic_control.wmf","../../data/campaigns/tutorial01_basic_control.wmf/scripting/texts.lua:376"
"Attack","Attacco","When you are expanding into no man’s land, you can make your buildings prefer rookies. When you are planning to attack, send heroes into that region. Conquered buildings always prefer heroes.","Quando ti espandi in territori non contesi, puoi dire ai tuoi edifici di preferire le reclute. Quando pianifichi di attaccare, manda veterani in quella regione. Gli edifici conquistati preferiscono sempre gli eroi.","scenario_tutorial02_warfare.wmf","../../data/campaigns/tutorial02_warfare.wmf/scripting/texts.lua:136"
