"glossary_term","glossary_translation","source","target","file","location"
"building","Edificio","‘2/4’ below your sentry: For military buildings, the stationed soldiers are shown instead of a productivity. You want to have four soldiers in your sentries, but only two soldiers are stationed in this kind of building. This leaves two vacant positions – we really need more soldiers.","'2/4' sotto alla guardiola: per gli edifici militari, al posto della produttività vengono mostrati i soldati di guarnigione. Tu vorresti avere quattro soldati nelle tue guardiole, ma solo due soldati sono di guarnigione in questo tipo di edifici. Questo lascia due posizioni vuote - abbiamo bisogno di più soldati","scenario_tutorial04_economy.wmf","../../data/campaigns/tutorial04_economy.wmf/scripting/texts.lua:78"
"building","Edificio","You have closed the building statistics window. I didn’t notice that you switched to the medium buildings to look up the number of taverns. Would you please be so nice and show it to me?","Hai chiuso la finestra delle statistiche sugli edifici. Non ti ho visto selezionare glli edifici medi per controllare il numero di taverne. Potresti per cortesia farmelo vedere?","scenario_tutorial04_economy.wmf","../../data/campaigns/tutorial04_economy.wmf/scripting/texts.lua:98"
"building","Edificio","The stock menu window has four tabs. The first (and currently selected) one shows you all your current wares, including those on roads, at flags and inside buildings waiting for processing.","La finestra del menù scorte ha quattro linguette. La prima (e attualmente selezionata) mostra tutte le merci che hai al momento, incluse quelle lungo le strade, nelle bandiere, e all'interno degli edifici in attesa di essere lavorate.","scenario_tutorial04_economy.wmf","../../data/campaigns/tutorial04_economy.wmf/scripting/texts.lua:139"
"building","Edificio","The second tab shows you all your workers, again those on roads and in buildings summed up.","La seconda linguetta mostra tutti i tuoi lavoratori, di nuovo inclusi quelli per strada o negli edifici.","scenario_tutorial04_economy.wmf","../../data/campaigns/tutorial04_economy.wmf/scripting/texts.lua:141"
"building","Edificio","In our situation, you might want to work the bakeries as fast as possible because they supply our taverns, so you could set water to the highest priority for them. The other buildings (for example the donkey farm) would then get less water, but the bakery could work faster.","Nel nostro caso, potresti volerfar lavorare i forni il più rapidamente possibile, perchè riforniscono le nostre taverne, quindi dovresti indicare la priorità massima per l'acqua nei forni. Gli altri edifici (per esempio l'allevamento di asini) riceverebbero meno acqua, ma il forno potrebbe lavorare più in fretta.","scenario_tutorial04_economy.wmf","../../data/campaigns/tutorial04_economy.wmf/scripting/texts.lua:279"
"building","Edificio","Most buildings will only produce something when the stock level in your warehouses falls below the target quantity, so you should indicate the reserve you want to stockpile.","La maggior parte degli edifici producono qualcosa solo quando il livello delle scorte nei tuoi magazzini scende sotto la quantità bersaglio, quindi dovresti indicare quante scorte vuoi accumulare.","scenario_tutorial04_economy.wmf","../../data/campaigns/tutorial04_economy.wmf/scripting/texts.lua:418"
"building","Edificio","Only buildings that consume wares care about this setting. Buildings that produce wares for free (e.g. your farms or wells) will always keep working.","Solo gli edifici che consumano merci sono influenzati da questa impostazione. Gli edifici che producono qualcosa gratis (per esempio le fattorie o i pozzi) continueranno sempre a lavorare.","scenario_tutorial04_economy.wmf","../../data/campaigns/tutorial04_economy.wmf/scripting/texts.lua:429"
"building","Edificio","Widelands records every game you play in two files. One of these files has a .wrpl.wgf extension and contains an initial savegame. The other file has a .wrpl extension and contains all commands that were issued by all players, such as building a road or attacking an enemy. The rest of the filenames will tell you the time you started the game.","Widelands registra ogni partita giocata in due files. Uno di questi file ha estensione .wrpl.wgf e contiene il salvataggio iniziale. L'altro file ha estensione .wrpl e contiene tutti i comandi eseguiti da tutti i giocatori, ad esempio costruisci un strada o attacca un nemico. L'altra parte dei nomi dei file indica quando hai avviato il gioco.","texts","../../data/txts/help/common_helptexts.lua:26"
"building","Edificio","The building process will only start after a road is built to the construction site.","Il processo di costruzione inizierà soltanto se esiste una strada per raggiungere il cantiere.","texts","../../data/txts/tips/general_game.lua:6"
"building","Edificio","Be sure to send a geologist to survey sites before building a well or a mine.","Assicurati di mandare un geologo ad esaminare i luoghi prima di costruire un pozzo o una miniera.","texts","../../data/txts/tips/general_game.lua:10"
"building","Edificio","Your territory can be expanded by building various military buildings – Sentry, Fortress, Blockhouse, etc.","Il tuo territorio può essere esteso costruendo vari edifici militari - guardiole, fortezze, caserme, ecc.","texts","../../data/txts/tips/general_game.lua:14"
"building","Edificio","An economy consists of all buildings and flags connected by roads. The supplies and demands of buildings are handled in its economy.","Un'economia è composta da tutti gli edifici e le bandiere collegati da strade. Le forniture e le esigenze degli edifici sono gestiti all'interno della propria economia.","texts","../../data/txts/tips/general_game.lua:63"
"building","Edificio","The fisher working out of this fisher’s house can’t find any fish in his work area. Remember that you can increase the number of existing fish by building a fish breeder’s house.","Il pescatore che lavora in questa casa del pescatore non riesce trovare pesci nella sua area di lavoro.","tribes","../../data/tribes/buildings/productionsites/atlanteans/fishers_house/init.lua:59"
"building","Edificio","The lumberjack working at this lumberjack’s hut can’t find any trees in his work area. You should consider dismantling or destroying the building or building a ranger’s hut.","Controlli","tribes","../../data/tribes/buildings/productionsites/barbarians/lumberjacks_hut/init.lua:61"
"building","Edificio","Weaves spidercloth for buildings and ships’ sails, and tabards to equip and train the soldiers.","Tesse il tessuto di ragno per gli edifici e per le vele delle navi, e i tabarri per equipaggiare e addestrare i soldati","tribes_encyclopedia","../../data/tribes/buildings/productionsites/atlanteans/weaving_mill/helptexts.lua:16"
"building","Edificio","Ragnald the Child’s answer to the question, what he’s doing in the dirt. His ‘new stone’ now is an important building material.","Ragnald il Bambino risponde alla domanda su cosa stesse facendo per terra. La sua 'pietra nuova' ora è un importante materiale da costruzione","tribes_encyclopedia","../../data/tribes/buildings/productionsites/barbarians/lime_kiln/helptexts.lua:8"
"building","Edificio","The Barbarian metal workshop is the basic production site in a series of three buildings and creates all the tools that Barbarians need. The others are for weapons.","L'officina metallica barbarica è il sito di produzione di base in una serie di tre edifici e crea tutti gli attrezzi di cui i barbari hanno bisogno. Gli altri fabbricano armi.","tribes_encyclopedia","../../data/tribes/buildings/productionsites/barbarians/metal_workshop/helptexts.lua:18"
"building","Edificio","Cloth is needed to build several buildings. It is also consumed in the armor smithy.","Il tessuto si usa per costruire diversi edifici. È anche usato nella fucina di armature.","tribes_encyclopedia","../../data/tribes/wares/cloth/helptexts.lua:8"
"building","Edificio","These wonderful diamonds are used to build some exclusive buildings. They are mined in a crystal mine.","Questi splendidi diamanti sono utilizzati per costruire alcuni edifici esclusivi. Sono estratti dalle miniere di cristallo.","tribes_encyclopedia","../../data/tribes/wares/diamond/helptexts.lua:4"
"building","Edificio","Granite is a basic building material.","Il granito è un materiale di costruzione di base.","tribes_encyclopedia","../../data/tribes/wares/granite/helptexts.lua:4"
"building","Edificio","Logs are an important basic building material. They are produced by felling trees.","I tronchi sono un importante risorsa base per gli edifici. Vengono prodotti abbattendo gli alberi.","tribes_encyclopedia","../../data/tribes/wares/log/helptexts.lua:4"
"building","Edificio","Planks are an important building material.","Le tavole sono un importante materiale di costruzione.","tribes_encyclopedia","../../data/tribes/wares/planks/helptexts.lua:4"
"building","Edificio","These transparent quartz gems are used to build some exclusive buildings. They are produced in a crystal mine.","Questi quarzi trasparenti sono utilizzati per costruire alcuni edifici esclusivi. Sono prodotti nelle miniere di cristallo.","tribes_encyclopedia","../../data/tribes/wares/quartz/helptexts.lua:4"
"building","Edificio","Some of your starting buildings didn’t have enough room and weren’t built. You are at a disadvantage with this; consider restarting this map with a fair starting condition.","Alcuni dei tuoi edifici non sono stati costruiti per mancanza di spazio. Sei svantaggiato per questo; considera riavviare la mappa con condizioni iniziali più bilanciate.","widelands","../../data/scripting/infrastructure.lua:170"
"building","Edificio","Start building road after placing a flag","Inizia la costruzione della strada dopo aver piazzato la bandiera","widelands","../../src/ui_fsmenu/options.cc:210"
"building","Edificio","Toggle building label display","Mostra/Nascondi le etichette degli edifici","widelands","../../src/wui/fieldaction.cc:362"
"building","Edificio","Military buildings lost","Edifici militari persi","widelands","../../src/wui/general_statistics_menu.cc:173"
"building","Edificio","Military buildings defeated","Edifici militari sconfitti","widelands","../../src/wui/general_statistics_menu.cc:178"
"building","Edificio","Civilian buildings lost","Edifici civili persi","widelands","../../src/wui/general_statistics_menu.cc:183"
"Military Site","Edificio Militare","Build military sites to expand your territory","Costruisci dei siti militari per espandere il tuo territorio","scenario_atl01.wmf","../../data/campaigns/atl01.wmf/scripting/texts.lua:48"
"Military Site","Edificio Militare","If you’re low on soldiers to occupy new military sites, use the downward arrow button to decrease the capacity. You can also click on a soldier to send him away.","Se sei a corto di soldati, puoi premere sul pulsante con la freccia in giù per ridurre la capacità dell'edificio. Puoi anche cliccare su un soldato per mandarlo via","tribes_encyclopedia","../../data/tribes/buildings/militarysites/atlanteans/castle/helptexts.lua:24 ../../data/tribes/buildings/militarysites/atlanteans/guardhall/helptexts.lua:21 ../../data/tribes/buildings/militarysites/atlanteans/guardhouse/helptexts.lua:21 ../../data/tribes/buildings/militarysites/atlanteans/tower/helptexts.lua:21 ../../data/tribes/buildings/militarysites/atlanteans/tower_high/helptexts.lua:21 ../../data/tribes/buildings/militarysites/atlanteans/tower_small/helptexts.lua:21 ../../data/tribes/buildings/militarysites/barbarians/barrier/helptexts.lua:21 ../../data/tribes/buildings/militarysites/barbarians/citadel/helptexts.lua:21 ../../data/tribes/buildings/militarysites/barbarians/fortress/helptexts.lua:21 ../../data/tribes/buildings/militarysites/barbarians/sentry/helptexts.lua:21 ../../data/tribes/buildings/militarysites/barbarians/tower/helptexts.lua:21 ../../data/tribes/buildings/militarysites/empire/barrier/helptexts.lua:21 ../../data/tribes/buildings/militarysites/empire/blockhouse/helptexts.lua:21 ../../data/tribes/buildings/militarysites/empire/castle/helptexts.lua:21 ../../data/tribes/buildings/militarysites/empire/fortress/helptexts.lua:21 ../../data/tribes/buildings/militarysites/empire/outpost/helptexts.lua:21 ../../data/tribes/buildings/militarysites/empire/sentry/helptexts.lua:21 ../../data/tribes/buildings/militarysites/empire/tower/helptexts.lua:21 ../../data/tribes/buildings/militarysites/frisians/fortress/helptexts.lua:21 ../../data/tribes/buildings/militarysites/frisians/outpost/helptexts.lua:21 ../../data/tribes/buildings/militarysites/frisians/sentinel/helptexts.lua:21 ../../data/tribes/buildings/militarysites/frisians/tower/helptexts.lua:21 ../../data/tribes/buildings/militarysites/frisians/wooden_tower/helptexts.lua:21 ../../data/tribes/buildings/militarysites/frisians/wooden_tower_high/helptexts.lua:21"
"Helmet","Elmo","To train in the training camp, our soldiers need food like in the battle arena, but no strong beer. Instead, they need different axes for attack training and helmets for health training.","Per addestrarsi nel campo di addestramento, i nostri soldati necessitano di cibo come nell'arena di battaglia, ma non di birra. Invece, gli servono diversi tipi di asce per addestrarsi in attacco, e di elmi per la salute.","scenario_tutorial02_warfare.wmf","../../data/campaigns/tutorial02_warfare.wmf/scripting/texts.lua:122"
"Helmet","Elmo","Forges helmets that are used for training soldiers’ health in the training camp.","Forgia elmi che sono usati per addestrare la salute dei soldati nel campo di addestramento.","tribes_encyclopedia","../../data/tribes/buildings/productionsites/barbarians/helmsmithy/helptexts.lua:16"
"Helmet","Elmo","Forges armor and helmets that are used for training soldiers’ health in the training camp.","Forgia armature ed elmi che sono usati per addestrare i soldati nel campo di addestramento.","tribes_encyclopedia","../../data/tribes/buildings/productionsites/empire/armorsmithy/helptexts.lua:16"
"Helmet","Elmo","Forges helmets for soldiers.","Forgia elmi per i soldati.","tribes_encyclopedia","../../data/tribes/workers/barbarians/helmsmith/helptexts.lua:3"
"explore","Esplorare","In the vicinity of three major volcanoes, six lovely islands are inviting settlers to start a new life. Deserts and a quickly growing forest wait to be discovered. But only by becoming a naval power will your tribe be able to explore enough resources to compete with its opponents.","Nel luogo in cui sorgono i tre principali vulcani sei splendide isole invitano i coloni ad avviare una nuova vita. I deserti ed una foresta che cresce rapidamente attendono di essere scoperti. Ma solamente diventando una potenza navale la tua tribù potra scoprire abbastanza risorse da competere con i suoi avversari.","maps","../../data/maps/Trident_of_Fire.wmf/elemental:10"
"explore","Esplorare","The island is huge and as long as we are not sure that we are alone here, we cannot relax. Explore and conquer it, this is the only way to protect us from threats on the island and from Atlantis.","L'isola è enorme e fintanto che non saremo sicuri di essere soli non potremo rilassarci. Esplorala e conquistala, è il solo modo di proteggerci dalle minacce sull'isola e da Atlantide.","scenario_atl01.wmf","../../data/campaigns/atl01.wmf/scripting/texts.lua:47"
"explore","Esplorare","A friend of mine explored the island on his own and he told me of a big lake at the top of the mountain. I suggest we build the ships in this lake and wait until the island drowns beneath us. Then we can sail away. It is a bold plan, but I think it could work.","Un mio amico ha esplorato l'isola per conto suo e mi ha detto di un grande lago in cima alla montagna. Suggerisco di costruire le navi in questo lago e aspettare fino a che l'isola non affondi sotto di noi. Poi potremo salpare. È un piano ardito, però penso che possa funzionare.","scenario_atl01.wmf","../../data/campaigns/atl01.wmf/scripting/texts.lua:455"
"explore","Esplorare","Boldreth and I just explored the area around the three mountains. One major strategic problem of that area seems to be that there are two bigger passages – one north and one south of the central mountain. Those passages are quite hard to control, and so it seems to me like we have only one chance to secure the mountains from enemy hands: we must build a fortress to the east of the mountains!","Boldreth e io, abbiamo appena esplorato l'area attorno alle tre montagne. Dal punto di vista strategico uno dei maggiori problemi di quell'area sembrano essere due enormi passaggi – uno a nord e uno a sud della montagna centrale. Quei passaggi sono molto difficili da mettere sotto controllo e quindi ritengo che ci sia un solo modo di mettere le montagne al sicuro dalle mani del nemico: dobbiamo costruire una fortezza ad est delle montagne!","scenario_bar02.wmf","../../data/campaigns/bar02.wmf/scripting/texts.lua:300"
"Scout","Esploratore","By the Gods! One of our scouts has discovered a mighty castle at the center of the old plateau. The castle must be quite old and seems to have been built in a foreign style. It’s quite obvious that this is not barbarian craft.","Per tutti gli dei! Uno dei nostri esploratori ha scoperto un possente castello al centro dell'antico altopiano. Il castello deve essere abbastanza antico e sembra essere stato costruito in uno stile straniero. è chiaro che non è opera di barbari.","map_the_green_plateau.wmf","../../data/maps/The_Green_Plateau.wmf/scripting/texts.lua:79"
"Scout","Esploratore","But there is more news: My scouts have reported that the two raging tribes of my brothers are in chaos and have barely noticed the new danger that is about to strike them. However, they would not care if they noticed I guess, blinded by rage and hate, there is no sense left in them at all I believe.","Ma ci sono ancora altre novità: i miei esploratori riportano che le due furenti tribù dei miei fratelli sono in uno stato di confusione ed hanno notato a malapena il nuovo pericolo che sta per colpirli. Ad ogni modo, se anche l'avessero notato, non ci avrebbero dato peso, accecate dalla rabbia e dell'odio; credo non sia rimasto loro alcun senno.","scenario_bar02.wmf","../../data/campaigns/bar02.wmf/scripting/texts.lua:228"
"Scout","Esploratore","To overlook more of the area around our hall, we should explore further and set up more guards and scouts to observe the frontier and keep an eye on the raging wars on our doorstep. THEN we will be prepared once trouble seeks to capture our woods.","Per sorvegliare ancor di più l'area intorno alla nostra sede, dovremmo esplorare ancora e predisporre più guardie ed esploratori per controllare il confine e tenere d'occhio le guerre che infuriano alle nostre porte. SOLO ALLORA saremo pronti qualora i disordini intendano catturare i nostri boschi.","scenario_bar02.wmf","../../data/campaigns/bar02.wmf/scripting/texts.lua:274"
"Scout","Esploratore","Bakes bread to feed the scouts and miners and to train soldiers.","Inforna il pane per nutrire gli esploratori, i minatori, e i soldati in addestramento","tribes_encyclopedia","../../data/tribes/buildings/productionsites/atlanteans/bakery/helptexts.lua:16"
"Scout","Esploratore","Smokes meat and fish to feed the scouts and miners and to train soldiers in the dungeon.","Affumica carne e pesce per nutrire gli esploratori e i minatori e per addestrare i soldati.","tribes_encyclopedia","../../data/tribes/buildings/productionsites/atlanteans/smokery/helptexts.lua:16"
"Scout","Esploratore","Prepares rations for scouts and rations, snacks and meals to feed all miners.","Prepara razioni, spuntini e pasti per nutrire esploratori e minatori","tribes_encyclopedia","../../data/tribes/buildings/productionsites/barbarians/big_inn/helptexts.lua:16"
"Scout","Esploratore","Prepares rations for scouts and rations and snacks to feed the miners in the basic and deep mines.","Prepara razioni e spuntini per nutrire esploratori e minatori in miniere di base e profonde.","tribes_encyclopedia","../../data/tribes/buildings/productionsites/barbarians/inn/helptexts.lua:16"
"Scout","Esploratore","Prepares rations to feed the scouts and miners.","Prepara razioni per nutrire esploratori e minatori","tribes_encyclopedia","../../data/tribes/buildings/productionsites/barbarians/tavern/helptexts.lua:16 ../../data/tribes/buildings/productionsites/frisians/tavern/helptexts.lua:13"
"Scout","Esploratore","Prepares rations for scouts and rations and snacks to feed the miners in all mines.","Prepara razioni per gli esploratori e razioni e spuntini per i minatori di tutte le miniere.","tribes_encyclopedia","../../data/tribes/buildings/productionsites/empire/inn/helptexts.lua:16"
"Scout","Esploratore","Prepares rations to feed the scouts and miners.","Prepara razioni per nutrire esploratori e minatori","tribes_encyclopedia","../../data/tribes/buildings/productionsites/empire/tavern/helptexts.lua:16"
"Scout","Esploratore","This tasty bread is made in bakeries out of cornmeal, blackroot flour and water. It is appreciated as basic food by miners, scouts and soldiers in training sites (labyrinth and dungeon).","Questo pane saporito è prodotto nei forni a partire dalla farina di mais, farina di radici nere ed acqua. È apprezzato come cibo di base per i minatori, gli esploratori ed i soldati nei luoghi di addestramento (labirinto e segreta).","tribes_encyclopedia","../../data/tribes/wares/bread_atlanteans/helptexts.lua:4"
"Evade","Evasione","If a Barbarian soldier is fully trained, he has level %1% health, level %2% attack, level %3% defense and level %4% evade. This is one fearsome warrior then! The individual abilities have the following meaning:","Quando un soldato barbaro è allenato al massimo, ha salute livello %1%, attacco livello %2%, difesa livello %3% e elusione livello %4%. Un guerriero spaventoso, dunque! Le abilità individuali hanno il significato seguente:","scenario_tutorial02_warfare.wmf","../../data/campaigns/tutorial02_warfare.wmf/scripting/texts.lua:40"
"Evade","Evasione","If all needed wares are delivered in time, a battle arena can train evade for one soldier from 0 to the highest level in %1$s and %2$s on average.","Se tutte le merci necessarie sono consegnate in tempo, un'Arena di battaglia può addestrare un nuovo soldato da 0 al livello finale rispettivamente in %1$s e %2$s.","tribes_encyclopedia","../../data/tribes/buildings/trainingsites/barbarians/battlearena/helptexts.lua:26"
"Ax Workshop","Fabbrica di asce","Enhance your metal workshop to an ax workshop in order to produce weapons, and build up a second metal workshop to ensure the production of tools. When the blacksmith reaches his next level (master blacksmith), you can even enhance the ax workshop to a war mill, which will produce additional weapons.","Migliora la tua officina in una fabbrica d'asce per produrre armi e costruisci un'altra officina per garantire la produzione di attrezzi. Quando il fabbro raggiunge il suo prossimo livello (mastro fabbro), puoi anche migliorarla in una fucina da guerra, che produce ulteriori armi.","scenario_bar02.wmf","../../data/campaigns/bar02.wmf/scripting/texts.lua:94 ../../data/campaigns/bar02.wmf/scripting/texts.lua:124"
"Ax Workshop","Fabbrica di asce","Young soldiers are proud to learn to fight with this powerful weapon. It is heavier and sharper than the ordinary ax. It is produced in ax workshops and war mills. In training camps, it is used – together with food – to train soldiers from attack level 0 to level 1.","I giovani soldati sono orgogliosi di imparare a combattere con questa potente arma. È più pesante e affilata di un'ascia ordinaria. È prodotta nelle Fabbriche di asce e Fucine da guerra. Si usa nei campi di addestramento - insieme al cibo - per addestrare i soldati in attacco dal livello 0 al livello 1.","tribes_encyclopedia","../../data/tribes/wares/ax_sharp/helptexts.lua:4"
"Ax Workshop","Fabbrica di asce","The fires of the Barbarians are usually fed with coal. Consumers are several buildings: lime kiln, smelting works, ax workshop, war mill, and helm smithy.","I fuochi dei barbari sono solitamente alimentati a carbone. Diversi edifici lo usano: calchere, fonderie, fucine di elmi, fabbriche di asce e fucine da guerra.","tribes_encyclopedia","../../data/tribes/wares/coal/helptexts.lua:8"
"Weaponsmith","Fabbro di armi","This is the best and sharpest weapon the Empire weaponsmith creates for the soldiers. It is used in the training camp – together with food – to train soldiers from attack level 3 to level 4.","Questa è l'arma migliore che i fabbri dell'impero sono in grado di creare. È usata nel campo di addestramento - insieme al cibo - per addestrare i soldati in attacco dal livello 3 al livelllo 4.","tribes_encyclopedia","../../data/tribes/wares/spear_war/helptexts.lua:4"
"Blacksmith","Fabbro ferraio","Enhance your metal workshop to an ax workshop in order to produce weapons, and build up a second metal workshop to ensure the production of tools. When the blacksmith reaches his next level (master blacksmith), you can even enhance the ax workshop to a war mill, which will produce additional weapons.","Migliora la tua officina in una fabbrica d'asce per produrre armi e costruisci un'altra officina per garantire la produzione di attrezzi. Quando il fabbro raggiunge il suo prossimo livello (mastro fabbro), puoi anche migliorarla in una fucina da guerra, che produce ulteriori armi.","scenario_bar02.wmf","../../data/campaigns/bar02.wmf/scripting/texts.lua:94 ../../data/campaigns/bar02.wmf/scripting/texts.lua:124"
