"glossary_term","glossary_translation","source","target","file","location"
"building","edificio","In this scenario, I’m going to tell you about soldiers, their training and their profession: warfare. Although Widelands is about building up, not burning down, there is an enemy you sometimes have to defeat. Yet warfare is mainly focused on economics, not on military strategies, and its mechanics deserve explanation.","En este escenario te voy a hablar acerca de los soldados, su entrenamiento y su profesión: la guerra. Aunque Widelands es sobre construir, no sobre destruir, hay un enemigo que a veces tienes que derrotar. Además la guerra está principalmente enfocada en la economía, no en la estrategia militar, y sus mecánicas merecen una explicación.","scenario_tutorial02_warfare.wmf","../../data/campaigns/tutorial02_warfare.wmf/scripting/texts.lua:29"
"building","edificio","On this map, there is no enemy to fear. In other games, you should make building one or two military fortifications around your new colonies a priority.","En este mapa no hay enemigo que temer. En otras partidas, deberías priorizar la construcción de una o dos fortificaciones militares alrededor de tu colonia.","scenario_tutorial03_seafaring.wmf","../../data/campaigns/tutorial03_seafaring.wmf/scripting/texts.lua:215"
"building","edificio","On this map, there is no enemy to fear. In other games, you should make building one or two military fortifications around your new colonies a priority.","En este mapa no hay enemigo que temer. En otras partidas, deberías priorizar la construcción de una o dos fortificaciones militares alrededor de tu colonia.","scenario_tutorial03_seafaring.wmf","../../data/campaigns/tutorial03_seafaring.wmf/scripting/texts.lua:215"
"building","edificio","Now it’s your turn: Build a gold mine on the mountain in the south and connect it to the main land by building waterways over the streams.","Ahora es tu turno: Construye una mina de oro en la montaña en el sur y conéctala a tierra firme construyendo vías acuáticas sobre los arroyos.","scenario_tutorial03_seafaring.wmf","../../data/campaigns/tutorial03_seafaring.wmf/scripting/texts.lua:306"
"building","edificio","Now it’s your turn: Build a gold mine on the mountain in the south and connect it to the main land by building waterways over the streams.","Ahora es tu turno: Construye una mina de oro en la montaña en el sur y conéctala a tierra firme construyendo vías acuáticas sobre los arroyos.","scenario_tutorial03_seafaring.wmf","../../data/campaigns/tutorial03_seafaring.wmf/scripting/texts.lua:306"
"building","edificio","Build a gold mine on the mountain in the south, and connect it to the mainland by building waterways over the streams.","Construye una mina de oro en la montaña en el sur y conéctala a tierra firme construyendo vías acuáticas sobre los arroyos.","scenario_tutorial03_seafaring.wmf","../../data/campaigns/tutorial03_seafaring.wmf/scripting/texts.lua:315"
"building","edificio","Build a gold mine on the mountain in the south, and connect it to the mainland by building waterways over the streams.","Construye una mina de oro en la montaña en el sur y conéctala a tierra firme construyendo vías acuáticas sobre los arroyos.","scenario_tutorial03_seafaring.wmf","../../data/campaigns/tutorial03_seafaring.wmf/scripting/texts.lua:315"
"building","edificio","If you don’t have any building of a particular building type, it will be shown greyed out.","Si no tienes ninguna construcción de ningún tipo en concreto, se mostrará en gris.","scenario_tutorial04_economy.wmf","../../data/campaigns/tutorial04_economy.wmf/scripting/texts.lua:90"
"building","edificio","If you don’t have any building of a particular building type, it will be shown greyed out.","Si no tienes ninguna construcción de ningún tipo en concreto, se mostrará en gris.","scenario_tutorial04_economy.wmf","../../data/campaigns/tutorial04_economy.wmf/scripting/texts.lua:90"
"building","edificio","Wares not present in the building yet but already being transported there are shown in a darker grey.","Mercancías aún no presentes pero que vienen en camino se muestran en un gris más oscuro.","scenario_tutorial04_economy.wmf","../../data/campaigns/tutorial04_economy.wmf/scripting/texts.lua:325"
"building","edificio","Wares not present in the building yet but already being transported there are shown in a darker grey.","Mercancías aún no presentes pero que vienen en camino se muestran en un gris más oscuro.","scenario_tutorial04_economy.wmf","../../data/campaigns/tutorial04_economy.wmf/scripting/texts.lua:325"
"building","edificio","Widelands records every game you play in two files. One of these files has a .wrpl.wgf extension and contains an initial savegame. The other file has a .wrpl extension and contains all commands that were issued by all players, such as building a road or attacking an enemy. The rest of the filenames will tell you the time you started the game.","Widelands graba cada juego en dos archivos. Uno de esos archivos tiene una extensión .wrpl.wgf y contiene un guardado inicial. El otro archivo tiene una extensión .wrpl y contiene todos los comandos que fueron usados por todos los jugadores, como construir caminos o atacar al enemigo. El resto de los nombres de los archivos te dirán el tiempo de inicio del juego.","texts","../../data/txts/help/common_helptexts.lua:30"
"building","edificio","Widelands records every game you play in two files. One of these files has a .wrpl.wgf extension and contains an initial savegame. The other file has a .wrpl extension and contains all commands that were issued by all players, such as building a road or attacking an enemy. The rest of the filenames will tell you the time you started the game.","Widelands graba cada juego en dos archivos. Uno de esos archivos tiene una extensión .wrpl.wgf y contiene un guardado inicial. El otro archivo tiene una extensión .wrpl y contiene todos los comandos que fueron usados por todos los jugadores, como construir caminos o atacar al enemigo. El resto de los nombres de los archivos te dirán el tiempo de inicio del juego.","texts","../../data/txts/help/common_helptexts.lua:30"
"building","edificio","The building process will only start after a road is built to the construction site.","La construcción sólo comenzará cuando haya un camino construido hasta el punto de edificación.","texts","../../data/txts/tips/general_game.lua:7"
"building","edificio","The building process will only start after a road is built to the construction site.","La construcción sólo comenzará cuando haya un camino construido hasta el punto de edificación.","texts","../../data/txts/tips/general_game.lua:7"
"building","edificio","Be sure to send a geologist to survey sites before building a well or a mine.","Asegúrate de enviar un geólogo a explorar el área antes de construir un pozo o una mina.","texts","../../data/txts/tips/general_game.lua:11"
"building","edificio","Be sure to send a geologist to survey sites before building a well or a mine.","Asegúrate de enviar un geólogo a explorar el área antes de construir un pozo o una mina.","texts","../../data/txts/tips/general_game.lua:11"
"building","edificio","Use the priority sliders in building windows to adjust delivery of a specific ware. Holding down Shift while clicking will adjust all wares at once.","Utiliza los deslizadores de prioridad en las ventanas de construcción para ajustar la entrega de un artículo específico. Si mantienes presionada la tecla Shift mientras haces clic, se ajustarán todos los productos a la vez.","texts","../../data/txts/tips/general_game.lua:32"
"building","edificio","Use the priority sliders in building windows to adjust delivery of a specific ware. Holding down Shift while clicking will adjust all wares at once.","Utiliza los deslizadores de prioridad en las ventanas de construcción para ajustar la entrega de un artículo específico. Si mantienes presionada la tecla Shift mientras haces clic, se ajustarán todos los productos a la vez.","texts","../../data/txts/tips/general_game.lua:32"
"building","edificio","The fisher working out of this fisher’s house can’t find any fish in his work area. Remember that you can increase the number of existing fish by building a fish breeder’s house.","El pescador que trabaja desde esta cabaña de pescador no puede encontrar pescado en su zona de trabajo. Recuerda que puedes aumentar la cantidad de pescado construyendo una piscifactoría.","tribes","../../data/tribes/buildings/productionsites/atlanteans/fishers_house/init.lua:54"
"building","edificio","The fisher working out of this fisher’s house can’t find any fish in his work area. Remember that you can increase the number of existing fish by building a fish breeder’s house.","El pescador que trabaja desde esta cabaña de pescador no puede encontrar pescado en su zona de trabajo. Recuerda que puedes aumentar la cantidad de pescado construyendo una piscifactoría.","tribes","../../data/tribes/buildings/productionsites/atlanteans/fishers_house/init.lua:54"
"building","edificio","Start building road after placing a flag","Empezar a construir camino después de poner una bandera","widelands","../../src/ui_fsmenu/options.cc:256"
"building","edificio","Start building road after placing a flag","Empezar a construir camino después de poner una bandera","widelands","../../src/ui_fsmenu/options.cc:256"
"building","edificio","Cancel road and start building waterway","Cancelar caminos y trazar vía acuática","widelands","../../src/wui/fieldaction.cc:649"
"building","edificio","Cancel road and start building waterway","Cancelar caminos y trazar vía acuática","widelands","../../src/wui/fieldaction.cc:649"
"building","edificio","Cancel waterway and start building road","Cancelar vía acuática y trazar caminos","widelands","../../src/wui/fieldaction.cc:668"
"building","edificio","Cancel waterway and start building road","Cancelar vía acuática y trazar caminos","widelands","../../src/wui/fieldaction.cc:668"
"training","entrenamiento","Build a barracks to start training soldiers.","Construye unos barracones para empezar a entrenar soldados.","scenario_emp02.wmf","../../data/campaigns/emp02.wmf/scripting/texts.lua:97"
"training","entrenamiento","Sire, we have all buildings available for training our soldiers, but we should increase our efforts to train them to the highest level and to train more of them.","Señor, tenemos todos los edificios disponibles para entrenar a nuestros soldados, pero debemos aumentar nuestros esfuerzos para entrenarlos al más alto nivel y entrenar a más de ellos.","scenario_emp03.wmf","../../data/campaigns/emp03.wmf/scripting/texts.lua:600"
"training","entrenamiento","Increase your military strength by training your soldiers","Incrementa tu fuerza militar entrenando a tus soldados","scenario_emp04.wmf","../../data/campaigns/emp04.wmf/scripting/texts.lua:180"
"training","entrenamiento","While our soldiers are training, let me tell you what we can do with them.","Mientras entrenan nuestros soldados deja que te cuente lo que podemos hacer con ellos.","scenario_tutorial02_warfare.wmf","../../data/campaigns/tutorial02_warfare.wmf/scripting/texts.lua:188"
"training","entrenamiento","Chocolate is essential for training amazon soldiers.","El chocolate es esencial para entrenar guerreras amazonas.","tribes_encyclopedia","../../data/tribes/initialization/amazons/units.lua:1484"
"training","entrenamiento","A trainer training a soldier","Un entrenador entrenando a un soldado","tribes_encyclopedia","../../data/tribes/initialization/frisians/units.lua:2070 ../../data/tribes/initialization/frisians/units.lua:2083"
"Clay Digger","excavador de arcilla","Clay is easy to make: A clay digger working at a clay pit will simply dig up some earth and mix it with water. Just make sure that he has plenty of space for digging around his clay pit. It might be a good idea to build some sentinels to expand.","Es fácil hacer arcilla: un excavador trabajando en un pozo de arcilla simplemente excava algo de tierra y la mezcla con agua. Sólo asegúrate que tenga mucho espacio para excavar alrededor de su pozo. Puede ser una buena idea construir algunos centinelas para expandirte.","scenario_fri01.wmf","../../data/campaigns/fri01.wmf/scripting/texts.lua:166"
"Clay Digger","excavador de arcilla","The clay digger working at this clay pit can’t find any level ground in his work area. Consider dismantling this clay pit and rebuilding it somewhere else.","El excavador trabajando en esta barreda no puede encontrar ningún terreno nivelado en su área de trabajo. Considera desarmar esta barreda y reconstruirla en otra parte.","tribes","../../data/tribes/buildings/productionsites/frisians/clay_pit/init.lua:85"
"explore","explorar","The island is huge and as long as we are not sure that we are alone here, we cannot relax. Explore and conquer it, this is the only way to protect us from threats on the island and from Atlantis.","La isla es enorme y siempre cuando no estemos seguros de que estamos solos aquí, no podemos relajarnos. Explora y conquístalo, es la única forma de protegernos de las amenazas de la isla y de los atlantes.","scenario_atl01.wmf","../../data/campaigns/atl01.wmf/scripting/texts.lua:45"
"explore","explorar","And yet another of these buildings. We know now that the tribe that built them once had complete control over the island. But I am no longer so scared of potential enemies. We know so much of this island already and there is no trace of this old economy to be found. I am starting to relax, but I will not let our guard down as we continue to explore this beautiful island. But without obvious dangers, I am feeling very much at home here already.","Y otro más de estos edificios. Ahora sabemos que la tribu que los construyó alguna vez tuvo completo control sobre la isla. Pero ya no estoy tan asustada de enemigos potenciales. Sabemos mucho de esta isla y no hay rastro de esta antigua economía que encontramos. Estoy empezando a relajarme, pero no dejaré nuestra guardia baja hasta que continuemos explorando esta hermosa isla. Pero con evidentes peligros, ya me siento como en casa aquí.","scenario_atl01.wmf","../../data/campaigns/atl01.wmf/scripting/texts.lua:428"
"explore","explorar","Lutius, it seems that our coal supply is a little weak. So, we need to expand and explore all mineable areas for more coal.","Lutius, parece que nuestro suministro de carbón es algo débil. Por lo tanto necesitamos expandirnos y buscar más carbón en todas las áreas explotables.","scenario_emp04.wmf","../../data/campaigns/emp04.wmf/scripting/texts.lua:513"
"explore","explorar","It’s good to know your surroundings. A scout will explore unseen parts of the map for you.","Es bueno conocer tus alrededores. Un explorador examinará partes no vistas del mapa para ti.","scenario_tutorial02_warfare.wmf","../../data/campaigns/tutorial02_warfare.wmf/scripting/texts.lua:146"
"explore","explorar","Wait for the scout to explore unseen areas.","Espera a que el explorador examine areas no vistas.","scenario_tutorial02_warfare.wmf","../../data/campaigns/tutorial02_warfare.wmf/scripting/texts.lua:167"
"explore","explorar","‘Behind the next hill there might be wealth and happiness but also hostility and doom.<br>He who will not explore it commits the crime of stupidity.’","‘Detrás de la siguiente colina puede haber riqueza y felicidad pero también hostilidad y condena.<br>Aquel que no la explora comete el crimen de la estupidez.’","tribes_encyclopedia","../../data/tribes/initialization/barbarians/units.lua:1236"
"making","fabricar","This is a somewhat technical map, and it is best suited for two or three human players. Coal is hard to find – consider making some. There is gold near the starting point – do you see it?","Este es un mapa algo técnico y es el más adecuado para dos o tres jugadores humanos. El carbón es difícil de encontrar - considera crear algunos. Hay oro cerca del punto de partida - lo ves?","maps","../../data/maps/Fellowships.wmf/elemental:11"
"making","fabricar","Our building infrastructure is finished and I spent some days making sure that everybody is working well together. Now, there are other pressing matters. I called Colionder, my personal cook, before me to get his help with sorting some things out.","Nuestros edificios de infraestructura están terminados y he invertido algunos días asegurándome de que todos trabajan juntos. Ahora, hay otros asuntos urgentes. He llamado a Colionder, mi cocinero personal, delante de mí para conseguir su ayuda con la clasificación de algunas cosas.","scenario_atl01.wmf","../../data/campaigns/atl01.wmf/scripting/texts.lua:217"
"making","fabricar","May Satul warm you too, Colionder. Yes, I wondered if there is a way that we could centralize our food production. We lose a lot of productivity because our people are accustomed to making their own food. I feel if we could split responsibilities, it would be better for us all. I want your thoughts on this.","Que Satul te caliente a ti también, Colionder. Si, me preguntaba si hay alguna forma de centralizar nuestra producción de comida. Perdemos mucha productividad porque nuestra gente están acostumbrados a hacer su propia comida. Creo que podemos dividir las responsabilidades, será mejor para todos. Quiero tu opinión sobre ello.","scenario_atl01.wmf","../../data/campaigns/atl01.wmf/scripting/texts.lua:229"
"making","fabricar","But we might find a compromise in between: for me, making bread is a troublesome task. Grinding the blackroots and corn to flour and then baking the bread is tedious and boring; I feel a more industrial approach would be helpful here. I for one would love to just have fresh bread delivered to my house every day.","Pero podríamos encontrar un compromiso entre ellos: para mi, hacer pan es una tarea problemática. Moler la raíz negra y el trigo en harina y después hornear el pan es tedioso y aburrido; Creo que una aproximación más industrial puede ayudarnos. Me encantaría tener una entrega de pan fresco a mi casa cada día.","scenario_atl01.wmf","../../data/campaigns/atl01.wmf/scripting/texts.lua:238"
"making","fabricar","We found one more building of this strange making. We have yet to see any of its builders. But obviously there has been a community on this island before and obviously it was militarized. I have to check on our military status with my generals. I will not allow that a potential enemy will find us unprepared.","Hemos encontrado más edificios de esta extraña fabricación. Aún tenemos que ver alguno de sus constructores. Pero obviamente hubo una comunidad en esta isla antes y evidentemente estaba militarizada. Tengo que comprobar nuestro estado militar con mis generales. No permitiré que un enemigo potencial nos encuentre desprevenidos.","scenario_atl01.wmf","../../data/campaigns/atl01.wmf/scripting/texts.lua:417"
"making","fabricar","It’s nice, and of course a good idea, to build mines, which will give us a more comfortable life, but the people working in the mines are unhappy with the current situation. They have to do hard work and have no time for making their own food.","Es bonito, y por supuesto una buena idea, construir minas, que nos darán una vida confortable, pero la gente trabajando en las minas están infelices con la situación actual. Tienen que trabajar duro y no tienen tiempo de hacer su propia comida. ","scenario_emp02.wmf","../../data/campaigns/emp02.wmf/scripting/texts.lua:215"
"making","fabricar","Sire, we are making good progress towards getting home eventually. But there is one thing I need to talk about:","Señor, estamos haciendo un buen progreso para llegar a casa eventualmente. Pero hay una cosa de la que necesito hablar:","scenario_emp03.wmf","../../data/campaigns/emp03.wmf/scripting/texts.lua:563"
"making","fabricar","After we have managed this, we can start making rations in our tavern.","Después de gestionar eso, podemos comenzar a producir raciones en nuestra taberna.","scenario_emp04.wmf","../../data/campaigns/emp04.wmf/scripting/texts.lua:395"
"making","fabricar","Also, build a well – nobody likes to drink salt water, and it is no good for making clay.","También construye un pozo de agua – a nadie le gusta beber agua salada, y no es buena para hacer arcilla.","scenario_fri01.wmf","../../data/campaigns/fri01.wmf/scripting/texts.lua:172"
"making","fabricar","Chieftain Reebaud, I have more bad news. There are almost no fish in the waters nearby. While we can prepare rations using only fruit or bread, soldier training requires lots of smoked meat or fish. The scraps of meat a reindeer farm drops out as a by-product when making fur aren’t enough.","Caudillo Reebaud, tengo más malas noticias. Ya casi no quedan peces en las aguas cercanas. Aunque podemos preparar raciones usando sólo fruta o pan, el entrenamiento de los soldados requiere mucha carne o pescado ahumado. Las sobras de carne que deja la granja de renos como subproducto de la confección de pieles no son suficientes.","scenario_fri02.wmf","../../data/campaigns/fri02.wmf/scripting/texts.lua:226"
"making","fabricar","Building your economy up and making it work well and grow is the main part of Widelands. But you can’t control the workers directly – they will follow the general conditions you set.","Desarrollar tu economía y hacerla crecer y funcionar bien es lo principal en Widelands. Pero no puedes controlar a los trabajadores directamente – seguirán las condiciones generales que impongas.","scenario_tutorial04_economy.wmf","../../data/campaigns/tutorial04_economy.wmf/scripting/texts.lua:14"
"making","fabricar","Widelands is nearly feature complete and is much fun to play alone and even more in multiplayer with others. Still, there is always more work to be done in all areas. If you are interested in contributing – be it by making graphics, fixing bugs or adding new features, translating the game into your language or creating new maps – get in touch on our homepage.","Widelands tiene casi completas sus características y es muy divertido de jugar
solo y aún más en multijugador con otros. Siempre hay más trabajo por hacer
en todas las áreas. Si estás interesado en contribuir - ya sea haciendo gráficos,
arreglando errores o agregando nuevas funciones, traduciendo el juego en tu
lenguaje o creando mapas - ponte al tanto en nuestra página web.","texts","../../data/txts/README.lua:13"
"making","fabricar","Cassava roots are a special kind of root produced at cassava plantations. The Amazons like their strong taste for making bread and they also feed their tapirs with them.","Las raíces de mandioca son un tipo especial de raíz producida en las plantaciones de mandioca. A las Amazonas les gusta su sabor fuerte para hacer pan y alimentan a sus tapires con ellas.","tribes_encyclopedia","../../data/tribes/initialization/amazons/units.lua:181"
"making","fabricar","Blackroots are a special kind of root produced at blackroot farms and processed in mills. The Atlanteans like their strong taste and use their flour for making bread.","Las raíces negras son un tipo especial de raíz producida en las granjas de raíz negra y procesada en los molinos. A los Atlantes les gusta su sabor fuerte y utilizan su harina para hacer pan.","tribes_encyclopedia","../../data/tribes/initialization/atlanteans/units.lua:543"
"making","fabricar","The Barbarian bakers are best in making this flat and tasty pitta bread. It is made out of wheat and water following a secret recipe. Pitta bread is used in the taverns, inns and big inns to prepare rations, snacks and meals. It is also consumed at training sites (training camp and battle arena).","Los panaderos Bárbaros son mejores haciendo este plano y sabroso pan de pita. Se hace a partir de trigo y agua siguiendo una receta secreta. El pan de pita es usado en tabernas, posadas y grandes posadas para preparar raciones, bocadillos y comidas. Es además consumido en zonas de entrenamiento (campo de entrenamiento y arena de batalla),","tribes_encyclopedia","../../data/tribes/initialization/barbarians/units.lua:205"
"making","fabricar","All weapons require the same time for making, but the consumption of the same raw materials increases from step to step. The last two need gold.","Todas las armas requieren el mismo tiempo de fabricación, pero el consumo de la materia prima aumenta paso a paso. Las últimas dos necesitan oro.","tribes_encyclopedia","../../data/tribes/initialization/barbarians/units.lua:1420"
"making","fabricar","All three weapons take the same time for making, but the required raw materials vary.","Las tres armas tienen el mismo tiempo de fabricación, pero varía la materia prima necesaria.","tribes_encyclopedia","../../data/tribes/initialization/barbarians/units.lua:1439"
"Frisian","frisio","In 1362, the quiet, peaceful life of the inhabitants of the Northern Frisian Islands was disrupted by one of the greatest storm floods in human memory: Saint Marcellus’ Flood. Is it really nothing more than yet another storm, or a sign from the Gods that the Frisian community on the island of Langeness is not wanted here?","En 1362 la tranquila y pacífica vida de los habitantes de las Islas Frisias del Norte fue interrumpida por una de las mayores tormentas en la memoria de la humanidad: la inundación de san Marcelo. ¿Es solamente otra tormenta, o una señal de los Dioses de que la comunidad frisia de la isla de Langeness no es bienvenida aquí?","maps","../../data/campaigns/fri01.wmf/elemental:10"
"Frisian","frisio","The inventor of the Frisian charcoal kiln","El inventor de la fosa de carbonización frisona","tribes_encyclopedia","../../data/tribes/initialization/frisians/units.lua:1663 ../../data/tribes/initialization/frisians/units.lua:1846"
