"glossary_term","glossary_translation","source","target","file","location"
"Old","Viejo","When soldiers train, their old weapons are discarded. They can be turned into metal in a recycling center. Use the weapons in the store to train soldiers and recycle some scrap metal.","Cuando los soldados entrenan sus antiguas armas son descartadas, y pueden ser convertidas en metal en un centro de reciclaje. Usa las armas en el almacén para entrenar soldados y recicla algo de la chatarra.","scenario_fri02.wmf","../../data/campaigns/fri02.wmf/scripting/texts.lua:44"
"Old","Viejo","Now I have an idea: When our soldiers are trained, they are equipped with new swords and the old weapons are discarded. These are unfit to use in battle, so it would not be a waste to smelt down those.","Tengo una idea: Cuando nuestros soldados son entrenados, se les equipa de nuevas espadas y las armas antiguas son descartadas. Éstas no sirven para ser usadas en batalla, por lo que fundirlas no sería un desperdicio.","scenario_fri02.wmf","../../data/campaigns/fri02.wmf/scripting/texts.lua:200"
"Old","Viejo","The barbarian tribe he mentioned is also a threat. I don’t want to share this land with anyone, as sharing only leads to conflicts and battles, as we saw in our old home. We must defeat the barbarians as well.","La tribu bárbara que él mencionó también es una amenaza. No quiero compartir esta isla con nadie, ya que eso sólo lleva a conflictos y batallas, como vimos en nuestro antiguo hogar. También debemos derrotar a los bárbaros.","scenario_fri02.wmf","../../data/campaigns/fri02.wmf/scripting/texts.lua:376"
"Old","Viejo","‘Forming new stone from old with fire and water.’","«Formando nueva piedra desde vieja con fuego y agua.»","tribes_encyclopedia","../../data/tribes/initialization/barbarians/units.lua:1276"
"Old","Viejo","An old Barbarian proverb<br> meaning that you need to take some risks sometimes.","Un antiguo proverbio Bárbaro<br> dice que algunas veces necesitas tomar riesgos.","tribes_encyclopedia","../../data/tribes/initialization/barbarians/units.lua:1411 ../../data/tribes/initialization/barbarians/units.lua:1430"
"Old","Viejo","Recycles old armor and weapon parts that have been discarded by training sites into fur, iron and gold.","Recicla partes de viejas armaduras y armas que han sido descartadas por sitios de entrenamiento, obteniendo piel, hierro y oro.","tribes_encyclopedia","../../data/tribes/initialization/frisians/units.lua:1778"
"Old","Viejo","Watch the replay of an old game","Mirar la repetición de una partida antigua","widelands","../../src/ui_fsmenu/main.cc:455"
"Blackwood","Viga","‘This stronghold made from blackwood and stones will be a hard nut to crack for them.’","'Este baluarte hecho de maderas negras y piedras será un duro desafío para ellos.'","tribes_encyclopedia","../../data/tribes/initialization/barbarians/units.lua:1726"
"Vine Farmer","Viticultor","The vine farmer working at this vineyard has no cleared soil to plant his grapevines.","El granjero que trabaja en esta granja no ha limpiado tierra para plantar sus semillas.","tribes","../../data/tribes/buildings/productionsites/empire/vineyard/init.lua:76"
"Vine Farmer","Viticultor","This basket is needed by the vine farmer for harvesting the grapes. It is produced by the toolsmith.","Esta canasta se necesita por el agricultor de vid para la cosecha de la uva. Se produce en la herrería.","tribes_encyclopedia","../../data/tribes/initialization/empire/units.lua:480"
"Vineyard","Viñedo","The vine farmer working at this vineyard has no cleared soil to plant his grapevines.","El granjero que trabaja en esta granja no ha limpiado tierra para plantar sus semillas.","tribes","../../data/tribes/buildings/productionsites/empire/vineyard/init.lua:76"
"Waterway","Vía acuática","It is not recommended to permit waterway lengths greater than %u","No es recomendable permitir vías acuáticas más largas que %u","widelands","../../src/editor/ui_menus/main_menu_map_options.cc:491"
"Waterway","Vía acuática","Road and waterway details","Detalles de caminos y vías acuáticas","widelands","../../src/map_io/map_saver.cc:256"
"Widelands","Widelands","Compress Widelands data files (maps, replays, and savegames)","Comprimir archivos de datos (mapas, repeticiones y partidas guardadas)","widelands","../../src/ui_fsmenu/options.cc:232"
"Helmet","Yelmo","The helmet is the basic defense of a warrior. It is produced in an armor smithy. In combination with a wooden spear, it is the equipment to fit out young soldiers. Helmets are also used in training camps – together with food – to train soldiers from health level 0 to level 1.","Esta es una lanza avanzada con una punta de acero. Es producida en una armería y usada en un campo de entrenamiento-junto con comida-para entrenar soldados en ataque del nivel 0 al nivel 1.","tribes_encyclopedia","../../data/tribes/initialization/empire/units.lua:559"
"Helmets","Yelmos","To train in the training camp, our soldiers need food like in the battle arena, but no strong beer. Instead, they need different axes for attack training and helmets for health training.","Para entrenar en el campo de entrenamiento, nuestros soldados necesitan comida como en la arena de batalla, pero no cerveza negra. En cambio necesitan diferentes hachas para entrenar el ataque y cascos para entrenar la vida.","scenario_tutorial02_warfare.wmf","../../data/campaigns/tutorial02_warfare.wmf/scripting/texts.lua:123"
"Helmets","Yelmos","Forges helmets for soldiers.","Funde cascos para los soldados.","tribes_encyclopedia","../../data/tribes/initialization/barbarians/units.lua:783"
"Helmets","Yelmos","The helmet is the basic defense of a warrior. It is produced in an armor smithy. In combination with a wooden spear, it is the equipment to fit out young soldiers. Helmets are also used in training camps – together with food – to train soldiers from health level 0 to level 1.","Esta es una lanza avanzada con una punta de acero. Es producida en una armería y usada en un campo de entrenamiento-junto con comida-para entrenar soldados en ataque del nivel 0 al nivel 1.","tribes_encyclopedia","../../data/tribes/initialization/empire/units.lua:559"
"Building Space","Zona de Construcción","The mountains have an abundance of flat ground. Unfortunately, most of it is vertical – use the little building space you have wisely. A fortress at the mouth of a narrow mountain pass can be a formidable obstacle to an enemy army – use the terrain to your advantage. Chop all trees and expand wherever you can – it’s the only way to find all the precious farm spaces.","Las montañas abundan en suelo plano. Desafortunadamente, la mayor parte es vertical – usa las escasas zonas de construcción sabiamente. Una fortaleza en la boca de un estrecho desfiladero montañoso puede ser un obstáculo formidable para un ejército enemigo – usa el terreno a tu favor. Tala todos los árboles y expándete donde puedas – es el único modo de encontrar las preciadas zonas para granjas.","maps","../../data/maps/Dolomites.wmf/elemental:11"
"Building Space","Zona de Construcción","I think we should try to reveal some building space by cutting up all the rocks in a quarry.","Creo que deberíamos tratar de revelar algún espacio de construcción cortando todas las rocas en una cantera.","scenario_emp03.wmf","../../data/campaigns/emp03.wmf/scripting/texts.lua:275"
"Building Space","Zona de Construcción","Click on a small, medium or big building space, then select the building from the small buildings tab.","Haz clic en un espacio de construcción pequeño, mediano o grande, luego selecciona el edificio en la pestaña de edificios pequeños.","training_wheels","../../data/scripting/training_wheels/logs.lua:115 ../../data/scripting/training_wheels/rocks.lua:115"
"Building Space","Zona de Construcción","Click on a medium or big building space, then select the building from the medium buildings tab.","Haz clic en un espacio de construcción mediano o grande, luego selecciona el edificio en la pestaña de edificios medianos.","training_wheels","../../data/scripting/training_wheels/logs.lua:117 ../../data/scripting/training_wheels/rocks.lua:117"
"Building Space","Zona de Construcción","Click on a big building space, then select the building from the big buildings tab.","Haz clic en un espacio de construcción grande, luego selecciona el edificio en la pestaña de edificios grandes.","training_wheels","../../data/scripting/training_wheels/logs.lua:119 ../../data/scripting/training_wheels/rocks.lua:119"
"nickname","alias","You can use ‘/me’ at the beginning of a chatmessage: ‘/me is tired’ will be printed as ‘-> Nickname is tired’.","Puedes utilizar ‘/me’ al inicio de un mensaje de chat: ‘/me está cansado’ se mostrará como ‘-> Nickname está cansado’.","texts","../../data/txts/tips/multiplayer.lua:8"
"nickname","alias","Enter a valid nickname. This value may contain only English letters, numbers, and @ . + - _ characters.","Ingresa un apodo válido. Éste sólo puede contener letras en inglés, números, y los caracteres @ . + - _.","widelands","../../src/ui_fsmenu/login_box.cc:207"
"nickname","alias","Enter a valid nickname. This value may contain only English letters, numbers, and @ . + - _ characters and must not be "team".","Ingresa un apodo válido. Éste sólo puede contener letras en inglés, números, y los caracteres @ . + - _ y no debe ser "team".","widelands","../../src/ui_fsmenu/netsetup_lan.cc:280"
"food","alimento","Defeat Jomo. He is taking care of the soldiers’ food supply.","Derrota a Jomo. Se encarga del suministro de comida de los soldados.","map_the_green_plateau.wmf","../../data/maps/SP_Scenarios/The_Green_Plateau.wmf/scripting/texts.lua:43"
"food","alimento","It is amazing how far one can see from the highest tower of the castle. We can watch the whole island. So now I wonder why Lanissa did not see us and thus did not prepare. Be that as it may, some things will never come to the light of day. The only important issue at the moment are the opposing troops still left. We have discovered enemy positions held by Erwyn to the north and east of the castle. He is known to be a strong warlord and surely commands the strongest warriors. In the south, we caught sight of some food infrastructures guarded by Jomo – a younger warlord – and we should take care of those infrastructures so we can cut off our enemies’ food supply.","Es impresionante lo lejos que uno puede ver desde la torre más alta del castillo. Podemos ver toda la isla. Así que ahora me pregunto por qué Lanissa no nos vio y se preparó. Siendo eso así, nunca se conocerá la verdad de algunas cosas. El único problema importante son las tropas opositoras que aún quedan. Hemos descubierto posiciones enemigas mantenidas por Erwyn al norte y al este del castillo. Es conocido por ser un fuerte caudillo y comandar a las mejores tropas. Al sur, pudimos ver algunas infraestructuras de comida, vigiladas por Jomo – un caudillo más joven – y deberíamos hacernos cargo de dichas infraestructuras para así poder cortar el suministro alimenticio de los enemigos.","map_the_green_plateau.wmf","../../data/maps/SP_Scenarios/The_Green_Plateau.wmf/scripting/texts.lua:79"
"food","alimento","The river has always provided food and communication. This time, eight empires will fight for control over this land.","El río siempre ha proveído comida y comunicación. Esta vez, ocho imperios lucharán por controlar esta tierra.","maps","../../data/maps/The_Nile.wmf/elemental:10"
"food","alimento","Establish a solid food production","Establece una solida producción de comida","scenario_atl01.wmf","../../data/campaigns/atl01.wmf/scripting/texts.lua:52"
"food","alimento","Food is very important for mines and military training areas. Establish a well working food environment by building at least one farm, one blackroot farm and a mill. The two kinds of flour together with water from a well will be baked into bread in a bakery, so build a bakery and a well, too.","La comida es muy importante para minas y zonas de entrenamiento militar. Establece un buen ambiente de producción de comida construyendo al menos una granja, una granja de raíz negra y un molino. Los dos tipos de harina junto con agua de un pozo serán horneados en pan en una panadería, así que construye una panadería y un pozo también.","scenario_atl01.wmf","../../data/campaigns/atl01.wmf/scripting/texts.lua:55"
"food","alimento","The other two important food wares are smoked fish and smoked meat. Raw meat is delivered from a hunter. A fisher gets the fish out of the sea while a fish breeder makes sure that a school of fish does not go extinct by breeding more. Make sure that there are always fish left, otherwise the fish breeder won’t be able to breed new ones. The smoking happens in a smokery, you will need at least two of those.","Las otras dos mercancías alimenticias importantes son pescado ahumado y carne ahumada. La carne cruda es entregada por un cazador. Un pescador consigue pescado del mar mientras que un piscicultor se asegura que un banco de peces no se extinga criando más. Asegúrate de que siempre queden peces, de otra forma, el piscicultor no podrá criar nuevos. El ahumado ocurre en un ahumadero, necesitarás al menos dos de ellos.","scenario_atl01.wmf","../../data/campaigns/atl01.wmf/scripting/texts.lua:56"
"food","alimento","May Satul warm you too, Colionder. Yes, I wondered if there is a way that we could centralize our food production. We lose a lot of productivity because our people are accustomed to making their own food. I feel if we could split responsibilities, it would be better for us all. I want your thoughts on this.","Que Satul te caliente a ti también, Colionder. Si, me preguntaba si hay alguna forma de centralizar nuestra producción de comida. Perdemos mucha productividad porque nuestra gente están acostumbrados a hacer su propia comida. Creo que podemos dividir las responsabilidades, será mejor para todos. Quiero tu opinión sobre ello.","scenario_atl01.wmf","../../data/campaigns/atl01.wmf/scripting/texts.lua:229"
"food","alimento","Ahh, but I think this is impossible to change. The preparing and eating of food is something deeply ingrained in us Atlanteans – it is a ceremony that we just need for our well-being. So I guess we cannot take this away from the individuals completely.","Ahh, pero creo que es imposible de cambiar. La preparación y el consumo de comida es algo profundamente arraigado en nuestros Atlantes - es una ceremonia que necesitamos para nuestro bienestar. Así que supongo que no podemos apartar eso de los individuos por completo.","scenario_atl01.wmf","../../data/campaigns/atl01.wmf/scripting/texts.lua:235"
"food","alimento","Other ways to produce food – different kinds of food – are fishers and farms. The wheat of the farms has to be processed with water in a bakery before it becomes edible. You can obtain water by building a well. For the best productivity, build it on a spot where your geologists have found a water source.","Otras formas de producir comida – diferentes tipos de comida – son los pescadores y granjeros. El trigo de las granjas tiene que ser procesado con pan en una panadería antes de ser comestibles. Para la mejora productividad, construye un pozo en donde tus geólogos encuentren fuentes de agua.","scenario_bar01.wmf","../../data/campaigns/bar01.wmf/scripting/texts.lua:71"
"food","alimento","Such buildings usually have greater demands than the basic kind of that building – for instance, deep mines need snacks instead of rations. You will have to enhance your tavern to an inn in order to produce snacks out of pitta bread AND a second kind of food (meat or fish) AND beer.","Tales edificios a menudo tienen más grandes demandas que los de tipo básicos de ese edificio - por ejemplo, las minas profundas necesitan bocadillos en lugar de raciones. Tendrás que mejorar tu taberna a una posada para producir bocadillos a partir del pan de pita Y un segundo tipo de comida (carne o pescado) Y cerveza.","scenario_bar01.wmf","../../data/campaigns/bar01.wmf/scripting/texts.lua:91"
"food","alimento","You may of course enhance all mines to deep mines instantly given you have the workers – bigger mines work a bit faster, smaller mines need cheaper food. It’s up to you which strategy you prefer.","Es posible, por supuesto, mejorar todas las minas a minas profundas instantáneamente ya que tienes los trabajadores - grandes minas trabajan un poco más rápido, minas pequeñas necesitan comida barata. Está en ti que estrategia prefieres.","scenario_bar01.wmf","../../data/campaigns/bar01.wmf/scripting/texts.lua:92"
"food","alimento","So now that we have both the mines and the food to sustain them, we should bring what our brave miners gain for us into a more useful state. The iron ore has to be melted into iron so that it is ready to be forged into whatever we want. And we need the coal to keep the smelter’s ovens burning.","Entonces ahora que tenemos tanto las minas y el sustento alimenticio, deberíamos traer lo que nuestros bravos mineros ganan para nosotros en un estado más útil. El minera de hierro tiene que ser fundido en hierro así estará listo para ser forjado en lo que queramos. Y necesitamos el carbón para mantener los hornos del forjador sigan calientes.","scenario_bar01.wmf","../../data/campaigns/bar01.wmf/scripting/texts.lua:419"
"food","alimento","Build up a basic food economy to provide your people with food.","Levanta una economía de comida básica para proveer a tu gente con comida.","scenario_bar02.wmf","../../data/campaigns/bar02.wmf/scripting/texts.lua:35"
"food","alimento","Furthermore, his flight brought us a great benefit: all year, Kalitath was so busy fighting that he did not even care to store enough food for all his men. Now that he has fled, their hunger has caused some of his younger followers to desert. This group holds a strong fortification on the main ring.","Por otra parte, su huida nos trajo una gran ventaja: todo el año, Kalitath estuvo tan ocupado luchando que ni siquiera se preocupó de almacenar suficiente comida para todos sus hombres. Ahora que ha huido, el hambre ha llevado a desertar a algunos de sus seguidores más jóvenes. Este grupo tiene una fuerte fortificación en el anillo principal.","scenario_bar02.wmf","../../data/campaigns/bar02.wmf/scripting/texts.lua:223"
"food","alimento","Boldreth is right! We don’t have enough food to survive a long, cold winter. We should start building a well, a fisher’s and a hunter’s hut. And if we find enough space, we should as well build up a farm and a bakery! One of our farmers seems to be very clever – he already got some crops to grow in this cold soil.","Boldreth tiene razón! No tenemos suficiente comida para sobrevivir a un largo y frío invierno. Debemos empezar a construir un pozo, una cabaña de pescador y una de cazador. Y si tenemos espacio suficiente, también debemos construir una granja y una panadería! Uno de nuestros agricultores parece ser muy inteligente - ya tiene algunos cultivos creciendo en este suelo frío.","scenario_bar02.wmf","../../data/campaigns/bar02.wmf/scripting/texts.lua:242"
"food","alimento","Our geologists found a lot more deposits of iron ore, coal and even gold. We should enhance our current mines as soon as our miners are more experienced. We should build up some more mines, a bigger food infrastructure to always supply our men with sufficient food and a further processing economy. But that’s still not everything – most of our soldiers are quite young and neither have a good weapon nor are they well trained. We should build up training sites to prepare them for their future tasks.","Nuestros geólogos encontrar muchos depósitos de hierro, carbón e incluso oro. Debemos mejorar nuestras minas en cuanto nuestros mineros sean más experimentados. Debemos construir algunas minas más, una infraestructura alimenticia más grande para siempre suministrar a nuestros hombres con suficiente comida y una economía de procesado superior. Pero sigue sin ser todo - la mayoría de nuestros soldados son jovenes y ni tienen un buen arma ni están entrenados. Debemos construir zonas de entrenamiento para prepararlos.","scenario_bar02.wmf","../../data/campaigns/bar02.wmf/scripting/texts.lua:318"
"food","alimento","Build a tavern to produce some food to sustain our miners.","Construye una taberna para producir  comida para nutrir nuestros mineros.","scenario_emp02.wmf","../../data/campaigns/emp02.wmf/scripting/texts.lua:73"
"food","alimento","Of course this means you will need more resources for preparing this food – like fish, meat or bread.","Por supuesto esto significa que necesitas más recursos para preparar comida – como pescado, carne o pan.","scenario_emp02.wmf","../../data/campaigns/emp02.wmf/scripting/texts.lua:74"
"food","alimento","We need a lot of food, a lot of iron and a lot of gold to do so. So, we have lots of challenges to cope with.","Necesitamos mucha comida, mucho hierro y mucho oro para hacerlo. Por lo tanto, tenemos un montón de desafíos para hacer frente.","scenario_emp03.wmf","../../data/campaigns/emp03.wmf/scripting/texts.lua:602"
"food","alimento","To train a soldier to the highest level in one site, consider stopping the trainingsite until it is fully equipped with all food and weapons needed.","Para entrenar a un soldado al más alto nivel en un sitio, considere detener el lugar de entrenamiento hasta que esté completamente equipado con toda la comida y las armas necesarias.","scenario_emp04.wmf","../../data/campaigns/emp04.wmf/scripting/texts.lua:134"
"food","alimento","Chieftain Reebaud! I bring bad news. The miners are working so hard that they have no time to prepare their own food. They demand to be supplied with it.","¡Caudillo Reebaud! Traigo malas noticias. Los mineros trabajan tan duro que no tienen tiempo para prepararse su propia comida, y demandan que se les suministre.","scenario_fri01.wmf","../../data/campaigns/fri01.wmf/scripting/texts.lua:217"
"food","alimento","A drinking hall needs better food. Build a bakery, a brewery, and two or three farms to start growing barley. Keep in mind that barley grows very slowly; therefore, these few farms won’t suffice when we actually need the bread and beer. We should keep expanding quickly to have more space for farming.","Un hostal necesita mejor comida. Construye una panadería, una cervecería, y dos o tres granjas para comenzar a cultivar cebada. Recuerda que la cebada crece muy lentamente, por lo tanto estas nuevas granjas no serán suficientes cuando realmente necesitemos el pan y la cerveza. Deberíamos seguir expandiéndonos con rapidez para tener más espacio de cultivo.","scenario_fri01.wmf","../../data/campaigns/fri01.wmf/scripting/texts.lua:236"
"food","alimento","To train in the training camp, our soldiers need food like in the battle arena, but no strong beer. Instead, they need different axes for attack training and helmets for health training.","Para entrenar en el campo de entrenamiento, nuestros soldados necesitan comida como en la arena de batalla, pero no cerveza negra. En cambio necesitan diferentes hachas para entrenar el ataque y cascos para entrenar la vida.","scenario_tutorial02_warfare.wmf","../../data/campaigns/tutorial02_warfare.wmf/scripting/texts.lua:123"
"food","alimento","When provided with food, he will walk randomly around the area. You should follow his movement before fog of war hides what he saw.","Cuando tiene alimentación caminará aleatoriamente por el área. Deberías seguir sus movimientos antes que la niebla de guerra oculte lo que vio.","scenario_tutorial02_warfare.wmf","../../data/campaigns/tutorial02_warfare.wmf/scripting/texts.lua:158"
"food","alimento","Here in the northern part, you only have a goldmine and a warehouse. While the miners are supplied well with food, there is no way to transport the gold ore to our smelting works in the southern part.","Aquí en la parte norte solo tienes una mina de oro y un almacén. Pese a que los mineros están bien surtidos de comida, no hay camino para transportar el mineral de oro a nuestra forja en la parte sur.","scenario_tutorial03_seafaring.wmf","../../data/campaigns/tutorial03_seafaring.wmf/scripting/texts.lua:26"
"food","alimento","This spear has a stone spike. It is produced in a stone workshop and used in a warriors’ gathering – together with food – to train soldiers from attack level 0 to attack level 1.","Esta lanza tiene una punta de piedra. Es producida en un taller de piedra y usada en una asamblea de las guerreras – junto con comida – para entrenar guerreras en ataque del nivel 0 al 1.","tribes_encyclopedia","../../data/tribes/initialization/amazons/units.lua:425"
"food","alimento","This is a hardened spear with a stone tip. It is produced in a stone workshop and used in a warriors’ gathering – together with food – to train soldiers from attack level 1 to level 2.","Esta es una lanza endurecida con una punta de piedra. Es producida en un taller de piedra y usada en una asamblea de las guerreras – junto con comida – para entrenar guerreras en ataque del nivel 1 al 2.","tribes_encyclopedia","../../data/tribes/initialization/amazons/units.lua:436"
"food","alimento","Breeds fish and game to renew food resources.","Cría peces y animales cazado para regenerar los recursos de alimentación.","tribes_encyclopedia","../../data/tribes/initialization/amazons/units.lua:1338"
