"glossary_term","glossary_translation","source","target","file","location"
"Granite","Granito","You will usually start the game with one headquarters. This is the big building with the blue flag in front of it. The headquarters stores wares, workers and soldiers. Some wares are needed for building houses, others for making other wares. Obviously, the initial wares will not last forever, so you must make sure to replenish them. The most important wares in the early game are the basic construction wares: logs and granite. Let’s make sure that we do not run out of logs. For this, we need a lumberjack and a hut for him to stay in.","Por lo general, inicias el juego con una sede. Es el gran edificio con la bandera azul en frente. La sede almacena mercancías, trabajadores y soldados. Se necesitan algunas mercancías para la construcción de casas, otras para fabricar otras mercancías. Obviamente, las mercancías iniciales no durarán para siempre, por lo que debes asegurarte de rellenarlas. Las mercancías más importantes al principio del juego son las mercancías básicas de construcción: troncos y piedra en bruto. Vamos a asegurarnos de que no nos quedemos sin troncos. Para esto, necesitamos un leñador y una cabaña para que viva en ella.","scenario_tutorial01_basic_control.wmf","../../data/campaigns/tutorial01_basic_control.wmf/scripting/texts.lua:65"
"Aqua Farm","Granja Marina","Fish are maturing in this pond. A fisher working from an aqua farm will be able to catch them when they are bigger.","Los peces están creciendo en este estanque. Un pescador que trabaje en una granja acuícola podrá atraparlos cuando sean más grandes.","tribes_encyclopedia","../../data/tribes/initialization/frisians/units.lua:1212"
"Aqua Farm","Granja Marina","Fish are living in this pond. A fisher working from an aqua farm can catch them as food.","Los peces viven en este estanque. Un pescador que trabaja en una granja acuícola puede capturarlos como alimento.","tribes_encyclopedia","../../data/tribes/initialization/frisians/units.lua:1219"
"Cocoa Farmer","Granjera de Cacao","Cocoa beans are gathered from cocoa trees by a cocoa farmer. They are used for producing chocolate.","Las almendras de cacao son recogidas por granjeras de cacao en árboles de cacao. Se utilizan para fabricar chocolate.","tribes_encyclopedia","../../data/tribes/initialization/amazons/units.lua:191"
"Farmer","Granjero","I think a stock of 50 sheaves of wheat would be enough for starters. We do not have a target quantity for wheat, because the farmer does not need other wares to produce it. All we have to do is watch our stock of wheat grow.","Creo que una reserva de 50 gavillas de trigo sería suficiente para empezar. No tenemos una cantidad objetivo para el trigo, porque el agricultor no necesita otros productos para producirlo. Todo lo que tenemos que hacer es ver crecer nuestro stock de trigo.","scenario_emp03.wmf","../../data/campaigns/emp03.wmf/scripting/texts.lua:378"
"Farmer","Granjero","The farmer working at this cassava plantation has no cleared soil to plant her seeds.","La granjera trabajando en esta plantación de mandioca no tiene tierra despejada para plantar sus semillas.","tribes","../../data/tribes/buildings/productionsites/amazons/cassava_plantation/init.lua:68"
"Blackroot Farmer","Granjero de Raíz Negra","The blackroot farmer working at this blackroot farm has no cleared soil to plant his seeds.","El granjero que trabaja en esta granja de raíz negra no ha limpiado tierra para plantar sus semillas.","tribes","../../data/tribes/buildings/productionsites/atlanteans/blackroot_farm/init.lua:71"
"Gulf of Perl","Gulf of Perl","Still, I saw no way that I could erase my shame without fighting against these Barbarians. So, I left Fremil by boat to find a new world and a new life for myself, somewhere in the south. Now I am sailing on the Gulf of Perl with my family, some of my friends and a few of my best warriors.","Aún así, no veo forma de borrar mi vergüenza sin luchar contra esos Bárbaros. Entonces, dejé Fremil en barco para encontrar un nuevo mundo y una nueva vida por mi cuenta, algún lugar en el sur. Ahora estoy navegando en el Golfo de Perl con mi familia, algunos de mis amigos y unos pocos de mis mejores guerreros.","scenario_emp01.wmf","../../data/campaigns/emp01.wmf/scripting/texts.lua:90"
"Gulf of Perl","Gulf of Perl","It seems as if sailing on the Gulf of Perl was one of our biggest mistakes. Nature was against us and drove us into a dark, wild storm. I really don’t know how many hours have passed since the waves rose higher than our boat, but still it would be suicide to go outside.","Parece como si la navegación en el Golfo de Perl fuera uno de nuestros mayores errores. La naturaleza estaba en contra de nosotros y nos llevó a una oscura y salvaje tormenta. Realmente no sé cuántas horas han pasado desde que las olas se elevaron más alto que nuestro barco, pero aún así sería un suicidio salir.","scenario_emp01.wmf","../../data/campaigns/emp01.wmf/scripting/texts.lua:99"
"Cornmeal","Harina de Maíz","This corn is processed in the mill into fine cornmeal that every Atlantean baker needs for a good bread. Also horse and spider farms need to be provided with corn.","Este maíz es procesado en el molino en harina fina de maíz que todo panadero Atlante necesita para un buen pan. Los establos y granjas de arañas también necesitan maíz.","tribes_encyclopedia","../../data/tribes/initialization/atlanteans/units.lua:526"
"Blacksmith","Herrero","The blacksmith needs %s on average to produce one tool.","La herrería necesita %s de rendimiento para producir una herramienta.","tribes_encyclopedia","../../data/tribes/initialization/frisians/units.lua:1791"
"Master Blacksmith","Herrero Maestro","A master blacksmith refusing to forge anything but the most sophisticated helmets and weapons","Un maestro herrero rehusándose a forjar algo que no sean los yelmos y armas más sofisticados","tribes_encyclopedia","../../data/tribes/initialization/frisians/units.lua:1811"
"Gold Thread","Hilo de Oro","Golden tabards are produced in Atlantean weaving mills out of gold thread. They are used in the labyrinth – together with food – to train soldiers from health level 0 to level 1.","Los tabardos dorados son producidos en los telares Atlantes a partir de hilos de oro. Son usados en el laberinto - junto con comida - para entrenar soldados en vida del nivel 0 al 1.","tribes_encyclopedia","../../data/tribes/initialization/atlanteans/units.lua:871"
"Gold Thread","Hilo de Oro","Spins gold thread out of gold.","Devana hilos de oro del oro.","tribes_encyclopedia","../../data/tribes/initialization/atlanteans/units.lua:1566"
"Empire","Imperio","The message was addressed to me, begging me to come back to Fremil. It says that the Empire is at war with the Barbarians. They were attacked from the north by the tribe that I was forbidden to attack. It is clear to me what I must do…","El mensaje fue dirigido a mi, rogándome que regrese a Fremil. Decía que el Emperador estaba en guerra con los Bárbaros. Fueron atacados desde el norte por la tribu que se me prohibió atacar. Está claro para mí lo que tengo que hacer...","scenario_emp02.wmf","../../data/campaigns/emp02.wmf/scripting/texts.lua:288"
"Empire","Imperio","Flour is produced by the mill out of wheat and is needed in the bakery to produce the tasty Empire bread.","La harina se produce en el molino a base de trigo y se necesita en la panadería para producir el sabroso pan Imperial.","tribes_encyclopedia","../../data/tribes/initialization/empire/units.lua:217"
"Empire","Imperio","The fires of the Empire smelting works, armor smithies and weapon smithies are usually fed with coal.","El fuego de las forjas, talleres de armadura y armerías Imperiales, normalmente es alimentado con carbón.","tribes_encyclopedia","../../data/tribes/initialization/empire/units.lua:306"
"Empire","Imperio","Basic armor for Empire soldiers. It is produced in the armor smithy and used in the training camp – together with food – to train soldiers from health level 1 to level 2.","Esta es una lanza avanzada con una punta de acero. Es producida en una armería y usada en un campo de entrenamiento-junto con comida-para entrenar soldados en ataque del nivel 1 al nivel 2.","tribes_encyclopedia","../../data/tribes/initialization/empire/units.lua:568"
"Empire","Imperio","The chain armor is a medium armor for Empire soldiers. It is produced in an armor smithy and used in a training camp – together with food – to train soldiers from health level 2 to level 3.","Esta es una lanza avanzada con una punta de acero. Es producida en una armería y usada en un campo de entrenamiento-junto con comida-para entrenar soldados en ataque del nivel 2 al nivel 3.","tribes_encyclopedia","../../data/tribes/initialization/empire/units.lua:577"
"Immovable","Inamovible","Mark this immovable for timely removal by a suited worker","Marcar este objeto inmóvil como movible temporalmente por un trabajador habilitado ","widelands","../../src/wui/fieldaction.cc:387"
"game","Juego","Some say that impenetrable lands to the far north scared away even the most courageous settlers and the bravest of the brave warriors. Big and old forests, full of big and predatory game, cut across by wetlands and hills were shrouded in mystery. The ones who had managed to come back mentioned tremendous buildings, decorated with carvings and gold from majestic mountain ranges somewhere amongst the wilderness. Dozens of years after only some crumbly ruins remain of these good old times, covered with moss and trees. Their shapes give only an idea about the craftsmanship of ancient constructors. Nobody knows why they (have) disappeared. Nobody knows why. People say that now nothing is blocking the road to wealth. But many will die pulled apart by wolves, engulfed by swamp… encircled by hostile tribes.","Algunos dicen que las tierras impenetrables del lejano norte ahuyentan incluso a los colonos más corajudos y al más valiente de los guerreros valientes. Grandes y antiguos bosques, llenos de grandes depredadores, cortado por los humedales y las colinas estaban envueltas en el misterio. Los que habían conseguido volver mencionaron edificios enormes, decorados con tallados y el oro de majestuosas montañas encadenadas en algún lugar entre el desierto. Decenas de años después sólo quedan algunas ruinas desmenuzables de estos buenos viejos tiempos, cubiertas de musgo y árboles. Sus formas sólo dan una idea acerca de la artesanía de los constructores antiguos. Nadie sabe por qué desaparecieron. Nadie sabe por qué. La gente dice que ahora no hay nada bloqueando el camino hacia la riqueza. Sin embargo, muchos murieron separados por los lobos, rodeado por pantanos ... rodeados por tribus hostiles. ()","maps","../../data/maps/The_Far_North.wmf/elemental:10"
"game","Juego","I am sorry, but will I have to tear this down again. We might need the space here later on. If I am too slow for you, you might want to play a real game and just find everything out for yourself. Otherwise, please bear with me, I am not the youngest and quickest anymore.","Lo siento, pero tendré que demoler esto nuevamente. Es posible que necesitemos el espacio más adelante. Si soy demasiado lento para tí, es posible que desees jugar una partida real y aprender todo por tí mismo. De lo contrario, por favor ten paciencia conmigo, ya no soy tan joven y rápido como antes.","scenario_tutorial01_basic_control.wmf","../../data/campaigns/tutorial01_basic_control.wmf/scripting/texts.lua:12"
"game","Juego","The message window is central to fully controlling your tribe’s fortune. However, you will get a lot of messages in a real game. To keep your head straight, you should try to keep the inbox empty.","La ventana de mensajes es clave para controlar completamente la suerte de tu tribu. Sin embargo, en una partida real recibirás un montón de mensajes. Para mantener centrada tu mente centrada, deberías intentar mantener vacía tu bandeja de entrada.","scenario_tutorial01_basic_control.wmf","../../data/campaigns/tutorial01_basic_control.wmf/scripting/texts.lua:491"
"game","Juego","Well done! Let’s see how messages work in a real game, shall we? For this, I’ll take all rocks away from the poor stonemasons in the quarries. They will then send a message each that they can’t find any in their work areas the next time they try to do some work.","¡Bien hecho! Veamos cómo funcionan los mensajes en una partida real, ¿de acuerdo? Para esto voy a quitarles todas las rocas a los pobres mamposteros en las canteras. La próxima vez que intenten salir a trabajar, ellos enviarán entonces un mensaje cada uno indicando que no pueden encontrar más rocas en su área de trabajo.","scenario_tutorial01_basic_control.wmf","../../data/campaigns/tutorial01_basic_control.wmf/scripting/texts.lua:531"
"game","Juego","However, since you now know how to control Widelands, you can also start a game (or continue this one) and discover more by yourself.","Sin embargo, dado que ya conoces cómo se controla Widelands, también puedes comenzar una partida (o continuar con ésta) y descubrir más por tí mismo.","scenario_tutorial01_basic_control.wmf","../../data/campaigns/tutorial01_basic_control.wmf/scripting/texts.lua:603"
"game","Juego","I’ve set up a small village that contains the most important buildings. You also have enough wares, so you do not have to take care of your weapons production. In a real game, you will not have this luxury.","He levantado un pequeño pueblo que contiene los edificios más importantes. También tienes suficientes mercancías, así que no tienes que preocuparte de tu producción de armas. En una partida real no disfrutarás de este lujo.","scenario_tutorial02_warfare.wmf","../../data/campaigns/tutorial02_warfare.wmf/scripting/texts.lua:30"
"game","Juego","One of these training sites is the battle arena. It is a big and expensive building, and it trains soldiers in evade. Since soldiers get very hungry during their workout, this building needs a lot of food and strong beer. In a real game, you should have a good infrastructure before you build it.","Una de estos sitios de entrenamiento es la arena de batalla. Es un edificio grande y costoso, y entrena a los soldados en la evasión. Dado que los soldados acaban muy hambrientos después del entrenamiento, este edificio necesita un montón de alimento y cerveza fuerte. En una partida real deberías tener una buena infraestructura de producción de alimento antes de construirlo.","scenario_tutorial02_warfare.wmf","../../data/campaigns/tutorial02_warfare.wmf/scripting/texts.lua:66"
"game","Juego","But a war is expensive, and not always the path leading to the goal. When setting up a new game, you can also choose peaceful win conditions. You should definitely try them out, they’re worth it.","Pero una guerra es cara, y no siempre es el camino a la meta. Cuando estés ajustando una nueva partida siempre puedes elegir condiciones de victoria pacíficas. Si duda deberías probarlas, merecen la pena.","scenario_tutorial02_warfare.wmf","../../data/campaigns/tutorial02_warfare.wmf/scripting/texts.lua:283"
"game","Juego","You can see information about the selected map or savegame on the right-hand side. A button next to the map name allows the host to change to a different map. Furthermore, the host is able to set a specific win condition, and finally can start the game as soon as all players are set up.","En el lado derecho puedes ver información acerca del mapa o partida guardada seleccionados. Un botón junto al nombre del mapa permite al anfitrión cambiar a un mapa diferente. Adicionalmente, el anfitrión puede establecer una condición de victoria específica, y finalmente iniciar la partida en cuanto todos los jugadores estén preparados.","texts","../../data/txts/help/multiplayer_help.lua:25"
"game","Juego","The hunter working out of this hunter’s house can’t find any game in his work area.","El transportista que trabaja en este pozo no puede encontrar agua en su área de trabajo.","tribes","../../data/tribes/buildings/productionsites/atlanteans/hunters_house/init.lua:52"
"game","Juego","The hunter working out of this hunter’s house can’t find any game in his work area.","El transportista que trabaja en este pozo no puede encontrar agua en su área de trabajo.","tribes","../../data/tribes/buildings/productionsites/empire/hunters_house/init.lua:55"
"game","Juego","‘Fresh from the countryside: Bread, fish or game to go.’","‘Fresco del campesino: pan, pescado o venado para llevar.’","tribes_encyclopedia","../../data/tribes/initialization/barbarians/units.lua:1331"
"game","Juego","/kick <user|game> - Remove the given user or game from the metaserver","/kick <user|game> - Expulsa al usuario o la partida indicados del servidor","widelands","../../src/network/internet_gaming.cc:918"
"game","Juego","The game no longer exists, maybe it has just been closed.","La partida ya no existe, puede que haya sido cerrada.","widelands","../../src/network/internet_gaming_messages.cc:44"
"game","Juego","Server sent a SYNCREQUEST even though no game is running.","El servidor ha enviado un SYNCREQUEST aunque ninguna partida se está jugando.","widelands","../../src/network/network_gaming_messages.cc:131"
"game","Juego","Received a PLAYERCOMMAND even though no game is running.","Se recibió un COMANDODEJUGADOR aunque ninguna partida se está jugando.","widelands","../../src/network/network_gaming_messages.cc:132"
"game","Juego","Client simulates beyond the game time allowed by the host.","La simulación del cliente se ejecuta más allá del tiempo permitido por el anfitrión.","widelands","../../src/network/network_gaming_messages.cc:144"
"game","Juego","The game has already started.","La partida ya ha comenzado.","widelands","../../src/network/network_gaming_messages.cc:146"
"game","Juego","Client sent TIME command even though game is not running.","El cliente envió un comando TIME aunque la partida aún no se está ejecutando.","widelands","../../src/network/network_gaming_messages.cc:150"
"game","Juego","The game %s is already running. Please choose a different name.","La partida %s ya se está ejecutando. Por favor escoge un nombre diferente.","widelands","../../src/ui_fsmenu/internet_lobby.cc:417"
"game","Juego","The game is a saved game – the win condition was set before.","Esta es una partida guardada – la condición de victoria ya fue establecida.","widelands","../../src/ui_fsmenu/launch_game.cc:247"
"game","Juego","Saved Game is Directory","Partida Guardada es un Directorio","widelands","../../src/ui_fsmenu/launch_mpg.cc:189"
"game","Juego","Widelands tried to start a game with a file that could not be found at the given path.
The file was: %s
If this happens in a network game, the host might have selected a file that you do not own. Normally, such a file should be sent from the host to you, but perhaps the transfer was not yet finished!?!","Widelands intentó iniciar una partida con un archivo que no pudo encontrarse en la ruta indicada.
El archivo era: %s
Si esto sucede en una partida en red, el anfitrión puede haber seleccionado un archivo que no posees. Normalmente un archivo así te lo debería enviar el anfitrión, ¿puede ser que la descarga aún no haya finalizado?","widelands","../../src/ui_fsmenu/launch_mpg.cc:210 ../../src/ui_fsmenu/launch_spg.cc:127"
"game","Juego","Multiplayer Game Setup","Configuración de Partida Multijugador","widelands","../../src/ui_fsmenu/launch_mpg.cc:420"
"game","Juego","Online Game Settings","Configuración de Partidas en Línea","widelands","../../src/ui_fsmenu/login_box.cc:37 ../../src/ui_fsmenu/main.cc:387"
"game","Juego","Save game automatically every:","Guardado automático cada:","widelands","../../src/ui_fsmenu/options.cc:212"
"game","Juego","Exit Game Confirmation","Confirmación de Salida","widelands","../../src/wui/game_exit_confirm_box.cc:27"
"game","Juego","The date this game was saved","La fecha en el que la partida fue guardada","widelands","../../src/wui/savegametable.cc:146 ../../src/wui/savegametable.cc:174 ../../src/wui/savegametable.cc:237"
"game","Juego","The filename that the game was saved under followed by the map’s name, or the map’s name followed by the last objective achieved.","El nombre del archivo con el que se guardó la partida seguido por el nombre del mapa, o el nombre del mapa seguido por el último objetivo conseguido.","widelands","../../src/wui/savegametable.cc:148 ../../src/wui/savegametable.cc:200 ../../src/wui/savegametable.cc:259"
"Endless Game","Juego Sin Fin","This is an endless game without rules. Fog of war is disabled.","Este es un juego interminable sin reglas. La niebla de guerra está deshabilitada.","win_conditions","../../data/scripting/win_conditions/endless_game_fogless.lua:15"
"Jundlina","Jundlina","May Satul warm you, Jundlina. My name is Ostur and I construct ships. I have invented a new kind of ship: smaller than those we are used to, but much sturdier. If we build them correctly, I am confident that we can sail a much longer distance with them and maybe escape from Lutas’ influence.","Que Satul te caliente, Judlina. Mi nombre es Ostur y construyo barcos. He inventado un nuevo tipo de barco: más pequeño que los que usamos, pero mucho más resistente. Si los construimos correctamente, confío en que podemos navegar distancias más largas con ellos y quizás escapar de la influencia de Lutas.","scenario_atl01.wmf","../../data/campaigns/atl01.wmf/scripting/texts.lua:448"
"Wooden Spear","Lanza de Madera","The helmet is the basic defense of a warrior. It is produced in an armor smithy. In combination with a wooden spear, it is the equipment to fit out young soldiers. Helmets are also used in training camps – together with food – to train soldiers from health level 0 to level 1.","Esta es una lanza avanzada con una punta de acero. Es producida en una armería y usada en un campo de entrenamiento-junto con comida-para entrenar soldados en ataque del nivel 0 al nivel 1.","tribes_encyclopedia","../../data/tribes/initialization/empire/units.lua:559"
"Lutius","Lutius","On their way home to defend the Empire, the crew of Lutius was surprised by the will of the gods.","En su camino a casa para defender el Imperio, el equipo de Lucio fue sorprendido por la voluntad de los dioses.","maps","../../data/campaigns/emp03.wmf/elemental:10"
"Malac’ Mor","Malac' Mor","Perhaps the people aboard that ship were caught in the same storm which brought us to Malac’ Mor – and were brought to this island.","Quizás las personas abordo de ese barco fueron atrapados en la misma tormenta que nos trago a Malac'Mor - y fueron traídos a esta isla.","scenario_emp02.wmf","../../data/campaigns/emp02.wmf/scripting/texts.lua:169"
"Stonemason","Mampostero","I noticed that our stonemason has started his work, finally. He will cut the number of marble columns that we request in our basic economy settings.","Me di cuenta que nuestro cantero ha comenzado su trabajo, por fin. Él cortará el número de columnas de mármol que solicitamos en nuestra economía básica.","scenario_emp03.wmf","../../data/campaigns/emp03.wmf/scripting/texts.lua:306"
"Stonemason’s House","Mampostería","Build a lumberjack’s house, a sawmill and a stonemason’s house as soon as there is enough space for them. This will complete the basic building material supply chain.","Construya la casa de un leñador, un aserradero y la casa de un albañil tan pronto como haya espacio suficiente para ellos. Esto completará la cadena básica de suministro de materiales de construcción.","scenario_emp03.wmf","../../data/campaigns/emp03.wmf/scripting/texts.lua:66"
"Corn","Maíz","As your road network gets longer and more complicated, you should employ horses to help out your carriers. Horses are bred at horse farms using water and corn. A warehouse will also help to ensure that your transportation system does not collapse.","Como tu red de caminos se hace más larga y complicada, debes emplear caballos para ayudar a tus transportistas. Los caballos son criados en el establo usando agua y trigo. Un almacén también te ayudará a asegurarte de que tu sistema de transporte no colapse.","scenario_atl01.wmf","../../data/campaigns/atl01.wmf/scripting/texts.lua:119"
"Corn","Maíz","But we might find a compromise in between: for me, making bread is a troublesome task. Grinding the blackroots and corn to flour and then baking the bread is tedious and boring; I feel a more industrial approach would be helpful here. I for one would love to just have fresh bread delivered to my house every day.","Pero podríamos encontrar un compromiso entre ellos: para mi, hacer pan es una tarea problemática. Moler la raíz negra y el trigo en harina y después hornear el pan es tedioso y aburrido; Creo que una aproximación más industrial puede ayudarnos. Me encantaría tener una entrega de pan fresco a mi casa cada día.","scenario_atl01.wmf","../../data/campaigns/atl01.wmf/scripting/texts.lua:238"
"Military","Militar","Sire, today we got a lot closer to finally returning home again. Our military has spotted a space to build a port on. We should start to build a port quickly.","Señor, hoy nos hemos acercado mucho más al regreso a casa. Nuestro ejército ha descubierto un espacio para construir un puerto. Debemos empezar a construir un puerto rápidamente.","scenario_emp03.wmf","../../data/campaigns/emp03.wmf/scripting/texts.lua:349"
