"glossary_term","glossary_translation","source","target","file","location"
"view","nézet","Moving your view is essential to get a complete overview of your whole economy. There are three ways to move your view in Widelands.","A navigálás létfontosságú hogy teljes képet kapj a gazdaságodról. Három módja van a navigációnak a Widelands játékban.","scenario_tutorial01_basic_control.wmf","../../data/campaigns/tutorial01_basic_control.wmf/scripting/texts.lua:189"
"view","nézet","The second one is the more common and faster one: press-and-hold the right mouse button anywhere on the map, then move your mouse around and you’ll see the view scroll.","A másik, egyben közkeletűbb és gyorsabb mód: nyomd meg bárhol a térképen és tartsd lenyomva az egér jobb gombját, majd mozgasd az egeret, és láthatod, amint mozog a látókör.","scenario_tutorial01_basic_control.wmf","../../data/campaigns/tutorial01_basic_control.wmf/scripting/texts.lua:191"
"view","nézet","Move your view with the mouse","Navigálj az egér segítségével","scenario_tutorial01_basic_control.wmf","../../data/campaigns/tutorial01_basic_control.wmf/scripting/texts.lua:205"
"view","nézet","Center view on this","Látómező közepébe helyezés","widelands","../../src/wui/buildingwindow.cc:342"
"view","nézet","Center the main view on this","Látómező közepébe helyezés","widelands","../../src/wui/watchwindow.cc:67"
"watch tab","nézet lapfül","Let me quickly enable these two for you. Remember: ‘c’ and ‘s’ are the keys. Alternatively, you can click on any field without a building on it, select the watch tab and then click on the corresponding buttons.","Gyorsan meg is mutatom mindkettőt. Emlékezz: a „c” és az „s” billentyűvel aktiválhatod ezeket. Vagy egy üres területre kattintva a nézőkéből is elérhető mindkettő funkció.","scenario_tutorial01_basic_control.wmf","../../data/campaigns/tutorial01_basic_control.wmf/scripting/texts.lua:360"
"spectator","néző","You lost your last warehouse and are therefore defeated. You may continue as spectator if you want.","Elvesztetted az utolsó raktáradat, ezért vesztettél. Folytathatod a játékot megfigyelőként, ha akarod.","win_conditions","../../data/scripting/win_conditions/win_condition_texts.lua:10"
"command","parancs","Defeat Erwyn. He commands the strongest opposing military force left on this island.","Győzd le Erwynt. Ő vezeti a szigeten megmaradt legerősebb ellenálló katonákat.","map_the_green_plateau.wmf","../../data/maps/The_Green_Plateau.wmf/scripting/texts.lua:38"
"command","parancs","It is amazing how far one can see from the highest tower of the castle. We can watch the whole island. So now I wonder why Lanissa did not see us and thus did not prepare. Be that as it may, some things will never come to the light of day. The only important issue at the moment are the opposing troops still left. We have discovered enemy positions held by Erwyn to the north and east of the castle. He is known to be a strong warlord and surely commands the strongest warriors. In the south, we caught sight of some food infrastructures guarded by Jomo – a younger warlord – and we should take care of those infrastructures so we can cut off our enemies’ food supply.","Csodálatos, hogy milyen messze el lehet látni a kastély legmagasabb tornyából. Az egész szigetet beláthatjuk. Úgyhogy csodálom, hogy Lanissa miért nem látott meg minket és miért nem készült fel. Bárhogy legyen is, néhány dolog soha nem lát napvilágot. Az egyetlen fontos kérdés, hogy még mindig maradtak ellenséges csapatok. Felfedeztünk Erwyn irányítása alatt tartott ellenséges pozíciókat a kastély északi és keleti részén. Ő erős hadúrként ismert , és biztosan tudja irányítani a legerősebb harcosokat is. Délen megpillantottunk néhány Jomo – egy fiatalabb hadúr – által védett  étel ellátó hálózatot, gondoskodnunk kell azokról a hálózatokról, hogy el tudjuk vágni az ellenséget az utánpótlástól.","map_the_green_plateau.wmf","../../data/maps/The_Green_Plateau.wmf/scripting/texts.lua:91"
"seafaring","tengerjáró","In this tutorial, you will get to know seafaring, which is how to handle ships and ports.","Ebben az oktatójátékban megismered a hajózást, azon belül a hajók és a kikötők kezelését.","maps","../../data/campaigns/tutorial03_seafaring.wmf/elemental:10"
"seafaring","tengerjáró","Welcome back. In this tutorial, you are going to learn the most important things about seafaring, that is ships, ports, and expedition.","Üdv újra. Ebben a bemutatóban megtanulod a legfontosabb dolgokat a hajózásról, ezek a hajók, a kikötők, és az expedíciók.","scenario_tutorial03_seafaring.wmf","../../data/campaigns/tutorial03_seafaring.wmf/scripting/texts.lua:22"
"seafaring","tengerjáró","Show seafaring messages only","Csak a hajózási üzenetek megjelenítése","tribes_encyclopedia","../../data/tribes/scripting/help/controls.lua:97"
"seafaring","tengerjáró","Show seafaring messages only","Csak a hajózási üzenetek megjelenítése","widelands","../../src/wui/game_message_menu.cc:548"
"produce","termelni","The four mighty harbors of the Craw Islands have been trading their goods among each other for ages. All of them needed resources that they could not produce in their own territory and in exchange provided other resources to those that could not produce them. Based on these trades, a very friendly commerce was common between the four harbors and the people living on the Craw Islands – until recently, when two of the harbors united to form an exclusive trade alliance, forcing the other two to do the same. Suddenly, it seems only a matter of time before the first fights between the harbors will shatter the peaceful life that has lasted for so long…","A Rák-szigetek négy nagy kikötője időtlen idők óta kereskedett egymással. Mindnyájuknak kellettek nyersanyagok, melyekkel nem rendelkeztek, cserébe olyat adtak, amije a másiknak nem volt. Erre a csereberére egy igen barátságos kereskedelem épült a négy kikötő és a Rák-szigetek népei között – egészen addig, míg utóbb két kikötő kizárólagos kereskedelmi szerződést nem kötött egymással, ugyanilyenbe kényszerítve ezzel a másik kettőt. Hirtelen úgy látszik, már csak idő kérdése, hogy a kikötők közötti első harcok szétzilálják a békét, mi oly sokáig tartott…","maps","../../data/maps/Together_We're_Strong.wmf/elemental:10"
"produce","termelni","The weavers produce spidercloth and tabards in the weaving mill. Spidercloth is needed for the construction of some buildings and clothing, while tabards are the uniforms of soldiers. The weaving mill needs gold thread and spider silk as raw material. Spider silk is produced by the spider farm, while gold thread is produced by the gold spinning mill out of gold.","A szövők pókszövetet és köntösöket gyártanak a szövőmalomban. A pókszövet szükséges alapanyaga pár épületnek és ruhának, míg a köntösök a katonák egyenruhái. A szövőmalomnak aranyfonálra és pókselyemre van szüksége nyersanyagként. Pókselymet a póktenyészetek termelnek, aranyfonalat pedig az aranyszálfonó malmok hoznak létre.","scenario_atl01.wmf","../../data/campaigns/atl01.wmf/scripting/texts.lua:76"
"produce","termelni","Iron ore, gold ore and coal are mined in the respective mines. The crystal mine will dig for quartz and diamonds – all of them are precious materials and very rarely found. It will produce a lot of granite while searching for them.","A vasércet, az aranyércet és a szenet a megfelelő bányákban termelik ki. A kristálybánya kvarcot és gyémántot is keres – mindkettő ritka anyag, és nagyon ritkán kerül elő. Míg keresik, sok gránitot termel ki a bánya.","scenario_atl01.wmf","../../data/campaigns/atl01.wmf/scripting/texts.lua:88"
"produce","termelni","Like all other tribes, the Atlanteans are also able to train soldiers: the dungeon trains attack – the major attribute of the Atlanteans – and the labyrinth trains evasion, health and defense. The items produced by the industry are used to train better soldiers in the two training sites.","Mint a többi törzs, az atlantisziak is képesek katonákat képezni: a kazamata képzi a támadásukat – az atlantisziak fő tulajdonságát – és a labirintus képzi a kitérésüket, életerejüket és védelmüket. Az ipar által termelt árukat arra használják, hogy jobb katonákat képezzenek ki a két kiképzőhelyen.","scenario_atl01.wmf","../../data/campaigns/atl01.wmf/scripting/texts.lua:112"
"produce","termelni","May Satul warm you, Jundlina. My name is Opol, and I am the highest weaver of the guild abandoning Atlantis and Lutas with you. I come with sad news indeed: we have no more spidercloth. Not a single piece is to be found in our warehouses. Could you not help the weavers’ guild by arranging the building of a weaving mill and a spider farm? The spiders deliver the finest silk and we will produce the finest spidercloth from it.","Satul melegítsen, Jundlina. A nevem Opol, én vagyok a céh első takácsa, és veled hagytam el Atlantiszt és Lutast. Valóban szomorú hírekkel érkeztem: nincs több pókszövetünk. Egyetlen darab sincs a raktárainkban. Segítenél a takácscéhnek azzal, hogy elrendeled egy szövőmalom és egy póktenyészet építését? A pókok készítik a legfinomabb selymet, és mi abból a legjobb pókszövetet.","scenario_atl01.wmf","../../data/campaigns/atl01.wmf/scripting/texts.lua:269"
"produce","termelni","We offer to also produce the tabards for young soldiers and the golden tabards for officers for you in exchange. You will need them for sure as soon as you want to recruit new soldiers.","Cserébe felajánljuk, hogy elkészítjük az új katonák köntöseit és a tisztek aranyköntöseit is. Szükséged lesz ezekre, amint új katonákat toborzol.","scenario_atl01.wmf","../../data/campaigns/atl01.wmf/scripting/texts.lua:272"
"produce","termelni","May Satul warm you, Jundlina. Have you considered mining for resources in the mountains around us? We are running short of quartz and diamonds for our buildings. Also, we could use more iron, gold and especially coal. If we find an ample supply of those commodities, we could start producing weapons and tools; this would help enormously. Of course, we would need smelters, a weapon smithy, an armor smithy and a toolsmithy. And maybe even more.","Satul melegítsen, Jundlina. Gondoltál már arra, hogy bányászhatnánk a környező hegyekből? Fogytán van a kvarcunk és a gyémántunk, melyek az épületekhez kellenek. Ezenkívül hasznát vennénk még a vasnak, az aranynak, és különösen a szénnek. Ha bő forrásra lelnénk ezekből az anyagokból, akkor elkezdhetnénk fegyvereket és szerszámokat készíteni, ez óriási segítség lenne. Természetesen akkor kohókra, fegyver-, páncél- és szerszámkovácsműhelyre is szükségünk lesz. Talán többre is.","scenario_atl01.wmf","../../data/campaigns/atl01.wmf/scripting/texts.lua:304"
"produce","termelni","Other ways to produce food – different kinds of food – are fishers and farms. The wheat of the farms has to be processed with water in a bakery before it becomes edible. You can obtain water by building a well on a spot where your geologists have found a water source.","Az élelmiszer-termelés más módjai – különböző fajta élelmiszereknek –, a halászok és a farmok. A farmok búzáit vízzel együtt kell feldogozni a pékségben, mielőtt ehető lesz. Vizet kút építésével szerezhetsz, egy olyan helyen, ahol a geológusok vízforrást találtak.","scenario_bar01.wmf","../../data/campaigns/bar01.wmf/scripting/texts.lua:77"
"produce","termelni","Such buildings usually have greater demands than the basic kind of that building – for instance, deep mines need snacks instead of rations. You will have to enhance your tavern to an inn in order to produce snacks out of pitta bread AND a second kind of food (meat or fish) AND beer.","Az ilyen épületeknek általában nagyobb igényei vannak, mint az alapvető épületnek – például a mély bányáknak uzsonnákra van szüksége harapnivalók helyett. Vendéglővé kell fejlesztened a fogadódat, hogy uzsonnákat készítsen pitából, egy másik élelmiszerből (húsból vagy halból) és sörből.","scenario_bar01.wmf","../../data/campaigns/bar01.wmf/scripting/texts.lua:97"
"produce","termelni","Chieftain, this is a disgrace! It is well that we can produce grout for mighty fortifications and great buildings now – only this does not prevent our roofs from becoming leaky! Maybe the young ones like spending their nights in the rain, but I just can’t find any sleep with these raindrops dripping on my face!","Szégyen, törzsfőnök! Az rendben van, hogy már tudunk cementet csinálni kitartó erődítményekhez és nagy épületekhez – de ettől a tetőink még beáznak! Lehet, hogy az ifjak szívesen töltik az éjszakát az esőben, de én nem tudok aludni, ha víz csepeg az arcomra!","scenario_bar01.wmf","../../data/campaigns/bar01.wmf/scripting/texts.lua:478"
"produce","termelni","Enhance your metal workshop to an ax workshop in order to produce weapons, and build up a second metal workshop to ensure the production of tools. When the blacksmith reaches his next level (master blacksmith), you can even enhance the ax workshop to a war mill, which will produce additional weapons.","Fejleszd tovább szerszámkészítő műhelyedet fejszekészítő műhellyé, hogy fegyvert gyártson, és építs egy másik szerszámkészítő műhelyt, hogy biztosítsd a szerszámok gyártását. Ha a kovács eléri a következő szintet (mesterkovács), a fejszekészítő műhelyt fegyverkészítő műhellyé is fejlesztheted, ahol más fegyverek is készülnek.","scenario_bar02.wmf","../../data/campaigns/bar02.wmf/scripting/texts.lua:94 ../../data/campaigns/bar02.wmf/scripting/texts.lua:124"
"produce","termelni","Build a tavern to produce some food to sustain our miners.","Építs egy fogadót, hogy némi élelmet termelj a bányászok fenntartásához.","scenario_emp02.wmf","../../data/campaigns/emp02.wmf/scripting/texts.lua:75"
"produce","termelni","It’s up to you what you want to build. But remember – coal and iron mines need beer, marble and gold mines need wine and all mines need at least rations, which are produced out of bread OR meat OR fish.","Rajtad áll, hogy mit építesz. De ne feledd: a szén- és vasércbányákba sör szükséges, a márvány- és aranybányákba bor, és minden bányába legalább harapnivalók kellenek, ami kenyérből VAGY húsból VAGY halból készül.","scenario_emp02.wmf","../../data/campaigns/emp02.wmf/scripting/texts.lua:80"
"produce","termelni","But until that day, many years may pass! For now, we must concentrate on the present, and build a few lumberjack’s houses and a sawmill to produce some basic building materials.","De addig a napig még sok év fog eltelni! Most a jelenre kell összpontosítanunk, és építenünk kell pár favágóházat és egy fűrészmalmot, némi alapvető építőanyag termeléséhez.","scenario_emp02.wmf","../../data/campaigns/emp02.wmf/scripting/texts.lua:127"
"produce","termelni","This equipment is produced in smithies out of coal, iron, and sometimes gold. You will learn more about this in the second scenario of the Barbarian campaign.","Ez a felszerelés a kovácsműhelyekben készül szénből, vasból és néha aranyból. Többet fogsz erről megtudni a barbár hadjárat második küldetésében.","scenario_tutorial02_warfare.wmf","../../data/campaigns/tutorial02_warfare.wmf/scripting/texts.lua:124"
"produce","termelni","Ships are produced in a shipyard.","A hajók a hajógyárban készülnek.","scenario_tutorial03_seafaring.wmf","../../data/campaigns/tutorial03_seafaring.wmf/scripting/texts.lua:88"
"produce","termelni","Hunts animals to produce meat.","Állatokra vadászik, hogy húst termeljen.","tribes_encyclopedia","../../data/tribes/buildings/productionsites/atlanteans/hunters_house/helptexts.lua:16 ../../data/tribes/buildings/productionsites/barbarians/hunters_hut/helptexts.lua:13 ../../data/tribes/buildings/productionsites/empire/hunters_house/helptexts.lua:16 ../../data/tribes/buildings/productionsites/frisians/hunters_house/helptexts.lua:16"
"produce","termelni","Grinds blackroots and corn to produce blackroot flour and cornmeal, respectively.","Feketegyökeret és kukoricát őröl feketegyökérlisztté és kukoricalisztté.","tribes_encyclopedia","../../data/tribes/buildings/productionsites/atlanteans/mill/helptexts.lua:16"
"produce","termelni","Saws logs to produce planks.","Rönköket fűrészel, hogy deszkákat készítsen.","tribes_encyclopedia","../../data/tribes/buildings/productionsites/atlanteans/sawmill/helptexts.lua:16 ../../data/tribes/buildings/productionsites/empire/sawmill/helptexts.lua:16"
"produce","termelni","A reed yard can produce a sheaf of thatch reed in about %s on average.","A nádudvar átlagosan %s alatt termel egy kéve tetőnádat.","tribes_encyclopedia","../../data/tribes/buildings/productionsites/barbarians/reed_yard/helptexts.lua:23"
"produce","termelni","Grinds wheat to produce flour.","Lisztté őrli a búzát.","tribes_encyclopedia","../../data/tribes/buildings/productionsites/empire/mill/helptexts.lua:16"
"produce","termelni","Basic armor for Empire soldiers. It is produced in the armor smithy and used in the training camp – together with food – to train soldiers from health level 1 to level 2.","Alapszintű páncél a Birodalom katonáinak. A páncélkovács műhelyben készül, és a kiképzőtáborban használják – élelmiszerrel együtt – a katonák életerejének 1. szintről 2. szintre történő képzéséhez.","tribes_encyclopedia","../../data/tribes/wares/armor/helptexts.lua:4"
"produce","termelni","The chain armor is a medium armor for Empire soldiers. It is produced in an armor smithy and used in a training camp – together with food – to train soldiers from health level 2 to level 3.","A láncing a Birodalom katonáinak közepes vértezete. A páncélkovács műhelyben készül, és a kiképzőtáborban használják – élelmiszerrel együtt – a katonák életerejének 2. szintről 3. szintre történő képzéséhez.","tribes_encyclopedia","../../data/tribes/wares/armor_chain/helptexts.lua:4"
"produce","termelni","The gilded armor is the strongest armor an Empire soldier can have. It is produced in the armor smithy and used in the training camp – together with food – to train soldiers from health level 3 to level 4.","A aranyozott páncél a Birodalom katonaságában létező legerősebb vértezet. A páncélkovácsműhelyben készül, és a kiképzőhelyeken – élelmiszerrel együtt – a katonák életerejének 3. szintről 4. szintre történő képzéséhez.","tribes_encyclopedia","../../data/tribes/wares/armor_gilded/helptexts.lua:4"
"produce","termelni","The helmet is the basic defense of a warrior. It is produced in an armor smithy. In combination with a wooden spear, it is the equipment to fit out young soldiers. Helmets are also used in training camps – together with food – to train soldiers from health level 0 to level 1.","A sisak a harcos alapvető védelmét látja el. A páncélkovács műhelyben készül. A falándzsával együtt ez adja az újoncok felszerelését. A sisakot a kiképzőtáborban is használják – élelmiszerrel együtt – a katonák életerejének 0. szintről 1. szintre történő képzéséhez.","tribes_encyclopedia","../../data/tribes/wares/armor_helmet/helptexts.lua:4"
"produce","termelni","This is a dangerous weapon the Barbarians are able to produce. It is produced in the war mill. Only trained soldiers are able to wield such a weapon. It is used – together with food – in the training camp to train soldiers from attack level 3 to 4.","Ezt a veszélyes fegyvert csak a barbárok képesek készíteni. A fegyverkészítő műhelyben állítják elő. Csak képzett harcosok tudnak egy ilyen fegyvert forgatni. A kiképzőtáborban használják – élelmiszerrel együtt – a katonák támadásának 3. szintről 4. szintre történő képzéséhez.","tribes_encyclopedia","../../data/tribes/wares/ax_battle/helptexts.lua:4"
"produce","termelni","The broad ax is produced by the ax workshop and the war mill. It is used in the training camp – together with food – to train soldiers with a fundamental fighting knowledge from attack level 1 to attack level 2.","A nagy fejsze a fejszekészítő műhelyben és a fegyverkészítő műhelyben készül. A kiképzőtábor használja – élelmiszerrel együtt – alapvető harci ismeretekkel rendelkező katonák támadásának 1. szintről 2. szintre történő képzéséhez.","tribes_encyclopedia","../../data/tribes/wares/ax_broad/helptexts.lua:4"
"produce","termelni","The bronze ax is considered a weapon that is hard to handle. Only skilled soldiers can use it. It is produced at the war mill and used in the training camp – together with food – to train soldiers from attack level 2 to level 3.","A bronzfejszét nehezen kezelhető fegyvernek tartják. Csak jártas katonák tudják használni. A fegyverkészítő műhelyben állítják elő, és a kiképzőtáborban használják – élelmiszerrel együtt – a katonák támadásának 2. szintről 3. szintre történő képzéséhez.","tribes_encyclopedia","../../data/tribes/wares/ax_bronze/helptexts.lua:4"
"produce","termelni","Young soldiers are proud to learn to fight with this powerful weapon. It is heavier and sharper than the ordinary ax. It is produced in ax workshops and war mills. In training camps, it is used – together with food – to train soldiers from attack level 0 to level 1.","A fiatal katonák büszkén tanulnak meg harcolni ezzel a hatalmas fegyverrel. Nehezebb és élesebb, mint egy közönséges balta. A fejszekészítő és a fegyverkovács műhelyekben készítik. A kiképzőtáborban használják – élelmiszerrel együtt – a katonák támadásának 0. szintről 1. szintre történő képzéséhez.","tribes_encyclopedia","../../data/tribes/wares/ax_sharp/helptexts.lua:4"
"produce","termelni","The warrior’s ax is the most dangerous of all Barbarian weapons. Only a few soldiers ever were able to handle this huge and powerful ax. It is produced in a war mill and used – together with food – in a training camp to train soldiers from attack level 4 to level 5.","A harci fejsze a legveszélyesebb barbár fegyver. Csak kevés katona képes kezelni ezt az óriási és hatalmas fegyvert. A kiképzőtáborban használják – élelmiszerrel együtt – a katonák támadásának 4. szintről 5. szintre történő képzéséhez.","tribes_encyclopedia","../../data/tribes/wares/ax_warriors/helptexts.lua:4"
"produce","termelni","This basket is needed by the vine farmer for harvesting the grapes. It is produced by the toolsmith.","Ezt a puttonyt a szőlősgazda használja, ebbe szüreteli a szőlőt. A szerszámkovács készíti.","tribes_encyclopedia","../../data/tribes/wares/basket/helptexts.lua:4"
"produce","termelni","Beer is produced in micro breweries and used in inns and big inns to produce snacks.","A sört a kis sörfőzdében állítják elő, és a fogadókban, valamint a nagy fogadókban használják fel uzsonna készítéséhez.","tribes_encyclopedia","../../data/tribes/wares/beer/helptexts.lua:4"
"produce","termelni","This beer is produced in a brewery out of wheat and water. It is consumed by miners in coal and iron mines.","Ezt a sört búzából és vízből készítik a sörfőzdében. A szén- és vasércbányák munkásai fogyasztják.","tribes_encyclopedia","../../data/tribes/wares/beer/helptexts.lua:8"
"produce","termelni","Blackroots are a special kind of root produced at blackroot farms and processed in mills. The Atlanteans like their strong taste and use their flour for making bread.","A feketegyökér egy különleges gyökérzet, mely a feketegyökér-termesztőtől jön és a malomban dolgozzák fel. Az atlantisziak kedvelik erős ízét, lisztjét kenyérsütéshez használják.","tribes_encyclopedia","../../data/tribes/wares/blackroot/helptexts.lua:4"
"produce","termelni","Blackroot Flour is produced in mills out of blackroots. It is used in bakeries to make a tasty bread.","A feketegyökérlisztet malmokban őrlik feketegyökérből. A pékségekben ízletes kenyér sütéséhez használják fel.","tribes_encyclopedia","../../data/tribes/wares/blackroot_flour/helptexts.lua:4"
"produce","termelni","This fire-hardened wood is as hard as iron and it is used for several buildings. It is produced out of logs in the wood hardener.","Ez a tűzben edzett fa olyan kemény, mint a vas, és számos épülethez felhasználják. Farönkből készül a faedző műhelyben.","tribes_encyclopedia","../../data/tribes/wares/blackwood/helptexts.lua:4"
"produce","termelni","Bread paddles are produced by the toolsmith.","A péklapátokat a szerszámkovács készíti.","tribes_encyclopedia","../../data/tribes/wares/bread_paddle/helptexts.lua:6"
"produce","termelni","Bread paddles are produced in the metal workshop like all other tools (but cease to be produced by the building if it is enhanced to an ax workshop and war mill).","A péklapát a pék eszköze, minden péknek kell egy. Mint minden eszközt, ezt is a szerszámkészítő műhelyben állítják elő (de továbbfejlesztéseiben, azaz a fejsze- és a fegyverkészítő műhelyben már nem).","tribes_encyclopedia","../../data/tribes/wares/bread_paddle/helptexts.lua:8"
"produce","termelni","Bread paddles are produced by the toolsmith.","A péklapátokat a szerszámkovács készíti.","tribes_encyclopedia","../../data/tribes/wares/bread_paddle/helptexts.lua:12"
