"glossary_term","glossary_translation","source","target","file","location"
"building","건설","Atlanteans use logs also as the base for planks, which are used in nearly every building. Besides the sawmill, the charcoal kiln, the toolsmithy and the smokery also need logs for their work.","아틀란티스인들은 또한 통나무를 거의 모든 건물에 사용되는 널빤지의 재료로 사용합니다. 제재소뿐만 아니라, 숯가마, 도구 제작소와 훈제소 또한 통나무가 작업에 필요합니다.","tribes_encyclopedia","../../data/tribes/wares/log/helptexts.lua:6"
"building","건설","Marble columns represent the high culture of the Empire, so they are needed for nearly every larger building. They are produced out of marble at a stonemason’s house.","대리석 기둥은 제국의 높은 문화를 나타내므로, 거의 모든 큰 건물에 필요합니다. 석공의 집에서 대리석을 이용해 생산합니다.","tribes_encyclopedia","../../data/tribes/wares/marble_column/helptexts.lua:4"
"building","건설","Picks are used by stonemasons and miners. They are produced in the metal workshop (but cease to be produced by the building if it is enhanced to an ax workshop and war mill).","곡괭이는 광부들과 석공들이 사용합니다. 금속 제작소에서 생산합니다(하지만 도끼 제작소와 전쟁 공장으로 향상되면 생산을 중지합니다).","tribes_encyclopedia","../../data/tribes/wares/pick/helptexts.lua:6"
"building","건설","Scythes are produced by the metal workshop (but cease to be produced by the building if it is enhanced to an ax workshop and war mill).","큰 낫은 금속 제작소에서 생산합니다(하지만 도끼 제작소와 전쟁 공장으로 향상되면 생산을 중지합니다).","tribes_encyclopedia","../../data/tribes/wares/scythe/helptexts.lua:10"
"building","건설","Therefore the gardener and the ranger use them. Produced at the metal workshop (but cease to be produced by the building if it is enhanced to an ax workshop and war mill).","그러므로 정원사와 숲지기가 그것들을 사용합니다. 금속 제작소에서 생산됩니다(하지만 도끼 제작소와 전쟁 공장으로 향상되면 생산이 중지됩니다).","tribes_encyclopedia","../../data/tribes/wares/shovel/helptexts.lua:8"
"building","건설","Thatch reed is produced in a reed yard and used to make the roofs of buildings waterproof.","억새풀은 갈대 뜰에서 생산하고 건물 지붕이 방수되는데 사용합니다.","tribes_encyclopedia","../../data/tribes/wares/thatch_reed/helptexts.lua:4"
"building","건설","Produces spidercloth for buildings, ships and soldiers.","건물, 선박과 군인들을 위해 거미천을 생산합니다.","tribes_encyclopedia","../../data/tribes/workers/atlanteans/weaver/helptexts.lua:3"
"building","건설","Show building spaces (on/off)","건물 공간 표시 (켜기/끄기)","widelands","../../src/editor/editorinteractive.cc:99 ../../src/wui/interactive_player.cc:183 ../../src/wui/interactive_spectator.cc:72"
"building","건설","the building has the following wares: %s","이 건물은 다음 용품을 소유하고 있음: %s","widelands","../../src/logic/map_objects/tribes/production_program.cc:393"
"building","건설","the building doesn’t have the following wares: %s","이 건물은 다음 용품을 소유하고 있지 않음: %s","widelands","../../src/logic/map_objects/tribes/production_program.cc:419"
"building","건설","Toggle building statistics display","건물 통계 창 켜기/끄기","widelands","../../src/wui/fieldaction.cc:359"
"building","건설","Toggle building label display","건물 꼬리표 표시 켜기/끄기","widelands","../../src/wui/fieldaction.cc:362"
"building","건설","Military buildings lost","군사 건물 잃음","widelands","../../src/wui/general_statistics_menu.cc:173"
"building","건설","Military buildings defeated","군사 건물 파괴","widelands","../../src/wui/general_statistics_menu.cc:178"
"building","건설","Civilian buildings lost","민간 건물 잃음","widelands","../../src/wui/general_statistics_menu.cc:183"
"construction site","건설 현장","New port construction site is gone","새로운 항구 건설 위치가 사라졌습니다","widelands","../../src/logic/map_objects/tribes/ship.cc:671"
"game","게임","Some say that impenetrable lands to the far north scared away even the most courageous settlers and the bravest of the brave warriors. Big and old forests, full of big and predatory game, cut across by wetlands and hills were shrouded in mystery. The ones who had managed to come back mentioned tremendous buildings, decorated with carvings and gold from majestic mountain ranges somewhere amongst the wilderness. Dozens of years after only some crumbly ruins remain of these good old times, covered with moss and trees. Their shapes give only an idea about the craftsmanship of ancient constructors. Nobody knows why they (have) disappeared. Nobody knows why. People say that now nothing is blocking the road to wealth. But many will die pulled apart by wolves, engulfed by swamp… encircled by hostile tribes.","어떤이들은 눈앞이 안 보일 정도의 먼 북쪽 땅은 가장 용감한 정착민들과 용사중의 용사들 조차도 쫓아버렸다고 말합니다. 습지와 언덕을 가로 지르는 크고 약탈적인 놀이로 가득 찬 크고 오래된 숲은 수수께끼에 싸여있었습니다. 가까스로 돌아올 수 있었던 사람들은 황무지의 어딘가에 있는 웅장한 산맥에서 나온 조각과 금으로 장식된 엄청난 건물을 언급했습니다. 
일부 부서지기 쉬운 폐허만이 이런 좋은 시절의 잔재를 남겨둔 수십년 후, 이곳은 이끼와 나무로 뒤덮였습니다. 그것들의 모양은 고대 건축가의 장인 정신에 대한 생각만을 줍니다.. 
그들이 왜 사라졌는지는 아무도 모른다. 아무도... 사람들은 이제 부자로 가는 길을 가로 막고 있는것은 아무것도 없다고 말합니다. 하지만 많은 사람들이 늪으로 둘러쌓인… 늑대에 의해 갈갈히 찣겨져 죽을것입니다. 적대적인 부족들에게 둘러 쌓인체. (번역확인??)","maps","../../data/maps/The_Far_North.wmf/elemental:10"
"game","게임","%s is now King of the Hill and will win the game in 20 minutes, if nobody takes over the hill before then.","%s 은(는) 현재 언덕의 왕이며, 아무도 없을 경우 20분 안에 이깁니다. 그 전에 언덕을 맡아라.","mp_scenario_island_hopping.wmf","../../data/maps/MP_Scenarios/Island_Hopping.wmf/scripting/texts.lua:51"
"game","게임","The hunter working out of this hunter’s house can’t find any game in his work area.","사냥꾼의 집에서 일하는 사냥꾼은 작업 영역 내에 어떤 사냥감도 찾을 수 없습니다.","tribes","../../data/tribes/buildings/productionsites/atlanteans/hunters_house/init.lua:57"
"game","게임","The hunter working out of this hunter’s hut can’t find any game in his work area. Remember that you can build a gamekeeper’s hut to release more game into the wild.","사냥꾼의 오두막에서 일하는 사냥꾼은 작업 영역 내에 어떤 사냥감도 찾을 수 없습니다. 야생에 더 많은 사냥감을 풀어놓는 사냥터지기의 오두막을 지을 수 있음을 명심하십시오.","tribes","../../data/tribes/buildings/productionsites/barbarians/hunters_hut/init.lua:68"
"game","게임","The hunter working out of this hunter’s house can’t find any game in his work area.","사냥꾼의 집에서 일하는 사냥꾼은 작업 영역 내에 어떤 사냥감도 찾을 수 없습니다.","tribes","../../data/tribes/buildings/productionsites/empire/hunters_house/init.lua:57"
"game","게임","The hunter working out of this hunter’s house can’t find any game in his work area.","이 사냥꾼의 집에서 일하는 이는 그의 작업장에서 어떤 야생동물도 찾지 못했습니다.","tribes","../../data/tribes/buildings/productionsites/frisians/hunters_house/init.lua:69"
"game","게임","Meat contains a lot of energy, and it is obtained from wild game taken by hunters.","고기는 많은 에너지를 갖고 있고, 사냥꾼들이 잡는 야생 동물로부터 얻습니다.","tribes_encyclopedia","../../data/tribes/wares/meat/helptexts.lua:4"
"game","게임"," --nosound            Starts the game with sound disabled."," --nosound            サウンドを無効にしてゲームを開始します。","widelands_console","../../src/wlapplication_messages.cc:90"
"game","게임"," --auto_speed         In multiplayer games only, this will keep
                      adjusting the game speed automatically,
                      depending on FPS. Useful in conjunction with
                      --ai_training."," --auto_speed         マルチプレイ限定。ゲームスピードをFPS
                      に応じて自動的に調整します。--ai_training指定時
                      にこれを指定すると便利です。","widelands_console","../../src/wlapplication_messages.cc:104"
"symbol","기호","The stories they tell about the deeds of our kin are sad to hear. I’ve spent nights lying awake, restless, more tired than I ever believed one could be. Yet whenever I close my eyes, I see the fortress my father built consumed by flames. The Throne Among the Trees, the symbol of unity and peace among our kin, became the wedge that drives us apart.","그들이 우리 친척들의 행동에 대해 이야기하는 것은 듣기 슬픈 일이다. 나는 잠에서 깨어 있고, 불안하며, 제가 생각했던 것보다 더 피곤한 채 밤을 보냈다. 하지만 나는 눈을 감을 때마다 아버지께서 건설하신 성이 화염에 휩싸인것을 본다. 우리의 동족 간의 화합과 평화의 상징인 나무들 사이의 왕좌는 우리를 갈라놓는 쐐기가 되었다.","scenario_bar01.wmf","../../data/campaigns/bar01.wmf/scripting/texts.lua:194"
"symbol","기호","Build a blockhouse at the red house symbol on the east side of the forests, to the right of your provisional headquarters.","임시 기지 오른쪽 숲 동쪽에 있는 빨간색 집 모양에 막사를 지으십시오.","scenario_emp01.wmf","../../data/campaigns/emp01.wmf/scripting/texts.lua:30"
"symbol","기호","Build a lumberjack’s house at the red house symbol, south of your provisional headquarters.","임시 기지 남쪽에 빨간색 집 모양에 나무꾼의 집을 지으십시오.","scenario_emp01.wmf","../../data/campaigns/emp01.wmf/scripting/texts.lua:39"
"flag","깃발","build flag symbol."," ","scenario_tutorial01_basic_control.wmf","../../data/campaigns/tutorial01_basic_control.wmf/scripting/texts.lua:119"
"idle","대기중??","Show idle ships","쉬는 배 표시","tribes_encyclopedia","../../data/tribes/scripting/help/controls.lua:114"
"idle","대기중??","Show idle ships","쉬는 배 표시","widelands","../../src/wui/seafaring_statistics_menu.cc:510"
"back","뒤로","Some say that impenetrable lands to the far north scared away even the most courageous settlers and the bravest of the brave warriors. Big and old forests, full of big and predatory game, cut across by wetlands and hills were shrouded in mystery. The ones who had managed to come back mentioned tremendous buildings, decorated with carvings and gold from majestic mountain ranges somewhere amongst the wilderness. Dozens of years after only some crumbly ruins remain of these good old times, covered with moss and trees. Their shapes give only an idea about the craftsmanship of ancient constructors. Nobody knows why they (have) disappeared. Nobody knows why. People say that now nothing is blocking the road to wealth. But many will die pulled apart by wolves, engulfed by swamp… encircled by hostile tribes.","어떤이들은 눈앞이 안 보일 정도의 먼 북쪽 땅은 가장 용감한 정착민들과 용사중의 용사들 조차도 쫓아버렸다고 말합니다. 습지와 언덕을 가로 지르는 크고 약탈적인 놀이로 가득 찬 크고 오래된 숲은 수수께끼에 싸여있었습니다. 가까스로 돌아올 수 있었던 사람들은 황무지의 어딘가에 있는 웅장한 산맥에서 나온 조각과 금으로 장식된 엄청난 건물을 언급했습니다. 
일부 부서지기 쉬운 폐허만이 이런 좋은 시절의 잔재를 남겨둔 수십년 후, 이곳은 이끼와 나무로 뒤덮였습니다. 그것들의 모양은 고대 건축가의 장인 정신에 대한 생각만을 줍니다.. 
그들이 왜 사라졌는지는 아무도 모른다. 아무도... 사람들은 이제 부자로 가는 길을 가로 막고 있는것은 아무것도 없다고 말합니다. 하지만 많은 사람들이 늪으로 둘러쌓인… 늑대에 의해 갈갈히 찣겨져 죽을것입니다. 적대적인 부족들에게 둘러 쌓인체. (번역확인??)","maps","../../data/maps/The_Far_North.wmf/elemental:10"
"back","뒤로","Only the gods know for how long we have to remain hidden here. The warriors hope we may march back gloriously any day now, but I strongly doubt that will happen soon. And the days are short and cold…","우리가 얼마나 오랫동안 숨어있어야 하는지는 신들만이 알것이오. 전사들은 우리가 언제든지 다시 영광스럽게 진군하기를 희망하고 있지만, 나는 그런일은 오지 않을것 이라고 생각하오. 더군다나 낮은 점점 짧아지고 있고 날씨는 점점 추워지고있소…","scenario_bar01.wmf","../../data/campaigns/bar01.wmf/scripting/texts.lua:230"
"back","뒤로","But never forget – these forests are our heritage, entrusted upon us by our ancestors. We must always respect and care for them. What we take, we must give back again.","그러나 절때 잊지 마시오. 이 숲은 우리의 조상들이 우리에게 주신 유산이오. 우리는 항상 이 숲에 고마워해야하며 아껴야 하오. 우리가 받은것은 언젠가는 다시 돌려줘야 하오.","scenario_bar01.wmf","../../data/campaigns/bar01.wmf/scripting/texts.lua:242"
"back","뒤로","The BASTARD! Only one man of our frontier patrol came back alive. He carried a message from Kalitath, telling us that he will punish every move of our troops with their own blood! We cannot accept this behavior. From now on, there is war between Kalitath and us!","카리타쓰, 이런 후레자식놈! 사신으로 갔던 우리 국경 수비대를 모두 죽이고 단 한명만 살려보내놨소. 그는 카리타쓰의 답변을 받았는데 우리 군의 모든 움직임들을 그들 자신의 피로서 처벌할것이라고 전했었소.이런 무례한 행동을 용서할수 없소. 이제는 카리타쓰와 우리 사이에 전쟁뿐이오!","scenario_bar02.wmf","../../data/campaigns/bar02.wmf/scripting/texts.lua:211"
"back","뒤로","The traitor left his armies dying where they lay when he saw that he would not keep my forces back. Kalitath disappeared in the confusion of the war, but I don’t care now. Shall he flee and be forgotten for all times as a tribal leader that would not bow before the wooden throne, that is mine to take now.","카리타쓰, 그 반역자는 그는 내 군대를 막지못하자 그의 죽어가는 군대를 남겨두고 떠나버렸다. 그는 전쟁의 혼란속에서 사라졌다. 하지만 지금은 상관없다. 그는 도망갔고 ,숲의 옥좌앞에 복종하지 않는 부족의 우두머리로 영원히 잊혀졌다. 그 숲의 옥좌는 바로 지금 내가 가야 할 것이다.","scenario_bar02.wmf","../../data/campaigns/bar02.wmf/scripting/texts.lua:222"
"back","뒤로","This morning, I found Thron’s mind troubled. He returned from his patrol late last night and sat back against a tree, watching over the encampment. The number of quarrels and disputes keeps growing, and the winter has us firmly in its grip. We should put food in our storage to survive the long, cold winter!","오늘 아침, 쓰론의 마음에 문제가 있음을 발견했소.그는 어제밤 순찰에서 돌아와 나무에 기대어 앉아 야영지 너머를 지켜보았었소. 싸움과 분쟁의 횟수는 계속해서 늘어나고, 겨울은 우리를 단단히 붙잡을것이오. 우리는 길고 추운 겨울을 극복하기 위해 창고에 식량을 모아두어야 하오!","scenario_bar02.wmf","../../data/campaigns/bar02.wmf/scripting/texts.lua:236"
"back","뒤로","Nothing is left of that beauty I remember, only ruins remain of the old capital. I am sorrowful but also relieved. I never hoped to see Al’thunran’s old beauty again – it was only a few months ago that I wondered whether I would ever be able to set my feet there again. Now the old town is back in my hands, and I will not hesitate to rebuild it with all the strength my people have. I can’t wait to see it again in its old beauty.","내가 기억속 아름다움은 그 아름다움은 남아있지 않았다. 단지 오래된 수도는 폐허로만 남아있었다. 나는 슬펐지만 한편으로는 안심이 되었다. 나는 알'쑨란의 오래된 아름다움을 다시 볼수있을거라고 생각하지 않았다. 몇달전까지만해도 내가 이곳에 다시 올수있을지 의문이었다. 이제 오래된 마을은 내손으로 들어왔고 내 동료들이 가질수있는 모든 힘으로 재건하는데 망설이지 않을것이다. 나는 그것의 오래된 아름다움을 다시 보고싶어 견딜수 없다.","scenario_bar02.wmf","../../data/campaigns/bar02.wmf/scripting/texts.lua:332"
"back","뒤로","It seems like you destroyed a construction site for a quarry we wanted to build. Since we need the granite, I suggest you reload the game from a previous savegame. Luckily, these are created from time to time. To do so, you have to go back to the main menu and choose ‘Single Player’ → ‘Load Game’. And please be a bit more careful next time.","우리가 건설해야 할 채석장 건설 현장을 파괴하신 것 같습니다. 화강암이 필요하기에, 이전에 저장된 게임에서 게임을 다시 불러올 것을 권합니다. 운좋게도, 일정한 시간마다 게임이 저장됩니다. 게임을 다시 불러오려면, 주 메뉴로 돌아가서 '단일 플레이어' → '게임 불러오기' 를 선택하십시오. 그리고 다음에는 좀 더 조심하시기 바랍니다.","scenario_tutorial01_basic_control.wmf","../../data/campaigns/tutorial01_basic_control.wmf/scripting/texts.lua:331"
"back","뒤로","Well done. Now you know how to draw back your soldiers from the places where you don’t need them. It is time to tell you how to reinforce your front line.","잘하셨습니다. 이제 어떻게 군인들을 필요로 하지 않는 곳에서 군인들을 빼낼 지 알았으니까, 최전선을 강화하는 방법에 대해 말할 차례입니다.","scenario_tutorial02_warfare.wmf","../../data/campaigns/tutorial02_warfare.wmf/scripting/texts.lua:179"
"back","뒤로","Great work, the citadel is finished. But what’s that? A hostile tribe has settled next to us while the citadel was under construction! Do you see how they took away a part of our land? And our lumberjack has now lost his place of work. This is what I was talking about. Let’s take our land back and defeat the enemy!","훌륭합니다, 성채가 완성되었습니다. 하지만 이게 뭡니까? 적대적인 부족이 성채가 건설되는 중에 우리 옆에 자리잡았습니다. 어떻게 그들이 우리 땅의 일부를 강탈하는지 보셨습니까? 그리고 우리 나무꾼은 이제 일할 공간을 잃어버렸습니다. 제가 할 말은 다 했습니다. 우리의 땅을 되찾고 적을 물리칩시다!","scenario_tutorial02_warfare.wmf","../../data/campaigns/tutorial02_warfare.wmf/scripting/texts.lua:200"
"back","뒤로","Welcome back. In this tutorial, you are going to learn the most important things about seafaring, that is ships, ports, and expedition.","다시 오신 것을 환영합니다. 이번 튜토리얼에서, 당신은 선박, 항구와 탐험 같은 항해의 가장 중요한 요소들에 대해 배울 것입니다.","scenario_tutorial03_seafaring.wmf","../../data/campaigns/tutorial03_seafaring.wmf/scripting/texts.lua:23"
"back","뒤로","But I don’t want to rush you: you have just arrived here and you would probably like to have a closer look at your camp. I will also take a short break and be back soon.","하지만 지금 당장 하라고는 안하겠습니다: 당신은 여기 막 도착했고 캠프를 자세히 살피는 것을 더 좋아하실 것 같습니다. 잠깐 휴식을 갖고 다시 오겠습니다.","scenario_tutorial03_seafaring.wmf","../../data/campaigns/tutorial03_seafaring.wmf/scripting/texts.lua:36"
"back","뒤로","Welcome back. In this tutorial, I’ll tell you what you can do to check how well your economy works.","돌아오신 것을 환영합니다. 이번 자습서에서, 어떻게 당신의 경제가 잘 작동하는지 체크하려면 무엇을 해야 할지 알려드리겠습니다.","scenario_tutorial04_economy.wmf","../../data/campaigns/tutorial04_economy.wmf/scripting/texts.lua:20"
"back","뒤로","The stonemason pauses %s before going back to work again.","석공은 다시 일하러 가기 전에 %s 쉽니다.","tribes_encyclopedia","../../data/tribes/buildings/productionsites/barbarians/quarry/helptexts.lua:26"
"multiplayer","멀티 플레이어; 함께 노는 이","A multiplayer battle map on a small circle-shaped island.","작은 원 모양의 섬에 있는 함께 놀기 전투 지도입니다.","maps","../../data/maps/Two_Frontiers.wmf/elemental:10"
"multiplayer","멀티 플레이어; 함께 노는 이","Widelands is nearly feature complete and is much fun to play alone and even more in multiplayer with others. Still, there is always more work to be done in all areas. If you are interested in contributing – be it by making graphics, fixing bugs or adding new features, translating the game into your language or creating new maps – get in touch on our homepage.","와이드랜드는 거의 완벽한 기능을 제공하며, 다른 사람들과 함께 함께 놀기를 하면 훨씬 더 재미있게 즐길 수 있습니다. 여전히 모든 분야에서 더 많은 작업이 이루어져야합니다. 그래픽을 만들거나 버그를 수정하거나 새로운 기능을 추가하거나 게임을 자신의 언어로 번역하거나 새로운 지도를 만드는 등의 기여에 관심이 있다면 저희 홈페이지에 문의하십시오.","texts","../../data/txts/README.lua:14"
"multiplayer","멀티 플레이어; 함께 노는 이","Widelands is a free, open source real-time strategy game with singleplayer campaigns and a multiplayer mode. The game was inspired by Settlers II but has significantly more variety and depth to it. Still, it is easy to get started through playable tutorials.","와이드랜드는 혼자놀기 캠페인과 여럿놀기 모드를 갖춘 무료 오픈 소스 실시간 전략 게임입니다. 이 게임은 세틀러 2에 의해 영감을 받았지만 훨씬 더 다양하고 깊이 있습니다. 그러나 놀기 가능한 자습서를 통해 쉽게 시작할수 있습니다.","texts","../../data/txts/help/common_helptexts.lua:18"
"multiplayer","멀티 플레이어; 함께 노는 이","You are in the multiplayer launch game menu.","여럿이 하기 시작 게임 메뉴에 있습니다.","texts","../../data/txts/help/multiplayer_help.lua:8"
"multiplayer","멀티 플레이어; 함께 노는 이","Return to the multiplayer game setup","멀티플레이어 게임 설정으로 복귀","widelands","../../src/ui_fsmenu/loadgame.cc:86 ../../src/ui_fsmenu/mapselect.cc:68"
"multiplayer","멀티 플레이어; 함께 노는 이","H = Multiplayer (Host)","H = 멀티플레이어 (호스트)","widelands","../../src/wui/load_or_save_game.cc:108"
"multiplayer","멀티 플레이어; 함께 노는 이"," --auto_speed         In multiplayer games only, this will keep
                      adjusting the game speed automatically,
                      depending on FPS. Useful in conjunction with
                      --ai_training."," --auto_speed         マルチプレイ限定。ゲームスピードをFPS
                      に応じて自動的に調整します。--ai_training指定時
                      にこれを指定すると便利です。","widelands_console","../../src/wlapplication_messages.cc:104"
"encyclopedia","백과사전","You have closed the encyclopedia window, but I didn’t notice that you were trying to find out which wares are needed to recruit a soldier. Would you please reopen it and do so?","당신은 백과 사전창을 닫아버렸습니다. 그러나 병사를 모집하기위해서 어떤 물건이 필요한지 몰랐습니다. 다시한번 창을 열어주시겠습니까?","scenario_tutorial04_economy.wmf","../../data/campaigns/tutorial04_economy.wmf/scripting/texts.lua:254"
"tribe","부족","Whether it is the latest solstice, or lunar illness, something moves these tribes towards their final ordeal.","그것이 최후의 태양 지점이든, 달의 병이든, 이 종족들은 그들의 마지막 시련으로 향해 움직입니다.","maps","../../data/maps/Full_Moon_v2.wmf/elemental:10"
"tribes","부족","Whether it is the latest solstice, or lunar illness, something moves these tribes towards their final ordeal.","그것이 최후의 태양 지점이든, 달의 병이든, 이 종족들은 그들의 마지막 시련으로 향해 움직입니다.","maps","../../data/maps/Full_Moon_v2.wmf/elemental:10"
