"glossary_term","glossary_translation","source","target","file","location"
"building","건설","You can only reduce the number of soldiers to one. The last soldier of a building will never come out (unless this building is attacked). If you want to have your soldier elsewhere, you will have to dismantle or burn down the building.","군인의 수는 오직 1까지밖에 줄일 수 없습니다. 마지막 군인은 절대로 건물에서 나오지 않을 겁니다 (건물이 공격받지 않는 한). 만약 당신의 군인을 다른 곳으로 보내고 싶다면, 건물을 해체하거나 불태워버려야 합니다.","scenario_tutorial02_warfare.wmf","../../data/campaigns/tutorial02_warfare.wmf/scripting/texts.lua:160"
"building","건설","To attack a building, click on its doors, choose the number of soldiers that you wish to send and click on the ‘Attack’ button.","건물을 공격하려면, 문을 클릭하시고, 파견할 군인의 숫자를 선택한 다음 '공격' 버튼을 클릭하십시오.","scenario_tutorial02_warfare.wmf","../../data/campaigns/tutorial02_warfare.wmf/scripting/texts.lua:201 ../../data/campaigns/tutorial02_warfare.wmf/scripting/texts.lua:210"
"building","건설","Your soldiers will come from all nearby military buildings. Likewise, the defenders will come from all nearby military buildings of the enemy and intercept your forces.","근처의 모든 군사 건물에서 당신의 군인들이 올 것입니다. 비슷하게, 근처의 적의 모든 군사 건물에서 방어자들이 나와서 당신의 군대를 요격할 것입니다.","scenario_tutorial02_warfare.wmf","../../data/campaigns/tutorial02_warfare.wmf/scripting/texts.lua:201"
"building","건설","Attack and conquer all military buildings of the enemy and destroy their headquarters.","적의 모든 군사 건물을 공격하고 정복한 다음 그들의 본부를 파괴하십시오.","scenario_tutorial02_warfare.wmf","../../data/campaigns/tutorial02_warfare.wmf/scripting/texts.lua:202"
"building","건설","Open the building statistics window.","건물 통계 창을 여십시오.","scenario_tutorial04_economy.wmf","../../data/campaigns/tutorial04_economy.wmf/scripting/texts.lua:58"
"building","건설","Open the building statistics window","건물 통계 창을 열기","scenario_tutorial04_economy.wmf","../../data/campaigns/tutorial04_economy.wmf/scripting/texts.lua:63"
"building","건설","The building statistics window gives you an overview over the buildings you have.","건물 통계 창은 당신이 가진 건물들에 대한 개요를 제공합니다.","scenario_tutorial04_economy.wmf","../../data/campaigns/tutorial04_economy.wmf/scripting/texts.lua:65"
"building","건설","This is the building statistics window. It shows you all buildings you can own, sorted by their size.","이것이 건물 통계 창입니다. 당신이 소유한 모든 건물들을, 그 크기에 맞게 배열하여 보여줍니다.","scenario_tutorial04_economy.wmf","../../data/campaigns/tutorial04_economy.wmf/scripting/texts.lua:74"
"building","건설","‘0%’: This indicates the average productivity of all buildings of that type. You have just started this game, therefore none of your buildings has done any work yet, but they are going to start working soon.","‘0%’: 이는 그 종류의 모든 건물들의 평균 생산성을 알립니다. 당신이 막 이 게임을 시작했기에, 어떤 건물들도 아직 아무런 작업도 하지 않았지만, 곧 일을 시작할 예정입니다.","scenario_tutorial04_economy.wmf","../../data/campaigns/tutorial04_economy.wmf/scripting/texts.lua:77"
"building","건설","‘2/4’ below your sentry: For military buildings, the stationed soldiers are shown instead of a productivity. You want to have four soldiers in your sentries, but only two soldiers are stationed in this kind of building. This leaves two vacant positions – we really need more soldiers.","초소 아래 ‘2/4’: 군사 건물의 경우, 생산성 대신 주둔하는 군인들을 표시합니다. 당신 초소들에는 네 명의 군인들이 필요하지만, 오직 두 명의 군인들만이 주둔하고 있습니다. 두 자리가 비어 있습니다 - 우리는 정말로 더 많은 군인들이 필요합니다.","scenario_tutorial04_economy.wmf","../../data/campaigns/tutorial04_economy.wmf/scripting/texts.lua:78"
"building","건설","If you click on a building, you can scroll through the buildings of the selected type.","건물을 클릭하면, 당신은 선택한 종류의 건물들을 스크롤할 수 있습니다.","scenario_tutorial04_economy.wmf","../../data/campaigns/tutorial04_economy.wmf/scripting/texts.lua:80"
"building","건설","If you don’t have any building of a particular building type, it will be shown greyed out.","특정 건물 종류를 하나도 갖고 있지 않다면, 회색으로 바래져 보일 것입니다.","scenario_tutorial04_economy.wmf","../../data/campaigns/tutorial04_economy.wmf/scripting/texts.lua:81"
"building","건설","This is enough explanation for now. Now try it out yourself. We want to know whether we still have taverns, so you have to choose the ‘Medium buildings’ tab. Close the building statistics menu afterwards.","충분히 설명한 것 같습니다. 이제 시도해보십시오. 우리는 아직 선술집을 갖고 있는지 알고 싶으니까, ‘중형 건물’ 탭을 선택해야 합니다. 그 다음에 건물 통계 메뉴를 닫으십시오.","scenario_tutorial04_economy.wmf","../../data/campaigns/tutorial04_economy.wmf/scripting/texts.lua:83"
"building","건설","Choose the ‘Medium buildings’ tab in the building statistics window.","건물 통계 창에서 ‘중형 건물’ 탭을 선택하십시오.","scenario_tutorial04_economy.wmf","../../data/campaigns/tutorial04_economy.wmf/scripting/texts.lua:88"
"building","건설","Close the building statistics window when you are done.","다 했으면 건물 통계 창을 닫으십시오.","scenario_tutorial04_economy.wmf","../../data/campaigns/tutorial04_economy.wmf/scripting/texts.lua:91"
"building","건설","You closed the building statistics window!","건물 통계 창을 닫았습니다!","scenario_tutorial04_economy.wmf","../../data/campaigns/tutorial04_economy.wmf/scripting/texts.lua:96"
"building","건설","You have closed the building statistics window. I didn’t notice that you switched to the medium buildings to look up the number of taverns. Would you please be so nice and show it to me?","건물 통계 창을 닫으셨습니다. 당신이 선술집 숫자를 확인하기 위해 중형 건물로 바꾼 것을 보지 못했습니다. 부탁하건데 제가 그 광경을 보도록 해주시겠습니까?","scenario_tutorial04_economy.wmf","../../data/campaigns/tutorial04_economy.wmf/scripting/texts.lua:98"
"building","건설","Open the building statistics window again","건물 통계 창을 열기","scenario_tutorial04_economy.wmf","../../data/campaigns/tutorial04_economy.wmf/scripting/texts.lua:107"
"building","건설","You closed the building statistics window, although you have not yet looked up the number of taverns.","아직 선술집 숫자를 확인하지 않았는데도, 건물 통계 창을 닫으셨습니다.","scenario_tutorial04_economy.wmf","../../data/campaigns/tutorial04_economy.wmf/scripting/texts.lua:109"
"building","건설","The stock menu window has four tabs. The first (and currently selected) one shows you all your current wares, including those on roads, at flags and inside buildings waiting for processing.","재고 메뉴 창을 네 개의 탭으로 이루어져 있습니다. 첫번째 (현재 선택된) 탭은  도로에 있거나, 깃발에 있거나 아니면 처리를 위해 건물 안에 있는 것들을 포함해서, 당신이 보유한 모든 용품들을 보여줍니다.","scenario_tutorial04_economy.wmf","../../data/campaigns/tutorial04_economy.wmf/scripting/texts.lua:139"
"building","건설","The second tab shows you all your workers, again those on roads and in buildings summed up.","두번째 탭은 도로에 있거나 건물에 있는 것을 합친, 모든 당신의 일꾼들을 보여줍니다.","scenario_tutorial04_economy.wmf","../../data/campaigns/tutorial04_economy.wmf/scripting/texts.lua:141"
"building","건설","When you’ve played a lot, you will know all these things by heart. But until then or if you’re unsure about your tribe’s needs and abilities and how its buildings and workers operate, you can look it up easily in our tribe-specific in-game help and encyclopedia.","당신이 많이 해봤으면, 이 모든 것이 익숙해지셨을 것입니다. 그러나 그때까지 또는 부족의 필요와 능력, 건물과 노동자가 어떻게 운영되는지 잘 모른다면, 게임내 부족별 도움말과 백과사전에서 쉽게 찾을 수 있습니다.","scenario_tutorial04_economy.wmf","../../data/campaigns/tutorial04_economy.wmf/scripting/texts.lua:209"
"building","건설","The ‘Wares’ tab shows information about the wares that your tribe needs, including a short help text, a list of buildings that produce each ware, the needed wares to produce it and where the ware is consumed.","‘물자’ 탭은 짧은 도움말 글자, 각 물자들을 생산하는 건물 목록, 그것을 생산하는 필요한 물자, 물자가 소비되는곳등을 포함하여 부족이 필요로 하는 물자에 관한 정보를 표시합니다.","scenario_tutorial04_economy.wmf","../../data/campaigns/tutorial04_economy.wmf/scripting/texts.lua:232"
"building","건설","The ‘Buildings’ tab contains all the necessary information about the buildings of your tribe.","‘건물’ 탭에는 부족 건물에 대한 필요한 모든 정보가 들어있습니다.","scenario_tutorial04_economy.wmf","../../data/campaigns/tutorial04_economy.wmf/scripting/texts.lua:234"
"building","건설","A soldier needs a wooden spear and a helmet – from there on out, you can search backwards to find the wares and the buildings you need to supply your barracks where the soldier is recruited. When you are finished, just close the encyclopedia window.","군인은 나무창과 투구가 필요합니다. 병사가 채용된 병영에 필요한 물품과 건물을 찾기 위해 뒤쪽으로 찾아갈 수 있습니다. 검색이 끝나면 백과사전 창을 닫으십시오.","scenario_tutorial04_economy.wmf","../../data/campaigns/tutorial04_economy.wmf/scripting/texts.lua:237"
"building","건설","When you click on the red dot (low priority), the corresponding ware gets delivered less frequently. Green means that as many wares as possible should be delivered to this building, maybe because it produces something important.","빨간 점 (낮은 우선권) 을 클릭할 때, 해당하는 용품은 덜 자주 배달됩니다. 초록은 가능한 한 많은 용품을, 아마도 무언가 중요한 것을 생산하는 건물로 배달해야 하는 것을 의미합니다.","scenario_tutorial04_economy.wmf","../../data/campaigns/tutorial04_economy.wmf/scripting/texts.lua:278"
"building","건설","In our situation, you might want to work the bakeries as fast as possible because they supply our taverns, so you could set water to the highest priority for them. The other buildings (for example the donkey farm) would then get less water, but the bakery could work faster.","지금 상황에서, 제과점들은 선술집에 공급하고 있기 때문에 가능한 빨리 작업해야 하고, 그래서 제과점들을 물에 대해 가장 높은 우선권을 갖도록 설정할 수 있습니다. 다른 건물들은 (예를 들어 당나귀 농장) 더 적은 물을 얻겠지만, 제과점은 더 빨리 일할 것입니다.","scenario_tutorial04_economy.wmf","../../data/campaigns/tutorial04_economy.wmf/scripting/texts.lua:279"
"building","건설","Most buildings will only produce something when the stock level in your warehouses falls below the target quantity, so you should indicate the reserve you want to stockpile.","대부분의 건물은 창고의 재고 수준이 목표 양 아래로 하락할 때에만 무언가를 생산할 것이므로, 저장하고 싶은 예비품을 설정하시면 됩니다.","scenario_tutorial04_economy.wmf","../../data/campaigns/tutorial04_economy.wmf/scripting/texts.lua:418"
"building","건설","Only buildings that consume wares care about this setting. Buildings that produce wares for free (e.g. your farms or wells) will always keep working.","오직 용품을 소모하는 건물만이 이 설정에 좌우됩니다. 공짜로 용품을 생산하는 건물들은 (예로 농장이나 우물) 언제나 계속 일을 할 겁니다.","scenario_tutorial04_economy.wmf","../../data/campaigns/tutorial04_economy.wmf/scripting/texts.lua:429"
"building","건설","Toggle building spaces","건물공간 켜기/끄기","texts","../../data/txts/help/common_helptexts.lua:42"
"building","건설","The latter three can only be set by the hosting client by left-clicking the ‘type’ button of a player. Hosting players can also set the initialization of each player (the set of buildings, wares and workers the player starts with) and the tribe and team for computer players.","뒤의 세 개는 선수의 ‘유형’ 버튼을 마우스 왼쪽 버튼으로 클릭해야만 호스팅 손님에서 설정할 수 있습니다. 방장 선수는 또한 각 선수(선수가 시작하는 건물, 창고 및 작업자 설정)와 컴퓨터 선수 부족 및 팀의 초기화를 설정할 수 있습니다.","texts","../../data/txts/help/multiplayer_help.lua:21"
"building","건설","Atlanteans need spidercloth for many buildings. Build the needed infrastructure early before you run out.","아틀란티스족은 많은 건물에 거미줄이 필요합니다. 예산이 소진되기 전에 필요한 기반 시설을 초반에 구축하십시오.","texts","../../data/txts/tips/atlanteans.lua:12"
"building","건설","Most enhanced buildings need experienced workers. Do not enhance a building unless you have the necessary workers available.","대부분의 고급 건물에는 숙련된 근로자가 필요합니다. 필요한 근로자가 없는 한 건물을 개선하지 마십시오.","texts","../../data/txts/tips/barbarians.lua:12 ../../data/txts/tips/empire.lua:12 ../../data/txts/tips/frisians.lua:12"
"building","건설","Space key behaves like in normal game. It switches if building spaces are shown on or off.","스페이스키는 정상적인 게임에서처럼 작동합니다. 건물 공간이 켜져 있거나 꺼져있는 경우 전환됩니다.","texts","../../data/txts/tips/editor.lua:31"
"building","건설","You can place a medium building on any node where there is a slope no greater than 1 in the south-east direction and its height difference to all nodes in a radius of 2 is no greater than 2.","남동쪽 방향에서 1 이하의 경사가 있고 반지름 2의 모든 노드에 대한 높이 차이가 2 이하인 노드에 중간 건물을 배치할 수 있습니다.","texts","../../data/txts/tips/editor.lua:43"
"building","건설","You can place a big building on any node where you could place a medium building if there is no obstacle or non-arable terrain towards the west, northwest and northeast.","당신은 서쪽, 북서쪽, 북동쪽을 향해 장애물이나 생존할 수 없는 지형지물이 없는 경우 중간 건물을 배치할 수 있는 어떤 노드에도 큰 건물을 세울 수 있습니다.","texts","../../data/txts/tips/editor.lua:47"
"building","건설","Be sure to send a geologist to survey sites before building a well or a mine.","우물이나 광산을 짓기 전에 지질학자를 보내 사이트를 조사하십시오.","texts","../../data/txts/tips/general_game.lua:10"
"building","건설","Use the priority buttons in building windows to adjust delivery of a specific ware. Pressing Ctrl while clicking will adjust all wares at once.","특정 물건의 배달을 조정하려면 건물 창에서 우선 순위 버튼을 사용하십시오. Ctrl키를 누른 상태에서 클릭하면 모든 제품이 한번에 조정됩니다.","texts","../../data/txts/tips/general_game.lua:31"
"building","건설","If you like to live dangerously, pressing Ctrl while clicking the enhance, dismantle or destroy building buttons will skip the confirmation.","위험하게 살고 싶다면, 컨트롤 키를 누른 상태에서 건물 강화나 건물 해체나 파괴 버튼을 클릭하면 확인을 건너 뜁니다.","texts","../../data/txts/tips/general_game.lua:55"
"building","건설","An economy consists of all buildings and flags connected by roads. The supplies and demands of buildings are handled in its economy.","경제는 길로 연결된 모든 건물과 깃발로 이루어져 있습니다. 건물의 공급과 수요는 경제에서 처리됩니다.[쉬운번역으로수정바람 내용어려움]","texts","../../data/txts/tips/general_game.lua:63"
"building","건설","Some buildings, such as the farm, have a very small work area. If the building is surrounded with trees or roads, production will stop.","농장과 같은 몇몇 건물은 작업 공간이 매우 작습니다. 만약 그 건물이 나무나 도로로 둘러싸버리면, 생산은 중단될 것입니다.","texts","../../data/txts/tips/general_game.lua:67"
"building","건설","When a building is destroyed, its workers will start looking for a nearby flag from which they can move by road to a connected warehouse. If there are no such flags in the vicinity, they will keep wandering around and eventually die.","건물이 파괴되면, 노동자들은 도로 근처의 연결된 창고로 이동할 수 있는 가까운 깃발을 찾기 시작할 것입니다. 주변에 그런 깃발이 없다면 주변을 방황하다가 결국 죽게될 것입니다.","texts","../../data/txts/tips/general_game.lua:75"
"building","건설","The beekeeper working at this beekeepers’s house can’t find any flowering fields or bushes in his work area. You should consider building another farm or berry farm nearby, or dismantling or destroying this building.","이 벌 키우는 집에서 일하는 이가 자신의 일터에서 어떠한 꽃밭이나 덤불을 찾지 못했습니다. 근처에 딸기 키우는 곳이나 다른 열매나무나 풀을 키우는 곳을 짓거나 이건물을 해체하거나 파괴하는것도 생각해야합니다.","tribes","../../data/tribes/buildings/productionsites/frisians/beekeepers_house/init.lua:63"
"building","건설","The fruit collector working at this fruit collector’s house can’t find any berry bushes in his work area. You should consider building another berry farm, or dismantling or destroying this building.","이 열매 거두는 이의 집에서 일하는 이는 그의 일터에서는 딸기 덤불을 찾지 못했습니다. 다른 딸기 심는 집을 짓거나 이 건물을 해체하거나 파괴하는 것을 생각해보십시요.","tribes","../../data/tribes/buildings/productionsites/frisians/collectors_house/init.lua:63"
"building","건설","Weaves spidercloth for buildings and ships’ sails, and tabards to equip and train the soldiers.","건물과 배의 돛, 그리고 군인들을 무장시키고 훈련시킬 외투를 위해 거미실 천을 만드십시오.","tribes_encyclopedia","../../data/tribes/buildings/productionsites/atlanteans/weaving_mill/helptexts.lua:16"
"building","건설","The Barbarian ax workshop is the intermediate production site in a series of three buildings. It is enhanced from the metal workshop but doesn’t require additional qualification for the worker.","야만족의 도끼 제작소는 3곳의 연속된 건물들 중 중간 단계의 생산 기지입니다. 이는 금속 제작소에서 향상되지만 추가적인 일꾼을 필요로 하지는 않습니다.","tribes_encyclopedia","../../data/tribes/buildings/productionsites/barbarians/ax_workshop/helptexts.lua:18"
"building","건설","If all needed wares are delivered in time, this building can produce each type of ax in about %s on average.","모든 용품들이 제 시간 내에 도착한다면, 이 건물은 각 종류의 도끼를 평균적으로 %s 내에 만들어 냅니다.","tribes_encyclopedia","../../data/tribes/buildings/productionsites/barbarians/ax_workshop/helptexts.lua:23 ../../data/tribes/buildings/productionsites/barbarians/warmill/helptexts.lua:27"
"building","건설","If all needed wares are delivered in time, this building can produce a pitta bread in %s on average.","모든 용품들이 제 시간 내에 도착한다면, 이 건물은 피타 빵을 평균적으로 %s 내에 구워냅니다.","tribes_encyclopedia","../../data/tribes/buildings/productionsites/barbarians/bakery/helptexts.lua:26"
"building","건설","If all needed wares are delivered in time, this building can produce an ox in %s on average.","모든 용품들이 제 시간 내에 도착한다면, 이 건물은 황소를 평균적으로 %s 내에 사육합니다.","tribes_encyclopedia","../../data/tribes/buildings/productionsites/barbarians/cattlefarm/helptexts.lua:26"
"building","건설","If all needed wares are delivered in time, this building can produce grout in about %s on average.","모든 용품들이 제 시간 내에 도착한다면, 이 건물은 회반죽을 평균적으로 %s 내에 제작합니다.","tribes_encyclopedia","../../data/tribes/buildings/productionsites/barbarians/lime_kiln/helptexts.lua:23"
"building","건설","The Barbarian metal workshop is the basic production site in a series of three buildings and creates all the tools that Barbarians need. The others are for weapons.","야만족 금속 제작소는 세 단계의 건물 중 기초 단계의 생산 기지이고 야만족들이 필요로 하는 모든 도구를 제작합니다. 다른 건물들은 무기를 위한 곳입니다.","tribes_encyclopedia","../../data/tribes/buildings/productionsites/barbarians/metal_workshop/helptexts.lua:18"
"building","건설","If all needed wares are delivered in time, this building can produce each tool in about %s on average.","모든 용품들이 제 시간 내에 도착한다면, 이 건물은 각 종류의 도구를 평균적으로 %s 내에 제작합니다.","tribes_encyclopedia","../../data/tribes/buildings/productionsites/barbarians/metal_workshop/helptexts.lua:23"
"building","건설","If all needed wares are delivered in time, this building can produce beer in about %s on average.","모든 용품들이 제 시간 내에 도착한다면, 이 건물은 맥주를 평균적으로 %s 내에 양조합니다.","tribes_encyclopedia","../../data/tribes/buildings/productionsites/barbarians/micro_brewery/helptexts.lua:23"
"building","건설","Toggle building statistics","건물 통계 켜기/끄기","tribes_encyclopedia","../../data/tribes/scripting/help/controls.lua:64"
"building","건설","This fire-hardened wood is as hard as iron and it is used for several buildings. It is produced out of logs in the wood hardener.","이 불에 강화된 목재는 철만큼 강하고 여러 건물에 사용됩니다. 목재 강화소에서 통나무를 이용해 생산됩니다.","tribes_encyclopedia","../../data/tribes/wares/blackwood/helptexts.lua:4"
"building","건설","Bread paddles are produced in the metal workshop like all other tools (but cease to be produced by the building if it is enhanced to an ax workshop and war mill).","빵 주걱은 다른 도구들처럼 금속 제작소에서 생산합니다(하지만 도끼 제작소와 전쟁 공장으로 향상되면 생산을 중지합니다).","tribes_encyclopedia","../../data/tribes/wares/bread_paddle/helptexts.lua:8"
"building","건설","Felling axes are produced in the metal workshop (but cease to be produced by the building if it is enhanced to an ax workshop and war mill).","벌목 도끼는 금속 제작소에서 생산합니다(하지만 도끼 제작소와 전쟁 공장으로 향상되면 생산을 중지합니다).","tribes_encyclopedia","../../data/tribes/wares/felling_ax/helptexts.lua:6"
"building","건설","Produced by the metal workshop (but they cease to be produced by the building if it is enhanced to an ax workshop and war mill).","금속 제작소에서 생산됩니다(하지만 도끼 제작소와 전쟁 공장으로 향상되면 생산이 중지됩니다).","tribes_encyclopedia","../../data/tribes/wares/fire_tongs/helptexts.lua:10"
"building","건설","They are one of the basic tools produced in a metal workshop (but cease to be produced by the building if it is enhanced to an ax workshop and war mill).","금속 제작소에서 생산하는 기본적인 도구 중 하나입니다(하지만 도끼 제작소와 전쟁 공장으로 향상되면 생산을 중지합니다).","tribes_encyclopedia","../../data/tribes/wares/fishing_rod/helptexts.lua:6"
"building","건설","Geologists, builders, blacksmiths and helmsmiths all need a hammer. Make sure you’ve always got some in reserve! They are one of the basic tools produced at the metal workshop (but cease to be produced by the building if it is enhanced to an ax workshop and war mill).","지질학자, 건축업자, 대장장이와 투구 장인 모두 망치가 필요합니다. 언제나 여분의 것을 남기는 것을 명심하십시오! 금속 제작소에서 생산하는 기본적인 도구 중 하나입니다(하지만 도끼 제작소와 전쟁 공장으로 향상되면 생산을 중지합니다).","tribes_encyclopedia","../../data/tribes/wares/hammer/helptexts.lua:8"
"building","건설","Hunting spears are produced in the metal workshop (but cease to be produced by the building if it is enhanced to an ax workshop and war mill).","사냥용 창은 금속 제작소에서 생산합니다(하지만 도끼 제작소와 전쟁 공장으로 향상되면 생산을 중지합니다).","tribes_encyclopedia","../../data/tribes/wares/hunting_spear/helptexts.lua:6"
